id,link,title,thumbnail,time,summary,category,sub_category,full_article
20180521073517398,https://tuoitre.vn/thiet-bi-chong-bat-coc-tre-em-cua-sinh-vien-20180521073517398.htm,Thiết bị chống bắt cóc trẻ em của sinh viên,https://cdn1.tuoitre.vn/zoom/600_315/2018/5/21/photo1526869535107-15268695351081391832005.jpg,21/05/2018 09:28 GMT+7,"TTO - Làm thế nào bảo vệ con nhỏ từ xa trước những tình huống bị bắt cóc, đi lạc, tai nạn ngoài ý muốn? Làm thế nào phụ huynh biết được tình hình con nhỏ khi ở xa vòng tay cha mẹ?",Khoa học,Phát minh,"Những câu hỏi này khiến Lê Văn Đây (sinh viên năm 4 khoa cơ khí, ĐH Bách khoa Đà Nẵng) bóp trán suy nghĩ. Sau nhiều lần mày mò, Đây trả lời bằng một sản phẩm tích hợp trên đôi giày có thể giải quyết được những tình huống trên.Ám ảnh nạn bắt cóc  trẻ em""Tôi bị ám ảnh bởi vụ việc bé Nhật Linh ở Nhật bị bắt cóc rồi sát hại. Ban đầu tôi nghĩ tại sao không trang bị những thiết bị định vị gắn lên cặp sách hoặc đồng hồ cho bé để cha mẹ không phải mất công tìm kiếm. Nhưng khi suy đi tính lại, tôi vẫn thấy đôi giày là vật dụng theo suốt với trẻ con hơn cả"" - Đây chia sẻ.Đưa ra một vật nhỏ hơn lòng bàn tay được bọc kín, Đây giới thiệu đó là phần thông minh của đôi giày. Thiết bị này được Đây thiết kế cứng, nhỏ gọn để có thể gắn dưới đế giày. Bên trong có chip xử lý, bộ định vị GPS, kết nối sim điện thoại. Khi được kích hoạt, thiết bị liên tục ghi nhận tọa độ và phát cảnh báo với thời gian cài đặt 45 phút/lần về điện thoại đăng ký.Nhưng nếu cha mẹ không an tâm về con nhỏ, muốn biết con mình ngay lúc này đang ở đâu thì phải làm sao? Đây cho biết ngoài khoảng thời gian 45 phút báo tin cố định trên, nếu bố mẹ muốn biết thông tin của con chỉ việc gửi tin nhắn tới, thiết bị sẽ báo cáo chính xác. Trong trường hợp mất sóng, thiết bị sẽ lưu lại tọa độ GPS cuối cùng nhận được.Đây phân tích: ""Khi chọn lựa vật dụng thích hợp mà các bé hay dùng, tôi thấy gắn cho giày là rất hợp lý. Ngoài việc có kích cỡ thích hợp để ""ngụy trang"", mình cũng bố trí thêm một vị trí bên hông thiết bị. Nếu bé gặp bất trắc cứ dùng chân bên kia đá vào chỗ này ba cái liên tục, thiết bị sẽ ghi nhận như đó là tín hiệu cấp cứu khẩn cấp báo cho cha mẹ"".Không những vậy, trong trường hợp cha mẹ muốn giám sát con cái, thiết bị của Đây còn giải được ""bài toán"" này. Thiết bị cho phép số đăng ký có thể gọi tới, lúc đó đôi giày sẽ tự động bắt máy và ghi âm cuộc gọi... Bằng cách này, cha mẹ có thể chủ động quản lý con cái hoặc tăng cường giám sát những diễn biến xung quanh con nhỏ. Hiện nay với phiên bản thiết kế mới nhất, thiết bị của Đây có tính năng  cho phép hoạt động liên tục trong 15 giờ với thời gian sạc đầy tầm 2 tiếng.Khả năng ứng dụng  thực tiễn caoChị Phạm Thị Phương - một phụ huynh có con nhỏ - cho rằng nếu sản phẩm trở thành thương phẩm trên thị trường, chị sẽ trang bị ngay cho con mình. Có 2 con nhỏ trong độ tuổi học cấp I rất hiếu động, không ít lần chị toát mồ hôi vì con mê đi chơi. ""Nếu có đôi giày được gắn định vị, mình an tâm phần nào vì có thể biết được con đang ở đâu, đang tiếp xúc với môi trường nào. Trường hợp nào mình  cũng là người chủ động""- chị Phương nói.Với thiết bị này, Đây vừa đoạt giải trong cuộc thi nghiên cứu khoa học của Trường ĐH Bách khoa Đà Nẵng. Nhưng từ ý tưởng đến thương phẩm còn rất xa. Đây nhìn nhận cái khó nhất của sản phẩm hiện nay vẫn phải là gọn và... tinh gọn hơn nữa.""Hiện nay các tính năng của sản phẩm đã cơ bản đáp ứng được các đặc tính thông minh và công dụng. Nhưng cái khó là đưa thiết bị nhỏ hơn nữa để vừa vặn kích cỡ giày mà vẫn đảm bảo các tính năng sạc không dây và độ bền để chịu được trọng lực cơ thể"", Đây nói.TS Nguyễn Danh Ngọc - giảng viên khoa cơ khí ĐH Bách khoa Đà Nẵng - đánh giá những sáng chế của Đây rất có tiềm năng thành thương phẩm do khả năng ứng dụng vào thực tiễn rất cao. Đặc biệt quá trình tự học, tự mày mò của Đây chính là chìa khóa thực tiễn cho những sáng chế đoạt giải. ""Đây là một sinh viên nắm rất chắc kỹ thuật và tinh thần học hỏi rất cao. Nhờ ăn nằm thường xuyên với máy móc mà hiện nay có nhiều bạn sinh viên tìm đến Đây như một ""kênh"" học tập và tự nghiên cứu"" - TS Ngọc nói."
20180518074923619,https://tuoitre.vn/thiet-bi-sieu-nho-biet-danh-hoi-nguoi-bi-ket-trong-dong-dat-20180518074923619.htm,Thiết bị siêu nhỏ biết 'đánh hơi' người bị kẹt trong động đất,https://cdn1.tuoitre.vn/zoom/600_315/2018/5/18/photo1526604235523-1526604235523636735556.jpg,18/05/2018 07:51 GMT+7,"TTO - Nhỏ cỡ con chip máy tính, thiết bị của các nhà nghiên cứu tại Trường đại học ETH, Zurich, Thụy Sĩ có thể phát hiện dấu vết con người bị kẹt trong động đất, lở tuyết...",Khoa học,Phát minh,"Các nhà nghiên cứu tại Trường đại học ETH, Zurich, Thụy Sĩ đã phát triển một thiết bị ""nhỏ nhất và rẻ nhất"" có thể phát hiện mùi con người bị vùi lấp trong động đất, tuyết lở...Theo ScienceDaily, thiết bị này nhỏ cỡ con chip máy tính, chứa các cảm biến cực nhạy có thể phát hiện đồng thời mùi acetone, ammonia, hydro carbon lỏng (isoprene), carbon dioxide (CO2) và hơi ẩm - những dấu hiệu cho thấy sự hiện diện của con người.Trong một tuyên bố, nhóm nghiên cứu của ETH cho biết thiết bị của họ có thể dùng trong cứu hộ thay cho những chú chó cứu hộ cần phải nghỉ ngơi và không phải lúc nào cũng có sẵn trong các tình huống khẩn cấp.Nó cũng có thể được trang bị cho máy bay không người lái để giúp tiếp cận các khu vực xa xôi, khó tiếp cận để tìm kiếm những người còn sống sót...ETH hiện đang tìm kiếm đối tác công nghiệp hoặc các nhà đầu tư để phát triển một mẫu thử nghiệm và thử nghiệm thiết bị trong thực tế."
20180515132748678,https://tuoitre.vn/da-co-thuoc-hoa-giai-tac-hai-cua-ruou-20180515132748678.htm,Đã có thuốc 'hóa giải' tác hại của rượu?,https://cdn1.tuoitre.vn/zoom/600_315/2018/5/15/photo1526373346231-15263733462312071433226.jpg,15/05/2018 22:18 GMT+7,"TTO - Sau những chầu nhậu tưng bừng, điều khiến bạn sợ nhất là gì? Chính là những cơn đau đầu như búa bổ và cảm giác khát khô cổ họng.",Khoa học,Phát minh,"Yunfeng Lu - một giáo sư kỹ thuật hóa học tại Đại học California, Los Angeles, Mỹ (và tự nhận là một người mê rượu), đang cố gắng tìm ra giải pháp cho những tác động tiêu cực của rượu. Và các thử nghiệm trên chuột thí nghiệm đang cho thấy kết quả rất hứa hẹn.Viên thuốc mà Lu nghiên cứu chứa đầy các enzym tự nhiên thường được tìm thấy trong các tế bào gan, giúp cơ thể xử lý rượu nhanh hơn. Nó không chỉ giúp giảm những cơn đau đầu như búa bổ và khát khô cổ họng mà còn có thể dùng điều trị cho các trường hợp ngộ độc rượu.Để kiểm tra thuốc, đầu tiên giáo sư Lu và các cộng sự của ông đã làm cho rất nhiều con chuột say rượu. Sau đó, họ tiến hành điều trị cho chúng. Kết quả? Nồng độ cồn trong máu của những con chuột này đã giảm 45% trong vòng 4 giờ so với những con không được điều trị.Tất nhiên, chuột thì hiếm khi phàn nàn về những cơn đau đầu do quá chén, nhưng Lu thấy rằng mức độ acetaldehyde - một hợp chất độc hại gây ung thư, gây đau đầu và nôn mửa, làm cho mọi người đỏ mặt sau khi uống rượu và được sản sinh ra trong quá trình trao đổi chất cồn bình thường - vẫn ở mức cực kỳ thấp.Tuy nhiên, lời khuyên của giáo sư Lu là ""Đừng có chè chén say sưa"". Nghiên cứu của ông nhằm mục đích giúp đỡ các bệnh viện, chứ không phải để cổ súy cho các ""chiến binh cuối tuần"".Giáo sư Lu và nhóm của ông đang kiểm tra để chắc chắn rằng không có tác dụng phụ nguy hiểm nào từ cách điều trị này. Nếu điều đó diễn ra tốt đẹp, các thử nghiệm trên người sẽ được bắt đầu trong khoảng một năm tới.Phòng ngừa những cơn đau đầu do quá chén là một ngành kinh doanh béo bở đối với một số công ty. Ở một số nơi thậm chí còn có các loại đồ uống, trang phục và thậm chí là rượu không gây đau đầu. Mặc dù vậy, kết quả của tất cả những điều này vẫn còn gây tranh cãi."
20180510145051785,https://tuoitre.vn/xem-video-nguoi-dan-ong-dung-y-nghi-dieu-khien-tay-gia-20180510145051785.htm,Xem video người đàn ông dùng ý nghĩ điều khiển tay giả,https://cdn1.tuoitre.vn/zoom/600_315/2018/5/10/photo1525938326390-1525938326390128440036.jpg,10/05/2018 15:11 GMT+7,"TTO - Sinh ra không có cổ tay, một người đàn ông ở Kyrgyzstan cuối cùng đã có thể bắt tay người khác, cầm nắm đồ vật... nhờ bàn tay giả điều khiển bằng ý nghĩ.",Khoa học,Phát minh,"Thiết kế mang tính đột phá này, được thực hiện tại Bệnh viện quốc gia Kyrgyzstan ở thủ đô Bishkek, có thể mang lại cơ hội lớn cho những người khuyết tật khắp thế giới.Đoạn video cho thấy người đàn ông được gắn bàn tay giả kỹ thuật sinh học đã dùng ý nghĩ điều khiển bàn tay. Sau khi bắt tay tiến sĩ Sultan Tukeshov - người lắp tay giả cho mình, bệnh nhân đã có thể lấy, nhấc và thả một chai nhựa một cách dễ dàng.""Trước đây chúng tôi chỉ có thể nhìn thấy điều này trên phim. Giờ thì nhóm của chúng tôi đã làm được, bệnh nhân điều khiển tay giả bằng ý nghĩ của mình, thật tuyệt vời"", tiến sĩ Tukeshov nói về thành tựu của mình.Theo báo Mail Online, nhiều cư dân mạng đã khen ngợi và hi vọng công nghệ tương lai này sẽ sớm đến được với những người không may sinh ra bị khuyết tật."
20180509135011639,https://tuoitre.vn/taxi-bay-cua-uber-tham-vong-chinh-phuc-bau-troi-20180509135011639.htm,Taxi bay của Uber tham vọng chinh phục bầu trời,https://cdn1.tuoitre.vn/zoom/600_315/2018/5/9/photo1525848230561-15258482305611382303809.jpg,09/05/2018 13:49 GMT+7,"TTO - Các mẫu xe bay của Uber giống máy bay không người lái hơn trực thăng, bay ở độ cao từ 300-610m so với mặt đất và tạo ra ít tiếng ồn hơn so với trực thăng.",Khoa học,Phát minh,"Ngày 8-5, Uber đã giới thiệu mẫu taxi bay tại hội nghị Uber Elevate Summit thường niên diễn ra tại thành phố Los Angeles, Mỹ, một bước tiến gần hơn tới tham vọng chinh phục bầu trời của dịch vụ đi chung xe này.Các mẫu xe bay của Uber giống máy bay không người lái hơn trực thăng, bay ở độ cao từ 300-610 m so với mặt đất và tạo ra ít tiếng ồn hơn so với trực thăng.Những chiếc xe bay sẽ cất cánh và hạ cánh trên skyport - các trạm xe đặt trên nóc nhà hoặc dưới mặt đất. Các skyport có thể tiếp nhận 200 lượt cất cánh và hạ cánh mỗi giờ. Dự kiến Uber sẽ giới thiệu với người dùng mẫu xe bay và trạm skyport trong vòng từ 2-5 năm tới.Người phụ trách các sản phẩm hàng không của Uber, ông Nikhil Goel, cho biết mục tiêu của hãng là tăng tính cơ động trong ngành vận tải đô thị. Những chiếc taxi bay của Uber sẽ có khả năng đạt tốc độ tối đa trên 300km/h và bay được khoảng 100km sau mỗi lần sạc pin.Công ty có kế hoạch triển khai UberAIR tại Dallas-Fort Worth và Los Angeles vào năm 2023, và bắt đầu quá trình thử nghiệm ở những thành phố này vào năm 2020.Eric Allison - người đứng đầu các chương trình hàng không của Uber, cho biết việc phát triển xe bay là một phần của chiến lược tổng thể của Uber hướng tới xóa bỏ việc sở hữu và lái xe riêng. Uber tham vọng giới thiệu dịch vụ taxi bay giá bình dân khiến việc sử dụng Uber kinh tế hơn cả sử dụng xe cá nhân. Ban đầu, các taxi bay của Uber sẽ có phi công, song hãng này hướng tới phát triển các phương tiện tự động.Tuy nhiên, trong tham vọng chinh phục bầu trời của mình, Uber hiện đối mặt với sự cạnh tranh khốc liệt. Kitty Hawk, một công ty taxi bay được Larry Page của Alphabet hậu thuẫn, đã giới thiệu mẫu máy bay thương mại mới nhất của hãng có tên là Cora vào tháng 3 vừa qua.Công ty này đang hợp tác với Chính phủ New Zealand để thương mại hóa Cora. Một đối thủ cạnh tranh khác là Airbus đã thực hiện thành công chuyến bay đầu tiên của xe bay tự lái hồi tháng 2."
20180507130321164,https://tuoitre.vn/tim-ra-cach-phat-hien-alzheimer-truoc-15-nam-20180507130321164.htm,Tìm ra cách phát hiện Alzheimer trước 15 năm,https://cdn1.tuoitre.vn/zoom/600_315/2018/5/7/photo1525673065283-1525673065283730953914.png,07/05/2018 14:47 GMT+7,"TTO - Tạp chí Nature vừa công bố đề tài của nhóm nghiên cứu ở Trung tâm nghiên cứu quốc gia về lão khoa Nhật Bản, theo đó dùng chỉ dấu sinh học (biomarker) để phát hiện Alzheimer từ rất sớm.",Khoa học,Phát minh,"Phát triển ngấm ngầm qua thời gian, Alzheimer khi biểu hiện triệu chứng rõ ràng thì đã gây ra nhiều thay đổi trong não bộ. Các nghiên cứu trước đây cho thấy điểm chung của người mang bệnh Alzheimer là quá trình tích tụ protein amyloid-β trên não. Đây là loại protein vẫn hiện diện trong não người khỏe mạnh nhưng trong trường hợp Alzheimer, amyloid-β bị sắp xếp sai trật tự và cứ thế tích lũy qua thời gian. Quá trình này có thể bắt đầu từ rất sớm, khoảng 15-20 năm trước khi triệu chứng xuất hiện, gây độc lên tế bào thần kinh.Hiện tại, các phương pháp chẩn đoán đáng tin cậy là chụp cắt lớp phát xạ positron (PET) tốn nhiều thời gian, tiền bạc và phân tích dịch não tủy (CSF) gây đau đớn và xâm lấn.Để tạo điều kiện cho các thử nghiệm lâm sàng điều trị bệnh Alzheimer trong giai đoạn sớm và nhẹ, các nhà khoa học tại Nhật Bản đã tìm đến chỉ dấu sinh học plasma kiểm tra trên máu. Nghiên cứu đã chứng minh tiềm năng của dấu ấn sinh học trong việc dự đoán nguy cơ tích tụ amyloid-β trong não.Điểm đáng chú ý là phương pháp này ít tốn chi phí và có khả năng áp dụng đại trà cho người dân.Đầu tháng 4 năm nay, tạp chí EMBO Molecular Medicine cũng đã công bố hướng nghiên cứu tương tự do nhóm nhà khoa học tại Đức thực hiện. Dẫn đầu nhóm nghiên cứu là GS.TS Klaus Gerwert. Họ đặt mục tiêu tìm hiểu khả năng đo đạc mức độ tương quan giữa amyloid-β khỏe mạnh và amyloid-β bệnh lý đối với nguy cơ Alzheimer từ giai đoạn đầu.Xét nghiệm máu này sử dụng công nghệ cảm biến hồng ngoại miễn dịch. Dựa trên một kháng thể, cảm biến sẽ trích xuất amyloid-β từ mẫu máu. Hai phiên bản amyloid-β sẽ hấp thụ ánh sáng hồng ngoại ở các tần số khác nhau, cho phép nhóm nghiên cứu đo mức độ tương quan giữa chúng.Alzheimer là một căn bệnh thoái hóa thần kinh phổ biến ở người già, triệu chứng điển hình là mất trí nhớ, rối loạn định hướng (dễ đi lạc), tâm tính không ổn định, mất khả năng tự chăm sóc bản thân, thay đổi các hành vi khác. Căn bệnh chiếm khoảng 60-70% trong tổng số trường hợp mất trí nhớ ở người cao tuổi. Thời gian sống trung bình của bệnh nhân chỉ khoảng từ 3 đến 9 năm sau khi phát bệnh."
20180504103629079,https://tuoitre.vn/lan-dau-tim-thay-khi-heli-o-hanh-tinh-ngoai-he-mat-troi-20180504103629079.htm,Lần đầu tìm thấy khí heli ở hành tinh ngoài Hệ mặt trời,https://cdn1.tuoitre.vn/zoom/600_315/2018/5/4/photo1525404883401-1525404883401662844206.jpg,04/05/2018 11:40 GMT+7,"TTO - Sau hơn một thập kỷ kiếm tìm, rốt cục các nhà khoa học đã lần đầu tiên tìm thấy khí heli tỏa ra xung quanh một hành tinh ngoài Hệ mặt trời (gọi là exoplanet).",Khoa học,Phát minh,"Theo tạp chí Nature, các nhà khoa học đã tìm thấy một hành tinh lớn có quỹ đạo quay quanh một ngôi sao nhỏ nhưng sáng trong chòm sao Xử Nữ đang phát ra khí heli hòa vào vũ trụ.Đây là lần đầu tiên các nhà thiên văn học phát hiện thấy nguyên tố khí heli trên một hành trình ngoài Hệ mặt trời sau hơn một thập kỷ tìm kiếm.Phát hiện này được nhà thiên văn học chuyên về các exoplanet, bà Jessica Spake, tại Đại học Exeter, Vương quốc Anh, mô tả trong công trình đăng trên tạp chí khoa học Nature.Bà Jessica Spake cùng các cộng sự cho rằng nhiều hành tinh tương tự cũng có thể đang tồn tại, do đó công trình nghiên cứu của họ mở ra các khả năng mới trong việc chứng minh những bầu khí quyển đó đã che đi sự tồn tại của những thế giới xa xôi khác trong không gian.Heli là nguyên tố hóa học có nhiều thứ hai trong vũ trụ, chỉ sau hydro. Đây cũng là nguyên tố phổ biến ở các hành tinh khí khổng lồ như Sao Mộc và Sao Thổ. Cho tới nay các nhà lý thuyết vẫn dự đoán sẽ tìm thấy loại khí này trong bầu khí quyển của các exoplanet.""Thật hứng khởi khi lần đầu tiên nhìn thấy khí heli"" - bà Laura Kreidberg, thành viên nhóm nghiên cứu, nhà thiên văn học chuyên về exoplanet tại Đại học Harvard ở Cambridge, bang Massachusettes, bày tỏ niềm vui trước thành tựu nghiên cứu mới."
20180503094802245,https://tuoitre.vn/robot-bat-chuoc-loai-vat-tu-di-tiep-khi-bi-thuong-20180503094802245.htm,Robot bắt chước loài vật tự đi tiếp khi 'bị thương',https://cdn1.tuoitre.vn/zoom/600_315/2018/5/3/photo1525315957142-15253159571431319232266.jpg,03/05/2018 10:47 GMT+7,TTO - Một nhóm các nhà khoa học quốc tế vừa chế tạo robot với phần mềm đặc biệt cho phép chúng tìm cách thích nghi khi bị chấn thương chỉ trong 2 phút.,Khoa học,Phát minh,"Các nhà khoa học từ Đại học Pierre và Marie Curie (Pháp) và Đại học Wyoming (Mỹ) cho biết họ đã chế tạo robot này dựa trên cơ chế tự phục hồi của các loài vật.Khi một con thú bị thương ở chân, chúng có thể thích nghi bằng cách đi khập khiễng, chuyển trọng tâm sang chân kia hoặc một số chiến lược khác.Ví dụ một con chó dù chỉ ba chân vẫn có thể bắt bọ cánh cứng, hoặc nếu ai đó bị bong gân mắt cá chân, họ vẫn có thể tìm ra cách để đi tiếp.""Khi bị thương, động vật có trực giác về những cách khác nhau để xử lý tình huống"", Jean-Baptiste Mouret - đồng tác giả nghiên cứu, nói.""Những trực giác này cho phép chúng chọn vài cách khác nhau để thử, và sau những lần thử này, chúng sẽ chọn một cách có lợi nhất. Chúng tôi đã chế tạo ra các robot có thể làm tương tự"", ông giải thích.Trước khi vận hành, robot này sử dụng thuật toán mới để tạo ra một bản đồ chi tiết về không gian. Điều này cho phép nó phát triển trực giác nhất định về những hành vi mà nó có thể thực hiện và ưu thế của các hành vi đó.Về cơ bản, robot có thể xây dựng một thư viện các chuyển động khác nhau và thiết lập các bộ phận cơ thể mà nó có thể dựa vào nếu bị thương, ngay cả khi nó bị gãy hoặc cụt chân.Tuy nhiên quá trình này sẽ mất quá nhiều thời gian và có khả năng làm hỏng thiết bị, do đó các nhà khoa học đã lập sẵn bản đồ bằng mô phỏng máy tính.Khi làm như vậy, họ có thể kiểm tra và lập bản đồ hơn 13.000 cách đi khác nhau cho robot, bao gồm cả khi ""chân robot bị hỏng, gãy và rơi ra, và cánh tay robot bị gãy"", theo các nhà nghiên cứu.Các nhà khoa học gọi quá trình này là ""một thuật toán và thử nghiệm thông minh"", cuối cùng cho phép robot thích ứng với các tình huống trong tối đa 2 phút.Với nghiên cứu này, họ hi vọng sẽ giúp robot 'sống sót' lâu hơn khi làm các nhiệm vụ nguy hiểm như cứu người trong cháy rừng hoặc động đất."
20180501120651152,https://tuoitre.vn/sap-co-hoa-hong-khong-heo-toa-huong-lau-hon-20180501120651152.htm,"Sắp có hoa hồng 'không héo', tỏa hương lâu hơn?",https://cdn1.tuoitre.vn/zoom/600_315/2018/5/1/photo1525151087315-15251510873151055885560.jpg,01/05/2018 15:42 GMT+7,"TTO - Các nhà khoa học cho biết đã tìm ra cách chỉnh sửa gene để có được những đóa hồng tỏa hương thơm ngọt ngào hơn, lâu héo hơn và nở hoa quanh năm.",Khoa học,Phát minh,"Theo báo New York Times, các nhà nghiên cứu Pháp đã hoàn thành bản đồ gene của hoa hồng, từ đó mở ra cơ hội chỉnh sửa gene để tạo ra những giống hồng nở hoa quanh năm và có những đặc tính mà nhiều người ưa chuộng ở loài hoa này về màu sắc, hương thơm.Nghiên cứu về bản đồ gene toàn diện của hoa hồng vừa được công bố trên tạp chí khoa học Nature Genetics.Mặc dù trước đây từng có công trình nghiên cứu về bản đồ gene của hoa hồng, tuy nhiên phiên bản do các nhà khoa học Pháp công bố được cho là toàn diện nhất cho tới nay.Theo đó giới khoa học đã phát hiện ra những gene nào quy định về mùi hương, màu sắc cũng như thời gian nở của hoa hồng.Tiến sĩ Mohammed Bendahmane, đồng tác giả nghiên cứu, nói: ""Tôi hy vọng chúng tôi có thể thay đổi những loại hoa này trong tương lai, giúp chúng có thời gian tồn tại và thời gian tỏa hương lâu hơn"".Không chỉ mở ra cơ hội nâng cao chất lượng các giống hoa hồng, nghiên cứu bản đồ gene của giống hoa này cũng sẽ giúp giới khoa học tìm ra cách thức giúp chúng giảm bớt tình trạng bị sâu bệnh và cũng bớt tiêu hao nước trong quá trình chăm sóc."
