id,link,title,thumbnail,time,summary,category,sub_category,full_article
20221023223511823,https://tuoitre.vn/huynh-dong-oanh-kieu-dong-web-drama-the-loai-tam-ly-rung-ron-20221023223511823.htm,"Huỳnh Đông, Oanh Kiều đóng web drama thể loại tâm lý rùng rợn",https://cdn1.tuoitre.vn/zoom/600_315/2022/10/23/3118848564994916188578041712413952162022389n-16665397465041440938572-1666539769505708222326-crop-16665398591911199185095.png,23/10/2022 23:21 GMT+7,"TTO - Tối 23-10, tại TP.HCM, ê kíp thực hiện web drama ""Bí ẩn rừng sâu"" của đạo diễn Chánh Trực đã có buổi gặp báo chí, chia sẻ về quá trình thực hiện phim và công chiếu tập đầu tiên.",Giải trí,Điện ảnh,"Web drama Bí ẩn rừng sâu gồm ba tập thuộc thể loại phim tâm lý rùng rợn. Đây cũng là sản phẩm đầu tay của đạo diễn Chánh Trực khi thực hiện thể loại phim này.Kịch bản phim do Lan Lê đảm nhận. Cô cũng là thành viên trong nhóm viết kịch bản phim Cây táo nở hoa. Tham gia diễn xuất trong web drama này có ba diễn viên chính gồm Huỳnh Đông, Oanh Kiều và Trần Cường.Đây là những diễn viên được đông đảo khán giả biết đến trong lĩnh vực phim điện ảnh, truyền hình và web drama. Đạo diễn Chánh Trực quan niệm phim hay mà không có diễn viên nổi tiếng tham gia thì không có người xem.Nội dung phim kể về một chuyến trekking (du lịch mạo hiểm dã ngoại ở những địa điểm hoang dã bằng hình thức đi bộ dài ngày) của YouTuber Lâm (Trần Cường thủ vai). Anh gặp đôi vợ chồng (Huỳnh Đông, Oanh Kiều đóng) có hành tung bí hiểm đang sinh sống trên ngôi nhà sàn giữa suối ở rừng sâu.Do không may bị thương ở chân, Lâm xin ở nhờ một đêm nhưng anh không khỏi hốt hoảng, thậm chí sợ hãi trước hành tung kỳ lạ của đôi vợ chồng này.Đặc biệt, kịch bản xoáy vào chấn thương tâm lý của con người. Từng gây ấn tượng qua vai diễn liên quan đến các tổn thương tinh thần, Oanh Kiều một lần nữa vào dạng vai này. Nói về kịch bản, biên kịch Lan Lê cho biết cô tìm hiểu về căn bệnh rối loạn tâm thần từ tài liệu, sách tâm lý nước ngoài để hoàn thành kịch bản.Bối cảnh quay chính của web drama ở khu vực thác Mai (huyện Định Quán, tỉnh Đồng Nai), cách đường dân sinh khoảng 15km nên việc vận chuyển máy móc, thiết bị quay khó khăn. Đoàn phim có 5 ngày dựng bối cảnh và 2 ngày quay phim.Là một đạo diễn sân khấu, khi chuyển sang làm phim, đạo diễn Chánh Trực cũng có một số khó khăn nhất định.Anh chia sẻ: ""Đạo diễn sân khấu chuyển sang làm phim thì phim dễ bị kịch. Bản thân tôi ý thức được điều này, hiểu được ranh giới giữa kịch và phim trong diễn xuất, nên mời diễn viên giỏi để hỗ trợ. Tôi may mắn có DOP (đạo diễn hình ảnh) hỗ trợ để bộ phim không giống kịch"".Qua tập đầu cho thấy web drama được đầu tư chỉn chu, diễn xuất của diễn viên tự nhiên, tạo được sức hút cho người xem. Đạo diễn Chánh Trực cho biết thêm nếu ba tập phim Bí ẩn rừng sâu được khán giả ủng hộ, ê kíp sẽ tiếp tục triển khai chuỗi web drama này."
20221023101227078,https://tuoitre.vn/cha-con-cong-hau-va-cu-lieu-nghe-thuat-20221023101227078.htm,Cha con Công Hậu và 'cú liều' nghệ thuật,https://cdn1.tuoitre.vn/zoom/600_315/2022/10/23/20221015103042-3read-only-1666485836426982628835-crop-1666494634358391103779.jpg,23/10/2022 11:23 GMT+7,"TTO - Thông tin Công Hậu và con trai - đạo diễn Nhất Duy - bán hai miếng đất để làm phim chiếu rạp đầu tay của Nhất Duy tạo sự quan tâm của nhiều người bởi độ ""liều"" của hai cha con.",Giải trí,Điện ảnh,"Nói về việc bán đất để tiếp thêm ""lực"" cho con làm phim, Công Hậu giải thích: ""Đúng là tôi cũng có liều thật nhưng tôi chấp nhận sự rủi ro. Nếu phim của con có khán giả ủng hộ đó là điều rất vui. Còn không được như ý thì con có thêm kinh nghiệm"".Nếp nhàDiễn viên Công Hậu nổi tiếng từ những thập niên 80-90 của thế kỷ 20. Anh kết hôn với diễn viên lồng tiếng Bích Ngọc và có hai con. Nhất Duy là con trai lớn và theo nghề ba. Còn con gái đang du học. Thời gian sau này, Công Hậu vừa là diễn viên vừa đạo diễn phim và một số chương trình, các sự kiện...Hồi còn bé, Nhất Duy đã quen với việc... ở nhà một mình. Duy nhớ lại: ""Ngày tôi còn nhỏ, ba đi đoàn phim suốt cả tháng. Mẹ đi làm lồng tiếng phim đến 5h-6h chiều mới về. Lúc đó, quận 2 nơi gia đình tôi sinh sống còn nhiều vườn tược, vắng vẻ lắm. Tôi thường xuyên đi bộ từ nhà đến trường. Thỉnh thoảng mẹ có dẫn tôi đến chỗ làm. Mẹ làm việc, còn tôi chơi thơ thẩn ở phía ngoài..."".Lúc 3 tuổi anh vào vai Đức Phật lúc nhỏ, Công Hậu vai Đức Phật lúc lớn trong phim Ánh đạo vàng. Và đó là vai diễn duy nhất cho đến khi Nhất Duy 18 tuổi. ""Vợ chồng tôi nếm trải nhiều khó khăn khi làm nghệ thuật rồi nên không muốn các con mình đi theo nghề. Tôi muốn cho các con được học hành đến nơi đến chốn. Các cháu học ngoại ngữ từ nhỏ để sau này có công việc ổn định"", Công Hậu nói về quan điểm dạy con của mình.Thế nhưng cha tính không bằng con tính, năm Nhất Duy 18 tuổi, những tưởng anh sẽ theo học ngành công nghệ máy tính của một trường đại học thì anh tiếp tục thi vào Trường Sân khấu - Điện ảnh TP.HCM - khoa diễn viên. Sau thời gian học cả hai trường với hai nghề khác biệt, Duy quyết định theo đuổi nghệ thuật.Ra trường, để có thêm cơ hội tăng thu nhập, Duy tiếp tục học và trở thành diễn viên lồng tiếng. Rồi lại tiếp tục thi vào ngành đạo diễn điện ảnh, tiếp nối con đường của ba mình.""Cái này chỉ có thể nói là gene nghệ thuật của ba mẹ thấm trong người Duy. Dù không muốn con theo nghề nhưng chúng tôi tôn trọng quyết định của con"", Công Hậu cười.Và nghiệp diễnNgoài vai trò là một trong những nhà đầu tư tài chính, Công Hậu còn đảm nhận vai trò chủ nhiệm đoàn phim Virus cuồng loạn, làm trăm ngàn công việc trên phim trường để giúp con. Anh nói: ""Hai cha con cùng làm nghề, tôi cố gắng chia sẻ với con những kinh nghiệm mà mình có. Nhưng tôi tuyệt đối tôn trọng quyết định của con trên phim trường"", bởi theo Công Hậu ""tuy hai cha con làm nghề chung nhưng suy nghĩ khác nhau. Tôi hay hoài cổ, còn tụi nhỏ thì trẻ trung"".Theo nghề diễn đã lâu năm, tham gia kha khá phim nhưng cái tên Nhất Duy vẫn chưa được nhiều người biết đến như cha. Hỏi Duy có buồn khi mình lép vế trước sự nổi tiếng ấy, anh nói không buồn lắm: ""Trước đây mọi người không có nhiều sự lựa chọn giải trí. Nghệ sĩ đóng phim được khán giả biết đến nhiều. Còn bây giờ khán giả có quá nhiều sự lựa chọn. Nghệ sĩ cũng nhiều hơn nên không dễ nổi tiếng. Nhưng tôi chỉ cần mình sống được với nghề đã tốt lắm rồi"".Nhất Duy giờ là đồng nghiệp của ba, anh thường xuyên được ""đàn anh ba"" truyền đạt những kinh nghiệm trong công việc, nhưng Duy bảo người gần gũi nhất với anh lại là mẹ - người đã luôn lắng nghe và chia sẻ với anh. ""Mẹ chỉ góp ý lắng nghe, còn tất cả do tôi quyết định"", Duy nói rồi cười: ""Còn ba hay giận lắm. Có khi sau tranh cãi, ba không thèm nói chuyện với tôi hai ba ngày luôn. Sau đó hai cha con lại tự làm huề"".Nhắc lại ""cú liều"" bán đất làm phim, Duy cũng trầm tư nói: ""Tôi rất biết ơn ba mẹ đã bán đất làm phim, thực hiện ước mơ của tôi. Nhưng tôi sẽ cố gắng làm việc hơn nữa để trả lại số tiền ấy. Tiền ba mẹ dưỡng già mà, mình đâu thể lấy được"".Công Hậu kể: ""Bên cạnh chân sai vặt của đoàn phim, Duy còn giao cho tôi một vai diễn trong phim. Nói thật trong cuộc đời làm phim của mình, chưa khi nào tôi được đạo diễn giao vai diễn ít xuất hiện như vậy. Vậy mà sau đó vai này lại bị cắt mất hết. Buồn ghê chứ!"".Công Hậu nói buồn mà miệng thì cười giòn tan, ánh mắt hạnh phúc hướng về con trai nay là đồng nghiệp."
20221022013902136,https://tuoitre.vn/black-adam-khi-gioi-phe-binh-bo-tay-truoc-khan-gia-20221022013902136.htm,Black Adam: Khi giới phê bình 'bó tay' trước khán giả,https://cdn1.tuoitre.vn/zoom/600_315/2022/10/22/black-adam-2read-only-1666371834441862317656-crop-1666377327249210605408.jpg,22/10/2022 08:50 GMT+7,"TTO - Trong khi giới phê bình chấm Black Adam 44%, xếp loại ""cà chua thối"", khán giả toàn cầu lại chấm phim này tới 89%...",Giải trí,Điện ảnh,"""Bom tấn"" Black Adam của siêu sao The Rock đạt số điểm chênh lệch đến nực cười trên Rotten Tomatoes. Giới phê bình chấm 44%, xếp loại ""cà chua thối"". Còn khán giả toàn cầu chấm 89% và được dự báo chi 135 triệu USD xem phim trong dịp cuối tuần đầu tiên.Black Adam của DC đang rơi vào tình thế giống Venom của Sony năm 2018. Venom, cũng như phần hai là Venom: Let There Be Carnage, là những bộ phim chia đôi giới phê bình và khán giả. Thông thường giới phê bình và khán giả luôn có đánh giá khác biệt về phim ""bom tấn"", nhưng ở vài trường hợp, sự khác biệt đó ""sâu hoắm hơn cả rãnh Mariana"".""Thất vọng"", ""bản sao rẻ tiền""Sự khác biệt, cách biệt trong cách đánh giá của giới phê bình và khán giả luôn là chủ đề hấp dẫn, được nhiều người thảo luận để tìm lý do. ""Câu trả lời ngắn gọn là: giới phê bình đánh giá một bộ phim, còn khán giả đánh giá một trải nghiệm"" - khán giả Jon Negroni nêu ý kiến trên Quora khi Venom gây chia rẽ vào năm 2018.Khán giả Alexandra Cravioto đồng tình: ""Một khán giả thông thường sẽ thấy một bộ phim ""hay"" nếu bộ phim đó khiến họ thoải mái, thích thú, tận hưởng tại rạp. Còn một nhà phê bình luôn tập trung vào cách bộ phim được làm ra: kịch bản, biên tập, hiệu ứng đặc biệt, diễn xuất, tính tiếp nối... Rất thường xuyên, quan điểm của họ là khác biệt. Một bộ phim được làm rất dở lại khiến đông đảo khán giả thích thú (Venom) và một bộ phim được làm rất tốt lại bị một bộ phận khán giả ghét bỏ (Hereditary)"".Còn với Black Adam thì sao? Dù ca ngợi diễn xuất của ngôi sao The Rock - Dwayne Johnson trong vai chính là một phản anh hùng của vũ trụ DC, giới phê bình lại chê bai nặng nề về kịch bản và cốt truyện. ""Black Adam giống một bản phác thảo hơn là một bộ phim đã hoàn tất"" - Slashfilm viết. Cinemablend viết: ""Dự án này tốn nhiều năm sản xuất để thay đổi cán cân quyền lực trong vũ trụ điện ảnh DC, nhưng thật đáng thất vọng khi kết quả cuối cùng không đáng kể"".IndieWire nặng nề hơn: ""Nhân vật nào trong Black Adam cũng trông giống một bản sao rẻ tiền từ Gotham (thành phố giả tưởng trong các phim của DC) hoặc vũ trụ điện ảnh Marvel"".Bất chấp những đánh giá không tích cực từ giới phê bình, thành công của Black Adam vẫn sẽ phụ thuộc hoàn toàn vào phản ứng của khán giả và doanh thu phòng vé. Bởi từ thời Venom gây chia rẽ, người hâm mộ của truyện tranh và phim siêu anh hùng đã đi đến một kết luận: Không cần quan tâm giới phê bình nghĩ gì.Giới phê bình thiên vị Marvel, ""vùi dập"" DC?Sau khi Black Adam bị xếp loại ""cà chua thối"", người hâm mộ của vũ trụ điện ảnh DC đang có cuộc tranh luận sôi nổi về giá trị thực sự của điểm số trên Rotten Tomatoes với phim siêu anh hùng, đặc biệt là phim của DC.Từ nhiều năm nay, có một nghi vấn râm ran trong khán giả: Liệu giới phê bình có thành kiến với các phim siêu anh hùng bên ngoài vũ trụ điện ảnh Marvel? Không chỉ Black Adam, nhiều phim khác thuộc DC cũng có điểm số thấp như Justice League (39%), Batman v Superman: Dawn of Justice (29%) và Suicide Squad (26%).Một khán giả chỉ ra rằng Man of Steel, phim về Superman của DC, được khán giả yêu thích nhưng bị giới phê bình chấm điểm thấp. Còn She-Hulk: Attorney at Law, phim của Marvel, bị khán giả ghét nhưng lại được giới phê bình chấm điểm cao chót vót.""Nếu Black Adam có logo của Marvel thay vì DC, hẳn phim đã được giới phê bình trên Rotten Tomatoes chấm trên 70%. Tôi yêu cả hai vũ trụ điện ảnh, nhưng thật nực cười khi nhìn Rotten Tomatoes thiên vị Marvel suốt những năm qua"" - tài khoản Twitter GV viết.Trang Watch lấy ví dụ Thor: Love and Thunder, một phim của Marvel, nhận số điểm 64% và xếp loại ""cà chua tươi"", trong khi Black Adam với chất lượng tương đương lại bị vùi dập bởi số điểm thấp và những lời mỉa mai.Giữa cơn bão tranh luận, mọi ánh mắt đều đổ dồn vào doanh thu dịp cuối tuần đầu tiên của Black Adam (sẽ được công bố vào thứ hai tuần sau). Nếu phim ăn khách, đó sẽ là sự phản bác đanh thép nhất đối với cách đánh giá trên Rotten Tomatoes với các phim siêu anh hùng ""ngoài Marvel""."
20221021160735403,https://tuoitre.vn/dao-dien-phim-so-do-ha-van-trong-qua-doi-20221021160735403.htm,Đạo diễn phim ‘Số đỏ’ Hà Văn Trọng qua đời,https://cdn1.tuoitre.vn/zoom/600_315/2022/10/21/ha-van-trong-16663429571012035433596-crop-16663431021231418191927.jpg,21/10/2022 16:29 GMT+7,"TTO - Đạo diễn của bộ phim điện ảnh ‘Số đỏ’ và diễn viên trong nhiều bộ phim truyền hình, sân khấu nổi tiếng Hà Văn Trọng vừa qua đời ở tuổi 86 vì tuổi già, bệnh nặng.",Giải trí,Điện ảnh,"Bà Hà Thục Vân - con gái đạo diễn Hà Văn Trọng - chia sẻ tin buồn. Bà cho biết ông qua đời vào sáng 21-10, sau thời gian điều trị căn bệnh hiểm nghèo.Ông Hà Văn Trọng sinh năm 1937 tại Lào, về nước vào năm lên 10 tuổi. Ước mơ làm diễn viên nên ông sớm gia nhập Đoàn kịch Thanh Niên thuộc Thành Đoàn Hà Nội khi đoàn kịch vừa thành lập.  Sau này khi Đoàn kịch Thanh Niên sáp nhập với Nhà hát Kịch Việt Nam, ông trở thành một trong những diễn viên chính của nhà hát, đảm nhận những vai chính trong các vở như Lịch sử và nhân chứng, Nila - Cô gái đánh trống trận, Cơ sở trắng, Anh Trỗi… Bên cạnh kịch nói, ông còn tham gia nhiều bộ phim truyền hình như Phía cuối cầu vồng, Luật đời, Đất và người, Cảnh sát hình sự...  Trong cuộc đời diễn xuất của mình, ông được vào vai nhiều vị lãnh đạo cấp cao của Đảng trong các vở kịch, bộ phim lịch sử.  Đó là vai Chủ tịch Hồ Chí Minh trong vở kịch Lịch sử và nhân chứng (đạo diễn Doãn Hoàng Giang), vai Tổng bí thư Lê Duẩn trong phim truyện nhựa Giải phóng Sài Gòn (đạo diễn Long Vân).  Nhưng sự nghiệp diễn xuất cả sân khấu, điện ảnh, truyền hình mới chỉ là một nửa sự nghiệp đáng nể của nghệ sĩ này.  Sau thời gian cống hiến ở Nhà hát Kịch Việt Nam, ông chuyển sang Hãng phim truyện I và đi làm trợ lý, rồi phó đạo diễn cho đạo diễn Hải Ninh. Sau vài năm tự mày mò học hỏi, ông quyết định làm bộ phim của mình.  Với vai trò đạo diễn, ông đã sáng tạo nhiều bộ phim đáng chú ý như Kỷ niệm đồi trăng, Đứa con của người hàng xóm… và đặc biệt là phim Số đỏ, đồng đạo diễn với Lộng Chương.Vào đầu những năm 1990, bộ phim này từng gặp khó khăn trong việc phát hành do có quá nhiều cảnh phòng the, chưa phù hợp với những quan niệm thẩm mỹ nghệ thuật hiện thời. Nhưng sau khi được phát hành thì bộ phim lại gây sốt trong khán giả. Đạo diễn Quốc Trọng (vai Xuân Tóc đỏ) trong một chương trình Quán Thanh xuân của Đài Truyền hình Việt Nam kể lại: ""Bộ phim được ví như “quả bom” phim. Hầu hết các rạp ở Hà Nội, người xếp hàng mua vé chật kín các cung giờ. Suất chiếu cuối cùng lúc 1h30 sáng vẫn đông đúc người xếp hàng nghiêm chỉnh chờ vào xem. Rạp nào cũng thuê công an bảo vệ không thì... vỡ rạp""."
20221020160839037,https://tuoitre.vn/bo-phim-cuoi-cung-cua-dao-dien-dang-nhat-minh-duoc-chon-du-thi-lien-hoan-phim-quoc-te-ha-noi-2022-20221020160839037.htm,Bộ phim cuối cùng của đạo diễn Đặng Nhật Minh được chọn dự thi Liên hoan phim quốc tế Hà Nội 2022,https://cdn1.tuoitre.vn/zoom/600_315/2022/10/20/dang-nhat-minh-1666255610933670314628-crop-166625573503047327324.jpg,20/10/2022 17:07 GMT+7,"TTO - Phim ‘Hoa nhài’ - một bộ phim về người Hà Nội thanh lịch của đạo diễn Đặng Nhật Minh sản xuất năm 2022, khi đạo diễn 84 tuổi - là bộ phim dài duy nhất của Việt Nam được chọn dự thi Liên hoan phim quốc tế Hà Nội lần thứ VI năm 2022.",Giải trí,Điện ảnh,"Bộ phim do Công ty TNHH Điện ảnh và Truyền thông Khánh An - một hãng phim ở Huế, quê hương của đạo diễn - sản xuất. Đạo diễn Đặng Nhật Minh làm bộ phim này từ chính kịch bản của mình. Diễn viên chính là Đức Minsu.Chiều 20-10, tại buổi họp báo thông tin về Liên hoan phim quốc tế Hà Nội lần thứ VI diễn ra từ ngày 8 đến 12-11 tại Hà Nội, ông Vi Kiến Thành - cục trưởng Cục Điện ảnh - cho biết bộ phim được làm bằng nguồn cảm hứng từ câu ca dao: ""Chẳng thơm cũng thể hoa nhài / Dẫu không thanh lịch cũng người Tràng An"".  Theo ban tổ chức, bộ phim là những lát cắt của cuộc sống người Hà Nội dung dị, tinh tế, nhuần nhị, ngân lên tiếng ca sâu thẳm của tâm hồn người Hà Nội nhân nghĩa, tử tế, nhân văn.  Đạo diễn Đặng Nhật Minh không có mặt tại buổi họp báo. Đoàn phim sẽ ra mắt vào buổi chiếu bộ phim này tại khai mạc liên hoan phim.  Trong một bài trả lời phỏng vấn hồi đầu năm, đạo diễn Đặng Nhật Minh cho biết ông làm phim này bởi thấy báo chí, phim ảnh phản ánh nhiều về những mặt tiêu cực của người Hà Nội, ""chất hoa nhài"" của người Hà Nội dường như không còn.  Ông muốn làm bộ phim cuối cùng này của mình, với kinh phí rất hạn hẹp, để chứng minh dù bây giờ người tứ xứ đổ về khiến người Hà Nội không còn như xưa thì chất hoa nhài vẫn ẩn sâu trong những người Hà Nội bình dị.  Hoa nhài là câu chuyện xoay quanh các mối quan hệ giữa con người với nhau trong vòng xoáy của cuộc sống đô thị hiện nay: một em bé đánh giày từ nông thôn ra, một ông thợ cắt tóc với vợ là người từ làng bánh cuốn Thanh Trì, một ông giáo già người Hà Nội gốc dạy hát cho các em trong dàn đồng ca khiếm thị… Họ vẫn giữ được cái cốt cách của ""người Tràng An"".  Là người rất hâm mộ điện ảnh Iran với những bộ phim kinh phí thấp nhưng rất cảm động và giành nhiều giải thưởng lớn, đạo diễn Đặng Nhật Minh cố học theo họ trong bộ phim này trước hết về phương diện kinh phí thấp và câu chuyện đơn giản.  10 phim nước ngoài dự thi cùng Hoa nhài là các bộ phim đến từ Tây Ban Nha, Iran, Sri Lanka, Myanmar, Kazakhstan, Ba Lan/Thụy Điển, Philippines, Pháp, Brazil, Ấn Độ.  Ngoài 11 phim dài dự thi, còn có 20 phim ngắn dự thi (Việt Nam có 8 phim), 63 phim trong chương trình Toàn cảnh điện ảnh thế giới (Panorama), 22 phim trong chương trình Phim Việt Nam đương đại, 7 phim trong chương trình Tiêu điểm điện ảnh Hàn Quốc.800 đại biểu sẽ tham dự, trong đó có khoảng 100 đại biểu quốc tế, nhưng những ngôi sao quốc tế tham gia liên hoan phim chưa được tiết lộ.  Năm nay, ngoài các giải thưởng truyền thống của liên hoan phim này thì có thêm giải đạo diễn triển vọng. Ngoài ra UBND TP Hà Nội có thêm giải thưởng cho bộ phim hoặc đạo diễn bộ phim xuất sắc về đề tài Hà Nội.  Liên hoan phim là cơ hội để người yêu điện ảnh được thưởng thức miễn phí hơn 100 bộ phim mới đến từ 50 nước trên thế giới và những bộ phim Việt Nam đương đại như 1990, Bố già, Cơn giông, Em và Trịnh, Maika - Cô bé đến từ hành tinh khác, Memento Mori - Đất, Những đứa trẻ trong sương…Các bộ phim được chiếu tại Trung tâm Chiếu phim quốc gia (87 Láng Hạ, quận Đống Đa), CGV Vincom Center (54 Nguyễn Chí Thanh, quận Đống Đa), BHD Star Cinema, tầng 8, Trung tâm thương mại Vincom, số 2 Phạm Ngọc Thạch, quận Đống Đa.Chương trình chiếu phim và vé mời xem phim được in và gửi tới khán giả tại các địa điểm chiếu phim."
