id,link,title,thumbnail,time,summary,category,sub_category,full_article
20211222184733721,https://tuoitre.vn/bo-gia-gai-gia-lam-chieu-v-dai-thang-trong-con-mua-giai-thuong-canh-dieu-2020-20211222184733721.htm,"‘Bố già’, 'Gái già lắm chiêu V' đại thắng trong cơn mưa giải thưởng Cánh diều 2020",https://cdn1.tuoitre.vn/zoom/600_315/2021/12/22/z30446685258021bf21d2553645d9d5835b2750e9f76bc-16401735127341130428482-crop-16401735330211592425354.jpg,22/12/2021 19:25 GMT+7,"TTO - Giải Cánh diều vàng 2020 trao chiều 22-12 tiếp tục gọi tên những bộ phim quen thuộc đã được trao giải thưởng lớn ở Liên hoan phim Việt Nam lần thứ 22 vừa diễn ra tại TP Huế như Bố già, Gái già lắm chiêu V - Những cuộc đời vương giả…",Giải trí,Điện ảnh,"Lễ trao giải thưởng Hội Điện ảnh Việt Nam  - Cánh diều 2020 được Hội Điện ảnh Việt Nam tổ chức chiều 22-12 tại Hà Nội, vì tình hình dịch bệnh phức tạp, nhiều người được trao giải không thể đến nhận giải.Như mọi năm, một ""cơn mưa"" giải thưởng đã được trao cho nhiều bộ phim và nhiều nghệ sĩ. Giải thích về điều này với Tuổi Trẻ Online, diễn viên Quyền Linh - phó chủ tịch Hội Điện ảnh Việt Nam - nói phim ảnh là sản phẩm của tập thể nên giải thưởng của hội muốn vinh danh nhiều thành phần của đoàn làm phim.Hạng mục phim truyện điện ảnh: ""chia đều"" cả làngGiải Cánh diều năm nay, thể loại phim truyện điện ảnh có 13 hạng mục được chia cho 8 phim. Dẫn đầu là Gái già lắm chiêu V - Những cuộc đời vương giả với 4 giải và Bố già với 3 giải.Các phim khác chia nhau 1, 2 giải gồm có: Trạng Tí phiêu lưu ký, Võ sinh đại chiến, Con đường có mặt trời, Trái tim quái vật và thậm chí những phim không được đánh giá cao như Kiều, Người cần quên phải nhớ.Cách trao giải chia đều cho nhiều phim như vậy có lẽ phải thay đổi vì tạo nên nhiều hạng mục chỉ mang tính chất khuyến khích, ""góp mặt cho đủ"". Ngoài giải Cánh diều vàng cho Bố già, ban tổ chức trao đến 2 Cánh diều bạc, 3 bằng khen (chia đều cho điện ảnh tư nhân và nhà nước).Giải bằng khen từng gây tranh cãi vì trao nhiều giải đồng hạng, cho thấy tính chọn lọc không cao. Liệu đây có phải lúc cân nhắc nên tinh giản, đồng thời nâng cao giá trị vinh danh của từng giải thưởng?Đoạt nhiều giải nhất là Gái già lắm chiêu V - Những cuộc đời vương giả, với 4 giải: Cánh diều bạc, Đạo diễn, Thiết kế mỹ thuật và Nữ diễn viên chính xuất sắc cho Kaity Nguyễn. Điều này khá bất ngờ khi bộ phim nhận nhiều lời khen về mỹ thuật, thiết kế sản xuất nhưng mặt nội dung chưa được đánh giá cao.Bố già đoạt Cánh diều vàng dễ hiểu khi đạt doanh thu kỷ lục và được khán giả yêu mến trong một năm 2021 đầy khó khăn, chỉ có 12 phim Việt ra rạp. Bố già đoạt thêm 2 giải phụ cho Quay phim và Nam diễn viên chính xuất sắc (Tuấn Trần). Kết quả này xứng đáng nếu chấp nhận gu của giải thiên về dòng phim thị trường.Điều đáng tiếc là danh sách đề cử không được công bố rộng rãi trong vài tuần hoặc vài tháng trước ngày trao giải, khiến báo chí không thể tiếp cận hay bàn luận về đề cử. Trong khi đó, chất lượng của đề cử - bao gồm các ứng viên xuất sắc, mang tính tiêu biểu cho nền điện ảnh - sẽ làm nên chất lượng của giải thưởng sau đó.Hạng mục phim truyền hình: VFC chiếm 14/15Những năm gần đây các phim của VFC sản xuất đều thống trị hầu hết các giải thưởng Cánh diều vàng. Và năm nay cũng không ngoại lệ. Trong tổng số 15 giải thưởng, Trung tâm sản xuất phim truyền hình VFC giành đến 14 giải.Hồ sơ cá sấu - bộ phim khai thác đề tài hình sự, pha lẫn với chính luận và gia đình - đạt đến 4 giải: Phim hay nhất, Biên kịch xuất sắc, Đạo diễn xuất sắc, Nam diễn viên chính xuất sắc (Mạnh Trường).Vỏn vẹn chỉ có 4 tập phát sóng trong ngày Tết Nguyên đán năm 2021 (tháng 2), Yêu hơn cả bầu trời là bộ phim ít tập nhất đoạt giải Cánh diều bạc, cùng với hai phim có số tập khá dài là Tình yêu và tham vọng (60 tập) và Hướng dương ngược nắng (70 tập).Giải cá nhân cũng không quá bất ngờ bởi hai diễn viên nam nữ đoạt giải diễn viên chính xuất sắc cũng đến từ những bộ phim đoạt giải. Thoát khỏi vai soái ca, Mạnh Trường lần đầu thể hiện nhân vật người chồng ghen tuông, lạnh lùng trong Hồ sơ cá sấu được khen là hóa thân tốt.Còn Lương Thu Trang chỉ mới bước chân vào lĩnh vực phim truyền hình qua vài phim như Những cô gái trong thành phố, Mùa xuân ở lại… và vai ấn tượng nhất của cô là Minh ""hung hãn"" thẳng thắn, thông minh trong Hướng dương ngược nắng.Kẻ sát nhân cô độc (30 tập) của Hãng phim TFS sản xuất là phim duy nhất lọt vào danh sách nhận bằng khen của giải thưởng này - cùng các phim Cô gái nhà người ta (25 tập), Cát đỏ (30 tập), Nhà trọ balanha (35 tập). Phim theo thể loại hình sự, khai thác góc khuất tâm lý tội phạm khá lạ. Tuy nhiên, đôi chỗ phim xử lý tình huống khá rối...Cuối năm 2020, bộ phim này từng đoạt giải vàng Liên hoan truyền hình toàn quốc lần thứ 40. Đầu năm 2021 tiếp tục đoạt giải A dành cho hạng mục phim truyền hình do Hội Điện ảnh TP.HCM trao tặng.Một số giải thưởng cá nhân khác như: Tạ Hồng Minh và Nguyễn Mai Hiền của phim Hồ sơ cá sấu đoạt giải Biên kịch và Đạo diễn xuất sắc; Quay phim xuất sắc nhất là Trần Kim Vũ của Cát đỏ; Thanh Sơn trong phim Tình yêu và tham vọng và Tuyết Hương phim Cát đỏ đoạt giải Nam, Nữ diễn viên phụ xuất sắc."
20211222131745609,https://tuoitre.vn/an-mang-tren-song-nile-tung-trailer-sau-be-boi-tinh-duc-cua-dien-vien-20211222131745609.htm,'Án mạng trên sông Nile' tung trailer sau bê bối tình dục của diễn viên,https://cdn1.tuoitre.vn/zoom/600_315/2021/12/22/nile-0-1640155067841474582465-crop-16401550887031387944432.jpg,22/12/2021 14:30 GMT+7,"TTO - Nữ diễn viên Gal Gadot đẹp lộng lẫy trong 'Án mạng trên sông Nile' (Death on the Nile), phim chuyển thể từ tiểu thuyết nổi tiếng bậc nhất của nhà văn trinh thám Agatha Christie.",Giải trí,Điện ảnh,"Trailer Án mạng trên sông Nile đưa khán giả theo chuyến du thuyền sang trọng dọc dòng sông Nile, băng qua những địa danh nổi tiếng của Ai Cập, tái hiện nếp ăn chơi xa hoa của quý tộc Pháp ở châu Phi vào thập niên 1930.Sau thành công với Án mạng trên chuyến tàu tốc hành Phương Đông (năm 2017), đạo diễn Kenneth Branagh trở lại với Án mạng trên sông Nile.Trong phim, vị đạo diễn kỳ cựu tiếp tục vào vai thám tử lừng danh Hercule Poirot, người được phu nhân giàu có Linnet (Gal Gadot) thuê đồng hành trên chuyến du thuyền định mệnh.Linnet vừa kết hôn với người chồng bảnh trai Simon (Armie Hammer) nhưng sâu thẳm trong lòng, cô vẫn hoài nghi về những người xung quanh. Cô tâm sự với Poirot: ""Khi ta có tiền, chẳng có ai là bạn thật sự"".Liền đó, một vụ án mạng kinh hoàng xảy ra trên chiếc du thuyền. Tất cả những ai còn sống đều bị vị thám tử đưa vào diện tình nghi.Nổi tiếng với vai diễn Wonder Woman, Gal Gadot xuất hiện với tạo hình sang trọng, cổ điển của thập niên 1930 trong Án mạng trên sông Nile. Trong lần quảng bá này, cô là tâm điểm khi xuất hiện dày đặc trong trailer.Những cái tên đáng mong đợi khác trong dàn sao là Emma Mackey (từng đóng Maeve  loạt phim đình đám Sex Education), Letitia Wright, Annette Bening, Rose Leslie (Game of Thrones), Russell Brandt...Án mạng trên sông Nile từng định ra mắt năm 2020 nhưng hoãn vì COVID-19. Theo Hollywood Reporter, sau bê bối đời tư của nam diễn viên chính Armie Hammer, Hãng Disney đã cân nhắc một vài phương án, trong đó có thay diễn viên. Nhưng vì phim có quy mô quá lớn, điều này không khả thi. Do đó, trong trailer, Hammer xuất hiện khá ít ỏi.Gần 9 tháng sau khi bị tố hiếp dâm và bạo hành, phải ngừng mọi hoạt động, mới đây Armie Hammer thông báo đã hoàn thành khóa cai nghiện và trị liệu. Tài tử sẽ phải đối mặt với những cáo buộc chống lại mình.Một số hình ảnh trong phim:"
2021120914183678,https://tuoitre.vn/trung-quoc-chieu-lai-phim-rap-han-quoc-sau-6-nam-cam-2021120914183678.htm,Trung Quốc chiếu lại phim rạp Hàn Quốc sau 6 năm cấm,https://cdn1.tuoitre.vn/zoom/600_315/2021/12/9/oh-my-gran-2-1639035711118189727190-crop-16390360268332037574421.jpeg,09/12/2021 15:47 GMT+7,TTO - 'Oh! My Gran' là phim điện ảnh Hàn Quốc đầu tiên ra rạp tại Trung Quốc từ khi Trung Quốc cấm chiếu phim Hàn vào năm 2016. Động thái diễn ra trước năm trao đổi văn hóa Trung - Hàn 2022.,Giải trí,Điện ảnh,"Ra rạp tại Trung Quốc từ ngày 3-12, phim Oh! My Gran được chọn là phim gia đình cảm động. Mặc dù vậy, phim khá cũ, đã chiếu ở Hàn Quốc năm 2020 và không hòa chung dòng chảy với các phim Hàn thuộc thể loại kinh dị giả tưởng đang gây sốt trên thế giới.Theo Global Times, mạng xã hội Trung Quốc rất đón nhận trước thông tin Oh! My Gran (còn có tên khác là Oh! Moon Hee) được chiếu tại Trung Quốc sau 6 năm cấm đoán điện ảnh Hàn. Hashtag về sự việc thu hút 150 triệu lượt xem trên Weibo. Các chuyên gia nhận định động thái này là ""tàu phá băng"" cho quá trình trao đổi văn hóa giữa 2 nước, trong khi công chúng Trung Quốc đặt câu hỏi: ""Đây là dấu hiệu chấm dứt hạn chế phổ biến Làn sóng Hàn tại Trung Quốc?"".Dù dư luận xung quanh sự việc tích cực, bộ phim Oh! My Gran lại có doanh thu kém. Trong cuối tuần đầu tiên, phim chỉ thu được hơn 147.000 USD. ""Thành tích kém cỏi này cho thấy khán giả Trung Quốc vẫn cần thời gian để thích nghi với sự trở lại của phim Hàn Quốc. Các nhà làm phim Hàn Quốc còn cả một chặng đường dài trước khi thực sự được hưởng lợi từ thị trường phim đại lục"", Global Times bình luận.Theo phân tích, thế mạnh của điện ảnh Hàn là những phim kinh dị gây sửng sốt với các tình tiết hồi hộp, vượt lên khuôn khổ. Nhưng những phim như vậy có vẻ không hợp gu khán giả Trung Quốc.Các phim gia đình ấm áp như Oh! My Gran là lựa chọn an toàn nhưng lại khó đột phá, dễ mắc kẹt trong các khuôn mẫu. Khán giả Trung Quốc cần thời gian để làm quen trở lại với phong cách kể chuyện của điện ảnh Hàn vì 6 năm xa cách không phải là thời gian ngắn ngủi.Gần đây, các nghệ sĩ của Làn sóng Hàn cũng khôi phục hoạt động quảng bá tại Trung Quốc, như tài tử Lee Dong Wook lên trang bìa tạp chí GQ Trung Quốc số tháng 12.Việc Trung Quốc cấm chiếu phim Hàn Quốc 6 năm được cho liên quan đến bất đồng giữa 2 nước, sau khi Seoul triển khai hệ thống phòng thủ tên lửa THAAD của Mỹ vào năm 2016.Cũng năm đó, Catman, bộ phim hợp tác Trung - Hàn, vốn ấn định lịch chiếu vào tháng 4 đã bị hủy. Bộ phim sau đó lên nền tảng trực tuyến nhưng cũng bị gỡ sau 2 tiếng. Trước lệnh cấm, Hàn Quốc đã có các phim điện ảnh ăn khách tại Trung Quốc như Assassination (2015), The Admiral: Roaring Currents (2014), The Thieves (2013), Sector 7 (2011) và Tidal Wave (2009)."
20211209110150336,https://tuoitre.vn/phim-kinh-di-chuyen-ma-gan-nha-cua-mac-can-tung-trailer-rung-ron-20211209110150336.htm,Phim kinh dị 'Chuyện ma gần nhà' của Mạc Can tung trailer rùng rợn,https://cdn1.tuoitre.vn/zoom/600_315/2021/12/9/cmgnteaserstill1511712107021411-16390243007211131466972-crop-16390245299931375137596.jpg,09/12/2021 13:27 GMT+7,"TTO - Do nghệ sĩ Mạc Can đóng vai chính, phim kinh dị 'Chuyện ma gần nhà' vừa tung video giới thiệu và poster hé lộ thêm nhiều nhân vật, tạo bầu không khí rùng rợn.",Giải trí,Điện ảnh,"Đây là bộ phim được nghệ sĩ Mạc Can đóng vào năm 2020, khi sức khỏe ông rất yếu, có lúc chỉ nằm một chỗ, nói chuyện khó khăn. Nhưng khi đi đóng phim, ông phấn chấn và khỏe mạnh trở lại.Teaser còn công bố cảnh phim của các diễn viên Ngọc Hiệp, Vân Trang, Khả Như, Lê Bê La... và hình ảnh ""cô gái trên xe nước mía"" bí hiểm.Chuyện ma gần nhà được lấy cảm hứng từ những truyền thuyết đô thị và các câu chuyện ma được đồn thổi trong dân gian. Phim mang màu sắc u ám, quỷ dị với chất liệu từ cuộc sống đời thường. Văn hóa, tín ngưỡng, phong tục tập quán của người Việt Nam sẽ là điểm nhấn trong tác phẩm.Trong teaser, nhân vật của Khả Như tỏ ra rất bí hiểm. Nhân vật của Vân Trang luôn mang vẻ hồi hộp, tâm linh. Còn nghệ sĩ gạo cội Mạc Can xuất hiện trong tạo hình chú hề mang nhiều nét ghê rợn. Clip khép lại bằng hình ảnh một phụ nữ mặt biến dạng, dường như bị tạt axit.Poster Chuyện ma gần nhà là hình ảnh tranh vẽ cô gái trên xe nước mía quen thuộc. Hình ảnh này gây tò mò cho khán giả với gương mặt bị bong tróc, ánh mắt u ám. Phim sẽ hé lộ câu chuyện đằng sau chân dung ám ảnh này.Chuyện ma gần nhà do Trần Hữu Tấn đạo diễn, Hoàng Quân sản xuất. Đây là bộ đôi đứng sau các bộ phim Bắc Kim Thang, Rừng thế mạng đều thuộc thể loại kinh dị.Phim dự kiến ra rạp ngày 11-2-2022.Một số hình ảnh trong phim Chuyện ma gần nhà:"
20211208123214229,https://tuoitre.vn/bo-gia-du-oscar-thi-cho-vui-cung-khong-co-gi-ho-then-20211208123214229.htm,'Bố già' dự Oscar: Thi cho vui cũng không có gì hổ thẹn,https://cdn1.tuoitre.vn/zoom/600_315/2021/10/22/bo-gia-3-1634888472830642019698-crop-16389452724161048815061.jpg,09/12/2021 09:24 GMT+7,"TTO - Chưa công bố danh sách rút gọn, hạng mục Phim quốc tế xuất sắc Oscar 2022 đã khá sôi động vì sự góp mặt của các phim đoạt giải quốc tế lớn như Titane, Drive My Car, A Hero...",Giải trí,Điện ảnh,"Cơ hội nào cho Bố già khi hầu hết các nền điện ảnh lớn gửi phim nghệ thuật (art-house) còn Việt Nam gửi phim thương mại? Hơn nữa, Bố già lại thuộc thể loại phim hài ít khi đoạt giải ở hạng mục này.Tuổi Trẻ Online từng đặt câu hỏi ""Đi thi làm gì khi cơ hội chỉ bằng không?"" khi Hai Phượng được chọn tham dự Oscar 2020, và rồi đến Mắt biếc năm 2021. Đây đều là các phim thương mại thành công của Việt Nam nhưng không đột phá về nghệ thuật, tư tưởng.Tham dự cho vui, không có gì đáng hổ thẹnNhận định về cơ hội của phim Việt Nam ở Oscar, nhà phê bình Lê Hồng Lâm viết: ""Trên đấu trường điện ảnh, Việt Nam vẫn là một chấm mờ và vẫn còn xa, xa lắm để lọt vào top phim tốt nhất của Đông Nam Á, của châu Á, chứ đừng nói các liên hoan phim quốc tế hạng A hay đề cử Oscar.Cho nên Bố già, cho dù là phim Việt Nam tốt nhất năm nay, việc tham dự tranh giải Phim quốc tế xuất sắc tại Oscar 2022 cũng chỉ là cho vui thôi. Chuyện đó cũng không có gì đáng hổ thẹn cả"".Anh Lê Hồng Lâm dự báo khoảng 10, 15 năm nữa, điện ảnh Việt Nam mới có một cơ hội thực sự rõ ràng ở Oscar.Giới thiệu về phim Việt Nam dự sơ loại Oscar năm nay, trang Screen Daily viết: ""Một tác phẩm hài hiếm hoi trong hạng mục phim quốc tế đến từ diễn viên hài Trấn Thành, người nổi tiếng ở đất nước của anh vì tài đóng nhại người khác.Trấn Thành cũng viết kịch bản và đóng chính trong phim, vai ông Sang, một tài xế xe ôm già sống trong một khu phố nghèo ở TP.HCM. Ông luôn hy sinh vì gia đình dù bản thân gặp khó khăn tài chính và bệnh tật"".Trước đó, Bố già đã được chiếu tại Mỹ với tên Dad, I'm Sorry, thu hơn 1 triệu USD và có bài phê bình không quá tích cực của nhà phê bình nổi tiếng Todd McCarthy trên trang Deadline.Cần khẳng định hướng đi của Bố già là đáng khích lệ đối với điện ảnh Việt Nam: một tác phẩm xem được, có thông điệp ý nghĩa, làm hài lòng nhiều đối tượng khán giả ở nhiều lứa tuổi, phát hành thương mại ở thị trường quốc tế. Chỉ có điều, dự Oscar là chiếc áo quá rộng.Các phim xuất sắc từ Nhật, Iran, Na UyTừ 21-10, tạp chí Variety đã dự báo danh sách đề cử chính thức hạng mục Phim quốc tế xuất sắc năm 2022. Lý do rất đơn giản: hầu hết phim xuất sắc đều đã ra mắt khá đình đám ở các liên hoan phim hạng A của thế giới, được các quốc gia nộp sớm để bắt đầu quá trình quảng bá, vận động tranh Oscar.Dự báo 5 đề cử chính thức của Variety là: The Worst Person in the World (đạo diễn Joachim Trier - Na Uy), A Hero (Asghar Farhadi - Iran), Flee (Jonas Poher Rasmussen - Đan Mạch), Drive My Car (Ryusuke Hamaguchi - Nhật Bản) và Prayers for the Stolen (Tatiana Huezo - Mexico).Và có 5 phim dự bị là: The Hand of God (Paolo Sorrentino - Ý), Compartment No. 6 (Juho Kuosmanen - Phần Lan), Titane	(Julia Ducournau - Pháp), Unclenching the Fists	(Kira Kovalenko - Nga), I’m Your Man (Maria Schrader - Đức).2 đại diện châu Á nổi bật nhất là A Hero của Iran và Drive My Car của Nhật Bản. A Hero giành giải Grand Prix, Drive My Car giành giải Kịch bản hay nhất tại Liên hoan phim Cannes 2021. Phía châu Âu, The Worst Person in the World của Na Uy nổi trội, với nữ chính Renate Reinsve giành giải Nữ diễn viên chính xuất sắc tại Cannes.Titane của Pháp giành Cành Cọ Vàng ở Cannes, nhưng vì là bộ phim gây sốc nhất năm, cơ hội của phim ở Oscar khó dự đoán.Hàn Quốc từng có đại diện tiêu biểu Parasite (2020) nhưng năm nay, phim dự thi Escape From Mogadishu của họ không được đánh giá cao.Năm nay, giải Oscar nhận 93 phim tham dự vòng sơ loại giải Phim quốc tế xuất sắc. Danh sách rút gọn gồm 15 phim sẽ được công bố vào ngày 21-12, còn danh sách đề cử chính thức gồm 5 phim sẽ được công bố vào ngày 8-2-2022.Lễ trao giải Oscar lần thứ 94 diễn ra vào ngày 27-3-2022."
