id,link,title,thumbnail,time,summary,category,sub_category,full_article
20200317192013518,https://tuoitre.vn/nguoi-chong-cham-vo-mac-covid-19-co-anh-o-day-roi-20200317192013518.htm,Người chồng chăm vợ mắc COVID-19: 'Có anh ở đây rồi',https://cdn1.tuoitre.vn/zoom/600_315/2020/3/17/phim-tai-lieu-covid-1584447690576180761192-crop-1584447719596499602318.png,17/03/2020 20:22 GMT+7,"TTO - Khi nữ y tá Li Ting khóc trên giường cách ly vì bệnh tình ngày càng nặng, chồng cô - nhà làm phim Cai Kaihai - nói: ""Có anh ở đây rồi"".",Giải trí,Điện ảnh,"Hôm 16-3, phim tài liệu Virus corona: Cuộc sống bên trong vùng phong tỏa của Trung Quốc  (Coronavirus: Life inside China's lockdown) được phát trên BBC News. Đây là phim tài liệu mới nhất về Vũ Hán những ngày ""phong thành"" vì COVID-19, được thực hiện bởi chính người dân Vũ Hán.Đồng tác giả của phim tài liệu này là Cai Kaihai, một nhà làm phim chuyên nghiệp và Lin Wenhua, nhà làm phim tự do kiêm tình nguyện viên. Cả hai đặt máy quay tại nhà, trên xe hơi và máy quay di động để ghi lại các hoạt động sống của họ ở Vũ Hán thời dịch COVID-19.Cuộc sống bên trong vùng phong tỏa của Trung Quốc được thực hiện trong suốt 50 ngày ở Vũ Hán, kể từ khi thành phố bị phong tỏa vào tháng 1 năm nay. Điều đặc biệt là hai nhà làm phim đều trực tiếp liên quan đến người mắc COVID-19: Cai Kaihai có vợ là Li Ting, một y tá dương tính với COVID-19, còn Lin Wenhua là tình nguyện viên đi giao thuốc cho các bệnh nhân dương tính. Trải nghiệm thực tế giúp bộ phim của họ chân thực và cảm xúc.BBC News giới thiệu: ""Dịch bệnh khởi phát từ thành phố Vũ Hán của Trung Quốc, nơi bị phong tỏa cuối tháng 1. Với quyền tiếp cận độc quyền của hai nhà làm phim sống ở thành phố này, BBC kể câu chuyện về cuộc sống những ngày phong thành.Bộ phim đưa bạn từ những con đường trống trải đến những căn hộ nơi người dân đang chiến đấu với virus corona. Làm thế nào họ sống sốt khi cuộc sống thường ngày ngừng trệ?"".Một bước ngoặt trong bộ phim là khi Li Ting phát hiện dương tính với COVID-19. Từ việc là y tá chăm sóc người bệnh, cô tự nguyện cách ly tại nhà. Người chồng Cai Kaihai muốn chăm sóc vợ, nhưng cô đề nghị cả hai phải sống tách biệt để đảm bảo an toàn cho anh.Cảnh phim ấn tượng nhất là khi bệnh Li Ting trở nặng, cô sốt trên 39 độ, ho liên tục và khóc lớn trên giường cách ly. Vì quá lo lắng cho vợ, Cai Kaihai mặc đồ bảo hộ, bước vào phòng và vỗ về vợ. Li Ting vẫn khóc và yêu cầu chồng phải ra khỏi phòng. Còn chồng cô chỉ biết nói: ""Em đừng khóc nữa, đừng lo, có anh ở đây rồi"".Chia sẻ về tình huống này, Cai Kaihai cho biết anh vô cùng bối rối khi không biết làm gì để giúp vợ. Anh hối hận vì không đưa vợ đến bệnh viện sớm hơn. Sau đó, Li Ting đã nhập viện và được cứu chữa.Còn Lin Wenhua, trên đường đi giao thuốc cho bệnh nhân, anh xúc động khi gặp gỡ rất nhiều người nhà của các bệnh nhân nhiễm nặng. Sau khi trò chuyện với họ, anh rơi nước mắt và mong tất cả được bình yên.Bản thân Lin Wenhua cũng phải từ bỏ chuyến bay đến Úc dự đám cưới em gái ruột vì Vũ Hán phong tỏa. Anh dự đám cưới qua cuộc gọi video, vẫy tay chúc phúc cho em gái và em rể.Những tình huống riêng tư như vậy khiến bộ phim Cuộc sống bên trong vùng phong tỏa của Trung Quốc trở nên chân thực và dễ cảm với khán giả quốc tế.Phản hồi về bộ phim, khán giả (chủ yếu là người Anh) tỏ ra ngạc nhiên khi đài truyền hình Anh phát bộ phim tài liệu về cuộc sống thời COVID-19 ở Vũ Hán. Họ cho rằng đây là lời cảnh tỉnh cho thấy đại dịch đã có ảnh hưởng nghiêm trọng đến nước Anh và người dân Anh cần ""thức tỉnh"" để cảnh giác trước COVID-19."
2020031713341409,https://tuoitre.vn/phim-ca-nhac-tham-hoa-cats-nhan-6-giai-mam-xoi-vang-2020031713341409.htm,Phim ca nhạc 'thảm họa' Cats nhận 6 giải Mâm xôi vàng,https://cdn1.tuoitre.vn/zoom/600_315/2020/3/17/cats-2-1-1584426539915541842151-crop-15844267586421748000192.jpg,17/03/2020 13:54 GMT+7,"TTO - Phim nhạc kịch Cats 'thắng lớn' tại giải Mâm xôi vàng năm nay với 6 giải thưởng, trong đó có cả giải Phim tệ nhất.",Giải trí,Điện ảnh,"Bộ phim nhạc kịch với tổng chi phí đầu tư 95 triệu USD của đạo diễn Tom Hooper chỉ thu được 6,6 triệu USD trong suất ra mắt cuối tuần hồi tháng 12-2019. Tại giải Mâm xôi vàng lần thứ 40, giải thưởng dành cho những bộ phim tệ nhất năm, Cats nhận được 6 giải.Trong số 8 đề cử, bộ phim ""thảm họa"" này đã giật 6 giải thưởng. Ngoài giải Phim tệ nhất, Cats còn nhận được giải Màn kết hợp tệ nhất.Phim nhạc kịch Cats từng nhận được nhiều chỉ trích nặng nề từ giới phê bình vào thời điểm ra rạp.Tác phẩm dựa trên vở nhạc kịch lừng danh Cats kể về câu chuyện của bộ tộc mèo Jellicle. Dự án quy tụ nhiều tên tuổi như diễn viên James Corden, Judi Dench, Idris Elba, Jennifer Hudson, Ian McKellen và nữ ca sĩ Taylor Swift.Giải Đạo diễn tệ nhất thuộc về Tom Hooper, đạo diễn từng đoạt tượng vàng Oscar với bộ phim The King's Speech. Ông cùng biên kịch Lee Hall cũng giành giải Kịch bản tệ nhất.Hai diễn viên James Corden và Rebel Wilson chia nhau giải Nam phụ và Nữ phụ tệ nhất.Theo sau Cats, phim Rambo: Last Blood của tài tử Sylvester Stallone nhận các giải Phần kế tiếp tệ nhất, Phim coi thường tính mạng con người và tài sản công cộng.  Hai giải Nam chính và Nữ chính tệ nhất của năm thuộc về nam diễn viên John Travolta trong cả 2 phim The Fanatic và Trading Paint, cùng nữ diễn viên Hilary Duff trong The Haunting of Sharon Tate.Mâm xôi vàng 2020 ban đầu dự kiến diễn ra ngày 14-3, tức ngày 15-3 theo giờ Việt Nam. Tuy nhiên, ban tổ chức thông báo vào phút chót rằng sẽ phải hoãn lễ trao giải vì chính quyền Los Angeles (Mỹ) không cho phép người dân tụ tập giữa lúc dịch COVID-19 đang hoành hành.  Thay vì phát trực tiếp trên truyền hình, Mâm xôi vàng đã thực hiện trao giải online."
20200229222014986,https://tuoitre.vn/oscar-phim-tai-lieu-american-factory-nguoi-co-xanh-thuong-ke-co-xanh-20200229222014986.htm,Oscar phim tài liệu American Factory: Người cổ xanh thương kẻ cổ xanh,https://cdn1.tuoitre.vn/zoom/600_315/2020/3/1/american-factory-15830341469521697499888-crop-1583034323546170507015.jpeg,01/03/2020 11:14 GMT+7,"TTO - Đoạt Oscar năm nay cho hạng mục phim tài liệu xuất sắc nhất, American Factory một lần nữa chạm vào những cái gai đã găm sâu vào người Mỹ mang tên ""nạn thất nghiệp"", dù đôi khi chúng vẫn tự tấy lên nhức nhối.",Giải trí,Điện ảnh,"Năm 2014, Công ty Fuyao của tỉ phú người Trung Quốc Cao Dewang đến mở nhà máy sản xuất kính ôtô tại Mỹ. Công xưởng sử dụng lại nhà máy cũ đã giải thể của Hãng General Motors, một biểu tượng cho cuộc đại suy thoái năm 2008. Bị thu hút từ cuộc hồi sinh lịch sử, hai đạo diễn Steven Bognar và Julia Reichert đã ròng rã suốt mấy năm trời quay bộ phim tài liệu American Factory (tạm dịch: Công xưởng Hoa Kỳ) để cận cảnh những sóng gió bên trong nhà máy.Cây đũa phép mang việc làm trở lại?Bộ phim mở đầu bằng hình ảnh một ngày đáng quên của những người dân thành phố Dayton khi xưởng sản xuất xe hơi General Motors đóng cửa và hơn 2.000 người phải thất nghiệp. Sáu năm sau, Fuyao đặt chân đến đây như một chương mới mở ra với họ. Nếu ""giấc mơ Mỹ"" có thật, ở thời điểm đó, niềm hi vọng đã được trao cho cả ban lãnh đạo công ty lẫn những công nhân Trung Quốc - Mỹ làm việc chung trong nhà máy.Trong ánh sáng rực rỡ của căn phòng được trang hoàng cho đêm Giáng sinh, nữ công nhân Jill nói về niềm hạnh phúc khi tìm được nơi ở mới, thay vì phải sống trong tầng hầm ẩm thấp nhà chị gái. Cô treo những chiếc vớ đỏ lên vách tường và nguyện cầu một cuộc sống bình yên.Nhưng những giây phút hân hoan ban đầu cũng chỉ có thế, hai đạo diễn nhanh chóng nhận ra chiếc bánh lái của công ty dần chuyển sang một hướng khác, đối mặt với khác biệt văn hóa, ngôn ngữ, tư duy công việc. Công nhân Trung Quốc có thể làm 12 giờ một ngày, ở lại nhà máy, không kêu ca điều kiện làm việc và nhận mức lương thấp hơn, trong khi công nhân Mỹ hoàn toàn ngược lại. Họ đã không gặp được nhau trong định nghĩa về sự tự do.Chỉ sau vài cảnh chóng vánh, người xem chợt nhận ra mình đang đứng trong cuộc chiến nổ ra giữa ban lãnh đạo nhà máy và những công nhân Mỹ muốn thành lập công đoàn. Người Mỹ cần công đoàn để có tiếng nói, còn những ông chủ lại không muốn mất đi tiếng nói của mình. Chẳng hề khoan nhượng, dùng đến cả thủ đoạn, có lúc còn cấm cả nhà làm phim ghi hình, trận chiến đã đổ ra sông biển những giao tình thuở đầu.Nếu chỉ là chuyện ""công ty anh, đất nước tôi"", phim có lẽ đã không khiêu khích người xem đến vậy. Mỗi công ty đa quốc gia luôn phải vượt qua rào cản luật lệ khi tìm đường vào một thị trường mới và công nhân luôn sẵn sàng đối mặt với những ông chủ không thấu hiểu nỗi vất vả của họ. Thế nhưng vì được gầy dựng trên niềm hi vọng quá lớn, khi cả thế giới xem nhà máy như dấu hiệu hồi phục của nền kinh tế, chuyện tình Fuyao đã sớm đổ vỡ, vỡ toang như những tấm kính họ đang sản xuất.Thiếu vắng lời dẫn chuyện, chắp nối với nhau bằng những đoạn độc thoại cụt ngủn, American Factory tựa như một bộ phim tài liệu chồng lấp lên một bộ phim tài liệu. Giữa những điều đang xảy ra, người xem phải phán đoán rất nhanh những cái chốt bất ngờ của phim.Chuyện gì xảy ra với cuộc sống của Jill, người từng có căn nhà ấm cúng ở một góc phố Dayton? Chẳng ai rõ điều ấy, người ta chỉ thấy cô đứng trên đường, giơ một tấm biển phản đối nhà máy trong mái tóc rối bời. Và khác với vẻ thân thiện ban đầu, chủ tịch Cao Dewang trở lại làm một ông chủ tư bản lạnh lùng, sa thải bất kỳ ai cứng đầu.Ước mơ đơn giản của người lao động tay chânGiữa mớ bòng bong của Fuyao, hai đạo diễn đã tìm ra một điểm sáng cho bộ phim với tình bạn của Vương và Rob. Vượt qua khoảng cách ngôn ngữ và văn hóa, kể cả khi đứng về hai phía khác nhau trong cuộc chiến đòi thành lập công đoàn, họ luôn giữ tình bạn dành cho nhau. Rob bị sa thải vì tuổi tác, Vương tiếp tục làm trong nhà máy và đưa vợ con sang đoàn tụ, nhưng họ vẫn gặp mặt mỗi cuối tuần.Ở Mỹ, những công nhân làm việc chân tay trong công xưởng thường được gọi là người cổ xanh (Blue-collar) để phân việc với giới nhân viên văn phòng cổ trắng. Vương và Rob nhìn nhau bằng những chiếc cổ xanh, không phải bằng đất nước. Và họ gặp ở người kia sự đồng cảm.American Factory đã mở ra những điều thật to lớn, để rồi đọng lại ở những thứ thật nhỏ bé. Bộ phim lướt qua vài phân đoạn Fuyao đang chuyển mình bằng những cỗ máy tự động hóa, họ sa thải nhiều hơn và sản xuất mạnh hơn. Trong một tương lai bấp bênh như vậy, Vương, Rob hay tất cả những công nhân khác đều có rất ít lựa chọn, dù đứng sau lưng họ là một đất nước to lớn nào chăng nữa. Đó cũng chính là lý do ông Obama từng nói sẽ chẳng có cây đũa phép nào có thể mang việc làm trở lại.American Factory là một thực trạng buồn về nạn thất nghiệp và những ước mơ đơn giản của người lao động tay chân. Vậy nên Tổng thống Trump có thể chỉ trích Oscar đã trao giải cho Parasite thay vì cho phim Mỹ, chứ chẳng hé nửa lời về bộ phim do đối thủ chính trị sản xuất, mặc cho ông vẫn luôn kiêu hãnh với những cải cách của mình.Trong phim, có một hình ảnh về đống kính vụn chìm trong cơn mưa tuyết, những tấm kính đã trở thành biểu tượng của American Factory. Sáng choang, tràn ngập thứ long lanh nhưng cũng dễ vỡ vụn và bị thay thế, chẳng ai biết điều này là để nói về tấm kính hay cuộc sống của những kẻ cổ (bị) xanh."
2020022601194678,https://tuoitre.vn/toi-nhu-con-ca-chua-bao-gio-tu-hoi-minh-boi-the-nao-2020022601194678.htm,Tôi như con cá chưa bao giờ tự hỏi mình bơi thế nào!,https://cdn1.tuoitre.vn/zoom/600_315/2020/2/26/nhung-thuoc-phim-trong-suot-1582654854461220962033-crop-15826839716275120375.png,26/02/2020 14:06 GMT+7,"TTO - ""Tôi chưa bao giờ tự vấn mình tại sao lại viết, như con cá thuận theo dòng chảy, chưa bao giờ tự hỏi mình bơi thế nào"", nhà quay phim Nguyễn Hữu Tuấn.",Giải trí,Điện ảnh,"Chiều 25-2, nhà quay phim Nguyễn Hữu Tuấn ra mắt cuốn sách Những thước phim trong suốt. Đây là cuốn sách tập hợp những hồi ức do chính ông viết ra, là thể loại pha trộn giữa truyện và ký, giữa sự thực (là chủ yếu) và hư cấu. NSND Nguyễn Hữu Tuấn là một trường hợp hi hữu bởi ông là nhà quay phim đầu tiên ở Việt Nam ra mắt truyện ký, chứ không phải sách hướng dẫn về kĩ năng quay phim.Tác phẩm này khi còn là những đoạn ghi chép tản mạn trên facebook đã thu hút cho hội bạn bè văn nghệ sĩ, nhà báo quen biết ông.Cánh bạn già đọc những dòng hồi ức của Nguyễn Hữu Tuấn thì rưng rưng, hội trung niên thì giục ""anh phải ra sách thôi anh Tuấn ơi"", thanh niên thì ""chú kể hay quá, chú kể tiếp nữa đi"".Càng viết ông Tuấn càng khiến những người quen ông ngạc nhiên. Vì ông Tuấn ngoài vai trò tay máy vàng của điện ảnh nhà nước một thời, còn là một tay chơi ảnh thực thụ, lại là người từng học vẽ. Nay thêm khả năng viết, bạn bè nghệ sĩ đều phải lắc đầu ""người đâu mà lắm tài lẻ"".  Dịch giả Trịnh Lữ cho biết ông thích Nguyễn Hữu Tuấn ở điểm khi ông Tuấn muốn diễn đạt điều gì đó, ông sẽ tùy chọn hình thức biểu đạt là phim, là ảnh, là tranh hoặc viết. ""Rất hiếm người làm được như thế"", dịch giả Trịnh Lữ nói.  Nhờ những lời động viên của bạn bè mà Những thước phim trong suốt ra đời. Cuốn sách chứa đựng những mẩu hồi ức của ông Tuấn về chiến tranh, về Hà Nội, về những ngôi làng ông đã đi qua, về những con người ông đã gặp trên vạn nẻo đường, về cái thời làm phim amatơ… Những thước phim trong suốt có câu chuyện ""siêu nhỏ"" như Đại Lý và cô gái điếm nhỏ kể câu chuyện về những cô gái điếm loay hoay sửa chữ  ""độ"" trong cái tên quán ""Nữ nhân 370"" thành hình trái tim.   Còn có câu chuyện nói về những đại tự sự như cách mạng Văn hóa ở Trung Quốc, nhưng lại được kể thông qua câu chuyện của Tiểu Quyên, một cô gái tác giả quen ở Trung Quốc.  Trong Những thước phim trong suốt, Nguyễn Hữu Tuấn không ngần ngại kể ra những câu chuyện cá nhân. Dường như thời gian đã đủ xa để tác giả bình tĩnh kể lại những khoảnh khắc, những động chạm rất đỗi con người của hai kẻ cô đơn trong đêm Mỹ đánh bom Hà Nội năm 1972.    Điều kì lạ là những kí ức vụn, rất đỗi cá nhân của Nguyễn Hữu Tuấn rất thu hút người đọc bởi cảnh trí, mùi vị của ký ức thấm đẫm trong từng câu văn. Câu văn rất giàu hình ảnh, ngôn từ rất đời, đôi chỗ rất hài hước. Đọc Nguyễn Hữu Tuấn, độc giả sẽ cảm thấy phảng phất chất truyện ngắn của nhà văn Trung Quốc Lỗ Tấn.  ""Chi tiết nhỏ là chi tiết đáng nhớ nhất. Có một chi tiết ấy rồi, mình có tưởng tượng thêm. Khi viết, tôi thường lấy chuyện A để nói chuyện B. Đơn cử như khi viết về công sức Thành Chương dựng phủ, tôi kể câu chuyện nửa đêm đá về đến phủ, chúng tôi phải nghĩ cách khiêng tảng đá mười mấy tấn đặt vào phủ.Lúc đó mưa rất nặng hạt, dưới ánh đèn pin, những giọt mưa rơi xuống tảng đá bắn tung tóe như những giọt pha lê. Lũ đàn ông hò nhau dùng đòn bẩy để di chuyển hòn đó. Cảnh đó vô cùng bi tráng"", nhà quay phim Nguyễn Hữu Tuấn chia sẻ về lối viết của mình.  Thời còn trẻ, đã từng có người nhắc Nguyễn Hữu Tuấn ""đừng tha thiết, đừng khắc khoải quá Tuấn ơi, cẩn thận bị tim đấy nhé"". Nhưng Nguyễn Hữu Tuấn cả đời làm cái gì cũng muốn đi đến tận cùng. Trái tim người nghệ sĩ lúc nào cũng thấy xốn xang trước vẻ đẹp của cuộc sống, như con người ""nóng ruột"" khi nghe tiếng chim tu hú gọi hè trong hai câu thơ của Chế Lan Viên: ""Cái con tu hú liên hồi. Ta ôm cuộc đời sao xuể""."
20200225164407269,https://tuoitre.vn/doan-lam-phim-nhiem-vu-bat-kha-thi-7-hoan-quay-o-y-vi-covid-19-20200225164407269.htm,Đoàn làm phim 'Nhiệm vụ bất khả thi 7' hoãn quay ở Ý vì COVID-19,https://cdn1.tuoitre.vn/zoom/600_315/2020/2/25/mi-7-tom-cruise-stunt-01-paramount-15826235857111550884110-crop-15826236895541152590349.jpg,25/02/2020 21:32 GMT+7,"TTO - Hãng phim Paramount Pictures quyết định tạm hoãn quay dự án phim ""Mission: Impossible 7"" tại Ý, sau khi nước này có hơn 200 người nhiễm bệnh viêm đường hô hấp cấp do virus corona chủng mới (COVID-19) gây ra.",Giải trí,Điện ảnh,"Theo trang Variety, Hãng Paramount đưa ra quyết định trên vào ngày khởi quay bộ phim là 24-2, sau khi có khuyến cáo của chính quyền thành phố Venice về việc hạn chế các cuộc tụ tập đông người. Dự kiến đoàn làm phim sẽ khởi quay một cảnh của nam diễn viên chính Tom Cruise, thời gian quay tại đây kéo dài 3 tuần.""Sau khi cân nhắc an toàn và sức khỏe của các diễn viên và đoàn làm phim, cũng như những nỗ lực của chính quyền địa phương để ngăn các cuộc tụ tập đông người trước mối đe dọa của virus corona, chúng tôi thay đổi kế hoạch quay phim cho cảnh quay kéo dài 3 tuần tại Venice"" - Hãng Paramount thông báo ngày 24-2.""Trong thời gian hoãn quay, chúng tôi chia sẻ lo âu với các nhân viên, cho họ về nhà đến khi kế hoạch quay phim được nối lại. Chúng tôi sẽ tiếp tục theo dõi tình hình và làm việc với các quan chức y tế và chính quyền để có hướng giải quyết tiếp theo"" - Hãng Paramount nói thêm.Nam diễn viên Tom Cruise sẽ lại vào vai điệp viên Ethan Hunt hoạt động cho tổ chức IMF trong hai phần phim của series phim Nhiệm vụ bất khả thi. Paramount dự tính Nhiệm vụ bất khả thi 7 sẽ ra rạp ngày 23-7-2021, và Nhiệm vụ bất khả thi 8 sẽ khởi chiếu vào 5-8-2022.Sau thành công của Nhiệm vụ bất khả thi 5: Quốc gia bí ẩn (2015) và Nhiệm vụ bất khả thi 6: Sụp đổ, ông Christopher McQuarrie vẫn tiếp tục làm đạo diễn cho hai phần 7 và 8. Hiện vẫn chưa có thông tin về nội dung của phần 7."
20200212211200481,https://tuoitre.vn/cuc-truong-my-thuat-vi-kien-thanh-duoc-bo-nhiem-lam-cuc-truong-dien-anh-20200212211200481.htm,Cục trưởng Mỹ thuật Vi Kiến Thành được bổ nhiệm làm cục trưởng Cục Điện ảnh,https://cdn1.tuoitre.vn/zoom/600_315/2020/2/20/vikienthanh-1582202863748268383003-crop-1582528502225416782817.jpg,24/02/2020 14:16 GMT+7,"TTO - Cục trưởng Cục Mỹ thuật, nhiếp ảnh và triển lãm Vi Kiến Thành đã được Bộ Văn hóa, thể thao và du lịch bổ nhiệm làm cục trưởng Cục Điện ảnh.",Giải trí,Điện ảnh,"Theo nguồn tin của Tuổi Trẻ Online, Bộ Văn hóa, thể thao và du lịch đã trao quyết định bổ nhiệm họa sĩ Vi Kiến Thành làm cục trưởng Cục Điện ảnh vào hôm 21-2. Trước đó họa sĩ Vi Kiến Thành giữ chức vụ cục trưởng Cục Mỹ thuật, nhiếp ảnh và triển lãm từ năm 2010 cho đến thời điểm ông nhận chức vụ cục trưởng Cục Điện ảnh.Ông Vi Kiến Thành sẽ chính thức về làm việc tại Cục Điện ảnh bắt đầu từ 1-3-2020.Năm 2018 và năm 2019 là năm Cục Điện ảnh khủng hoảng thiếu nhân sự. Trước đó ba cục phó Đỗ Duy Anh, Phan Đình Thanh, Lê Hồng Chương nghỉ hưu, sau đó đến cục trưởng Ngô Phương Lan về hưu. Một cục phó được bổ sung sau đó là bà Lý Phương Dung. Đến tháng 1-2019, Bộ Văn hóa, thể thao và du lịch mới quyết định bổ nhiệm bà Nguyễn Thị Thu Hà là quyền cục trưởng Cục Điện ảnh, ông Đỗ Quốc Việt về làm cục phó.Tuy nhiên đến 28-10-2019, Bộ Văn hóa, thể thao và du lịch đã cho bà Nguyễn Thị Thu Hà thôi chức quyền cục trưởng Cục Điện ảnh sau sự cố để lọt phim Everest - Người tuyết bé nhỏ có ""đường lưỡi bò"" ra rạp. Trong thời gian chờ có lãnh đạo mới, Thứ trưởng Bộ Văn hóa, thể thao và du lịch Tạ Quang Đông tạm thời được giao nhiệm vụ quản lý kiêm nhiệm Cục Điện ảnh. Bà Nguyễn Thị Thu Hà giữ chức phó cục trưởng Cục Điện ảnh.Như vậy hiện Cục Điện ảnh đã có cục trưởng là ông Vi Kiến Thành, ba cấp phó là bà Nguyễn Thị Thu Hà, bà Lý Phương Dung, ông Đỗ Quốc Việt."
