id,link,title,thumbnail,time,summary,category,sub_category,full_article
20191224074002361,https://tuoitre.vn/nhung-phat-minh-de-doi-cua-nguoi-thuy-si-20191224074002361.htm,Những phát minh 'để đời' của người Thụy Sĩ,https://cdn1.tuoitre.vn/zoom/600_315/2019/12/24/phat-minh-15771612602791975034300-crop-15771612809951426777355.jpg,26/12/2019 07:00 GMT+7,"TTO - Nói đến Thụy Sĩ, nhiều người nghĩ ngay đến hệ thống ngân hàng an toàn hàng đầu thế giới và các thương hiệu đồng hồ cao cấp. Nhưng có lẽ ít ai biết nước này cũng là nơi sản sinh ra những phát minh quan trọng.",Khoa học,Phát minh,"Với bản tính chú trọng thực tế, những phát minh của người Thụy Sĩ đều là những thứ rất thiết thực phục vụ cuộc sống con người. Chúng ta thử điểm qua một số phát minh đáng chú ý nhất của họ.Khóa dán Velcro (1941)Ngày nay khóa dán Velcro hiện diện trong mọi lĩnh vực của cuộc sống, từ những chiếc quai giày, ba lô, túi xách, túi đựng laptop đến máy đo huyết áp, các vật dụng trên máy bay. Từ những năm 1960, các phi hành gia của NASA đã xài Velcro để cột giữ những thiết bị cần thiết trên bộ đồ phi hành và trong phi thuyền. Một bộ khóa dán Velcro kích cỡ 5cm x 5cm có thể chịu được lực đến 80kg.Trước khi Velcro ra đời, người ta chỉ dùng các dây buộc, quai móc, nút gài để chằng buộc, cột các đồ vật, thao tác rất lỉnh kỉnh và tốn thời gian. Năm 1941, kỹ sư người Thụy Sĩ George de Mestral thường vào rừng săn bắn cùng con chó của mình. Sau những lần đi săn về, ông để ý thấy có rất nhiều hạt cây ngưu bàng bám khá chặt vào quần áo của ông và trên lông con chó. Mestral dùng kính hiển vi để quan sát một hạt cây và phát hiện bên trên bề mặt của nó có rất nhiều cái móc nhỏ li ti. Những cái móc này làm cho hạt bám chặt vào vải cũng như các loại lông động vật.Mestral nảy sinh ý tưởng chế ra một loại ‘khóa’ tiện dụng thay cho các loại dây, móc khóa đang có. Nhưng cũng phải mất đến 8 năm nghiên cứu, Mestral mới sáng chế ra thứ khóa dán mà ông đặt tên là Velcro. Từ này xuất phát từ chữ ‘velvet’ (nhung) và ‘crochet’ (móc) trong tiếng Pháp.Dây kéo (1923)Thực ra người Mỹ đã nghĩ ra một mẫu ‘tiền-dây kéo’ và đăng ký sáng chế này vào năm 1851, nhưng mẫu này còn nhiều khiếm khuyết, không tiện dụng và gọn gàng.Đến năm 1923, một doanh nhân người Mỹ tìm đến gặp ông Martin Winterhalter - một luật sư ở thành phố St. Gallen (Thụy Sĩ) để chào bán sáng chế này. Winterhalter rất nhạy bén, nhận ra tiềm năng thành công của sản phẩm mới nên bỏ ra 10.000 franc để sở hữu bằng sáng chế. Ông nghĩ ra cách để làm cho các răng dây kéo khóa vào nhau trơn tru mà chỉ cần dùng lực kéo nhẹ. Và sản phẩm hoàn thiện của Winterhalter chính là loại dây kéo tiện dụng mà chúng ta xài hàng ngày hiện nay.Hàng năm thế giới tiêu thụ đến 14 tỉ sợi dây kéo các loại, trong đó một nửa là được sản xuất ở Nhật bởi hãng dây kéo nổi tiếng YKK.Giấy bóng kính cellophane (1912)Ngày nay, mỗi dịp Giáng sinh và Tết, giấy bóng kính trong suốt dùng để gói quà là thứ không thể thiếu. Đây cũng là sản phẩm chủ lực dùng để bảo quản các loại thực phẩm. Nguồn gốc phát minh này đến từ một sự tình cờ: nhà hóa học người Thụy Sĩ  Jacques E. Brandenberger khi rót rượu vang đã làm đổ rượu xuống tấm vải trải bàn. Ông nảy ra ý tưởng chế tạo một loại vật liệu có thể chống sự thẩm thấu của các loại dung dịch thay vì hấp thụ nó.Thoạt đầu, Brandenberger chế tạo một hóa chất gốc cellulose phủ lên bề mặt vải nhưng không thành công vì nó bị tách lớp và làm vải bị cứng lại. Nhưng ông nhận thấy có một lớp màng trong suốt bị bong tróc khỏi bề mặt vải, màng này có tính năng chống thấm rất tốt và tạo sự thẩm mỹ khi dùng để phủ lên đồ vật. Từ phát hiện này, Brandenberger chế tạo thành công loại màng mỏng trong suốt dùng để bao gói hàng hóa đặt tên là cellophane, kết hợp hai từ cellulose và diaphane (trong suốt), nó là chế phẩm nhựa sinh học vì làm từ cellulose của gỗ. Ngày nay, phần lớn màng cellophane được sản xuất từ dầu mỏ với các sản phẩm như PVC (Polyvinyl chloride) và PP (polypropylene).Màn hình tinh thể lỏng LCD (1970)Người ta có câu ‘chính xác như đồng hồ Thụy Sĩ’ để ca ngợi chất lượng các loại đồng hồ do Thụy Sĩ sản xuất. Không chỉ đồng hồ cơ, Thụy Sĩ cũng sản xuất đồng hồ dùng mạch điện tử có màn hình tinh thể lỏng LCD (Liquid Crystal Display). Đây là phát minh năm 1970 của hãng Hoffman-La Roche, sau đó họ chuyển giao công nghệ cho hãng Brown, Boveri & Cie để sản xuất màn hình cho các loại đồng hồ và thiết bị khác bán ra khắp thế giới. Điều thú vị là Hoffman-La Roche xưa nay không dính dáng gì đến công nghiệp đồng hồ, mà chuyên ngành của họ là sản xuất… dược phẩm và là một tên tuổi lẫy lừng trong làng y dược thế giới.Kiểu dáng cổ ngỗng của chai dung dịch tẩy rửa nhà vệ sinh (1980)Các chai nhựa đựng dung dịch tẩy rửa nhà vệ sinh luôn có phần trên hình cổ ngỗng (các nước dùng tiếng Anh gọi là Toilet Duck), kiểu dáng ngộ nghĩnh này giúp người ta có thể xịt chất tẩy rửa vào mọi ngóc ngách của các thiết bị vệ sinh. Đây là phát minh của doanh nhân Walter Düring Orlob. Bà mẹ Maria Düring-Keller của ông cũng là người sáng chế ra Durgol - loại dung dịch dùng tẩy chất calci bị vôi hóa hiện được dùng rất phổ biến trên thế giới.Phông chữ Helvetica (1957)Hiện nay, phông chữ Helvetica được dùng rất phổ biến ở những nước sử dụng hệ thống ký tự Latinh, đặc biệt là trong báo chí, sách in, các trang web, cũng như không thể thiếu trong bộ phông chữ của máy vi tính. Đây là phát minh của hai nhà thiết kế mỹ thuật người Thụy Sĩ Max Miedinger và Eduard Hoffmann vào năm 1957.Cà phê hòa tan uống liền (1936)Trước năm 1936, thế giới chưa có loại cà phê hòa tan uống liền (instant coffee) như hiện nay. Việc thưởng thức cà phê thời đó tốn nhiều thời gian với các khâu đun nước, cho cà phê bột vào phin, chờ cà phê rỏ xuống đầy tách, cho đường vào... Năm 1929, một khối lượng rất lớn cà phê hạt thu hoạch được ở Brazil - quốc gia trồng cà phê nhiều nhất thế giới thời đó - không bán được sang thị trường tiêu thụ chủ lực là Mỹ vì nước này đang lâm vào cuộc Đại khủng hoảng kinh tế. Do hạt cà phê không thể bảo quản được lâu nên Viện nghiên cứu cà phê Brazil đã liên hệ với hãng chế biến thực phẩm Nestlé của Thụy Sĩ nhờ hãng này nghiên cứu phương thức sản xuất một loại cà phê có thể hòa tan và bảo quản lâu dài để cứu ngành cà phê đang suy thoái.Dù mất đến 5 năm nghiên cứu, các kỹ sư của Nestlé vẫn thất bại vì loại cà phê hòa tan trong nước của họ không giữ được hương vị đặc trưng của cà phê truyền thống. Nestlé đành bỏ cuộc nhưng một chuyên viên hóa học của họ, ông Max Morgenthaler, vẫn âm thầm theo đuổi việc nghiên cứu bằng tiền túi của mình. Năm 1936, Morgenthaler đã thành công và chuyển giao bí quyết chế biến cho Nestlé và đến ngày 1-4-1938, loại cà phê hòa tan đầu tiên của thế giới mang thương hiệu Nestlé được tung ra thị trường và thành công rực rỡ."
2019121212014379,https://tuoitre.vn/nhom-nghien-cuu-bien-rac-thai-nhua-thanh-axit-co-the-tao-ra-dien-2019121212014379.htm,Nhóm nghiên cứu biến rác thải nhựa thành axit có thể tạo ra điện,https://cdn1.tuoitre.vn/zoom/600_315/2019/12/12/chin-kek-foo-soo-han-sen-milos-dokic-1576126589299480082733-crop-1576126794186374206551.jpg,12/12/2019 13:30 GMT+7,TTO - Công trình của nhóm nghiên cứu Đại học Công nghệ Nanyang (Singapore) được kỳ vọng sẽ là giải pháp giải quyết vấn đề rác thải nhựa hiện tại theo hướng thân thiện môi trường.,Khoa học,Phát minh,"Trong nghiên cứu mới đây đăng trên tạp chí Advanced Science, các nhà khoa học Đại học Công nghệ Nanyang cho biết đã tìm ra cách tổng hợp một loại xúc tác mới từ vanadium và nhôm mang sức mạnh đặc biệt.  Xúc tác có thể hòa tan trong dung dịch chứa những loại nhựa khó phân hủy như polyethylene. Dưới sự hỗ trợ của ánh sáng mặt trời, xúc tác góp phần phá vỡ liên kết carbon-carbon trong thời gian chỉ khoảng 6 ngày.  Theo PGS Soo Han Sen - Trường Khoa học toán và vật lý, ĐH Công nghệ Nanyang - sở dĩ phần lớn các loại nhựa hiện nay khó xử lý là do trong cấu tạo hóa học chứa loại liên kết carbon-carbon cực bền và chỉ bị ""đánh bại"" ở nhiệt độ rất cao hay có sự ""góp sức"" của các loại kim loại nặng.  Công nghệ mới của nhóm nghiên cứu giải quyết được điểm nghẽn này.  Trước tiên, các mẩu nhựa khó phân hủy sẽ được xử lý bước 1 trong dung dịch đun nóng, ở khoảng 85 độ C. Tiếp đến, chất xúc tác dạng bột đặc biệt chứa vanadium và nhôm sẽ được cho vào dung dịch. Cộng thêm tác dụng của ánh sáng mặt trời, liên kết carbon-carbon bị phá vỡ hoàn toàn chỉ trong khoảng 6 ngày.  Kết quả, polyethylene được biến thành axit formic - loại hóa chất có thể dùng trong các loại pin nhiên liệu, giúp tạo ra năng lượng điện.  Trong tự nhiên, axit formic tồn tại trong nọc của nhiều loài kiến nên được đánh giá không gây nguy hiểm. Ngày nay, axit formic còn được dùng nhiều trong những ngành công nghiệp khác như dệt nhuộm, cao su, tổng hợp hóa học…  ""Nhiều năm qua, chúng tôi cố gắng tìm ra hướng đi bền vững và tiết kiệm nhất bằng cách tận dụng tối đa nguồn năng lượng ánh sáng và những vật liệu rẻ tiền để biến nhựa khó phân hủy thành sản phẩm hóa học hay các dạng năng lượng khác"" - PGS Soo Han Sen nói.  Ông cũng khẳng định đây là phương pháp đầu tiên có thể phá vỡ hoàn toàn cấu trúc của những loại nhựa không phân hủy như polyethylene mà không phải sử dụng các kim loại nặng như platinum, palladium hay ruthenium…  Từ nhiều nghiên cứu trong phòng thí nghiệm, nhóm ước tính phương pháp này có thể loại bỏ hoàn toàn đến 30 hợp chất chứa liên kết carbon-carbon và biến chúng thành những loại vật liệu có ích, thân thiện với môi trường.  Giá thành rẻ cùng với những nguồn vật liệu dễ tìm cũng là một trong những lợi thế khác của cách thức này.  PGS Soo cho biết phần lớn rác thải nhựa ở Singapore hiện được xử lý bằng phương pháp đốt, nhưng lại có hạn chế khi thải ra môi trường không ít khí nhà kính và lượng chất dư thừa độc hại.  ""Từ thành công bước đầu trong phòng thí nghiệm, chúng tôi sẽ tiếp tục nghiên cứu trên quy mô công nghiệp và hướng đến có thể thay đổi tình trạng rác thải nhựa tràn ngập hiện nay"" - PGS Soo nói."
20191209090622771,https://tuoitre.vn/sinh-vien-lam-gay-thong-minh-giup-dan-duong-bao-dong-khi-nguoi-khiem-thi-nga-20191209090622771.htm,"Sinh viên làm gậy thông minh giúp dẫn đường, 'báo động' khi người khiếm thị ngã",https://cdn1.tuoitre.vn/zoom/600_315/2019/12/9/gay-do-duong-thong-minh-1-15758590656481648503950-crop-15758590822171846201955.jpg,09/12/2019 14:26 GMT+7,"TTO - Ngoài tính năng dẫn đường, giúp tránh chướng ngại vật, gậy thông minh của nhóm sinh viên Trường ĐH Bách khoa Đà Nẵng còn biết 'báo động' khi người khiếm thị bị ngã.",Khoa học,Phát minh,"Đó là sản phẩm của nhóm sinh viên Trường ĐH Bách khoa, ĐH Đà Nẵng. Theo Lê Quốc Tín - sinh viên năm 4, trưởng nhóm nghiên cứu, gậy dò đường thông minh gồm 3 phần chính: tay cầm, cảm biến và hộp điều khiển trung tâm.Cảm biến được đặt ở nhiều nơi trên gậy, như ở phần chân cho mục tiêu phát hiện các vật cản nhỏ, 3 cảm biến ở phần giữa để dò ra các chướng ngại kích thước lớn hơn.Quốc Tín cho biết thêm một chức năng quan trọng khác của gậy là thông báo cho người nhà khi người thân gặp nạn. Cụ thể khi tai nạn xảy ra, gậy có thể tính toán thời gian ""nằm bất động"" của mình, đồng nghĩa với việc người dùng đang gặp sự cố, nhờ đó hộp điều khiển trung tâm có gắn một thẻ sim điện thoại có thể tự động nhắn tin hoặc thực hiện các cuộc gọi đến người thân của người dùng, thông báo vị trí GPS giúp nhanh chóng tìm kiếm.Gậy thông minh này còn được tích hợp nhiều tính năng khác như phần tay cầm có gắn đèn, còi để tạo sự chú ý với những người xung quanh. ""Bọn mình đang đánh giá thị trường và tiếp tục tích hợp ứng dụng chỉ đường như Google Maps cho người khiếm thị thông qua cây gậy này"" - Quốc Tín nói.Theo TS Võ Như Thành - khoa cơ khí Trường ĐH Bách khoa (ĐH Đà Nẵng), sản phẩm có thể đi theo hướng sử dụng nguồn năng lượng xanh, hoặc có thể bổ trợ thêm các ứng dụng về trí tuệ nhân tạo, qua đó cá nhân hóa việc sử dụng gậy thông minh. Chẳng hạn gậy có thể ""học"" được thói quen đi lại, những chỉ số khi di chuyển của người dùng, từ đó giúp việc hỗ trợ trở nên hữu ích hơn."
20191121085206676,https://tuoitre.vn/do-lan-chong-ca-map-can-20191121085206676.htm,Đồ lặn chống cá mập cắn,https://cdn1.tuoitre.vn/zoom/600_315/2019/11/21/do-lan-chong-ca-map-1574300907705525684233-crop-157430096676381016269.jpg,21/11/2019 22:43 GMT+7,"TTO - Các nhà nghiên cứu tạo ra bộ đồ lặn làm từ chất liệu đặc biệt có khả năng chống lại các kiểu tấn công của cá mập trắng như đâm thủng, xé rách và cắn người...",Khoa học,Phát minh,"Theo một nghiên cứu của Đại học Flinders, bang Nam Australia (Úc), vừa được công bố, các nhà khoa học nước này đã thiết kế một loại quần áo lặn mới có thể giúp hạn chế tình trạng mất máu do bị cá mập cắn.Loại quần áo mới được chế tạo dựa vào việc kết hợp 2 chất liệu là các sợi nhựa UHMWPE (Ultra-high molecular weight polyethylene) và cao su tổng hợp.Các nhà khoa học đã thử nghiệm 2 bộ quần áo lặn được làm bằng những chất liệu này và so sánh khả năng chống cá mập cắn của chúng với các bộ quần áo lặn đạt chuẩn thông thường được làm từ cao su tổng hợp. Kết quả cho thấy bộ quần áo mới nói trên có khả năng hạn chế được các vết cắn của cá mập cao hơn so với quần áo lặn thông thường.Theo ông Charlie Huveneers, thành viên nhóm nghiên cứu, bộ quần áo lặn mới có khả năng chống lại các kiểu tấn công của cá mập trắng như đâm thủng, xé rách và cắn người... tốt hơn so với quần áo lặn được làm bằng cao su tổng hợp.Với bộ quần áo này, cá mập khi muốn đâm thủng sẽ phải dùng lực mạnh hơn và những vết thương do nó gây ra đối với con người sẽ nhỏ hơn và nông hơn so với quần áo lặn thông thường.Tuy nhiên, để có thể đưa vào sản xuất hàng loạt và tung ra thị trường, cần phải thực hiện thêm nhiều cuộc thử nghiệm đối với loại quần áo lặn nói trên, đặc biệt là để kiểm tra khả năng hạn chế mức độ thương tích do cá mập gây ra.Mỗi năm có hàng chục triệu khách du lịch tới các bãi biển của Úc và các vụ cá mập tấn công người rất hiếm khi xảy ra. Tuy nhiên, theo số liệu thống kê của Vườn bách thú Taronga ở thành phố Sydney, chỉ tính riêng trong năm ngoái tại nước này đã xảy ra 27 vụ cá mập tấn công người, trong đó có một vụ tấn công làm chết người ở quần đảo Whitsunday, gần rạn san hô Great Barrier."
20191121103653769,https://tuoitre.vn/dot-pha-y-hoc-thay-mau-giup-hoi-sinh-nguoi-bi-tim-ngung-dap-20191121103653769.htm,Đột phá y học: 'Thay máu' giúp hồi sinh người bị tim ngừng đập?,https://cdn1.tuoitre.vn/zoom/600_315/2019/11/21/phau-thuat-thay-mau-hoi-sinh-benh-nha-1574307145919843988545-crop-1574307459548342813413.jpg,21/11/2019 10:58 GMT+7,"TTO - Nước muối lạnh sẽ được bơm trực tiếp vào máu thông qua động mạch chủ, đẩy nhiệt độ não xuống còn 10 độ C để hạn chế tổn thương. Điều này mở ra tia hi vọng cho những người khả năng sống chỉ còn dưới 5%.",Khoa học,Phát minh,"Các nhà khoa học Mỹ vừa ""thay máu"" thành công một bệnh nhân theo phương pháp dự phòng và hồi sức khẩn cấp hay còn gọi là EPR.Giáo sư Samuel Tisherman, một thành viên của nhóm nghiên cứu, đã mô tả thử nghiệm ""thay máu"" trong một hội nghị chuyên đề gần đây do Viện hàn lâm khoa học New York tổ chức.Mục đích ban đầu của thử nghiệm nhằm giúp hạn chế tổn thương cho não, kéo dài thời gian cho những trường hợp bị thương nặng, tim ngừng đập và mất hơn 1/2 lượng máu do bị đâm hoặc súng bắn. Khi tim ngừng đập và máu ngừng lưu thông, não sẽ nhanh chóng bị thiếu oxy, do đó có thể chịu những tổn thương không thể khắc phục chỉ sau khoảng 5 phút.Các nhà khoa học cũng tính toán: một khi được thay máu, hoạt động của não sẽ xuống mức thấp, ít bị tổn thương và các bác sĩ sẽ có thêm ít nhất 1 tiếng để cứu những người này.Quá trình này bao gồm việc làm lạnh nhanh bộ não của người bệnh xuống dưới 10 độ C bằng cách bơm nước muối lạnh trực tiếp vào máu thông qua động mạch chủ, động mạch chính đi từ tim đến phần còn lại của cơ thể.Các cuộc phẫu thuật sẽ được tiến hành ngay sau đó, tranh thủ từng phút quý giá. Bệnh nhân sẽ được làm ấm lại thân nhiệt, sau đó để bảo đảm các hoạt động trao đổi chất diễn ra bình thường.Nhóm của ông Tisherman sẽ tiếp tục thử nghiệm EPR trên khoảng 20 người nữa đến cuối năm nay. Kết quả chính thức sẽ được công bố trong năm sau, theo báo The Guardian ngày 20-11.Những thí nghiệm trên động vật như heo cho thấy: EPR có hiệu quả nhưng tỉ lệ thành công chưa đạt tới 100%. Giáo sư Tisherman không nói rõ tình trạng của bệnh nhân sau khi được ""thay máu"" trong hội nghị ở New York.""Chúng tôi cảm thấy đã tới lúc nên áp dụng công nghệ này cho các bệnh nhân của mình. Chúng tôi vẫn đang làm và rút kinh nghiệm trong quá trình thử nghiệm. Chúng tôi chỉ cố gắng mua thêm thời gian sự sống cho người bệnh"", ông Tisherman chia sẻ với tạp chí New Scienceist.Một biến chứng của phương pháp này là các tế bào của bệnh nhân có thể bị tổn thương trong quá trình làm ấm làm cơ thể bệnh nhân.Nhiều nghiên cứu đã được tiến hành dựa trên ý tưởng làm chậm quá trình trao đổi chất có thể giúp kéo dài thời gian sinh học cho những người bị thương nặng, tăng cơ hội sống sót.Các nhà khoa học của Cơ quan hàng không vũ trụ Mỹ cho rằng việc đóng băng con người và hồi sinh sau đó trong các sứ mệnh không gian sâu thẳm là điều không tưởng.Tuy nhiên, họ tin rằng việc làm giảm quá trình trao đổi chất trong cơ thể của các phi hành gia có thể giúp ích trong những chuyến du hành giữa các vì sao."
20191120100913124,https://tuoitre.vn/cong-ty-bi-an-do-bill-gates-tai-tro-tuyen-bo-tim-ra-cong-nghe-cuu-ca-hanh-tinh-20191120100913124.htm,Công ty bí ẩn do Bill Gates tài trợ tuyên bố tìm ra công nghệ 'cứu cả hành tinh',https://cdn.tuoitre.vn/zoom/600_315/2019/11/20/photo-1-15742177720541376494922-crop-1574217799542923427939.jpg,20/11/2019 13:31 GMT+7,"TTO - Đầu tuần này, một công ty tên Heliogen do tỉ phú Bill Gates ủng hộ tuyên bố đã phát minh ra một công nghệ năng lượng mặt trời đột phá, hứa hẹn loại bỏ hoàn toàn nhiên liệu hóa thạch khỏi sản xuất công nghiệp.",Khoa học,Phát minh,"Theo Đài CNN, bằng công nghệ năng lượng mới, Heliogen và Bill Gates có tham vọng cứu cả hành tinh Trái đất khỏi thảm họa biến đổi khí hậu.Theo mô tả của Heliogen - một start-up không ai biết cho đến hôm qua (19-11) - họ đã tìm ra cách dùng trí tuệ nhân tạo (AI), kết hợp với các tấm gương mặt trời, để phản chiếu nhiều ánh sáng đến mức tạo ra nguồn nhiệt cực mạnh trên 1.000 độ C.Nhiệt độ đó gần tương đương 1/4 nhiệt độ bề mặt của mặt trời.Đột phá trên đồng nghĩa lần đầu tiên trong lịch sử, năng lượng mặt trời có thể được dùng để tạo ra nhiệt độ đủ cao ứng dụng vào sản xuất xi măng, thép, thủy tinh và nhiều quá trình công nghiệp khác.Nói cách khác, mặt trời - một nguồn năng lượng không phát thải carbon, có triển vọng thay thế hoàn toàn nhiên liệu hóa thạch trong một lĩnh vực kinh tế xưa nay năng lượng sạch chưa đáp ứng được.Chỉ riêng ngành sản xuất xi măng thải ra đến 7% lượng CO2 toàn cầu, theo Cơ quan Năng lượng quốc tế.""Chúng tôi đang triển khai một công nghệ có thể đánh bật giá thành của nhiên liệu hóa thạch, đồng thời không thải ra khí CO2. Đây quả thực là Chén Thánh (báu vật trong Kitô giáo - PV) - ông Bill Gross, nhà sáng lập kiêm CEO của Heliogen, mô tả.Ngoài Bill Gates, Heliogen còn được tài trợ bởi tỉ phú Patrick Soon Shiong - sở hữu tờ báo Los Angeles Times.""Bill và cả nhóm đã chinh phục được mặt trời. Tiềm năng của công nghệ này đối với nhân loại hết sức to lớn, cơ hội làm ăn cũng không thể đo đếm được"" - tỉ phú Soon Shiong phấn khởi."
