id,link,title,thumbnail,time,summary,category,sub_category,full_article
20171004090209131,https://tuoitre.vn/duong-den-nobel-vat-ly-cua-nguoi-kham-pha-song-hap-dan-20171004090209131.htm,Đường đến Nobel vật lý của người khám phá sóng hấp dẫn,https://cdn1.tuoitre.vn/zoom/600_315/2017/song-hap-dan-1507082131983-8-0-355-660-crop-1507082377019.jpg,04/10/2017 09:55 GMT+7,"TTO - Chủ nhân của giải Nobel vật lý năm nay là những người đã phát hiện sự tồn tại của sóng hấp dẫn, một lý thuyết đã được nhà vật lý thiên tài Albert Einstein tiên đoán cách đây một thế kỷ.",Khoa học,Phát minh,"Họ gồm ông Rainer Weiss (sinh năm 1932) - giáo sư danh dự tại Viện Công nghệ Massachusetts; ông Kip Thorne (1940) - nhà vật lý lý thuyết tại Viện Công nghệ California (Caltech) và ông Barry Barish (1936) - giáo sư danh dự ở Caltech. Ông Rainer Weiss được nhận một nửa trong số tiền thưởng 9 triệu kronor (825.000 USD), ông Kip Thorne và ông Barry Barish chia nhau nửa còn lại.Họ đã tìm ra sóng hấp dẫn thế nào?Trăm năm chờ đợiCách đây 101 năm, Einstein sau khi công bố lý thuyết tương đối rộng đã tiên đoán sự tồn tại của sóng hấp dẫn. Theo lý thuyết này, sóng hấp dẫn là những xung động của không - thời gian được truyền với vận tốc ánh sáng đi khắp vũ trụ. Tuy nhiên, ngay cả bản thân Einstein cũng luôn nghi ngờ khả năng quan sát được sóng hấp dẫn. Lý do: sóng này có cường độ quá nhỏ nên rất khó đo đạc!Để hình dung độ nhỏ của sóng này, ta hãy hình dung Trái đất với đường kính 13.000km thì khi sóng hấp dẫn truyền đến, kích thước của nó sẽ thay đổi một phần nghìn tỉ mét! Với những khoảng cách ngắn hơn thì sự thay đổi này còn nhỏ nữa. Vì thế, rất khó để đo đạc tín hiệu gây ra bởi sóng hấp dẫn, đặc biệt khi nhiễu từ môi trường, như rung động gây ra bởi bước chân người, xe cộ chạy ngoài đường, thường lớn hơn như thế rất nhiều.Nhưng khoa học là thế. Một khi đã xuất hiện câu hỏi, đặc biệt là những câu hỏi quan trọng, thì nó sẽ ở đó và thôi thúc sự chinh phục. Nhỏ thì nhỏ thật, nhưng cũng phải có cách nào đó để đo đạc nó chứ. Câu trả lời là có: hãy sử dụng giao thoa kế laser. Đó chính là con đường mà các nhà khoa học được giải Nobel vật lý năm nay đã đi qua. Họ đã xây dựng một đài quan sát sóng hấp dẫn bằng giao thoa kế laser và sử dụng nó để quan sát sóng hấp dẫn.Đoạn trường ai hayNói thì dễ như vậy, nhưng thực hiện không hề dễ chút nào. Còn nhớ năm 1967, Reiner Weiss, khi đó đang ở Viện Công nghệ Massachusetts (MIT), đã công bố một phân tích về giao thoa kế và khởi động việc xây dựng một giao thoa kế thử nghiệm dưới sự tài trợ của quân đội Mỹ. Nhưng dự án này đã phải dừng lại. Sau đó, năm 1968, Kip Thorne, ở Caltech, đã tính toán lý thuyết về sóng hấp dẫn cùng những nguồn phát sinh ra nó và thấy rằng việc đo đạc sóng hấp dẫn ở Trái đất là hoàn toàn có thể.Các nhà khoa học ở MIT và Caltech sau đó đã dành nhiều năm theo đuổi dự án này. Sau rất nhiều lần đứt gánh giữa đường và bị từ chối cấp ngân sách cũng như nhiều trục trặc về kỹ thuật và tổ chức thì năm 1994, dưới sự dẫn dắt của Barry C. Barish, ở Caltech, đề án LIGO được cấp ngân sách 395 triệu USD, lớn nhất trong lịch sử tài trợ nghiên cứu của Quỹ khoa học quốc gia Mỹ.Sau 8 năm xây dựng, LIGO đi vào hoạt động năm 2002. Và tiếp tục 8 năm ròng rã nữa thu thập dữ liệu, LIGO không phát hiện sóng hấp dẫn nào! Năm 2010, LIGO tạm nghỉ để được nâng cấp, đến năm 2015 hoạt động trở lại.Đến thời điểm đó, các nhà khoa học đã theo đuổi dự án này hơn 40 năm. Nhưng sóng hấp dẫn ở đâu vẫn bặt vô âm tín.Đền đáp xứng đángKỳ diệu thay, ngay trong lần chạy đầu tiên, LIGO đã quan sát được sóng hấp dẫn lúc 16h51 ngày 14-9-2015 (giờ Việt Nam).Sự kiện này đến quá bất ngờ, đến mức các nhà khoa học LIGO không dám tin đó là sự thật. Phải 5 tháng sau, sau khi phân tích thật kỹ càng và chắc chắn rằng tín hiệu mình quan sát được là sóng hấp dẫn phát ra từ sự nhập lại của hai lỗ đen cách chúng ta 1,3 tỉ năm ánh sáng, tức sự kiện đã diễn ra cách đây 1,3 tỉ năm về trước nhưng sự xung động không - thời gian bây giờ mới truyền đến chúng ta, Đến lúc này, họ mới dám công bố cho cộng đồng khoa học biết vào ngày 11-2-2017.Việc quan sát được sóng hấp dẫn được coi là một trong những thành tựu khoa học lớn nhất của thế kỷ 20. Điều thú vị là tần số dao động của sóng hấp dẫn nằm trong dải tần nghe được bởi tai người. Vì thế, người ta ví von rằng sóng hấp dẫn là tiếng vọng từ thuở hồng hoang dội đến chúng ta. Trên nguyên tắc, chúng ta hoàn toàn có thể ""nghe được"" sóng hấp dẫn từ khi vũ trụ mới hình thành, tức từ thời sáng thế, vọng đến chúng ta. Đó là viễn cảnh quá ư choáng ngợp, là thành tựu quá lớn của khoa học.Vì thế, ngay sau khi được công bố, nhiều người đã dự đoán LIGO sẽ được trao giải Nobel năm 2016. Nhưng Ủy ban Nobel xem ra đã cẩn thận lùi lại một năm để xem xét và kiểm chứng. Vì thế, giải Nobel vật lý năm nay đã được nhiều người dự đoán trước nên không bất ngờ.Đó là ghi nhận và đền đáp hoàn toàn xứng đáng cho 50 năm theo đuổi dự án này của các nhà khoa học LIGO, đặc biệt là các nhà khoa học được vinh danh trong giải thưởng năm nay."
20171003151346545,https://tuoitre.vn/song-hap-dan-thang-giai-nobel-vat-ly-2017-20171003151346545.htm,Sóng hấp dẫn thắng giải Nobel Vật lý 2017,https://cdn1.tuoitre.vn/zoom/600_315/2017/nobel-vat-ly-bo-ba-1507027638218-80-0-1921-3500-crop-1507027819257.jpg,03/10/2017 16:20 GMT+7,"TTO - Tương tự như giải thưởng ở mảng Y học công bố hôm qua chia cho ba người, giải Vật lý cũng về tay 3 nhà khoa học Rainer Weiss, Barry C. Barish và Kip S. Thorne.",Khoa học,Phát minh,"Dù không ít người đã đánh giá cao về tầm quan trọng của công trình nghiên cứu về sóng hấp dẫn nhưng cũng lo ngại nghiên cứu quá mới không thuyết phục được ủy ban chấm giải nhưng kết quả vừa công bố cho thấy điều ngược lại.Ba nhà khoa học Rainer Weiss, Barry C. Barish và Kip S. Thorne đã chiến thắng.""Cách đây rất lâu, sâu thẳm trong vũ trụ… một vụ va chạm giữa hai hố đen đã tạo ra sóng hấp dẫn"", đại diện Ủy ban Nobel Vật lý mở đầu phần giải thích. Khoảng đó xa đến nỗi, phải mất đến tận 1,3 tỉ năm ánh sáng, chính xác hơn là ngày 14-9-2015, nó mới đến được Trái đất và được ghi nhận bởi Đài quan sát sóng hấp dẫn giao thoa kế laser (LIGO).Trên thực tế, kể từ khi thông tin này được công bố, nó đã thu hút được rất nhiều sự chú ý. Một lần nữa, phải mất hàng chục năm, nhân loại mới hiểu được những bí ẩn cuối cùng trong thuyết tương đối của bác học Albert Einstein.Việc loài người phát hiện sóng hấp dẫn được so sánh với cảnh người điếc đột nhiên nghe thấy âm thanh.""Khám phá này giống như việc Galileo lần đầu tiên hướng kính thiên văn lên bầu trời - giáo sư vật lý thiên văn Vassiliki Kalogera thuộc ĐH Northwestern (Mỹ), thành viên dự án LIGO, khẳng định - Bạn dỏng tai lắng nghe những tín hiệu mới từ vũ trụ mà các công nghệ trước đây của chúng ta không thể bắt và nghiên cứu được"".""Điều kỳ diệu nhất là âm thanh đó đã di chuyển và tồn tại trong suốt 1,3 tỉ năm kể từ khi hai hố đen đó va chạm lẫn nhau. Ở cái thời đó, làm gì có con người tồn tại, nhưng đến giờ chúng ta đã bắt được tín hiệu đó"". Nói như một nhà khoa học nào đó, những tín hiệu mà LIGO bắt được, như ""tiếng vọng từ Sáng thế"". Một đại diện Ủy ban Nobel Vật lý trao đổi với báo chí sau phần công bố người chiến thắng.LIGO là gì?Bài viết Tiếng vọng từ Sáng thế trên báo Tuổi Trẻ Cuối tuần số ra ngày 12-12-2016 có giải thích LIGO là một thiết bị khổng lồ vô cùng tinh xảo. Máy dò sóng hấp dẫn LIGO là hai đường ống dài khoảng 4km, nối với nhau hình chữ L. Ống được hút chân không cực cao, chỉ còn 1 phần ngàn tỉ áp suất không khí bình thường. Trong mỗi ống có một chùm tia laser được chiếu liên tục. Hai chùm tia gặp nhau ở góc chữ L. Các sóng laser được tính toán sao cho chúng triệt tiêu nhau và tạo nên giao thoa. Do hiện tượng phân cực, hai ống vuông góc với nhau nên chỉ có một ống sẽ bị sóng hấp dẫn đập vào. Khi sóng hấp dẫn đập vào một trong hai ống, chiều dài ống sẽ bị co giãn khác với ống kia, gây ra nhiễu loạn phá vỡ cân bằng của hai chùm laser, và làm mất các vân giao thoa.Độ co giãn của một ống dài 4km do ảnh hưởng của sóng hấp dẫn lại rất bé, chỉ cỡ 1/10.000 bề rộng của một hạt proton. Nếu phóng đại chiều dài của ống từ 4km lên tới khoảng cách từ Trái đất đến ngôi sao gần nhất bên ngoài hệ Mặt trời thì độ co giãn này sẽ có bề dày một sợi tóc.Độ co giãn nhỏ như vậy nên LIGO cần các gương phản chiếu laser trong giao thoa kế cực kỳ tinh xảo. Gương được mài nhẵn tới độ phẳng 1/30 tỉ inch và được điều khiển bằng 6 nam châm điện chỉ bé bằng con kiến.Toàn bộ đường ống của LIGO được đặt trên các trụ cách ly địa chấn bằng thép và lò xo đặc biệt, đứng trên các sàn bêtông dày 76cm, các sàn này không được tựa vào bất cứ bờ tường nào. Theo tính toán, để phát hiện sự va chạm của hai hố đen cách Trái đất 300 triệu năm ánh sáng, LIGO có thể phải chờ đợi từ 1-1.000 năm.Cuối cùng, Advanced LIGO phát hiện sự va chạm của hai hố đen cách Trái đất 1,3 tỉ năm chỉ vài tháng sau khi được sửa chữa, nâng cấp.Tín hiệu của sóng hấp dẫn ấy ở LIGO thể hiện dưới dạng âm thanh nghe thấy được. Một tiếng kêu rất khẽ của con sóng vũ trụ.Kết quả công bố giải thưởng Nobel Y học đã khiến mọi người không ít ngỡ ngàng khi các dự đoán thiên về những công trình nghiên cứu về chữa trị ung thư hoặc chống lại bệnh viêm gan siêu vi C.Chiều nay (giờ VN) giải thưởng Nobel Vật lý 2017 sẽ được công bố với những đồn đoán về việc phát hiện các sóng hấp dẫn chứng minh cho phỏng đoán của bác học thiên tài Albert Einstein trong lý thuyết về lực hấp dẫn của ông.  Tuy nhiên các chuyên gia cũng cho rằng do việc phát hiện sóng này là khá mới (từ tháng 9-2015) nên có thể sẽ bị Ủy ban Nobel đánh giá là còn quá sớm để chứng minh hiệu quả của nó cho cuộc sống.  Theo nhật báo Dagens Nyheter của Thụy Điển, ban giám khảo Nobel Vật lý có thể chọn tưởng thưởng cho công trình phát hiện các hành tinh ngoài hệ mặt trời của hai nhà vật lý thiên văn người Thụy Sĩ là Michel Mayor và Didier Queloz.  Cách đây đúng một năm, Viện Hàn lâm Khoa học Hoàng gia Thụy Điển tại Stockholm đã chọn lựa người thắng giải Nobel Vật lý 2016 là ba nhà khoa học người Anh David Thouless, Duncan Haldane và Michael Kosterlitz vì những phát hiện lý thuyết về sự chuyển pha tôpô học và các pha tôpô của vật chất.Cả ba nhà khoa học thắng giải năm ngoái đều đang làm việc tại Mỹ.Giải Nobel Vật lý và Hóa học do Viện Hàn lâm Khoa học Hoàng gia Thụy Điển đề cử và quyết định. Viện Hàn lâm Thụy Điển phụ trách giải Nobel Văn học. Tính đến thời điểm hiện tại, trong tổng cộng 914 chủ nhân (cá nhân hoặc tổ chức) của giải Nobel, có 48 phụ nữ. Trong số này, nhà khoa học người Pháp, bà Marie Curie được tôn vinh tới 2 lần, với giải thưởng Vật lý năm 1903 và giải Hóa học năm 1911."
20171003101923788,https://tuoitre.vn/buong-thi-nghiem-hoa-hoc-mini-20171003101923788.htm,'Buồng' thí nghiệm hóa học mini,https://cdn1.tuoitre.vn/zoom/600_315/2017/buong-thi-nghiem-mini-1507000349158-0-0-538-1024-crop-1507000406623.jpg,03/10/2017 14:36 GMT+7,"TTO - Trăn trở trước thực trạng giáo viên ""dạy chay"", học sinh ""học chay"" môn hóa học tại các trường phổ thông, hai giảng viên đại học đã chế tạo 'buồng' thí nghiệm hóa học mini đa năng.",Khoa học,Phát minh,"TS Chu Mạnh Nhương (35 tuổi, giảng viên khoa hóa học Trường ĐH Sư phạm Thái Nguyên) và cộng sự là ThS Nguyễn Văn Trung (58 tuổi, giảng viên khoa hóa học) đã cùng lên ý tưởng chế tạo ""buồng"" thí nghiệm này.Buồng thí nghiệm nặng chỉ 5-7kg, có thể di chuyển dễ dàng từ phòng này qua phòng khác, tạo thuận lợi cho giáo viên và học sinh làm các thí nghiệm hóa học mà không ngại khí độc hại thải ra môi trường.Sáng chế này tham dự cuộc thi ""Tri thức trẻ vì giáo dục năm 2017"", do Trung ương Đoàn, Bộ GD-ĐT, Tập đoàn Thiên Long phối hợp với báo Tuổi Trẻ tổ chức.Thí nghiệm là ""linh hồn"" của hóa họcNhen nhóm ý tưởng từ vài năm trước, đến tháng 4-2017 giảng viên trẻ Chu Mạnh Nhương mới cùng thầy Trung bắt tay chế tạo buồng thí nghiệm hóa học mini đa năng. Thầy Nhương kể khi bắt đầu đề xuất ý tưởng về buồng thí nghiệm, có rất nhiều người thắc mắc: đã có tư liệu trình chiếu, phần mềm mô phỏng, thí nghiệm ảo, video... thì thiết kế đồ dùng thí nghiệm dạy học liệu có cần thiết không? ""Chúng tôi tiếp thu hết, nhưng quan trọng là giáo viên phải làm thí nghiệm và học sinh phải được thực hành. Thí nghiệm là ""linh hồn"" của hóa học. Phần mềm mô phỏng, thí nghiệm ảo... chỉ là công cụ bổ trợ cho giáo viên khi triển khai bài học"" - thầy Nhương quả quyết.Sau hai tuần mày mò nghiên cứu, ngày đi dạy tối về chế tạo, cuối cùng buồng thí nghiệm hóa học mini của hai người thầy luôn trăn trở với môn hóa đã hoàn thành và đưa vào thử nghiệm thành công. Thầy Nhương cho hay kết cấu của buồng thí nghiệm rất đơn giản, làm từ nhựa mica trong suốt, chia làm hai tầng. Tầng dưới có hai ngăn trên và dưới: ngăn dưới dùng làm không gian tiến hành thí nghiệm, ngăn trên được gắn phễu thu khí, quạt hút gió, tum thu khí - thu hút các chất dễ bay hơi lên ống thu khí, và đi vào bình xử lý khí (chứa than gỗ).Còn tầng trên chứa một phần ống tum, ống nhựa thu khí, và được bố trí các bình đựng chất xử lý khí (như than gỗ, vôi sống, chè cám, bột gạo rang khô, silicagen...) nhằm xử lý triệt để các chất khí và hơi hút từ tầng dưới.""Than gỗ, chè cám dễ kiếm và rẻ tiền. Tác dụng của sản phẩm rất rõ là hút được trên 90% khí độc khi làm thí nghiệm, hiệu quả xử lý triệt để nếu được cải tiến. Với buồng hóa học mini này, thầy trò sẽ có cảm giác an toàn, hứng thú trong khi làm thí nghiệm, không còn sợ hít phải khí độc tràn ra ngoài"" - TS Chu Mạnh Nhương cho biết.Học sinh bớt e dè môn hóaTại những nơi thí nghiệm hóa học thường có các tủ hút khí độc. Tuy nhiên, tủ loại này rất nặng, cố định một chỗ, lại hay bị hỏng do sự ăn mòn của hóa chất. Buồng thí nghiệm hóa học của TS Nhương và đồng nghiệp đã khắc phục được những hạn chế trên.Hiện nay trên thế giới cũng có nhiều buồng thí nghiệm hóa học hiện đại song giá khá đắt, không phù hợp với việc dạy học ở trường THPT. Do đó TS Nhương và thầy Trung mong muốn buồng thí nghiệm hóa học mini được triển khai phổ biến, nhân rộng ra ở các trường đại học, viện nghiên cứu, phòng thực hành hóa ở trường phổ thông với giá cả phải chăng. Mức giá với mô hình buồng thí điểm từ 1,5-2 triệu đồng/buồng. ""Đưa buồng thí nghiệm tham gia chương trình Tri thức trẻ vì giáo dục, chúng tôi mong muốn nhận được ý kiến đóng góp về chuyên môn của các chuyên gia, giáo sư để sản phẩm được cải tiến, hoàn thiện hơn"" - thầy Nhương bày tỏ.Từ khi có buồng hóa học mini, phòng thí nghiệm của khoa hóa học Trường ĐH Sư phạm Thái Nguyên trở nên nhộn nhịp với các nhóm sinh viên nghiên cứu khoa học đến thực hành môn hóa. ""Tiếp xúc với buồng thí nghiệm này, em bị cuốn hút ngay, cảm thấy hứng thú với môn hóa học. Em thích làm thí nghiệm và làm say mê. Em mong sản phẩm này sẽ được phổ biến rộng rãi đến học sinh, sinh viên, nhất là các bạn trẻ đam mê môn hóa"" - bạn Nguyễn Đạt Sơn, sinh viên năm 3, khoa hóa học Trường ĐH Sư phạm Thái Nguyên, chia sẻ."
20171002100556901,https://tuoitre.vn/phuong-phap-moi-kiem-soat-benh-sot-ret-20171002100556901.htm,Phương pháp mới kiểm soát bệnh sốt rét,https://cdn1.tuoitre.vn/zoom/600_315/2017/sot-ret-1506916294691-0-0-367-699-crop-1506916329509.jpg,02/10/2017 11:01 GMT+7,TTO - Hai nghiên cứu độc lập đã phát hiện việc biến đổi những vi khuẩn đang sống trong ruột của muỗi có thể giúp chúng chống lại ký sinh trùng sốt rét.,Khoa học,Phát minh,"Cụ thể, một nhóm đã trang bị ""vũ khí"" cho các vi khuẩn có thể chuyển các protein ngăn chặn ký sinh trùng vào ruột muỗi. Trong khi đó một nhóm nhận thấy rằng muỗi nếu mang một loại gene chặn sốt rét đặc biệt có thể tạo ra một ""sở thích"" giao phối, được dùng để nhân rộng loại gene này.Sau khi đốt người bị nhiễm sốt rét, muỗi Anopheles cái sẽ chuyển ký sinh trùng sốt rét, có tên plasmodium falciparum vào trong ruột của chúng.Dựa vào đặc điểm trên, Marcelo Jacobs-Lorena từ trường Đại học Johns Hopkins ở Maryland, Mỹ và đồng nghiệp đã phát triển một chuỗi vi khuẩn được chuyển hóa gene để có thể chống lại ký sinh trùng này.Tuy nhiên cho đến nay vẫn khó để có thể làm cho loài vi khuẩn có lợi này có thể có mặt trong cơ thể của muỗi với số lượng lớn.Vi khuẩn biến đổi geneGần đây, Sibao Wang - một nhà nghiên cứu đã từng làm trong phòng thí nghiệm Jacobs Lorena, sau chuyển đến làm việc cho Viện Khoa học Trung Quốc ở Thượng Hải, đã chú ý một chất lỏng trong buồng trứng của muỗi có dấu hiệu cho thấy có thể vận chuyển vi khuẩn.Sau khi nghiên cứu thêm về các loại vi khuẩn đa dạng, ông phát hiện một nhóm mới của loại trực khuẩn serratia có tiềm năng phát tán rộng. Cụ thể, trong các thí nghiệm, khi cung cấp cho muỗi cái Anopheles lượng đường có chứa serratia, loại vi khuẩn này sẽ phát triển nhanh chóng khắp đường ruột của muỗi. Các vi khuẩn này sau đó sẽ xuất hiện trên bề mặt của trứng, thậm chí lan rộng đến những ấu trùng mà chúng có thể tiếp xúc. Đặc biệt, nó có thể được chuyển từ con đực sang con cái.Ngoài ra, vi khuẩn này dường như không gây ra tác động tiêu cực nào, do đó các nhà khoa học đã ""trang bị"" cho chúng loại gene phản trùng sốt rét. Họ thiết kế để nó có thể tạo ra 5 phân tử với các kĩ thuật đặc biệt giết, tóm hay cản trở trùng sốt rét trong ruột.Kết quả, những con muỗi được nuôi bằng vi khuẩn gắn với gene này 2 ngày trước khi được cho hút máu chứa ký sinh trùng sốt rét đã làm giảm 93% lượng ký sinh trùng so với thông thường.Nhân rộng ""vũ khí"" diệt sốt rét qua đường giao phốiTrong khi đó nhà sinh học Geogre Dimopoulos và đồng nghiệp đã phát triển muỗi Anophes có mang gene Rel2 làm tăng khả năng sản xuất protein giúp ngăn chặn nhiễm trùng sốt rét trong ruột của nó. Đồng thời, gene này tạo ra một xu hướng giao hợp có lợi cho cuộc chiến với sốt rét.Các thí nghiệm đã tiết lộ một điều thú vị: những con đực được biến đổi gene có xu hướng thích giao phối với bạn tình không được điều chỉnh hơn, trong khi những con đực đã điều chỉnh thì thích những con cái chưa điều chỉnh.Điều này sẽ làm gia tăng lượng gene có lợi và khi số lượng cân bằng trong một khu vực nhất định, thì khoảng 90% thế hệ kế tiếp sẽ mang gene Rel2 và tỉ lệ này sẽ duy trì khoảng 10 thế hệ tiếp theo.Cả 2 nhóm nghiên cứu đều công bố công trình của mình trên tạp chí Science, và họ hy vọng có thể kết hợp 2 phương pháp để chống sốt rét."
2017092909003674,https://tuoitre.vn/nang-robot-y-chang-nguoi-that-khien-nhieu-nguoi-ho-2017092909003674.htm,'Nàng' robot y chang người thật khiến nhiều người 'hớ',https://cdn.tuoitre.vn/zoom/600_315/2017/robottokyo-gs-female-robot-1506668658672-20-0-546-999-crop-1506669233218.jpg,,"TTO - Mới đây tại Game Show Tokyo (Nhật Bản), nhiều người bối rối khi nhìn thấy một phụ nữ xinh đẹp ""vừa thấy đã yêu"". Càng bối rối hơn khi họ phát hiện ""nàng"" chỉ là người máy.",Khoa học,Phát minh,
