id,link,title,thumbnail,time,summary,category,sub_category,full_article
20210216093755335,https://tuoitre.vn/dien-anh-2021-phai-thay-doi-tu-thu-lao-cua-nguoi-dung-phim-20210216093755335.htm,Điện ảnh 2021: Phải thay đổi từ thù lao của người dựng phim,https://cdn1.tuoitre.vn/zoom/600_315/2021/2/16/tran-thanh-1613452409613556458106-crop-16134530603081774583193.png,16/02/2021 13:31 GMT+7,"TTO - 'Một bộ phim mấy chục tỉ, nhưng người dựng phim chỉ nhận vài chục triệu, chưa tới 100 triệu đồng. Quá thiệt thòi' - diễn viên Trấn Thành chia sẻ. Điện ảnh 2021, giới làm phim mong những phim kém, tay ngang sẽ dễ dàng bị đào thải.",Giải trí,Điện ảnh,"Năm 2021 mở đầu với mùa phim Tết trống rỗng: không phim Việt mới, không quả bom phòng vé. Do COVID-19, mùa chiếu quan trọng nhất trong năm của điện ảnh Việt đã bị bỏ lỡ. Liệu có ""hiệu ứng domino"" gây khủng hoảng cho thị trường vốn đã ""trọng thương""?Góp ý cho nền điện ảnh năm 2021, diễn viên - đạo diễn Trấn Thành, biên kịch Bình Bồng Bột (Tiệc trăng máu, Chị Mười Ba) cho rằng thù lao ""vài chục triệu đồng"" của người dựng phim hiện nay là ""quá thiệt thòi"".Bên cạnh đó, giới làm phim tin rằng COVID-19 sẽ giúp đào thải những bộ phim chất lượng kém từ những người làm nghề tay ngang.'Hiệu ứng domino' lùi lịch, phim nhỏ tránh phim lớnTết 2021 từng có cơ hội trở thành mùa phim Tết tốt nhất của điện ảnh Việt từ trước đến nay. 4 phim dự định ra mắt - Bố già, Trạng Tí, Gái già lắm chiêu V và Lật mặt: 48h - đều được đầu tư cao, ít có khả năng là ""phim thảm họa"" như các năm trước. Hai phim đã chiếu cho báo chí là Trạng Tí và Lật mặt: 48h đều khá chất lượng.Cơ hội đó nay đã không còn, cũng không còn ""cuộc đại chiến"" giữa 4 phim. Trước mắt, mỗi phim sẽ chọn lịch chiếu riêng, có thể ngay đầu tháng 3. Ngay lập tức, nhà phát hành các phim nhỏ hơn đã chuẩn bị tâm lý hoãn chiếu để tránh đụng độ các phim lớn này. Điều này sẽ gây xáo trộn thị trường.Trên trang cá nhân, đạo diễn Bảo Nhân của Gái già lắm chiêu V chia sẻ về mùa phim Tết không thành: ""Đây có thể gọi là một cú xô ngã chí mạng để khởi đầu cho một cuộc khủng hoảng lớn của ngành công nghiệp điện ảnh Việt Nam.Điều lo lắng không chỉ là số phận của riêng Gái già lắm chiêu V ngày quay lại mà là ""hiệu ứng domino"" sẽ liên tục xô ngã sức chịu đựng của hệ thống rạp vốn đã gánh gồng suốt một năm qua, chỉ chờ dựa vào mùa phim Tết để ổn định. Vậy mà!"".Dựng phim, biên kịch đang quá thiệt thòiTrấn Thành là người tham gia hầu hết các khâu của phim điện ảnh Bố già, từ biên kịch, thủ vai diễn đến đạo diễn, dựng phim. Trong bàn tròn Vietnam Cinema trên K+ dịp Tết vừa qua, anh nêu quan điểm đội ngũ biên kịch và dựng phim cần được coi trọng hơn nữa, ngay từ khâu đầu tiên: tiền.Trấn Thành nói: ""Chúng ta cần tăng lương, thiết lập lại hệ thống lương cho đội ngũ dựng phim và biên kịch. Hai đội ngũ này quá quan trọng cho một bộ phim. Nếu chúng ta không tăng lương, họ sẽ không thể sống hạnh phúc và tập trung trí não cho công việc này.Một bộ phim mấy chục tỉ, nhưng người dựng phim chỉ nhận vài chục triệu, chưa tới 100 triệu đồng. Tôi thấy quá thiệt thòi cho họ"".Biên kịch Bình Bồng Bột bổ sung thêm, ""mấy chục triệu"" là thu nhập trong vòng mấy tháng nên không thể coi là cao. Anh mong thu nhập biên kịch trong năm 2021 ""tăng gấp đôi"", nhưng với điều kiện trình độ biên kịch phải ""tăng gấp ba"".Về thù lao dựng phim, nhà sản xuất Hoàng Quân (Bắc kim thang) nói với Tuổi Trẻ Online: ""Khâu hậu kỳ có nhiều giai đoạn. Đường hình có dựng phim, chỉnh màu, chỉnh nét, VFX, 3D. Đường tiếng có hiệu ứng âm thanh, nhạc nền, lồng tiếng, bài hát chủ đề.Tiền dựng phim, tính trước thuế, với cá nhân là từ 60 đến 80 triệu đồng đối với nhân sự bình thường, từ 100 đến 150 triệu đồng với đạo diễn dựng phim giỏi. Còn với đơn vị, tổ chức thì từ 150 đến 185 triệu đồng cho mỗi dự án. Đơn vị hậu kỳ cung cấp người dựng lẫn tư vấn dựng"".Còn về thù lao biên kịch, biên kịch Lương Kim Liên (Lô tô, Hạnh phúc của mẹ) chia sẻ, thu nhập của biên kịch có thể dao động nhiều mức. Với một phim thương mại lớn, biên kịch hoặc nhóm biên kịch có thể nhận từ 400-450 triệu đồng nhưng phải theo đuổi dự án khoảng 2 năm, bỏ rất nhiều công sức.Còn lại, thù lao phụ thuộc vào dự án lớn hay nhỏ và danh tiếng, bề dày kinh nghiệm của biên kịch. Thông thường, các biên kịch nhận từ 80 đến 200 triệu đồng trong nhiều tháng làm việc. Nếu muốn ủng hộ nhà làm phim thân thiết, họ có thể nhận nửa thù lao hoặc biến thù lao thành khoản đầu tư.""Ở Hàn Quốc, thù lao biên kịch còn cao hơn cả đạo diễn, thậm chí cao hơn diễn viên ngôi sao. Vai trò biên kịch rất được coi trọng trong các dự án điện ảnh và truyền hình"" - biên kịch Lương Kim Liên nói.COVID-19 giúp đào thải phim dở, phim thảm họaTrong chương trình Vietnam Cinema, diễn viên Trấn Thành nhận định: ""Tôi ngậm đắng nuốt cay để nói điều này: COVID-19 dạy mình bằng cách táng cho mình tỉnh. Nó táng mình trọng thương nhưng rồi phải tỉnh. Khi COVID-19 đến, nó cân bằng lại thị trường ở chỗ thanh lọc những phim kém chất lượng. Chúng phải được nhìn nhận đúng với bản chất của chúng"".Theo nhà làm phim Bố già, trước đây thị trường đông nên phim hay nhiều mà phim dở cũng nhiều. Khi đó, nhóm khán giả ""chọn đại"" vẫn đông đảo nên phim dở vẫn có thể thành công.Còn hiện nay, những nhà làm phim yêu nghề, tâm huyết mới dám ra phim. ""Ai sống sót được qua mùa COVID-19 này là họ làm sản phẩm chất lượng thực sự. Những người làm sản phẩm chưa chất lượng thì có dịp để nhìn lại mình"" - anh nói.Nhà sản xuất Charlie Nguyễn đưa ra thông tin: tại Hollywood hiện nay, những phim ít tiền (từ 20 đến 80 triệu USD) không còn được sản xuất nhiều. Các dự án thường có mức đầu tư lớn, từ 100 đến 300 triệu USD. Mỗi bộ phim phải là một ""sự kiện điện ảnh"" mới đủ thu hút khán giả.Tại thị trường Việt Nam, nhà sản xuất Ngô Thanh Vân nói trong một buổi họp báo phim Trạng Tí, phim ảnh khó có thể tốt nếu đầu tư dưới mức kinh phí 20 tỉ đồng. Nhận định này hợp lý với dòng phim thương mại.Tất nhiên, vẫn có những bộ phim kinh phí thấp mà chất lượng cao, nhưng đó thường là các phim độc lập ít tính thương mại hoặc một số trường hợp cá biệt.Khán giả ngày nay có quá nhiều lựa chọn trên các nền tảng mạng. Họ xem rất nhiều thể loại phim qua mạng nên những phim ""không xứng ra rạp"" (do lối làm phim tay ngang, không đạt chuẩn...) sẽ không còn chỗ đứng ở rạp. Việc loại bớt những phim như vậy có thể coi là điều tích cực đối với nền điện ảnh."
20210210100545403,https://tuoitre.vn/mat-biec-bi-loai-khoi-giai-oscar-20210210100545403.htm,'Mắt biếc' bị loại khỏi giải Oscar,https://cdn1.tuoitre.vn/zoom/600_315/2021/2/10/mat-biec-1612928178107774259541-crop-161292825202856082396.jpg,10/02/2021 11:44 GMT+7,"TTO - 'Mắt biếc' vắng mặt trong danh sách rút gọn hạng mục Phim quốc tế xuất sắc, giống như các đại diện Việt Nam gần đây như 'Hai Phượng', 'Cô Ba Sài Gòn'.",Giải trí,Điện ảnh,"Theo Hollywood Reporter, hôm 9-2, Viện hàn lâm Khoa học và nghệ thuật điện ảnh Mỹ công bố danh sách rút gọn đề cử một số hạng mục, trong đó có Phim quốc tế xuất sắc (tiền thân là giải Phim nói tiếng nước ngoài xuất sắc).Hạng mục này năm nay có 15 phim được vào vòng rút gọn. 15 phim này được chọn ra từ các phim do 93 quốc gia và vùng lãnh thổ gửi về. Từ danh sách rút gọn sẽ có 5 phim vào vòng đề cử chính thức.Đại diện Việt Nam, phim Mắt biếc của đạo diễn Victor Vũ, vắng mặt. Như vậy, Mắt biếc tiếp nối các phim Việt khác như Hai Phượng, Cô Ba Sài Gòn, Cha cõng con, Tôi thấy hoa vàng trên cỏ xanh, Trúng số, Mùi cỏ cháy...Châu Á có 3 đại diện đến từ Hong Kong, Đài Loan và Iran. Đại diện Đài Loan là A Sun (Dương quang phổ chiếu), bộ phim được nhiều khán giả Việt yêu thích. Hollywood Reporter đánh giá cao Another Round (Đan Mạch), Two of Us (Pháp) và La Llorona (phim đầu tiên của Guatemala vào danh sách rút gọn).2 phim không nói tiếng Anh được đánh giá cao gần đây, Minari và The Life Ahead, không đủ điều kiện góp mặt trong hạng mục này. Minari là phim do Mỹ sản xuất, còn The Life Ahead không được Ý nộp dự thi, thay vào đó Ý nộp phim Notturno (không được chọn).15 phim trong danh sách rút gọn của hạng mục Phim quốc tế hay nhất bao gồm: Quo Vadis, Aida? (Bosnia & Herzegovina), The Mole Agent (Chile), Charlatan (Cộng hòa Czech), Another Round (Đan Mạch), La Llorona (Guatemala), Better Days (Hong Kong), Sun Children (Iran), Night of the Kings (Ivory Coast), I’m No Longer Here (Mexico), Hope (Na Uy), Collective (Romania), Dear Comrades! (Nga), A Sun (Đài Loan), The Man Who Sold His Skin (Tunisia), Two of Us (Pháp).Hàn Quốc, nền điện ảnh từng mang đến Parasite thành công vang dội năm ngoái, năm nay nộp phim The Man Standing Next nhưng không được vào vòng rút gọn giải này.Đề cử chính thức của Oscar năm nay sẽ được công bố vào ngày 15-3. Lễ trao giải diễn ra vào ngày 25-4, lùi gần 2 tháng so với mọi năm vì COVID-19."
20210122154614006,https://tuoitre.vn/tuong-vi-hi-vong-nam-tan-suu-2021-se-khoi-sac-hon-20210122154614006.htm,Tường Vi: Hi vọng năm Tân Sửu 2021 sẽ khởi sắc hơn,https://cdn1.tuoitre.vn/zoom/600_315/2021/1/22/img8083-1611305135296328370518-crop-16113051422091293031644.jpg,10/02/2021 06:47 GMT+7,"TTO - Suốt 10 năm làm nghề, diễn viên Tường Vi chưa từng vướng vào scandal. Cô hoạt động nghệ thuật một cách nghiêm túc và khẳng định bản thân qua các vai diễn. Minh chứng là giải thưởng ‘Nữ diễn viên được yêu thích nhất’ giải ‘Ngôi sao xanh'.",Giải trí,Điện ảnh,"Vai diễn Đào trong phim Làm rể Mười Xuân đã mang về giải thưởng cho Tường Vi. Khả năng diễn xuất của Tường Vi đã được khán giả ghi nhận. Đó là những ngày miệt mài trên phim trường, những hôm quay xuyên đêm đã được đền đáp.Tường Vi chia sẻ: ""Tường Vi rất xúc động khi cầm trên tay giải thưởng Ngôi sao xanh. Vi cảm ơn tình cảm khán giả đã dành cho mình. Vi luôn trân quý những yêu thương của khán giả. Giải thưởng này sẽ là động lực giúp Vi cố gắng nhiều hơn nữa trong thời gian tới"".""Năm 2020 có quá nhiều sự kiện nhưng là sự kiện không vui, ảnh hưởng trực tiếp đến cuộc sống của mỗi người, trong đó có Tường Vi.Từ đầu năm đến cuối năm, lúc nào Vi cũng nơm nớp lo sợ, dịch bệnh sẽ ảnh hưởng nhiều đến công việc. Hy vọng năm 2021 sẽ là một năm khởi sắc hơn với nhiều niềm vui, hạnh phúc và may mắn hơn"", Tường Vi cho biết thêm.Nhìn lại năm 2020, Tường Vi tâm đắc nhất vai Thanh Hà trong Bánh mì ông Màu. Thông qua vai diễn này, khán giả thương thì thương rất nhiều nhưng lại tức giùm Hà tại sao lại quá hiền, đến mức nhu nhược.Tường Vi bảo: ""Trên trường quay, Tường Vi tranh cãi với đạo diễn rất nhiều, bởi vai này quá nhu nhược, hiếm có ngoài đời. Nhưng Vi lại bị thuyết phục có nhu nhược như vậy mới thể hiện được tính cách đặc trưng của nhân vật trong phim"".Bật mí kế hoạch trong năm 2021, Tường Vi cho biết, cô sẽ vào những vai diễn với màu sắc mới, khác biệt hoàn toàn so với những vai trước đó. Tường Vi muốn thử sức, bước qua  giới hạn an toàn mang đến khán giả điều mới lạ."
20210114142357188,https://tuoitre.vn/nha-phuong-khoc-khi-hop-bao-gioi-thieu-phim-song-song-20210114142357188.htm,Nhã Phương khóc khi họp báo giới thiệu phim 'Song song',https://cdn1.tuoitre.vn/zoom/600_315/2021/1/14/1384090471433939075996686840675272847821678n-1610614741565647274041-crop-16106149782301700118975.jpg,14/01/2021 17:19 GMT+7,"TTO - Nhã Phương - nữ diễn viên - đã khóc và xin lỗi vì đến muộn hơn 1 tiếng trong buổi họp báo giới thiệu phim giật gân 'Song song' do cô đóng chính. Đây là bộ phim đầu tiên của cô sau khi làm mẹ, vào vai môt người mẹ thương con.",Giải trí,Điện ảnh,"Chiều 14-1, sự kiện giới thiệu phim Song song diễn ra tại TP.HCM. Phim Song song do Nguyễn Hữu Hoàng (Ống kính sát nhân) đạo diễn. Dàn diễn viên bao gồm Nhã Phương, Trương Thế Vinh, Tiến Luật, Thuật Phát, Hoàng Phi, Việt Anh - Trung Anh (1977 Vlog).Nhã Phương chia sẻ: ""Hôm nay tôi khóc vì một phần thấy có lỗi, một phần vì thương đoàn làm phim đã tạo nhiều điều kiện cho mình trong thời gian quay phim. Tôi cảm ơn đạo diễn Nguyễn Hữu Hoàng, êkip sản xuất vì đã cho tôi một bộ phim tuyệt vời để trở lại sau thời gian nghỉ sinh con, chăm con"".Cô nói thêm về lựa chọn vai diễn: ""Tôi bị chinh phục bởi kịch bản Song song. Đây là bộ phim đầu tiên tôi quay lại với guồng quay công việc sau khi sinh con, phải xa nhà, xa con để đóng phim ở Đà Lạt"".Nhã Phương cho biết chồng cô, diễn viên Trường Giang, ủng hộ cô theo đuổi vai diễn này. Trong Song song, cô đóng vợ chồng với Trương Thế Vinh, một người bạn của Trường Giang, do đó có chút e ngại. Nhưng sau quá trình quay phim, Nhã Phương và Trương Thế Vinh trở nên thân thiết.Nhã Phương vào vai chính, Trang, người vợ và người mẹ tận tụy. Khi phát hiện chiếc TV trong nhà mình có thể kết nối với quá khứ, cô tìm cách cứu mạng cậu bé Phong (Thuận Phát), người sống trong ngôi nhà này từ 20 năm trước. Lựa chọn này đẩy Trang vào chuyến du hành hỗn độn, đối mặt với một thực tại kỳ lạ.Đây là phim đầu tiên Nhã Phương vào vai người mẹ nhờ trải nghiệm thật. Trước đây, khi chưa kết hôn, cô chỉ đóng vai người mẹ nhờ tưởng tượng, quan sát. Đạo diễn Nguyễn Hữu Hoàng cho biết anh nhìn thấy ở Nhã Phương cả sự ấm áp và đáng thương của một người mẹ trẻ vô tình đánh mất đứa con gái. Anh tin khán giả sẽ tin tưởng và đồng cảm với nhân vật Trang.Trương Thế Vinh vào vai Quân, chồng Trang. Tiến Luật vào vai ông Sơn, người được cho hung thủ sát hại cậu bé Phong 20 năm trước.Song song lấy hai mốc thời gian 1999 và 2020, thời điểm xảy ra hai cơn bão lớn gắn với những biến cố lớn trong cuộc đời các nhân vật. Do câu chuyện diễn ra trong bão, hình ảnh chiếc TV với hai biên tập viên thời sự (Việt Anh, Trung Anh) thường xuyên xuất hiện để cập nhật bối cảnh.Làm lại từ kịch bản gốc khá hấp dẫn của Tây Ban Nha, Song song được hi vọng sẽ tiếp nối dòng phim thriller (giật gân) của Việt Nam. Đạo diễn Nguyễn Hữu Hoàng cho biết anh yêu thích phim thriller và thán phục kịch bản rất tốt của bản gốc. Anh luôn mong muốn có cơ hội đạo diễn những bộ phim như thế này.Phim ra rạp ngày 26-2."
20210113222639891,https://tuoitre.vn/dong-nhi-ong-cao-thang-dong-hanh-cung-tuan-le-dien-anh-nhat-ban-2021-20210113222639891.htm,"Đông Nhi, Ông Cao Thắng đồng hành cùng ‘Tuần lễ điện ảnh Nhật Bản 2021’",https://cdn1.tuoitre.vn/zoom/600_315/2021/1/13/dong-nhi-ong-cao-thang-la-khach-dac-biet-cua-lien-hoan-phim-nhat-nam-nay-16105514207981124676480-crop-16105516113741560946623.jpg,13/01/2021 23:09 GMT+7,"TTO - Tuần lễ điện ảnh Nhật Bản 2021 tại TP.HCM sẽ diễn ra từ ngày 16-1 đến 22-1 ở BHD Star Thảo Điền (quận 2) và BHD Star Bitexco (quận 1). Đông Nhi, Ông Cao Thắng là khách mời đặc biệt của tuần lễ điện ảnh này.",Giải trí,Điện ảnh,"Tuần lễ điện ảnh Nhật Bản 2021 do Cục Văn hóa Nhật Bản tổ chức, sẽ diễn ra trong một tuần, kể từ ngày 16-1, nhằm giới thiệu, quảng bá dấu ấn về điện ảnh Nhật Bản với khán giả Việt Nam.Đây là lần thứ ba Tuần lễ điện ảnh Nhật Bản diễn ra tại TP.HCM. Hai lần trước đó diễn ra năm 2013 và 2014.Lần này sẽ có 15 tác phẩm gồm phim truyện, phim hoạt hình, phim cổ điển... được trình chiếu. Tất cả là những tác phẩm đã đạt nhiều giải thưởng điện ảnh và chưa ra mắt tại Việt Nam.Theo ban tổ chức, đáng lẽ tuần lễ phim được tổ chức vào năm ngoái, nhưng do ảnh hưởng của đại dịch COVID-19 nên sự kiện được tổ chức năm nay.Vợ chồng ca sĩ Đông Nhi - Ông Cao Thắng sẽ góp mặt trong ngày mở màn 16-1, tại BHD Star Thảo Điền.Đến hôn em vào lúc nửa đêm được lựa chọn là tác phẩm chiếu mở màn. Bộ phim này dựa trên series manga nổi tiếng Gozen 0 ji, Kiss Shi ni Kite yo do đạo diễn Takehiko Shinjo chỉ đạo sản xuất. Bộ phim đặt vấn đề gợi mở: liệu 2 con người ở 2 thế giới có đến được với nhau?Giá vé vào cửa: 50.000 đồng đối với người lớn và 45.000 đồng đối với học sinh, sinh viên."
2021011222061394,https://tuoitre.vn/cau-vang-khong-xung-voi-van-chuong-nam-cao-2021011222061394.htm,Cậu Vàng: Không xứng với văn chương Nam Cao,https://cdn1.tuoitre.vn/zoom/600_315/2021/1/12/cau-vang-12-1-1read-only-16104638906931784913998-crop-16104639827681791822524.jpg,13/01/2021 08:37 GMT+7,"TTO - Cậu Vàng thất bại trong việc chuyển tải giá trị hiện thực và tính tư tưởng của văn chương Nam Cao. Kể cả nếu tạm gác ý nghĩa đó, bộ phim cũng không mang lại được thông điệp nào có sức nặng.",Giải trí,Điện ảnh,"""Lão Hạc đang vật vã ở trên giường, đầu tóc rũ rượi, quần áo xộc xệch, hai mắt long sòng sọc. Lão tru tréo, bọt mép sùi ra, khắp người chốc chốc lại bị giật mạnh một cái, giật nẩy lên. Hai người đàn ông lực lưỡng phải ngồi đè lên người lão. Lão vật vã đến hai giờ đồng hồ rồi mới chết. Cái chết thật là dữ dội... Lão Hạc ơi!"".Đoạn văn về cái chết của lão Hạc điển hình cho văn chương Nam Cao: văn ""trữ tình sắc lạnh"", đầy chua xót, đặc tả và ngồn ngộn chất hiện thực như thể con người bằng xương bằng thịt hiện lên. Khi đặt cạnh sự sắc nét đó, Cậu Vàng - câu chuyện được phóng tác từ các tác phẩm của Nam Cao - chỉ là bản minh họa mờ nhòe, sơ sài.Khi phim gắn với tác phẩm nổi tiếngKhông chỉ mô tả sơ sài cái chết xót xa của lão Hạc (nghệ sĩ Viết Liên), cả cái chết của Binh Tư (Phương Nam) cũng được phim phác họa qua loa bằng hình ảnh dòng máu đỏ lan trên mặt sông, rất ước lệ và thiếu trực diện. Phim né tránh hầu như toàn bộ những hình ảnh bi kịch đủ sức nặng để gây ám ảnh, gây đau đớn cho khán giả về thân phận những con người cùng khổ, về một thời đại nghèo đói trong lịch sử Việt Nam.Không hề có ngôn ngữ điện ảnh rõ nét, không hình tượng đắt giá, không góc máy ấn tượng, màu sắc lòe loẹt, lời thoại bê nguyên từ văn học, Cậu Vàng khiến nhiều khán giả thất vọng.Đạo diễn Trần Vũ Thủy nói về tác phẩm Cậu Vàng anh dựng để tri ân nhà văn Nam Cao và đạo diễn Phạm Văn Khoa - những người đã mang đến vai Chí Phèo (phim Làng Vũ đại ngày ấy) cho NSND Bùi Cường (tác giả kịch bản Cậu Vàng): ""Chúng tôi không tái hiện cuộc sống nghèo khổ trước năm 1945, mà hướng đến một tác phẩm về luật nhân - quả, bài học đối nhân xử thế"". Nhưng với mục tiêu thứ hai, bộ phim cũng không đạt được. Hoặc đây là mục tiêu sai lầm vì khi phim gắn với nguyên tác lớn, khán giả có quyền kỳ vọng.Chuyển thể từ ba tác phẩm của Nam Cao nhưng Làng Vũ Đại ngày ấy của đạo diễn - NSND Phạm Văn Khoa đã chuyển tải tốt hơn giá trị của tác phẩm gốc. Và với điều kiện làm phim thô sơ thời đó, phim vẫn khắc họa kỹ càng, tỉ mẩn về nhân vật và các chi tiết đắt giá, diễn xuất chân thực và đi vào lòng người, toát lên tinh thần nguyên tác.Nếu nhà làm phim Cậu Vàng không đặt mục tiêu chuyển tải giá trị hiện thực hay tư tưởng của Nam Cao, chủ động xóa bỏ bối cảnh lịch sử (thời Pháp thuộc) của nguyên tác, phải đặt câu hỏi: Vì sao phải lấy các tác phẩm nổi tiếng, hệ thống nhân vật điển hình đã gắn chặt với tên tuổi Nam Cao mà không tự sáng tạo ra cốt truyện hay hệ thống nhân vật khác?Mất trọng tâmBên cạnh con chó Vàng, 12 nhân vật được xây dựng trong tuyến truyện gây xé lẻ đất diễn và mất trọng tâm. Bà Ba vợ Bá Kiến (Băng Di) - người có chuyện đời riêng đầy bi kịch, làm lẽ nhà giàu rồi tham gia chuyện ""gia đấu"" - gần như được đẩy lên làm nhân vật chính cùng đất diễn khá áp đảo. Trong khi đó, lão Hạc - người đáng ra là nhân vật chính - vắng mặt trong gần nửa thời lượng.Nếu xét theo sự phát triển rõ rệt về tính cách và có kết cục đích đáng, bà Ba và Lý Cường (Will) đều mang dáng dấp nhân vật chính. Đây là thay đổi lớn của phim nhưng không hay, vì cả hai nhân vật này đều không quá đặc biệt.Và cậu Vàng - nhân vật tiêu đề phim, được cho là chứng kiến mọi bi kịch con người trong thế giới ấy - lại xuất hiện qua lối dựng phim minh họa. Sẽ là sai lầm nếu nhà làm phim nghĩ rằng có thể thể hiện ý đó bằng cách dựng đan xen một cảnh có cậu Vàng, một cảnh có con người. Đó không phải là góc nhìn của con chó mà vẫn là của con người, ở đây là nhà làm phim.Sự tham gia của cậu Vàng vào các tuyến truyện bên ngoài lão Hạc vẫn rất ít ỏi, khiến cấu trúc nhân - quả mà cậu Vàng là nhân tố chính trở nên gượng ép.Rõ ràng, phim phóng tác như Cậu Vàng không nhất thiết phải trung thành với nguyên tác văn học hay giữ nguyên hình tượng nhân vật, nhưng việc toát lên tinh thần của tác phẩm gốc là điều khán giả mong mỏi và cũng là điều nhà làm phim hướng đến. Nói cho cùng, Cậu Vàng không thể nào tách khỏi cái gốc là những tác phẩm đầy hiện thực của Nam Cao: Lão Hạc, Chí Phèo, Sống mòn... Cái gốc ấy đậm đà, mạnh mẽ bao nhiêu thì cái ngọn là bộ phim lại nhạt nhòa, ốm yếu bấy nhiêu."
