id,link,title,thumbnail,time,summary,category,sub_category,full_article
/post-1518916.html,https://thanhnien.vn/dieu-gi-tao-nen-su-thanh-cong-cua-thuong-hieu-vien-thong-fpt-post1518916.html,Điều gì tạo nên sự thành công của thương hiệu Viễn thông FPT?,https://image.thanhnien.vn/1200x630/Uploaded/2022/aeymrexqam/2022_11_07/1667820657510-9583.jpeg,2022-11-07T18:32:26+0700,"Đánh trúng nhu cầu thực tế của người dùng và liên tục nâng cấp trải nghiệm bằng những công nghệ hàng đầu, chất lượng chăm sóc khách hàng tận tâm là cách mà FPT Telecom tạo nên thương hiệu có giá trị khác biệt trên thị trường.",Tài chính kinh doanh,Doanh nghiệp," Đánh trúng nhu cầu thực tế của người dùng và liên tục nâng cấp trải nghiệm bằng những công nghệ hàng đầu, chất lượng chăm sóc khách hàng tận tâm là cách mà FPT Telecom tạo nên thương hiệu có giá trị khác biệt trên thị trường. Xu thế mới của thế kỷ công nghệ đã thúc đẩy sự thay đổi trong “giao tiếp” giữa doanh nghiệp và người tiêu dùng. Trong lĩnh vực viễn thông, yếu tố này càng được coi trọng. Để có được thành công này, Viễn thông FPT lựa chọn lối đi riêng nhiều thách thức nhưng luôn giữ vững tôn chỉ ""chất lượng, sự đổi mới, sáng tạo cùng năng lực tiên phong"" từ khi ra đời vào năm 1997. Trong suốt hơn 25 năm có mặt trên thị trường, thương hiệu thành công tiếp cận, lấy được lòng tin của người tiêu dùng bằng sự tận tâm và chiến lược khác biệt. Mọi sản phẩm, dịch vụ phát triển từ sự thấu hiểu Nắm bắt sức ảnh hưởng của cuộc cách mạng 4.0 đang tác động mạnh mẽ đến mọi mặt đời sống, Viễn thông FPT thể hiện sự nhanh nhạy của mình khi liên tục đổi mới, cung cấp đa dạng gói cước với băng thông rộng, nhằm đáp ứng nhu cầu ngày càng cao của người dùng. Từ khách hàng cá nhân, gia đình, đến doanh nghiệp đều có thể dễ dàng lựa chọn gói dịch vụ internet phù hợp với nhu cầu thực tế.     Không chỉ đa dạng gói dịch vụ theo nhu cầu cơ bản, FPT Telecom còn nắm bắt xu hướng viễn thông thế giới, góp phần định nghĩa dịch vụ internet cao cấp tại Việt Nam. Từ việc cung cấp gói cước LUX với nền tảng công nghệ mới Wi-Fi 6, lần đầu xuất hiện tại Việt Nam đảm bảo tốc độ cao, vùng phủ sóng rộng… cho những nhu cầu khắt khe của khách hàng. Vấn đề an toàn khi kết nối cũng được Viễn thông FPT đáp ứng cho khách hàng bằng việc tích hợp tính năng bảo mật F-Safe trong dịch vụ internet  Bên cạnh việc đáp ứng nhu cầu “kết nối” cơ bản thông qua dịch vụ cốt lõi internet, FPT Telecom còn nắm bắt nhanh nhạy nhu cầu giải trí của người dùng hiện nay. FPT Play là dịch vụ truyền hình được FPT Telecom liên tục đầu tư mạnh mẽ cả về công nghệ lẫn nội dung. Có trong tay nền tảng công nghệ tiên tiến bậc nhất là IPTV và OTT, FPT Play còn là một trong những đơn vị tiên phong sở hữu nhiều công nghệ tương tác và nội dung độc quyền, tạo ra hệ sinh thái nhiều tiện ích cho người dùng.  Với thế mạnh là đơn vị sở hữu bản quyền phát sóng, FPT Play đã liên tục giới thiệu đến khán giả Việt Nam hàng loạt các giải đấu lớn hàng đầu thế giới, thuộc nhiều bộ môn khác nhau như: UEFA, AFC, Bellator MMA, PGA Championship và Turkish Airlines Euro League… Không chỉ trong mảng thể thao, FPT Play cũng dẫn đầu trong lĩnh vực phim truyền hình cung cấp hàng trăm tựa phim phát song song từ Hàn Quốc, Trung Quốc, Thái Lan… Gần đây nhất, FPT Play cũng đã sở hữu được bản quyền V-League.     Đối với nhu cầu vấn đề về an ninh, an toàn trong cuộc sống cũng được FPT Telecom thấu hiểu và đầu tư phát triển các giải pháp ứng dụng công nghệ AI. Minh chứng là FPT Camera được FPT Telecom ứng dụng các công nghệ mới nhất về trí tuệ nhân tạo, giúp phân biệt giữa chuyển động của con người và của vật thể. FPT Telecom cũng là một trong những đơn vị tiên phong trên thị trường về giải pháp lưu trữ trên nền tảng điện toán đám mây.  \n    Dẫn dắt chuyển đổi số nâng cấp trải nghiệm chinh phục khách hàng Chuyển đổi số là trong lĩnh vực ngân hàng đang diễn ra một cách mạnh mẽ. Đây là cuộc đua gay cấn của các nhà băng để thu hút sự chú ý của khách hàng. Với vai trò là một trong những đơn vị tiên phong dẫn dắt chuyển đổi số của ngành, FPT Telecom luôn nỗ lực đi đầu trong việc tạo ra những trải nghiệm thú vị, tiện lợi cho người dùng. Tuy nhiên, FPT Telecom đã chọn một hướng đi riêng trong hành trình chuyển đổi số: đó là câu chuyện thấu hiểu người dùng dựa trên dữ liệu và sự tận tâm từ đó tạo ra hệ sinh thái sản phẩm của ngân hàng được xây dựng trên tiêu chí lấy “khách hàng là trọng tâm”.    Bên cạnh cung cấp các dịch vụ cốt lõi, hàng loạt các thiết bị, giải pháp đã được công ty ra mắt liên tục tạo ra hệ sinh thái thông minh, đa dạng giúp nâng tầm trải nghiệm của khách hàng. Từ giải pháp phòng họp trực tuyến OnMeeting, ví điện tử Foxpay, FPT Smart Home, hay mới nhất là Bộ giải mã FPT Play 2022 tích hợp cùng lúc 2 công nghệ IPTV và OTT… Đây là chiến lược của FPT Telecom nhằm mang đến “trải nghiệm khách hàng tuyệt vời”.     Không chỉ về sản phẩm, chất lượng dịch vụ cũng là “chìa khóa” giúp nhà Viễn thông FPT nâng cấp trải nghiệm, giữ chân được khách hàng. Đại diện FPT Telecom chia sẻ: “FPT Telecom xác định mọi điểm chạm với khách hàng phải tạo ra được cảm xúc, nhằm mang đến trải nghiệm tuyệt vời nhất. Chiến lược này đã được FPT Telecom kiên trì theo đuổi trong suốt những năm qua bằng việc liên tục đầu tư, ứng dụng công nghệ tạo ra các sản phẩm dịch vụ mới có giá trị gia tăng cao, đồng thời liên tục nâng cấp cải tiến các kênh thông tin hỗ trợ khách hàng tối ưu nhất”. Sau 25 năm, FPT Telecom trở thành một trong những doanh nghiệp viễn thông hàng đầu tại Việt Nam, không ngừng tạo ra những giá trị cho khách hàng và cộng đồng. Thành công có được của nhà Viễn thông FPT là kết quả của một doanh nghiệp dám dấn thân, thử nghiệm những thứ mới mẻ và kiên trì với giá trị cốt lõi dành cho khách hàng để tạo dựng được giá trị thương hiệu khác biệt.  "
/post-1518549.html,https://thanhnien.vn/giam-gia-van-chuyen-jt-express-giup-chu-shop-toi-uu-doanh-thu-mua-sale-cuoi-nam-post1518549.html,"Giảm giá vận chuyển, J&T Express giúp chủ shop tối ưu doanh thu mùa sale cuối năm",https://image.thanhnien.vn/1200x630/Uploaded/2022/aeymrexqam/2022_11_06/jt-express-1-2028.jpg,2022-11-07T08:00:55+0700,"Hưởng ứng mùa mua sắm cuối năm, nhiều đơn vị vận chuyển đón “làn sóng” này khi áp dụng giảm cước vận chuyển nhằm hỗ trợ chủ shop, người bán hàng tối ưu chi phí và tăng lợi nhuận.",Tài chính kinh doanh,Doanh nghiệp," Hưởng ứng mùa mua sắm cuối năm, nhiều đơn vị vận chuyển đón “làn sóng” này khi áp dụng giảm cước vận chuyển nhằm hỗ trợ chủ shop, người bán hàng tối ưu chi phí và tăng lợi nhuận. Theo các chuyên gia kinh tế, cuối năm là thời điểm người tiêu dùng có xu hướng chi tiêu mạnh tay, tạo ra mùa mua sắm bùng nổ. Hành vi này của người tiêu dùng tạo điều kiện giúp chủ shop, doanh nghiệp và nhà bán hàng tích cực đưa ra kế hoạch kinh doanh phù hợp nhằm tối đa doanh thu, tối ưu lợi nhuận. Đơn cử, hàng loạt sản phẩm điện tử, gia dụng, một số cửa hàng thời trang giảm nửa giá với ưu đãi miễn phí vận chuyển hay hệ thống siêu thị dự tính năm 2022 sẽ đạt tăng trưởng 20% so với cùng kỳ năm trước.     Nắm bắt được xu thế thị trường dịp cuối năm, nhiều đơn vị vận chuyển trong đó có J&T Express đang tích cực đồng hành hiệu quả với tất cả các khách hàng trong hoạt động kinh doanh sắp tới. Cụ thể với J&T Express, đơn vị vận chuyển này đã điều chỉnh bảng giá vận chuyển toàn quốc, giảm lên đến 20% cước vận chuyển.     Giá cước gửi hàng qua J&T Express áp dụng tại tất cả các tỉnh thành, khu vực trên toàn quốc áp dụng cho 3 dịch vụ: Chuyển phát tiêu chuẩn - J&T Express, Dịch vụ Nhanh - J&T Fast và Siêu dịch vụ - J&T Super. Đây được xem là động thái tích cực của đơn vị này nhằm hỗ trợ và san sẻ gánh nặng chi phí cho người bán hàng nói chung đồng thời góp phần giúp hành trình mua sắm của người dùng thêm tiết kiệm và hiệu quả.  Theo báo cáo Allied Market Research, thị trường dịch vụ chuyển phát nhanh Việt Nam đạt giá trị 0,71 tỉ USD vào năm 2021 và ước tính sẽ tăng lên mức 4,88 tỉ USD vào năm 2030, đạt tốc độ tăng trưởng kép hằng năm (CAGR) là 24,1% trong giai đoạn 2022 - 2030. Phân khúc B2B được dự báo sẽ đạt CAGR cao nhất, khoảng gần 25,4% trong giai đoạn 2022 - 2030. Có thể nói, phân khúc B2B đang dần được đầu tư lâu dài từ các đơn vị dịch vụ chuyển phát. Đầu tư vào phân khúc này chính là tập trung vào chủ shop, hộ kinh doanh, người bán hàng online được coi là một trong số chiến lược “đường dài” nhằm nâng cao năng lực vận chuyển, gia tăng khả năng cạnh tranh đồng thời thúc đẩy sự tăng trưởng của ngành dịch vụ chuyển phát nhanh Việt Nam.   \n    Chủ động giảm giá thành vận chuyển mùa sale cuối năm cũng nằm trong số kế hoạch kinh doanh coi “khách hàng là trung tâm”, hướng đến lợi ích người bán, chủ shop được J&T Express hoạch định sẵn. Ngoài ra, đơn vị còn tập trung vào việc cung cấp các loại hình dịch vụ tiêu chuẩn đến chuyên biệt; đầu tư cơ sở vật chất kho bãi để nâng cao khả năng phân loại tự động hàng hóa - bưu kiện; theo dõi bưu kiện trực tuyến; ứng dụng di động, email cảnh báo;…     Với mỗi kế hoạch trên, J&T Express đều đưa ra từng hoạt động thiết thực với mục tiêu cốt lõi hướng đến khách hàng và nâng cao trải nghiệm người dùng. Đơn cử, đơn vị duy trì và không ngừng cải tiến bộ 5 loại hình dịch vụ áp dụng cho từng nhu cầu của khách hàng: chuyển phát tiêu chuẩn J&T Express; dịch vụ nhanh J&T Fast; siêu dịch vụ giao hàng J&T Super; tuyến vận chuyển quốc tế J&T International và dịch vụ tươi sống J&T Fresh. Ngoài ra, J&T còn đầu tư trung tâm trung chuyển hàng hóa được đánh giá là lớn bậc nhất Việt Nam, áp dụng công nghệ phân loại tự động theo quy chuẩn Smart Logistics (hậu cần thông minh). Mới đây, nhằm tối ưu quá trình theo dõi hàng hóa và thanh toán đơn hàng qua ứng dụng di động, doanh nghiệp này còn đi vào hoạt động bộ đôi dịch vụ theo dõi đơn hàng qua Zalo ZNS và tính năng thanh toán bằng mã QR động.  Trên thực tế, hạ tầng cơ sở vật chất đảm bảo, ứng dụng công nghệ thông tin hiệu quả sẽ giúp giảm thiểu chi phí dịch vụ chuyển phát nói chung tại Việt Nam. Những hoạt động thiết thực nói trên của J&T Express sẽ góp phần tối ưu giá trị vận chuyển, từ đó nhà bán hàng và người dùng sẽ hưởng ưu đãi và trải nghiệm tốt nhất.  Cũng theo báo cáo của Allied Market Research, J&T Express nằm trong số các doanh nghiệp hàng đầu trong lĩnh vực chuyển phát nhanh tại Việt Nam. Để tiếp tục giữ vững vị thế này, trong tương lai doanh nghiệp sẽ tiếp tục tạo ra những giá trị thực cho chủ shop, người bán hàng và người dùng bằng việc triển khai các chương trình khuyến mãi, ưu đãi giá gửi hàng, cước phí,... đồng thời nỗ lực cải tiến công nghệ, đưa vào vận hành các tính năng/dịch vụ mới để người dùng có một hành trình mua sắm tiết kiệm, thông minh và hiệu quả.  "
/post-1518290.html,https://thanhnien.vn/tung-bung-khai-truong-pnj-new-center-hai-thang-tu-nha-trang-post1518290.html,Tưng bừng khai trương PNJ New Center Hai Tháng Tư - Nha Trang,https://image.thanhnien.vn/1200x630/Uploaded/2022/otpfeclyrbn/2022_11_05/h1-8560.jpg,2022-11-05T18:30:24+0700,"Sáng 5.11, PNJ New Center Hai Tháng Tư đã chính thức khai trương, trở thành trung tâm mua sắm trang sức mới tại địa chỉ 443-445 đường Hai Tháng Tư, P.Vĩnh Hải, TP.Nha Trang, Khánh Hòa.",Tài chính kinh doanh,Doanh nghiệp," Sáng 5.11, PNJ New Center Hai Tháng Tư đã chính thức khai trương, trở thành trung tâm mua sắm trang sức mới tại địa chỉ 443-445 đường Hai Tháng Tư, P.Vĩnh Hải, TP.Nha Trang, Khánh Hòa.    Lễ khai trương cửa hàng PNJ New Center Hai Tháng Tư  ảnh: Hải Thanh Đây là cửa hàng Center thứ 2 tại TP.Nha Trang, mở ra không gian mua sắm sang trọng và đẳng cấp, hứa hẹn sẽ đem đến cho quý khách hàng những trải nghiệm trang sức tốt nhất.  Nhân dịp khai trương, PNJ trao tặng “Mái ấm niềm tin"" trị giá 50 triệu đồng cho các hộ gia đình khó khăn tại địa phương thông qua Hội LHPN tỉnh Khánh Hòa. Đây là hoạt động thường niên của PNJ kết hợp cùng các cơ quan đoàn thể, tổ chức, hiệp hội tại địa phương nhằm san sẻ niềm vui cuộc sống đến cho mọi nhà. Nhân dịp khai trương, PNJ Center Hai Tháng Tư gửi tặng đến quý khách hàng ưu đãi lên đến 15% khi mua sắm trang sức vàng, bạc từ ngày 5 - 13.11.2022; ưu đãi hấp dẫn lên đến 7% cho các dòng hàng trang sức ECZ, CZ, trang sức Ý, trang sức kim cương, trang sức Vỏ. Ngoài ra, khách hàng có cơ hội nhận ngay những món quà hấp dẫn: nhẫn khoen nửa chỉ PNJ, bộ mỹ phẩm cao cấp, bình giữ nhiệt, nón bảo hiểm… khi mua sắm với hóa đơn giá trị từ 15 triệu đồng trở lên. Đặc biệt, trong 3 ngày đầu khai trương, quý khách hàng có cơ hội trải nghiệm đặc quyền VIP với ưu đãi lên đến 4% khi mua sắm dòng hàng kim cương rời.         \n       Khách hàng tham quan, mua sắm PNJ New Center Hai Tháng Tư Tại lễ khai trương, khách hàng Nguyễn Thị Nữ (ngụ tại TP.Nha Trang) đã may mắn bốc thăm trúng thưởng phần quà là 1 cài áo mạ vàng PNJ Art dành cho khách hàng may mắn nhất trong ngày khai trương.    Ông Trần Thiệu Nhã (ảnh trái), Giám đốc PNJ - Chi Nhánh Tây nguyên - Nam Trung bộ, trao tặng “Mái ấm niềm tin"" trị giá 50 triệu đồng cho đại diện Hội LHPH tỉnh Khánh Hòa  ảnh: Hải Thanh Cửa hàng PNJ New Center Hai Tháng Tư Địa chỉ: 443-445 Hai Tháng Tư, P.Vĩnh Hải, TP.Nha Trang, Khánh Hòa  Hotline: 0258.3.89.88.99 - 3.73.73.79  Website: www.pnj.com.vn "
/post-1517972.html,https://thanhnien.vn/farmers-market-dan-khang-dinh-vi-the-trong-nganh-phan-phoi-thuc-pham-sach-post1517972.html,Farmers Market dần khẳng định vị thế trong ngành phân phối thực phẩm sạch ,https://image.thanhnien.vn/1200x630/Uploaded/2022/pwvosgyk/2022_11_04/image1-4104.jpeg,2022-11-05T08:00:49+0700,"Với hơn 5 năm hoạt động trong ngành cung ứng thực phẩm sạch, chuỗi siêu thị Farmers Market luôn là cái tên tiên phong trong ngành. Hướng đến xây dựng một cộng đồng ""sống lành mạnh"", với phương châm hoạt động “Healthy food - Healthy you”, Farmers Market đã gây dựng thành công cho mình một chỗ đứng vững chắc.",Tài chính kinh doanh,Doanh nghiệp," Với hơn 5 năm hoạt động trong ngành cung ứng thực phẩm sạch, chuỗi siêu thị Farmers Market luôn là cái tên tiên phong trong ngành. Hướng đến xây dựng một cộng đồng ""sống lành mạnh"", với phương châm hoạt động “Healthy food - Healthy you”, Farmers Market đã gây dựng thành công cho mình một chỗ đứng vững chắc. Hơn 5 năm kinh nghiệm trong lĩnh vực thực phẩm sạch  Các sản phẩm từ Farmers Market được chọn lựa kỹ càng từ các nhà sản xuất uy tín, chất lượng, an toàn cho sức khỏe người tiêu dùng trong và ngoài nước.    Farmers Market là thương hiệu thực phẩm sạch được người dùng ưa chuộng Hiện tại, Farmers Market đã đưa vào hoạt động 10 chi nhánh lớn nhỏ (bao gồm 5 Darkstore và 5 cửa hàng bán lẻ) trải đều tại những khu vực sầm uất của TP.HCM như Q.3, Q.7, Q.Bình Thạnh, Q.Phú Nhuận thu hút hơn 70.000 lượt khách/tháng.  Sẽ có thêm 18 cửa hàng mới trong năm 2023 Không dừng lại ở việc đảm bảo chất lượng, Farmers Market cũng không ngừng hoàn thiện dịch vụ bán hàng để mang đến trải nghiệm mua sắm hoàn hảo nhất cho khách hàng. Đặt mục tiêu tiếp cận khách hàng trên toàn quốc, Farmers Market từng bước mở rộng phạm vi hoạt động. Tháng 9 vừa qua, cửa hàng Farmers Market thứ 5 đã chính thức khai trương tại Hai Bà Trưng, Q.1 với quy mô hơn 500 m2, bày bán hơn 5.000 sản phẩm sạch - tốt cho sức khỏe. Đây cũng là “phát súng” đầu tiên cho chiến dịch mở rộng hệ thống. Trong năm 2023, Ban giám đốc Farmers Market dự kiến sẽ có thêm 18 chi nhánh Farmers Market đi vào hoạt động, cung cấp thực phẩm sạch cho khách hàng rộng khắp TP.HCM.  \n       Farmers Market theo mô hình mới sẽ tích hợp nhiều mặt hàng mới lạ Bên cạnh đó, trong thời đại số, Farmers Market cũng chú trọng phát triển cả các gian hàng trực tuyến trên các sàn thương mại điện tử lớn như Lazada, Tiki và ứng dụng công nghệ hàng đầu hiện nay như Grab, ShopeeFood và Baemin.  Mua thực phẩm sạch tại Farmers Market:  Cửa hàng Farmers Market 1 Địa chỉ: 496 Nguyễn Thị Minh Khai, P.2, Q.3 Điện thoại: 0931858198 Cửa hàng Farmers Market 2 Địa chỉ: 218 Phan Xích Long, P.2, Q.Phú Nhuận Điện thoại: 0941062332 Cửa hàng Farmers Market 3 Địa chỉ: 486 Nguyễn Thị Thập, P.Tân Quy, Q.7 Điện thoại: 0906988805 Cửa hàng Farmers Market 4 Địa chỉ: 99 Hoàng Hoa Thám, P.5, Q.Bình Thạnh Điện thoại: 0911543232 Mua sắm trực tuyến:  Website: https://farmersmarket.vn/collections/qua-tang-valentine Facebook: https://www.facebook.com/farmersmarket.vn "
