id,link,title,thumbnail,time,summary,category,sub_category,full_article
20200721112858089,https://tuoitre.vn/ben-trong-don-rach-cat-phao-dai-lon-nhat-dong-duong-20200721112858089.htm,Bên trong Đồn Rạch Cát - pháo đài lớn nhất Đông Dương,https://cdn1.tuoitre.vn/zoom/600_315/2020/7/24/fb-1595537156258396602885-crop-15955372027651329476522.jpg,,,Văn hóa,Đời sống,
20200709105018715,https://tuoitre.vn/ao-dai-dieu-pho-tri-an-chua-nguyen-phuc-khoat-20200709105018715.htm,Áo dài diễu phố tri ân chúa Nguyễn Phúc Khoát,https://cdn1.tuoitre.vn/zoom/600_315/2020/7/9/img3943-1594265810453118453781-crop-15942664817991422191236.jpg,09/07/2020 11:12 GMT+7,"TTO - Lần đầu tiên tỉnh Thừa Thiên Huế tổ chức lễ diễu hành áo dài, dâng hoa để tri ân chúa Nguyễn Phúc Khoát - người có công khai sinh ra áo dài Việt Nam",Văn hóa,Đời sống,"Sáng 9-7, tại khu vực lăng Trường Thái (làng La Khê, xã Hương Thọ, thị xã Hương Trà, Thừa Thiên Huế). Khu vực lăng mộ của chúa Nguyễn Phúc Khoát nằm trên một đồi keo tràm.  Buổi lễ bắt đầu từ rất sớm theo nghi lễ truyền thống với đội lễ nhạc trang trọng. Ông Phan Ngọc Thọ - chủ tịch UBND tỉnh Thừa Thiên Huế - đại diện dâng hương lên chúa Nguyễn Phúc Khoát để tưởng nhớ, tri ân người khai sinh ra áo dài Việt Nam.  Sau khi dâng hương tại lăng chúa, mọi người tiếp tục di chuyển về khu vực Đại Nội ở Kinh thành Huế để tham dự lễ diễu hành, dâng hoa tri ân chúa Nguyễn Phúc Khoát tại Triệu Tổ miếu.  Hơn 300 người gồm đội nghi thức đến từ Nhà hát Nghệ thuật cung đình Huế, người mẫu mang trên mình những bộ áo dài truyền thống đã tham dự lễ diễu hành.  Đoàn rước đi dọc đường 23/8, ngang Ngọ Môn rồi tiến về cửa Hiển Nhơn đi vào khu vực Triệu Tổ miếu. Trong tiếng lễ nhạc cung đình trang trọng, đoàn áo dài đã thu hút rất đông sự tò mò, thích thú của du khách trong và ngoài nước đang tham quan Đại nội Huế.  Sau khi đến vào khu vực Triệu Tổ miếu, đại diện lãnh đạo tỉnh Thừa Thiên Huế, các nhà thiết kế áo dài đã dâng hoa và dâng hương trên khu vực bàn thờ chúa Nguyễn Phúc Khoát đặt trong miếu.Ông Nguyễn Phước Bửu Tổ (71 tuổi, trưởng Phủ Tùng Thiện Vương, con cháu của chúa Nguyễn Phúc Khoát), cho biết ông rất vui khi chính quyền Thừa Thiên Huế tổ chức lễ tri ân này.  ""Ngay trong nội bộ con cháu thuộc Phủ chúng tôi cũng đã phát động phong trào mang áo dài tại mỗi buổi húy kỵ nhằm tri ân tiền nhân cũng như đưa áo dài vào đời  sống thường xuyên hơn"" - ông Tổ nói.Một số hình ảnh tại buổi diễu hành áo dài vào sáng 9-7:"
20200708184202509,https://tuoitre.vn/gan-200-pham-nhan-nuoc-ngoai-thu-an-ra-sao-trong-trai-z30d-20200708184202509.htm,Gần 200 phạm nhân nước ngoài thụ án ra sao trong trại Z30D?,https://cdn1.tuoitre.vn/zoom/600_315/2019/6/14/pham-nhan-1560479015280516214389-15604791549341442998402-156047933299723467685-crop-15942084272091210883308.png,08/07/2020 19:41 GMT+7,"TTO - Trại giam Thủ Đức (Z30D) là địa điểm giáo dục, giúp đỡ những phạm nhân nước ngoài sửa chữa sai lầm, tu dưỡng bản thân chuẩn bị cho ngày tái hòa nhập cộng đồng, trở về nước.",Văn hóa,Đời sống,"Thực hiện nghiêm túc các quy định của pháp luật Việt Nam cũng như quốc tế về việc tôn trọng các quyền con người, đảm bảo tính nhân đạo xã hội chủ nghĩa trong công tác giam giữ, cải tạo, ban giám thị trại giam Thủ Đức (Z30D) đã biến nơi đây trở thành địa điểm giáo dục, giúp đỡ những phạm nhân nước ngoài sửa chữa sai lầm, tu dưỡng bản thân chuẩn bị cho ngày tái hòa nhập cộng đồng, trở về nước. Thực tế tại đây đã góp phần thể hiện truyền thống tốt đẹp của dân tộc Việt Nam, sự tôn trọng những chuẩn mực quốc tế về quyền của con người mà Việt Nam đã ký kết, tham gia.Trại giam không chỉ là nơi giam giữ?Theo thượng tá Phạm Thị Minh Hải, phó giám thị trại giam Thủ Đức (Cục Cảnh sát quản lý trại giam, cơ sở giáo dục bắt buộc, Trường Giáo dưỡng - Bộ Công an), hiện trại đang quản lý, giam giữ gần 200 phạm nhân là người nước ngoài (gồm 21 quốc tịch), trong đó 8 phạm nhân không xác định quốc tịch. Các chế độ, chính sách đối với phạm nhân là người nước ngoài được thực hiện đúng quy định pháp luật như chế độ ăn, mặc, ở, sinh hoạt, chăm sóc y tế. Quy định về xếp loại thi đua chấp hành án phạt tù, giảm thời hạn chấp hành hình phạt, đặc xá… được thực hiện như đối với phạm nhân người Việt Nam. Các chế độ cho phạm nhân gặp thân nhân, tiếp xúc lãnh sự được đảm bảo đúng quy định.Các phạm nhân người nước ngoài được bố trí tập trung ở 2 khu tại phân trại số 1. Đó là những dãy nhà thoáng mát nằm giữa không gian rất nhiều cây xanh và các loại hoa. Phòng giam sạch sẽ, tràn ngập ánh sáng bởi rất nhiều cửa sổ và đều có trang bị tivi. Nơi ngủ của các phạm nhân được đảm bảo về diện tích và vệ sinh với đầy đủ các đồ dùng cá nhân thiết yếu.John Nguyễn, một nam phạm nhân quốc tịch Mỹ, cho biết anh đã ở trại được 19 năm. Nói chung cải tạo ở đây rất tốt, môi trường thân thiện. Cán bộ quan tâm giúp đỡ rất nhiệt tình. Trong thời gian tại trại, người chấp hành án được ăn uống điều độ, theo đúng quy định; ngày lễ, tết thì được ăn thêm đồ ăn. Ngoài ra, những người có tiền lưu ký thì được phép mua bán thêm. Trong thời gian ảnh hưởng của dịch COVID -19, những người không có điều kiện, gia đình chưa kịp gửi tiền lên thì được trại hỗ trợ. Gia đình đến thăm thấy tình hình thế nên yên tâm, khuyên phạm nhân tập trung cải tạo cho tốt để trở về.Gấp cuốn sách đang đọc dở, Nicholas Stars, nam phạm nhân 42 tuổi, người Nigeria, cho hay bản thân đã thụ án tại đây được 5 năm. Thời gian ở đây, anh được ăn uống tốt, sinh hoạt thoải mái. Cán bộ trại tử tế, tôn trọng. Lãnh sự thì 4 tháng đến thăm 1 lần, còn gia đình 1-2 năm qua thăm một lần. ""Nói chung là rất ổn. Tôi còn 10 năm nữa, nhưng sẽ cố gắng xong sớm hơn"", Nicholas Stars vui vẻ chia sẻ bằng tiếng Việt.Không chỉ được đảm bảo đầy đủ các quy định của pháp luật trong công tác quản lý, giam giữ, đảm bảo các tiêu chuẩn về nơi ăn nghỉ, quần áo, đồ dùng thiết yếu, chế độ chăm sóc y tế, gặp gỡ thân nhân… các phạm nhân nước ngoài tại trại giam Thủ Đức được hướng nghiệp, dạy nghề, dạy văn hóa, tham gia sinh hoạt văn nghệ và thể thao… chuẩn bị cho tái hòa nhập cộng đồng, trở thành người có ích cho gia đình và xã hội.Việc tham gia lao động sản xuất được tổ chức phù hợp với độ tuổi, thể chất, điều kiện của phạm nhân giúp họ hiểu hơn giá trị của lao động, trân trọng thành quả lao động của bản thân và của người khác. Lao động không chỉ giúp họ tu tâm, hướng thiện, mà còn xây dựng niềm tin vào cuộc sống sau khi mãn hạn.Nữ phạm nhân Li Chun Ying, người Trung Quốc, tâm sự ban đầu khi vào trại rất hoang mang, nhưng sau nhờ sự giải thích, khuyên bảo của cán bộ nên tâm lý dần ổn định, yên tâm cải tạo. Các phạm nhân nữ được đối xử tốt, đồ ăn uống, sinh hoạt, đồ dùng phụ nữ, nhu yếu phẩm được cấp đầy đủ. Phạm nhân còn được đi học tiếng Việt, tham gia chơi thể thao, hát karaoke và khi ốm được cán bộ y tế chăm sóc. ""Tôi nhiều lần đoạt giải nhất bóng bàn toàn trại. Không biết nói tiếng Việt nhiều, nhưng tôi thực sự rất cảm ơn ban giám thị, hội đồng cán bộ và cảm nhận được tình cảm của cán bộ như trong một gia đình"", Li Chun Ying xúc động cho biết.Khi nói về thời gian tại trại giam Thủ Đức, nữ phạm nhân người Thái Lan Preayamooch cho biết ở đây điều kiện sống rất tốt, hoàn toàn khác với những gì trước kia cô tưởng tượng về cuộc sống phạm nhân trong trại giam. Các cán bộ thân thiện, giúp đỡ, tạo điều kiện cho phạm nhân làm quen với cuộc sống trong trại để cải tạo và chấp hành bản án. Cô được hưởng chế độ như những phạm nhân Việt Nam khác và còn được nghỉ, ăn tiêu chuẩn cao hơn trong những ngày tết và Quốc khánh Thái Lan; không chỉ được khám bệnh định kỳ mà khi ốm bệnh thì được nghỉ lao động, được cán bộ y tế chăm sóc. Gia đình Preayamooch mỗi lần sang thăm cô đều vui và khuyên bảo cô yên tâm cải tạo, thực hiện đúng nội quy để sớm được trở về.Tiếng Việt và những bài học tình người?Xác định công tác giáo dục, cải tạo phạm nhân là nhiệm vụ trọng tâm, xuyên suốt và có vai trò quan trọng đặc biệt nhằm thay đổi nhận thức, thái độ, hành vi, lối sống của phạm nhân, giúp họ hiểu rõ tội lỗi, không tái phạm, ban giám thị trại giam Thủ Đức đã luôn quan tâm, đẩy mạnh công tác phổ biến kiến thức pháp luật, giáo dục công dân, dạy tiếng Việt cho phạm nhân là người nước ngoài.Học tiếng Việt không chỉ giúp các phạm nhân nước ngoài có một ngôn ngữ chung trong sinh hoạt, mà còn giúp họ hiểu rõ hơn nội quy, quy định của trại, các chính sách, pháp luật của Đảng, Nhà nước Việt Nam. Hiểu biết về các chính sách, chế độ, nội quy giúp họ an tâm cải tạo, chấp hành nội quy cơ sở giam giữ và được hưởng chính sách nhân đạo của Việt Nam như giảm thời hạn chấp hành án phạt tù, đặc xá trước thời hạn. Qua những bài học tiếng Việt, các phạm nhân người nước ngoài có thêm cơ hội tìm hiểu, làm quen với con người và nền văn hóa truyền thống tốt đẹp của dân tộc Việt Nam.Lớp trưởng lớp tiếng Việt của các phạm nhân nước ngoài tại trại giam Thủ Đức, anh Peng Kang Yu, người Đài Loan, cho biết phạm nhân của trại đến từ rất nhiều nơi như Campuchia, Nigeria, Thái Lan, Mỹ… nên học tiếng Việt giúp họ gần gũi và hiểu nhau hơn. Cố gắng học tiếng Việt cũng là để đọc được nhiều sách của thư viện, giúp con người sửa đổi tâm tính, cải tạo tốt hơn.Trong khi đó, nữ phạm nhân Thái Lan Preayamooch cho biết vốn Anh ngữ có được từ thời sinh viên đã giúp cô học tốt tiếng Việt, không những thế còn là trợ giảng đắc lực cho các thầy cô giáo trong giờ tiếng Việt.""Việc học tiếng Việt giúp hiểu được những gì cán bộ nói, thêm tin tưởng và ổn định tinh thần để chấp hành bản án. Những bài học chữ Việt có nội dung giáo dục con người, giúp thêm động lực phấn đấu, chấp hành tốt quy định, chuẩn bị tinh thần cho ngày trở về với xã hội. Xã hội giờ đã có nhiều thay đổi nên không thể nói trước, nhưng cũng có thể sau này trở về Thái Lan, tôi sẽ làm một công việc gì đó liên quan đến Việt Nam và tiếp tục sử dụng tiếng Việt"", Preayamooch vui vẻ nói về dự định sau này.Có ""thâm niên"" hơn 19 năm sống tại trại giam Thủ Đức và sử dụng thành thạo tiếng Việt, Mohd Hafiz Gomez Bin Abdullah, quốc tịch Malaysia, cho biết vốn là kẻ ""cứng đầu"", hồi mới vào trại phạm nhân cũng ngang bướng, phá phách, nhưng sau nhờ sự giúp đỡ, chia sẻ ân cần của cán bộ trại, người đàn ông này đã hiểu ra và quyết tâm thay đổi bản thân để làm lại cuộc đời, sớm trở về với gia đình. Học tiếng Việt giúp anh hiểu và yêu thích văn hóa Việt, con người Việt. Gomez đặc biệt ấn tượng với sự đoàn kết, nhân hậu, chia sẻ khó khăn của người Việt Nam và những đức tính ấy thể hiện rõ ngay cả trong cuộc sống ở trại, giữa các phạm nhân với nhau hay giữa cán bộ và phạm nhân.""Tình cảm và sự giúp đỡ của các cán bộ đã giúp phạm nhân thêm động lực để cải tạo thành người tốt. Bản thân tôi đã được giảm án 7 lần, nay chỉ còn 10 tháng nữa là được tự do. Mười tháng nữa sẽ nhanh lắm, bởi ngoài gia đình tôi ở Malaysia còn có một người con gái Việt Nam đang chờ đợi tôi"",  Gomez tươi cười chia sẻ một cách lưu loát bằng tiếng Việt.Trân trọng với những đối xử đầy tình người trong thời gian chấp hành bản án cũng là tâm lý chung của các phạm nhân nước ngoài tại trại giam Thủ Đức. Trước ngày trở về quê hương Úc, Kevin Willia De Santos viết: ""Tôi đã thi hành án tại Việt Nam được 4 năm 11 tháng. Trong thời gian ở đây, tôi được đối xử công bằng, thậm chí đôi khi tôi còn được đối xử tốt trên cả mong đợi.Những lần gia đình từ Úc đến thăm tôi đã được tạo điều kiện thuận lợi tối đa như được thăm thêm giờ. Tôi ghi nhận tất cả ở trong lòng, vì thế tôi luôn chấp hành tốt. Tôi xin được gửi lời cảm ơn ban giám thị, hội đồng cán bộ đã đối xử rất tử tế và tôn trọng tôi. Tôi luôn có cảm giác thoải mái và an toàn trong những ngày thi hành án ở đây. Tôi cũng cảm ơn ban giám thị đã tạo điều kiện cho tôi được tham gia lớp học tiếng Việt và cảm ơn các cán bộ giáo viên đã hướng dẫn tôi. Tôi được rời Việt Nam trong một trạng thái tinh thần, sức khỏe rất tốt"".Không chỉ với Kevin Willia De Santos, cuốn sổ cảm tưởng về những ngày sống tại trại giam Thủ Đức đã được rất nhiều phạm nhân nước ngoài ghi lại với những dòng chữ xúc động, thể hiện tấm lòng tri ân đối với sự giúp đỡ tận tình của các cán bộ nơi đây - những người đã giúp họ thấu hiểu tính nhân đạo, bao dung của con người và pháp luật Việt Nam đối với những người từng lầm đường, lạc lối.Thượng tá Phạm Thị Minh Hải cho rằng giống như các trại giam khác, cơ sở Thủ Đức dù còn nhiều khó khăn nhưng đã và đang nỗ lực hết sức để giúp các phạm nhân, trong đó có người nước ngoài phạm tội, nhìn ra lỗi lầm, ""tu tâm - hướng thiện"". Trại giam không phải làm nơi giam cầm, trừng phạt người phạm tội, mà là nơi giáo dục, cảm hóa, giúp họ tự tin, sửa chữa lỗi lầm và làm lại cuộc đời."
20200708152435364,https://tuoitre.vn/video-tat-de-bat-va-buc-tranh-ve-nhung-ap-luc-vo-hinh-thoi-hien-dai-20200708152435364.htm,Video ‘Tắt để Bật’ và bức tranh về những áp lực vô hình thời hiện đại,https://cdn1.tuoitre.vn/zoom/600_315/2020/7/8/cozy-15941962937401259406576-crop-15941963812081253201579.png,08/07/2020 16:00 GMT+7,"Khắc họa chân dung của một cô nàng thuộc thế hệ trẻ, video ‘Tắt để Bật’ của Cozy cho ta cái nhìn thấu đáo hơn về việc ‘Bật’ không ngừng để chu toàn mọi việc đã khiến người trẻ áp lực và mệt mỏi ra sao.",Văn hóa,Đời sống,"Ở giây phút tưởng như đã bị guồng quay cuộc sống nhấn chìm, cô gái đã tự ""Tắt"" hết những lo toan bộn bề thường nhật để thưởng thức một ly trà, tìm lại sự cân bằng và hài hòa trong tâm hồn để rồi sau đó lại tiếp tục ""Bật"" để tiến đến những mục tiêu xa hơn.Đưa ra đúng vấn đề mà thế hệ trẻ đang đối mặt cùng thông điệp mới lạ, có phần đi ngược lại suy nghĩ của số đông, video ""Tắt để Bật"" đã khiến nhiều người phải chú ý và suy ngẫm.Trong đó, cô nàng ""mắt biếc"" Trúc Anh chia sẻ: ""Đau đầu vì đứng giữa lựa chọn thay đổi hay ""một màu"", Trúc Anh quyết định ""Tắt"" hết những suy nghĩ, lắng lo ấy, dành chút thời gian thư giãn đầu óc, cân lại hài hòa, thông suốt mọi điều, rồi khi ""Bật"" lại, Trúc Anh vui vẻ tiếp nhận những ý kiến ấy và sống theo cách mà bản thân mình cảm thấy thoải mái nhất là được"".Giống như cô gái trong video, thế hệ trẻ hiện nay rõ ràng năng động hơn nhiều so với thế hệ của ông bà cha mẹ. không chỉ mang trên vai kì vọng của xã hội mà họ còn mang theo cả những tham vọng của bản thân.Những mục tiêu nối tiếp nhau khiến thế hệ trẻ phải giữ cho tâm trí và cơ thể mình luôn trong trạng thái ""Bật không ngừng"". Chỉ có cách đó, họ mới có thể an tâm rằng mình đang đến gần hơn với những mục tiêu đã đặt ra. Nhưng cũng chính vì điều này mà thế hệ trẻ trở thành thế hệ dễ bị mệt mỏi và mất cân bằng. Guồng quay cuộc sống được ""bật không ngừng"" khiến họ dễ bị stress vì chẳng còn thời gian để tĩnh tâm và suy ngẫm. Thậm chí, đôi lúc còn khiến những người trẻ mất đi sự nhiệt huyết và hứng khởi thuở ban đầu.Xét theo khía cạnh khoa học, cơ thể người không được lập trình để hoạt động liên tục. Giáo sư K.Anderson Ericsson của Đại học bang Florida đã thực hiện 1 nghiên cứu về tác động của việc nghỉ ngơi tới hiệu suất công việc đối với các nhạc sĩ, vận động viên, diễn viên... Nghiên cứu trên đã cho thấy rằng cường độ hoạt động càng cao đồng nghĩa với việc bạn cần nhiều thời gian hơn để nghỉ ngơi và ""hồi sức"".Hot mom Trang Lou tâm đắc: ""Nỗ lực là chuyện cả đời, cố gắng là chuyện cả ngày lẫn đêm, việc phải làm vẫn cứ dài lê thê. Bởi vậy, thỉnh thoảng mình cũng nên tạm ""Tắt"" bản thân một xíu, ung dung thưởng thức tách trà, cân lại hài hoà rồi tiếp tục ""Bật"" lại để hoàn tất núi việc, hoài bão hay đơn giản là chăm sóc gia đình Xoài của mình"".Thật vậy, đôi lúc chỉ cần tạm ""Tắt"" những bộn bề, lo âu và dành cho bản thân vài phút cân lại hài hòa bên tách trà, bạn đã có thể lánh mình khỏi tác động của stress cùng những cảm xúc tiêu cực. Để rồi sau đó, chúng ta lại tiếp tục ""Bật"" để tiến đến những mục tiêu xa hơn, như cô nàng trong video ""Tắt để Bật"" của Cozy vậy."
20200706113617711,https://tuoitre.vn/nhu-chua-he-co-cuoc-chia-ly-duoc-tiep-suc-ha-anh-tuan-ung-ho-3-ti-dong-20200706113617711.htm,Như chưa hề có cuộc chia ly được tiếp sức: Hà Anh Tuấn ủng hộ 3 tỉ đồng,https://cdn1.tuoitre.vn/zoom/600_315/2020/7/6/nhu-chua-he-co-cuoc-chia-ly-8-1594009496583155840455-crop-15940097844741170642651.jpg,06/07/2020 11:47 GMT+7,"TTO - Sau thông tin chương trình Như chưa hề có cuộc chia ly chia ly khán giả truyền hình (Tuổi Trẻ ngày 1-7), nhiều người đã chung tay đóng góp để chương trình ý nghĩa này tiếp tục hoạt động.",Văn hóa,Đời sống,"Mới đây, chương trình Như chưa hề có cuộc chia ly đã  thông tin: ca sĩ Hà Anh  Tuấn, Công ty Viet Vision cùng một đối tác (xin giấu tên) đã quyết định ủng hộ  cho chương trình 3 tỉ đồng để chương trình có thể tiếp  tục hoạt động nhân đạo này. Với số  tiền này, Như chưa hề có cuộc chia ly đã có thể đảm bảo cho những cuộc tìm kiếm  không dừng lại, ít nhất trong vòng nửa năm đến một năm tới.Nhà báo Thu Uyên đã gửi lời cảm ơn đến Hà Anh Tuấn, Viet Vision... và chia  sẻ: ""Tôi rất xúc động khi ca sĩ Hà Anh Tuấn liên lạc với tôi ngay khi nghe tin  từ báo chí, và bày tỏ nguyện vọng tiếp thêm nguồn lực để Như chưa hề có cuộc  chia ly phải sống. Chúng ta không để các hồ sơ tìm kiếm bị tạm ngưng trong một  năm trước mắt"".Ca sĩ Hà Anh Tuấn chia sẻ cảm xúc với đại diện của nhà sản xuất Như chưa hề  có cuộc chia ly  rằng: ""Tuấn là một người hâm mộ Như chưa hề có cuộc chia ly từ  số đầu tiên cách đây 13 năm. Đối với Tuấn, Như chưa hề có cuộc chia ly không  phải là ""show"", mà là một câu chuyện văn hóa đại diện cho bản sắc hướng thiện  của người Việt Nam. Tất cả những cuộc đoàn tụ mà đội ngũ những con người nhân ái  của Như chưa hề có cuộc chia ly tạo nên trong suốt 134 số vừa qua là cái kết có hậu cho biết bao  nhiêu số phận buồn của đồng bào, mà phần lớn do chiến tranh gây ra. Vì thế,  những xúc cảm được tạo ra từ chương trình không đơn thuần là sự rung động, mà đã  trở thành nguồn cảm hứng sống biết ơn, đóng góp và yêu nước. Cá nhân Tuấn và  Viet Vision không đến với Như chưa hề có cuộc chia ly với tư cách một nhà tài  trợ hay một nhà đầu tư, mà đơn giản là một người muốn góp một ít sức cho cả một  hành trình nhân văn. Đó là việc cần làm nên chúng tôi làm ngay khi mình còn có  thể"".""Chúng tôi muốn hành động thiết thực, cụ thể của mình sẽ truyền cảm hứng  cho những thế hệ đồng trang lứa và trẻ hơn, tùy theo sức, tùy theo khả năng để có  thể yểm trợ chương trình theo nhiều cách khác nhau. Cao hơn hết, Tuấn hi vọng  tất cả những hồ sơ tìm kiếm dở dang sẽ được hoàn thành nhiệm vụ, xóa tan tất cả  những chia ly đau buồn của đồng bào mình.""Đại diện của ca sĩ Hà Anh Tuấn cũng đã xác nhận với Tuổi Trẻ Online thông tin này."
