id,link,title,thumbnail,time,summary,category,sub_category,full_article
2022102223533093,https://tuoitre.vn/cuoc-trien-lam-ky-la-o-tp-hcm-toan-la-la-la-2022102223533093.htm,Cuộc triển lãm 'kỳ lạ' ở TP.HCM: Toàn lá là lá,https://cdn1.tuoitre.vn/zoom/600_315/2022/10/22/kieng-la-7-16664573953561115460384-crop-16664577580421937301571.jpg,23/10/2022 01:02 GMT+7,"TTO - Sự kiện Mê lá - Vietnam Exotic Plants Festival 2022 đang diễn ra tại Nhà thi đấu Hồ Xuân Hương, quận 3, TP.HCM trong hai ngày 22 và 23-10, thu hút hàng ngàn người yêu cây kiểng đến tham dự.",Văn hóa,Đời sống,"Công chúng có dịp thưởng lãm vô số loại kiểng lá và cây cảnh đủ mọi chủng loại, kích thước đến từ các nhà vườn trên toàn quốc.Đó là những loại cây từ bé nhất như rêu xanh trồng trong hộp kính đến bonsai, xương rồng, sen đá, nắp ấm, các loại kiểng lá ngoại nhập độc đáo khổng lồ...Người tham dự có dịp chụp ảnh check-in trong không gian xanh mát giữa lòng thành phố; tham gia các workshop giao lưu kiến thức chăm sóc kiểng lá, các cuộc thi thú vị…Sự kiện được tổ chức bởi chính các cộng đồng chơi kiểng lá, các diễn đàn yêu kiểng lá trên mạng xã hội và đông đảo nhà vườn cả trong nước lẫn quốc tế cùng tham dự nhằm mang đến cơ hội giao lưu, kết nối cộng đồng và lan tỏa tình yêu cây lá đến đông đảo mọi người, đặc biệt là các bạn trẻ.Một số hình ảnh tại sự kiện ""Mê lá"":"
20221019140701926,https://tuoitre.vn/thuong-thuc-van-chuong-cua-nguyen-du-cao-ba-quat-phan-chau-trinh-qua-6-tac-pham-thu-phap-20221019140701926.htm,"Thưởng thức văn chương Nguyễn Du, Cao Bá Quát, Phan Châu Trinh... qua tác phẩm của 6 thư pháp gia",https://cdn1.tuoitre.vn/zoom/600_315/2022/10/19/202210191350img2404-1666162400730807697644-crop-1666162488611966581641.jpg,19/10/2022 15:10 GMT+7,TTO - Triển lãm thư pháp chữ Hán mang tên 'Pháp cổ khai kim' của nhóm sáu nhà thư pháp tại TP.HCM vừa khai mạc sáng 19-10 tại Hội Mỹ thuật TP.HCM như một dịp trình hiện các tác phẩm văn chương trong hình thức thư họa.,Văn hóa,Đời sống,"Đến với triển lãm, công chúng sẽ được thưởng thức các tác phẩm thuộc dòng văn học chữ Hán chủ yếu là danh tác của cả Trung Quốc và Việt Nam, được thể hiện bằng các tay bút tài hoa mang dấu ấn riêng: Trương Lộ, Chu Ứng Xương, Trần Tiên Minh, Huỳnh Tuần Bá, Ô Dân Phát, Trịnh Huy.Đó là bức đại tự bốn chữ ""Phụng vũ long dược"" (phượng múa rồng bay) được thư pháp gia Trương Lộ thể hiện bằng thể giáp cốt văn tạo hình trong thư có họa. Hay như Huỳnh Tuần Bá thể hiện bài từ Vĩnh ngộ lạc, Bành Thành dạ túc Yến Tử lâu mộng Miến Miến của Tô Đông Pha theo thể hành khải rất độc đáo; hoặc bài từ Thủy điệu ca đầu của Tô Đông Pha được Huỳnh Tuần Bá thể hiện bằng khải thư kèm minh họa bức tranh thủy mặc.  Nhiều danh tác của Việt Nam cùng ""hội tụ"" tại đây như: Mộng đắc thái liên, Ký hữu của Nguyễn Du, Xuất tái của Cao Bá Quát, Vịnh Côn Lôn đảo của Phan Châu Trinh, Hạ cảnh của Trần Nhân Tôn, Du Côn Sơn của Nguyễn Phi Khanh, Đồng Mai xuyên tự thoại cảm tác của Tùng Thiện Vương, Thí phó tự vịnh của Nguyễn Công Trứ, Ký hữu của Nguyễn Du, Đăng Bảo Đài sơn của Trần Nhân Tông, Phong lan hoa của Phan Bội Châu...Bên cạnh đó là các danh tác của Trung Quốc như Tương Tiến Tửu của Lý Bạch, Dữ Tống Nguyên tư thư của Ngô Quân, Niệm Nô kiều tử - Xích Bích hoài cổ của Tô Thức, Lậu thất minh của Lưu Vũ Tích, Lâm Giang Tiên của Dương Thận... Có thể nói, 105 bức thư pháp trong triển lãm đủ để mang lại cái nhìn toàn diện về bút pháp, các thể chữ và cả nội dung văn thơ được thể hiện. Đây là một dịp tốt để các bạn học sinh sinh viên, những người yêu thích văn chương có thể trực tiếp chiêm ngưỡng các tác phẩm văn học chữ Hán được ""nối dài"" đời sống bằng hình thức thư họa - một hoạt động nghệ thuật công phu đồng thời là thú chơi tao nhã của các trí thức từ xưa.  Dịp này, nhóm tác giả cũng phát hành tập kỷ yếu Pháp cổ khai kim, tập hợp hình ảnh các tác phẩm trưng bày như một vựng tập để người hâm mộ lưu giữ làm kỷ niệm.  Triển lãm mở cửa đến ngày 25-10.  Một số tác phẩm thư pháp đang được triển lãm:"
20221018130216561,https://tuoitre.vn/ngam-tp-hcm-tu-tren-cao-bang-truc-thang-tham-hiem-son-doong-vao-top-50-tour-du-lich-doc-dao-20221018130216561.htm,"Ngắm TP.HCM từ trên cao bằng trực thăng, thám hiểm Sơn Đoòng vào top 50 tour du lịch độc đáo",https://cdn.tuoitre.vn/zoom/600_315/2022/10/18/4-tour-son-doong-1-1666073363157756691291-crop-1666073654759264052741.jpg,18/10/2022 13:54 GMT+7,"TTO - 20 tour du lịch đầu tiên trong top 50 tour du lịch độc đáo vừa được công bố. TP.HCM có nhiều tour lọt vào danh sách như: tour ""Ký ức biệt động Sài Gòn"" lần theo dấu chân lịch sử, tour trực thăng ""Ngắm TP.HCM từ trên cao""...",Văn hóa,Đời sống,"Tổ chức Kỷ lục Việt Nam (VietKings) và Trung tâm Top Việt Nam đã triển khai hành trình tìm kiếm ""Top 50 tour du lịch độc đáo mang lại trải nghiệm thú vị tại Việt Nam"" lần 1 năm 2022. Ngoài các tour khám phá thiên nhiên gắn liền với các danh thắng nổi tiếng, có nhiều tour được các đơn vị du lịch, lữ hành xây dựng lịch trình tour tìm hiểu các giá trị văn hóa, lịch sử, ẩm thực đặc sắc...TP.HCM có nhiều tour lọt vào top 50 tour đặc sắc này gồm: tour ""Ký ức biệt động Sài Gòn"" lần theo dấu chân lịch sử, tour trực thăng ""Ngắm TP.HCM từ trên cao"", tour trải nghiệm dạo Sài Gòn bằng xe máy và khám phá ẩm thực đêm, tour địa đạo Củ Chi.Danh sách 20 tour đầu tiên được công bố gồm:1. Tour ""Về nhà"" - tái thả động vật hoang dã về rừng (Ninh Bình).2. Tour xem rùa đẻ trứng tại hòn Bảy Cạnh (Bà Rịa - Vũng Tàu) chứng kiến thời khắc thiêng liêng của ""sứ giả đại dương"".3. Tour ""Ký ức biệt động Sài Gòn"" (TP.HCM) lần theo dấu chân lịch sử.4. Tour thám hiểm Sơn Đoòng (Quảng Bình) - tận mắt chiêm ngưỡng kỳ quan hang động tuyệt mỹ của thế giới.5. Tour du lịch sinh thái cộng đồng đất mũi Cà Mau - khám phá vùng ""đất biết nở, rừng biết đi và biển sinh sôi"".6. Tour du lịch tâm linh Côn Đảo viếng mộ chị Võ Thị Sáu - Nữ anh hùng huyền thoại vùng đất đỏ.7. Tour đêm ""Giải mã Hoàng thành Thăng Long"" (Hà Nội).8. Tour trực thăng ""Ngắm TP.HCM từ trên cao"".9. Tour xem thú đêm tại Vườn quốc gia Nam Cát Tiên (Đồng Nai) - ngắm nhìn đời sống sinh hoạt tự nhiên của động vật hoang dã.10. Tour du lịch hỗ trợ cộng đồng: khám phá bản làng người Rục (Quảng Bình) - tìm hiểu một trong 10 tộc người bí ẩn nhất thế giới.11. Du hành vào không gian với tour khám phá vũ trụ ""độc nhất vô nhị"" tại Việt Nam (Bình Định).12. Tour ""Làng Vũ Đại ngày ấy"" (Hà Nam) khi du lịch gắn liền với văn học.13. Trải nghiệm ""bay"" trên mặt nước siêu ấn tượng với flyboard ở Nha Trang (Khánh Hòa).14. Khám phá lòng đại dương với tàu ngầm kính đầu tiên tại Việt Nam (Khánh Hòa).15. Tour ""Đi tìm hoàng cung đã mất"" qua thực tế ảo tại Đại nội Huế (Thừa Thiên Huế).16. Tour săn mây đỉnh Mẫu Sơn (Lạng Sơn) - lên Mẫu Sơn ngắm mây vờn trước mắt.17. Tour ""Con đường di sản miền Trung"" (Thanh Hóa - Quảng Bình - Huế - Quảng Nam) in dấu chân dọc miền di sản.18. Bộ hành và khám phá kiến trúc pháp trong lòng Hà Nội.19. Trải nghiệm dạo Sài Gòn bằng xe máy và khám phá ẩm thực đêm (TP.HCM).20. Tour địa đạo Củ Chi (TP.HCM) - khám phá ""kỳ quan"" nghệ thuật quân sự xứ đất thép thành đồng."
20221014170458243,https://tuoitre.vn/hoa-si-xu-than-kinh-ve-tranh-nhu-nham-thach-20221014170458243.htm,Họa sĩ 'xứ thần kinh' vẽ tranh như 'nham thạch',https://cdn1.tuoitre.vn/zoom/600_315/2022/10/14/02c0028f834944171d582-1665749256446638674258-crop-16657501175872035635663.jpg,14/10/2022 22:03 GMT+7,"TTO - Có gì đó khó tả ở ngôn ngữ nghệ thuật của những họa sĩ đất Huế. Sinh ra giữa vùng đất yên bình, nên thơ nhưng tranh của họ lại ngồn ngộn những nỗi đau bị chèn nén.",Văn hóa,Đời sống,"Họa sĩ Trần Hữu Nhật gọi đó là ""nham thạch"", cuộn trào trong lòng đất rồi chợt nổ tung, tuôn chảy theo nhiều hướng. Là một người con của Huế, dành ngót 20 năm để sáng tác ở giữa xứ này, anh hiểu rõ tâm tư của những đồng nghiệp. ""Vẽ không hẳn để bán"" - Trần Hữu Nhật khẳng định chắc nịch. Những triển lãm ở Huế thường vắng người mua, có cuộc bày tranh ra rồi lại mang về nhưng họa sĩ vẫn sáng tác với những chủ đề chẳng ăn khách, thậm chí rất kén người sưu tập.Triển lãm Xứ thần kinh diễn ra tại Mây Artspace (36/70 Nguyễn Gia Trí, quận Bình Thạnh) là dịp để công chúng TP.HCM vén bức rèm, khám phá hội họa Huế qua tác phẩm của bốn họa sĩ: Trần Hữu Nhật, Nguyễn Đức Nghĩa, Lê Hữu Long và Nguyễn Trung Kiên. Triển lãm trưng bày 36 tác phẩm, kéo dài từ nay đến ngày 23-10.Ngay từ gian phòng đầu tiên, Nguyễn Đức Nghĩa đã đưa người xem vào cõi u uất. Anh vẽ những nhân dạng phì nộn, đang phình ra trước những tổn thương cuộc sống. Bức Thiếu phụ của anh mang những vết cắt xẻ như để tượng trưng cho nỗi đau người phụ nữ gánh chịu. Bức Chiếc hôn màu xanh miêu tả một cảnh gia đình với cha mẹ đang hôn lên đứa trẻ. Ở khung hình tưởng như hạnh phúc ấy, Nguyễn Đức Nghĩa lại suy nghĩ khác, anh muốn nói về sự bất hạnh của những đứa trẻ oằn mình trước mong ước của cha mẹ và bị kẹp giữa lằn ranh yêu thương - kỳ vọng.Còn các tác phẩm của họa sĩ Lê Hữu Long lại bày tỏ suy tư của anh trong dịch COVID-19. Với họa sĩ, đó là giai đoạn con người bị cuốn vào vòng xoáy của số phận, nơi sự sống và cái chết cách nhau gang tấc. Anh phóng to những con ngựa giấy được dùng để hóa vàng, phô rõ sự kết nối mong manh giữa hai thế giới âm - dương.Ở phòng bên cạnh, Nguyễn Trung Kiên bày chín bức tranh tổng hợp vải bố, đa số là chân dung tự họa. Nguyễn Trung Kiên nhìn thấy trong vải bố sự thô ráp của con người, những đường chỉ bị uốn nếp, cắt xẻo một cách chủ ý để tạo nên sự giằng xé nội tâm.Gian phòng giữa trưng bày tác phẩm của họa sĩ Trần Hữu Nhật, tươi sáng hơn. Khác với ba họa sĩ còn lại, Trần Hữu Nhật thích nhìn vào mặt tích cực của cuộc sống. Tranh trừu tượng của anh luôn tồn tại những vệt màu rực rỡ chấm phá trên cái nền mờ mịt. Nhìn xa, tác phẩm chỉ đơn giản là vài nét cọ ngẫu hứng nhưng khi người xem đến gần, họ có thể thấy nhiều lớp màu bên dưới, đó là nơi câu chuyện của họa sĩ chôn giấu. Người cũng như tranh, Trần Hữu Nhật không cố gắng quên lãng đi quá khứ nhọc nhằn của mình, anh chọn những cảm hứng tích cực để đè lên với từng mảng màu và tìm thấy niềm hạnh phúc từ đây.Theo họa sĩ Trần Hữu Nhật, mặc dù các họa sĩ Huế hoạt động nghệ thuật khá kín kẽ, cũng hiếm khi tham dự triển lãm lớn, song họ vẫn nhận được sự quan tâm từ giới sưu tập quốc tế. ""Nhiều người đã bay từ nước ngoài về Việt Nam và trò chuyện hàng giờ liền về cuộc sống, gia đình chỉ để hiểu thấu về người họa sĩ. Có nhà sưu tập còn bước vào căn nhà ẩm thấp, chật chội của chúng tôi, chụp lại hình ảnh gian phòng ngổn nganh tranh, tượng… và quần lót. Với họ, đó là cuộc sống thật của nghệ sĩ. Cũng chính nhờ sự đồng hành và thực tâm đó, họa sĩ Huế có thể bán được tranh và nuôi sống gia đình"" - họa sĩ Trần Hữu Nhật tâm sự."
20221014180310873,https://tuoitre.vn/75-van-nghe-si-nhay-flashmob-lan-toa-thong-diep-dai-hoi-doan-tp-hcm-20221014180310873.htm,75 văn nghệ sĩ nhảy flashmob lan tỏa thông điệp Đại hội Đoàn TP.HCM,https://cdn1.tuoitre.vn/zoom/600_315/2022/10/14/a76fa44c928d55d30c9c-16657452844211332795631-crop-16657452999391582281133.jpg,14/10/2022 19:51 GMT+7,"TTO - 75 văn nghệ sĩ của đội tình nguyện viên nghệ sĩ Nhà văn hóa Thanh niên TP.HCM thực hiện các clip nhảy flashmob lan tỏa thông điệp của Đại hội đại biểu Đoàn TNCS Hồ Chí Minh TP.HCM lần thứ XI, tạo được hiệu ứng trên mạng xã hội.",Văn hóa,Đời sống,"Chào mừng Đại hội đại biểu Đoàn TNCS Hồ Chí Minh TP.HCM lần thứ XI (nhiệm kỳ 2022 - 2027), các thành viên đội tình nguyện viên nghệ sĩ thực hiện clip các động tác nhảy flashmob trên nền điệp khúc của ca khúc Những bước chân tiên phong (sáng tác Mai Trâm).Đây là một trong những ca khúc mới được sáng tác chào mừng Đại hội đại biểu Đoàn TNCS Hồ Chí Minh TP.HCM lần thứ XI.Tham gia hoạt động này có nhiều văn nghệ sĩ như: ca sĩ Nguyễn Phi Hùng, Vy Oanh, Quốc Đại, Ngọc Linh, MC Quỳnh Hoa, NSƯT Tuyết Thu, NSƯT Trịnh Kim Chi, nhà thiết kế Việt Hùng, hoa hậu Ngọc Châu, hoa hậu Ban Mai, á hậu Thủy Tiên, diễn viên Nam Thư, Hòa Hiệp, Bá Thắng, đạo diễn Trần Thành Trung, diễn viên xiếc Thanh Hoa, Hiển Phước…MC Quỳnh Hoa nói với Tuổi Trẻ Online: ""Khi thực hiện MV, mỗi ca sĩ chia nhau chỉ hát một câu. Hình thức này quá quen thuộc nên đội quyết định thực hiện clip ngắn dưới 30 giây để đăng trên TikTok và Facebook theo dạng video ngắn (Facebook Reels). Hình thức chuyển tải này phù hợp với trào lưu và xu hướng của giới trẻ ngày nay"".Biên đạo múa Nguyễn Bảo - thành viên đội tình nguyện viên nghệ sĩ - là người biên đạo các động tác múa cho các nghệ sĩ thực hiện.Ngoài ra, các văn nghệ sĩ còn thực hiện clip gửi những lời chúc tốt đẹp đến đại hội. Các động tác tuy đơn giản nhưng nhiều nghệ sĩ mất nhiều thời gian tập luyện do không phải ai cũng biết nhảy flashmob. Nghĩ đây là món quà nên các nghệ sĩ đã làm hết khả năng của mình, tạo nên phong cách riêng.MC Quỳnh Hoa mong muốn Đại hội đại biểu Đoàn TNCS Hồ Chí Minh TP.HCM lần thứ XI sẽ có nhiều hoạt động cộng đồng để kết nối tinh thần tình nguyện của các bạn trẻ, trong đó có văn nghệ sĩ.Ca sĩ Nguyễn Phi Hùng ước mong được đồng hành với Thành Đoàn TP.HCM đến với biên giới, hải đảo xa xôi, để mang nhiệt huyết, sức trẻ cống hiến cho mọi người.Còn đạo diễn Trần Thành Trung mong Đoàn có nhiều khóa học, sân chơi hướng nghiệp, để định hướng nghề nghiệp tương lai thiết thực hơn cho giới trẻ.Nghệ sĩ Tuyết Thu mong Thành Đoàn có những phong trào, lớp kịch để có thể lan tỏa, hiểu hơn về tâm tư nguyện vọng của các bạn và chị sẵn sàng đóng góp sức mình cho các phong trào, chương trình này.Hoa hậu Ngọc Châu mong Thành Đoàn có nhiều chương trình để hỗ trợ trẻ em gặp khó khăn trên mọi miền đất nước. Cô xin nguyện dùng hết sức trẻ của mình để đồng hành.Còn nhà thiết kế Nguyễn Việt Hùng cũng mong muốn Thành Đoàn kết nối cho những người trẻ mang chiếc áo dài tặng giáo viên vùng sâu vùng xa."
20220905212352693,https://tuoitre.vn/nhu-chua-he-co-cuoc-chia-ly-tim-duoc-me-ruot-sau-hon-40-nam-luu-lac-va-nhan-nham-nguoi-20220905212352693.htm,Như chưa hề có cuộc chia ly: Tìm được mẹ ruột sau hơn 40 năm lưu lạc và nhận nhầm người,https://cdn1.tuoitre.vn/zoom/600_315/2022/9/5/img4079-16623878257901372147954-crop-1662388624640351368095.jpg,05/09/2022 22:15 GMT+7,"TTO - Tối 5-9, chương trình Như chưa hề có cuộc chia ly số 156 đã giúp cô bé 9 tuổi ngày nào đi lạc tìm được mẹ sau hơn 40 năm tìm kiếm, thậm chí từng nhận nhầm người xa lạ là người thân.",Văn hóa,Đời sống,"Bà Nguyễn Thị Loan (tên khai sinh là Quan Thị Hồng Loan), quê tỉnh Sóc Trăng, đi lạc từ tháng 2-1981 trong một lần cha dẫn lên TP.HCM. Lúc đi lạc, bà Loan được 9 tuổi, ký ức về gia đình, về quê hương chỉ là cây nọc mẹ thường dùng cấy lúa, đồng xu in hình bông lúa, ngôi chùa vàng trang trí nhiều hoa văn…Những hình ảnh đó theo bà Loan đến nay đã hơn 40 năm. Nhìn lại hành trình đã qua, bà Loan sợ nhất là cảnh đám tang, sợ đói, sợ bị xúc phạm… Từ khi đi lạc, bà Loan được nhiều gia đình nhận nuôi, lo cho cái ăn, cái mặc. Tuy nhiên, mỗi nơi bà Loan chỉ ở được một thời gian ngắn rồi trốn đi vì những gia đình bà ở xảy ra biến cố.Rồi bà Loan được một gia đình tại tỉnh Bình Dương nhận về nuôi. Bà có trên 40 năm gắn bó với mảnh đất Bình Dương và có thâm niên 25 năm làm cán bộ tạp vụ tại Thị ủy Bến Cát. Với tính tình hiền lành, chân chất, bà Loan luôn được mọi người xung quanh yêu thương. Về gia đình, bà nhiều lần tìm kiếm nhưng không có kết quả. Có khoảng thời gian bà Loan đi làm ở Tiền Giang, nhiều người thấy bà trông rất giống gia đình ông Hai Nam ở Bến Tre nên lân la hỏi giúp. Hai lần bà Loan đến gặp, gia đình đều không nhận vì không có người thất lạc.6 năm sau (2003), bà Loan một lần nữa xuống gặp gia đình ông Hai Nam thì được nhận. Bà chủ động góp tiền sửa nhà, lo cho các em việc làm. Nhưng mãi về sau bà Loan nhận ra đó không phải là gia đình ruột thịt mình cần tìm. Lúc này, bà Loan mới quyết định gửi thư nhờ Như chưa hề có cuộc chia ly tìm gia đình ruột cho mình.Bà Loan tâm sự mong muốn tìm được cội nguồn, để mình không phải trẻ mồ côi. Bản thân bà từng mặc cảm vì không có cha mẹ, không gia đình nên chuyện hôn nhân không thành.Về phía ba mẹ ruột bà Loan là bà Lê Thị Quít và ông Quan Văn Học cũng nhiều lần lên TP.HCM tìm con nhưng không thành. 5 năm sau ngày lạc con, ông bà đường ai nấy đi, bỏ xứ đi nơi khác lập nghiệp. Hai em của bà Loan là Quan Thị Hồng Trúc và Quan Thị Hồng Hòa đi theo mẹ.Ông Học lấy vợ mới nhưng không có con chung. Bà Hòa thương ba nên sống cùng ba để tiện bề chăm sóc. Ông mất cách đây một năm. Còn bà Quít đi thêm bước nữa và có một người con trai.Từ những manh mối bà Loan cung cấp, chương trình đã tìm ra gia đình ruột thịt của bà. Bà Quít cho biết bà hay nằm chiêm bao thấy con nhưng không biết sống chết ra sao. Bà nghĩ sẽ không bao giờ được gặp lại con.Còn bà Loan nói lời xin lỗi ba mẹ chỉ vì ham chơi mà lạc cha khiến gia đình ly tán. ""Con biết ba mẹ cũng buồn khổ lắm khi để lạc con. Con cũng bứt rứt vì cuộc sống tuổi thơ thiếu thốn tình cảm của ba mẹ và hai em. Con hay ngồi khóc một mình bên bờ suối mỗi khi nghĩ về gia đình"" - bà Loan nói.Phút giây hai mẹ con nhận ra nhau khiến cả phim trường không kìm được nước mắt trước cảnh tình thương gia đình được lấp đầy sau thời gian dài thiếu thốn."
20220901122447013,https://tuoitre.vn/ve-cu-chi-an-35-mon-tu-cu-mi-15-mon-tu-thit-bo-20220901122447013.htm,"Về Củ Chi ăn 35 món từ củ mì, 15 món từ thịt bò",https://cdn1.tuoitre.vn/zoom/600_315/2022/9/1/img9893-166201026988523469103-crop-16620102928671307303692.jpg,01/09/2022 13:26 GMT+7,"TTO - Sáng 1-9, nhiều người đã có mặt tại Công viên văn hóa huyện Củ Chi (TP.HCM) để tham gia Ngày hội văn hóa, ẩm thực và du lịch huyện Củ Chi với nhiều hoạt động thú vị, trong đó có thưởng thức 35 món ăn được chế biến từ khoai mì (củ sắn).",Văn hóa,Đời sống,"Bánh rế củ mì, bánh tằm, củ mì cay, củ mì quết, canh củ mì ếch, củ mì gà, bánh củ mì nướng, lẩu bò củ mì, chè củ mì... là những món ăn tiêu biểu được giới thiệu. Nhiều du khách đã thích thú ghé lại tham quan và dùng thử.Vốn là người bán bánh tằm và bánh cay tại gia hơn chục năm, chị Võ Thị Thu Hồng (xã Trung Lập Hạ, Củ Chi) cảm thấy rất vui khi được đem các món ăn mình làm đến với ngày hội. ""Bán đắt bán ế không thành vấn đề, khi tôi bán có người ra người vô cảm thấy vui lắm. Ở Củ Chi người ta ăn khoai mì nhiều nên không thích bằng những nơi khác. Nhưng khi tôi về Sài Gòn, đem thịt cá cho bạn thì họ không chuộng nhưng khi đem khoai mì lên là bạn tôi ăn hết trơn"", chị Hồng chia sẻ sau khi bán hết hai mâm bánh cay, hai mâm bánh tằm và đang chuẩn bị cho mẻ bánh buổi chiều.Đến Củ Chi làm việc được gần hai tháng, chị Mai Thị Nga (25 tuổi, quê Đắk Lắk) lần đầu được thưởng thức các món ăn làm từ củ mì. ""Trước giờ tôi ăn củ khoai lang thôi, củ mì thì ít ăn. Sau khi ăn cảm thấy đây là một món ăn rất ngon và còn ý nghĩa nữa, vì loại củ này đã nuôi sống người dân Củ Chi trong những năm tháng chiến tranh khốc liệt"", chị Nga nói.Ngoài những món từ củ mì, ban tổ chức còn trưng bày 15 món ăn chế biến từ thịt bò cùng hơn 85 gian hàng ẩm thực, du lịch và triển lãm về lịch sử huyện Củ Chi. Ngày hội còn có nhiều hoạt động thú vị như trổ tài làm bánh, đan lát, tô tượng, đi cà kheo, thưởng thức các món ngon...Được biết, Ngày hội văn hóa, ẩm thực và du lịch huyện Củ Chi năm 2022 được tổ chức với chủ đề ""Hương sắc vùng đất thép"" nhằm chào mừng kỷ niệm 77 năm Ngày Cách mạng Tháng Tám, Quốc khánh nước Cộng hòa xã hội chủ nghĩa Việt Nam và 55 năm Củ Chi được phong tặng danh hiệu ""Đất thép hóa rồng"".""Đây là hoạt động ý nghĩa, lần đầu tiên được tổ chức. Thông qua hoạt động này, huyện Củ Chi mong muốn quảng bá, giới thiệu con người, văn hóa đến với các du khách ở khắp mọi miền đất nước và nước ngoài, tạo điều kiện cho phát triển văn hóa gắn với du lịch, đa dạng các hình thức tổ chức"", bà Nguyễn Thị Hằng, phó chủ tịch huyện Củ Chi, trưởng ban tổ chức, phát biểu khai mạc ngày hội.Thời gian bắt đầu và kết thúc của ngày hội là từ ngày 1 đến 4-9, bên cạnh việc tôn vinh và phát huy bản sắc văn hóa, giá trị truyền thống thì ngày hội còn kết nối và thúc đẩy tiềm năng du lịch trên toàn địa bàn huyện."
