id,link,title,thumbnail,time,summary,category,sub_category,full_article
20221019173715405,https://tuoitre.vn/truong-ngoc-anh-noi-ve-viec-miss-earth-tut-hang-sau-2-nam-to-chuc-online-20221019173715405.htm,Trương Ngọc Ánh nói về việc Miss Earth tụt hạng sau 2 năm tổ chức online,https://cdn1.tuoitre.vn/zoom/600_315/2022/10/19/miss-earth-3-16661790499031793940518-crop-16661793948651810432588.jpg,19/10/2022 19:32 GMT+7,"TTO - Đưa người đẹp Thạch Thu Thảo dự thi Miss Earth, bà Trương Ngọc Ánh cho biết việc thứ hạng các cuộc thi có lúc lên, lúc xuống là việc bình thường trên đấu trường sắc đẹp thế giới.",Giải trí,Thời trang,"Chiều 19-10, người đẹp Thạch Thu Thảo - Á hậu Các dân tộc Việt Nam 2022, đại diện Việt Nam tại Miss Earth 2022 - ra mắt báo chí Việt Nam trước khi lên đường dự thi Miss Earth (diễn ra từ ngày 10 đến 30-11 tại Philippines).""Lúc lên, lúc xuống là chuyện bình thường""Miss Earth là cuộc thi được tổ chức hằng năm nhằm mục đích nâng cao sự hiểu biết của mọi người về những hoạt động bảo vệ môi trường. Á hậu Thạch Thu Thảo được tạo điều kiện phát triển nhiều kỹ năng về trình diễn, ứng xử và hoạt động môi trường.Mặc dù vậy, từ nhiều năm nay, Miss Earth bị chuyên trang sắc đẹp Global Beauties đưa khỏi top 5 cuộc thi hoa hậu lớn nhất thế giới (Grand Slam) vì tham nhũng, sản xuất kém và kết quả gây tranh cãi. 5 cuộc thi Grand Slam hiện có Miss World, Miss Universe, Miss Grand International, Miss International và Miss Supranational.Hai năm qua, Miss Earth tổ chức trực tuyến vì dịch COVID-19. Cuộc thi đang đối mặt với thử thách lấy lại vị thế, uy tín trước đây.Trả lời Tuổi Trẻ Online về sự tụt hạng của Miss Earth, bà Trương Ngọc Ánh - chủ tịch Nova Entertainment, tổ chức đưa thí sinh Việt Nam đi thi Miss Earth - nói: ""Hai năm vừa rồi có dịch, họ không tổ chức được nên chủ yếu tổ chức online. Miss Earth không chỉ là nơi các cô gái mặc đồ lung linh, catwalk mà phải nói nhiều về vấn đề môi trường. Thí sinh phải am hiểu về môi trường. Đó là lý do chúng tôi mua bản quyền cuộc thi. Các cuộc thi nhan sắc trên thế giới có lúc lên, lúc xuống là chuyện bình thường. Mình không nên đánh giá qua một năm nào đó"".Việt Nam có đại diện đăng quang tại Miss Earth là Hoa hậu Phương Khánh vào năm 2018. Nhưng trong nhiệm kỳ, Phương Khánh không có nhiều hoạt động gắn với tổ chức Miss Earth.Nếu Thạch Thu Thảo đạt danh hiệu cao tại Miss Earth 2022, bà Trương Ngọc Ánh cho biết việc hoa hậu hoạt động như thế nào sau khi nhận danh hiệu phụ thuộc vào mỗi người. Thu Thảo chưa đi thi nhưng đã được các tổ chức về môi trường mời tham gia, mời làm đại sứ. Công ty chỉ tạo điều kiện còn hoạt động như thế nào là ở nỗ lực của cô.Thạch Thu Thảo khóc vì những lời xúc phạmTrong clip hành trình chia sẻ tại sự kiện, Thạch Thu Thảo - người vừa được trao danh hiệu Miss Earth Việt Nam 2022 - cho biết từ khi được chọn, cô đã nhận được nhiều tin nhắn xúc phạm qua mạng xã hội. Đó là những lời miệt thị về nhan sắc, lời quy kết “out top (bị loại) là cái chắc”. Cô bật khóc khi chia sẻ điều này.Dưới áp lực như vậy, Thạch Thu Thảo vẫn miệt mài tập luyện hình thể, học tiếng Anh, học catwalk, làm việc với chuyên gia tư vấn để chuẩn bị cho cuộc thi.Mỗi năm, Miss Earth sẽ lựa chọn một chủ đề khác nhau để nâng cao kiến thức về bảo vệ môi trường. Năm nay, chủ đề là bảo vệ động vật. Phía Việt Nam chọn cho Thạch Thu Thảo loài sếu đầu đỏ để thực hiện hoạt động kêu gọi bảo tồn.Năm nay, một số đại diện Việt Nam đi thi nhan sắc quốc tế đã có danh hiệu tốt: Kim Duyên - Á hậu Siêu quốc gia (cuộc thi Miss Supranational), Bảo Ngọc - Hoa hậu Liên lục địa (Miss InterContinental), Lâm Thu Hồng - Á hậu Hoàn cầu (Miss Globe). Là người tiếp theo đại diện Việt Nam dự thi quốc tế, Thạch Thu Thảo dễ bị so sánh.Bà Trương Ngọc Ánh cho biết Thạch Thu Thảo cảm thấy áp lực về vấn đề này, có lúc tưởng như bỏ cuộc nhưng cô đã sớm lấy lại tinh thần."
20221007212736509,https://tuoitre.vn/hoa-hau-luong-thuy-linh-mao-hiem-dien-vedette-o-do-cao-8-met-20221007212736509.htm,Hoa hậu Lương Thùy Linh mạo hiểm diễn vedette ở độ cao 8 mét,https://cdn.tuoitre.vn/zoom/600_315/2022/10/7/miss-world-vn-2019-top-12-miss-world-2019-luong-thuy-linh-1-16651541231381997745828-crop-1665154144994181511892.jpg,,"TTO - Ngày 24-10, Novaland đã chính thức thông tin về các tin đồn những ngày qua liên quan đến các dự án của doanh nghiệp này. Phía Novaland khẳng định đây là tin đồn sai sự thật, gây tâm lý hoang mang cho nội bộ, cộng đồng, khách hàng, nhà đầu tư.",Giải trí,Thời trang,"Khán giả bất ngờ trước màn xuất hiện của hoa hậu Lương Thùy Linh ở độ cao gần 8 mét trong show diễn thời trang của nhà thiết kế Nguyễn Minh Tuấn.

Vừa qua, Lương Thùy Linh đảm nhận vai trò vedette của show diễn thời trang ra mắt bộ sưu tập mới Inside của ""nhà thiết kế của các hoa hậu"" Nguyễn Minh Tuấn, tại TP.HCM.Theo đó, nàng hậu chui ra từ một chiếc kén to, được thả từ từ xuống sân khấu ở độ cao gần 8 mét. Đây là ý tưởng độc đáo của đạo diễn Lê Việt, mang đến nhiều thú vị cho người xem.Sau đó, Lương Thùy Linh có màn trình diễn thần thái, những bước đi mạnh mẽ nhưng vẫn uyển chuyển trong tiếng reo hò cổ vũ nhiệt tình của khán giả.Lần này, nhà thiết kế trình làng 70 mẫu thiết kế mới, lạ, khác hẳn với những gì người hâm mộ từng thấy Nguyễn Minh Tuấn thể hiện trước đây.Đó là sự phá cách, sáng tạo khiến khán giả theo dõi không rời mắt khỏi sân khấu. Anh sử dụng đa dạng về chất liệu, tạo nên nhiều phom dáng với các hình ảnh ẩn dụ, đậm chất nghệ thuật.Bộ sưu tập gồm hai phần chính thể hiện những mảnh ghép của cá tính, sự nông nổi của tuổi đôi mươi. Show diễn được đầu tư công phu về sân khấu, âm thanh, ánh sáng với tổng chi phí đầu tư khoảng 2 tỉ đồng.Show diễn thời trang Inside còn có sự góp mặt trình diễn của Miss Universe 2005 Natalie Glebova, Miss Cambodia 2021 Sary Sovattey. Đây cũng là lần đầu 2 người đẹp sải bước trên sàn diễn thời trang cùng người đẹp Việt Nam.Ngoài ra, còn có sự tham gia trình diễn của hoa hậu Bella Vũ Huyền Diệu, á hậu Chế Nguyễn Quỳnh Châu, Ngọc Thảo…"
2022100722285635,https://tuoitre.vn/do-my-linh-tung-anh-mac-vay-cuoi-truoc-tin-sap-len-xe-bong-2022100722285635.htm,Đỗ Mỹ Linh tung ảnh mặc váy cưới trước tin sắp 'lên xe bông',https://cdn.tuoitre.vn/zoom/600_315/2022/10/7/anh-4-hh-do-my-linh-10-16651564015901077612680-crop-1665156429247409166561.jpg,,"TTO - Ngày 24-10, Novaland đã chính thức thông tin về các tin đồn những ngày qua liên quan đến các dự án của doanh nghiệp này. Phía Novaland khẳng định đây là tin đồn sai sự thật, gây tâm lý hoang mang cho nội bộ, cộng đồng, khách hàng, nhà đầu tư.",Giải trí,Thời trang,"Sau khi bê tráp cho lễ ăn hỏi của diễn viên Bình An và á hậu Phương Nga, hoa hậu Đỗ Mỹ Linh bất ngờ tung bộ ảnh diện váy cưới, dù chưa xác nhận tin đồn sẽ theo chàng về dinh vào tháng 10 năm nay.

Mới đây, hoa hậu Đỗ Mỹ Linh bất ngờ tung loạt ảnh mới trước những tin đồn úp mở rằng cô sẽ lên xe hoa vào tháng 10 này.Những mẫu váy cưới Đỗ Mỹ Linh diện nằm trong bộ sưu tập mới nhất của Vera Wang. Đặc biệt, Đỗ Mỹ Linh là một trong những người đầu tiên diện bộ sưu tập này tại Việt Nam.Và rồi nàng hậu sẽ chọn thiết kế nào cho ngày trọng đại sắp tới?"
20221006201227529,https://tuoitre.vn/fashup-2022-dua-thoi-trang-den-gan-hon-voi-cuoc-song-20221006201227529.htm,FashUP 2022: Đưa thời trang đến gần hơn với cuộc sống,https://cdn1.tuoitre.vn/zoom/600_315/2022/10/6/at1406-1665061812798284907181-crop-16650618582901504971197.jpg,06/10/2022 21:46 GMT+7,"TTO - ‘Thời trang không chỉ là những bộ sưu tập trên sàn diễn qua phần trình diễn của người mẫu, chúng tôi muốn đưa thời trang vào cuộc sống, truyền cảm hứng đến nhiều người hơn’, bà Trang Lê chia sẻ tại buổi công bố FashUP 2022 vào chiều 6-10.",Giải trí,Thời trang,"Bà Trang Lê - đại diện Multimedia JSC, ban tổ chức cuộc thi - cho biết cuộc thi FashUP 2022 by TikTok mùa 2 có nhiều điểm mới. Nếu như năm 2021 thực hiện quay hình hoàn toàn qua ứng dụng online thì năm nay format thực hiện offline thông qua chương trình truyền hình thực tế đúng nghĩa.Cuộc thi FashUP 2022 gồm bốn lĩnh vực: Làm đẹp (Beauty Icon), Người mẫu (Modeling Icon), Phối đồ thời trang (Fashion Icon), Thiết kế thời trang (Fashion Design Icon). Đây được xem là bốn thành phần quan trọng trong thời trang, có mối quan hệ mật thiết không thể thiếu.""Một người mẫu chưa tạo nên thế giới thời trang, những thiết kế mà không có người mặc cũng không thể giúp thời trang trở nên lung linh. Nếu không có người sáng tạo phong cách thời trang thì không giúp bộ trang phục rực rỡ và có phong cách sáng tạo. Ngoài ra, nếu như mặc một bộ quần áo đẹp, phong cách mà không biết trang điểm thể hiện thần thái cũng không tôn vinh thời trang. Chính vì thế mà cuộc thi tìm kiếm nhà sáng tạo nội dung trên cả bốn lĩnh vực"" - đại diện ban tổ chức cho biết.Giám khảo cuộc thi FashUP năm nay có: siêu mẫu Võ Hoàng Yến, á hậu Thảo Nhi Lê, nhà thiết kế Đỗ Long, chuyên gia trang điểm Nam Trung.Siêu mẫu Võ Hoàng Yến là giám khảo có lời góp ý thẳng thắn mang tính chất xây dựng. Cô cho biết chương trình này sẽ giúp các thí sinh có nền tảng, bệ phóng, cách làm việc nhóm hiệu quả.""Ngoài chuyên môn trình diễn, thí sinh phải là người sáng tạo nội dung có tư duy, truyền cảm hứng, giới thiệu được cho khán giả nội dung trong clip là gì"" - Võ Hoàng Yến nói tiêu chí chấm giải.Còn nhà thiết kế Đỗ Long chú trọng đến cách làm việc nhóm và xem đây là một trong những tiêu chí quan trọng. Ngoài ra thí sinh phải có gu thời trang, biết sử dụng nền tảng xã hội đưa hình ảnh của mình đến với khán giả.Chương trình truyền hình thực tế FashUP 2022 by TikTok phát vào chủ nhật hằng tuần trên các nền tảng xã hội, bắt đầu từ ngày 9-10. Dự kiến đêm gala sẽ diễn ra vào ngày 30-10 sắp tới."
20221004091244943,https://tuoitre.vn/thoi-trang-con-ke-mot-cau-chuyen-khac-20221004091244943.htm,Thời trang còn kể một câu chuyện khác,https://cdn1.tuoitre.vn/zoom/600_315/2022/10/4/phuong-ho-anh-1664849374720489728177-crop-16648495092871910542016.jpg,04/10/2022 09:22 GMT+7,"TTO - Sân chơi thời trang đang rất ""nóng"" khi gần đây các nhà thiết kế tổ chức các sô diễn cùng các chương trình thiết kế dành cho thiếu nhi, được các bậc phụ huynh và các em nhỏ mê thời trang quan tâm.",Giải trí,Thời trang,"Trong đợt dịch vừa qua, nhà thiết kế Phương Hồ có dịp tiếp xúc với nhiều em nhỏ có hoàn cảnh khó khăn qua các hoạt động thiện nguyện. Việc hiện thực hóa ước mơ được một lần trình diễn thời trang của các em thôi thúc chị tổ chức sàn diễn Walking On The River tại bến Bạch Đằng (quận 1, TP.HCM). Những trang phục, phụ kiện chuẩn bị cho buổi diễn đều được nhà thiết kế tặng lại cho các em nhỏ. Đây là một trong những hoạt động nằm trong khuôn khổ dự án nghệ thuật cộng đồng Có hẹn với Sài Gòn, phục vụ miễn phí du khách vào ngày cuối tuần.Điểm đặc biệt của chương trình này là có sự góp mặt của gần 10 em nhỏ có hoàn cảnh khó khăn ở quận 4 trình diễn cùng các người mẫu chuyên nghiệp. Em Lê Ngọc Thảo Vy (9 tuổi) chia sẻ rằng việc khoác lên mình chiếc áo mới và được diễn thời trang như là một giấc mơ.Nhà thiết kế Phương Hồ còn đang ấp ủ tổ chức hội trại thời trang cho các em với các hoạt động dã ngoại, thời trang và biểu diễn trong một ngày; qua đó giúp các em học kỹ năng sống, tìm hiểu về thời trang và có thể tham gia trình diễn thời trang.Nhà thiết kế Sĩ Hoàng cũng thường xuyên có những sô diễn, bộ sưu tập mới cho các em. Bộ sưu tập mới nhất của anh mang tên Tạ ơn mang thông điệp về lòng biết ơn với đội ngũ áo xanh, y bác sĩ tình nguyện, người dân đã đoàn kết, cùng nhau vượt qua đại dịch. Điểm đặc biệt của bộ áo dài này là chuyển tải những bức tranh về dịch COVID-19 do các em thiếu nhi mẫu giáo và lớp 1 vẽ. Anh đã chọn 40 bức tranh từ 8.000 bức vào vòng chung khảo.Nhà thiết kế Sĩ Hoàng chia sẻ với Tuổi Trẻ: ""Như thông điệp nối dài, bộ sưu tập lan tỏa sự hiểu biết, nhận thức của các bé dù còn rất nhỏ trước những biến động của xã hội"". Anh ví von con trẻ như một ổ cứng mới, các bậc phụ huynh cần nhập dữ liệu tốt nhất, tạo nền tảng sau này cho trẻ phát triển toàn diện. Sân chơi thời trang hỗ trợ cho các bé phát huy năng khiếu về mỹ thuật, hội họa giúp biết quan sát, ghi nhận và thể hiện lại cảm nhận của mình thông qua màu sắc, bố cục, đường nét."
20220614232953705,https://tuoitre.vn/chieu-ca-mau-doat-giai-nhat-trang-phuc-dan-toc-hoa-hau-hoan-vu-viet-nam-2022-20220614232953705.htm,'Chiếu Cà Mau' đoạt giải nhất trang phục dân tộc Hoa hậu Hoàn vũ Việt Nam 2022,https://cdn1.tuoitre.vn/zoom/600_315/2022/6/15/002muv-dan-toc-foto-kiengcan-studio--165522779224429927260-crop-16552278252831944573296.jpeg,15/06/2022 00:36 GMT+7,"TTO - Lấy ý tưởng thiết kế từ làng nghề truyền thống làm chiếu ở Cà Mau, nhà thiết kế Nguyễn Quốc Việt cho ra đời bộ trang phục dân tộc mang tên 'Chiếu Cà Mau'. Mẫu thiết kế đã đoạt giải nhất phần thi trang phục dân tộc.",Giải trí,Thời trang,"Trong khuôn khổ cuộc thi Hoa hậu Hoàn vũ Việt Nam 2022, đêm trình diễn trang phục dân tộc diễn ra vào tối 14-6, tại TP.HCM đã mang đến cho khán giả nhiều bộ trang phục dân tộc lộng lẫy, đa sắc màu và mang ý nghĩa văn hóa độc đáo.Top 41 thí sinh của cuộc thi Hoa hậu Hoàn vũ Việt Nam 2022 đã trình diễn 41 mẫu thiết kế trang phục dân tộc đến từ các nhà thiết kế là sinh viên ngành thời trang của các trường Đại học Công nghệ TP.HCM, Đại học Tôn Đức Thắng, Đại học Hoa Sen, Đại học Văn Lang, Đại học Sư phạm kỹ thuật TP.HCM, Đại học Kiến trúc TP.HCM…Đây là những mẫu thiết kế được chọn ra từ cuộc thi tuyển chọn thiết kế trang phục dân tộc tổ chức trước đó.41 mẫu thiết kế mang 41 ý nghĩa khác nhau nhưng tất cả hướng đến tôn vinh vẻ đẹp tự tin, hiện đại, bản lĩnh, giá trị chân thiện mỹ.Đó là các bộ trang phục dân tộc có tên gọi như: Đờn ca tài tử, Sắc màu Hội An, Tráp long phụng, Động Phong Nha, Tre Việt, Chị Võ Thị Sáu, Ngư ông, Chiếu Cà Mau, Bánh tráng trộn Sài Gòn, Tôm tre mỹ nghệ, Chiếu bông, Bánh tráng, Vượt vũ môn, Trưng Vương…Theo ghi nhận của Tuổi Trẻ Online, đa phần các mẫu thiết kế được đầu tư tỉ mỉ, có nhiều chi tiết tinh xảo, mang thông điệp ý nghĩa… Tuy nhiên trọng lượng các bộ trang phục này khá nặng, cồng kềnh gây khó khăn khi trình diễn cho các thí sinh.Đây được xem là thử thách và cũng là cơ hội để top 41 Hoa hậu Hoàn vũ Việt Nam 2022 thể hiện kỹ năng trình diễn, cũng như cách ứng biến trên sân khấu.Ông Trần Việt Bảo Hoàng - phó ban tổ chức cuộc thi Hoa hậu Hoàn vũ Việt Nam 2022 - cho biết: ""Tất cả các thiết kế trang phục dân tộc trình diễn được các nhà thiết kế bốc thăm ngẫu nhiên chọn ra thí sinh trình diễn bộ trang phục của mình. Phần chấm điểm chỉ chấm phần trình diễn và bộ trang phục của nhà thiết kế. Điểm này không phải là điểm thi chính thức của cuộc thi Hoa hậu Hoàn vũ Việt Nam 2022"".Ban giám khảo chọn ra những bộ trang phục dân tộc xuất sắc gồm: nhà thiết kế Lê Long Dũng, Hoàng Minh Hà, Nguyễn Minh Tuấn và Nguyễn Minh Công.Nhà thiết kế Nguyễn Minh Tuấn nói với Tuổi Trẻ Online: ""Lần đầu tiên có một đêm trình diễn nhiều mẫu trang phục dân tộc trong một cuộc thi sắc đẹp của Việt Nam được đầu tư chỉn chu, bài bản rất đáng tự hào. Phần thi này sát với format của thế giới, giúp cho thí sinh trải nghiệm trước khi đi thi quốc tế, mặc trang phục nặng như thế nào, trình diễn ra sao để thể hiện tinh thần và thông điệp nhà thiết kế muốn truyền tải"".Chung cuộc, giải nhất trao cho bộ trang phục Chiếu Cà Mau của Nguyễn Quốc Việt. Giải nhì là bộ trang phục Bánh tráng của Phan Xuân Giàu và bộ trang phục Tôm tre mỹ nghệ của Nguyễn Minh Khôi đoạt giải ba."
20220613065540411,https://tuoitre.vn/thanh-hang-xuan-lan-trinh-dien-thoi-trang-giua-rung-20220613065540411.htm,"Thanh Hằng, Xuân Lan trình diễn thời trang giữa ‘rừng’",https://cdn1.tuoitre.vn/zoom/600_315/2022/6/13/007halinhthu-2022-foto-kiengcan--165507808271154708814-crop-1655078135668106185751.jpeg,13/06/2022 09:31 GMT+7,TTO - Siêu mẫu Thanh Hằng bất ngờ xuất hiện trong đêm diễn thời trang giới thiệu bộ sưu tập mới của nhà thiết kế Hà Linh Thư. Cô diện bộ váy nhung đen đơn giản nhưng cuốn hút mọi ánh nhìn.,Giải trí,Thời trang,"Welcome to the Jungle là dự án thời trang được nhà thiết kế Hà Linh Thư ấp ủ khá lâu, được giới thiệu đến công chúng vào tối 12-6.Hà Linh Thư biến không gian sàn diễn thời trang thành một khu rừng nhiệt đới với các loại cây cỏ, hoa lá đặc trưng và rock hóa sàn diễn khi mời ca sĩ Phạm Anh Khoa trình diễn ca khúc Sương đêm. Hà Linh Thư cho biết bộ sưu tập lần này như là chương đầu tiên của một cuốn tiểu thuyết về thời trang mà chị muốn giới thiệu đến khán giả. Các chương tiếp theo sẽ được trình làng trong thời gian tới.Hình ảnh chính trong bộ sưu tập này là họa tiết con báo, thể hiện tinh thần mạnh mẽ và sự mềm mại, đầy chất thơ trong mỗi người phụ nữ Việt Nam.Những họa tiết đều được thêu tay kỳ công, tỉ mỉ và rất tinh tế, đồng thời thể hiện sự sáng tạo của các nghệ nhân, tạo nên thiết kế sang trọng cho quý cô và cá tính cho quý ông.Siêu mẫu Xuân Lan đảm nhận vai trò đạo diễn catwalk, nhà sản xuất cho show diễn đã bất ngờ xuất hiện mở màn đêm diễn với trang phục bodysuit, khoe đường cong cuốn hút.Minh Kha - chàng trai bước ra từ cuộc thi Quý ông hoàn mỹ - ghi dấu ấn khi đảm nhận vai trò vedette cùng siêu mẫu Thanh Hằng.Tham gia trình diễn bộ sưu tập còn có Thùy Dương, Hồng AJ, Hữu Long, Vũ Linh, Lừng Nguyễn…Hoa hậu Giáng My, MC Thanh Mai, siêu mẫu Thúy Hạnh, nhạc sĩ Lưu Thiên Hương… cũng đã đến ủng hộ show diễn thời trang của Hà Linh Thư."
20220530063911758,https://tuoitre.vn/hoa-hau-thuy-tien-trinh-dien-trong-dem-be-mac-tuan-le-thoi-trang-20220530063911758.htm,Hoa hậu Thùy Tiên trình diễn trong đêm bế mạc tuần lễ thời trang,https://cdn1.tuoitre.vn/zoom/600_315/2022/5/30/75-can-canh-nhan-sac-nu-than-cua-hoa-hau-thuy-tien-1653868045213890524448-crop-1653868079061552243666.jpg,30/05/2022 07:53 GMT+7,"TTO - Tuần lễ thời trang quốc tế Việt Nam xuân hè 2022 khép lại vào tối 29-5 với phần trình diễn 5 bộ sưu tập mới của các hoa hậu, á hậu, diễn viên, người mẫu chuyên nghiệp.",Giải trí,Thời trang,"Với chủ đề ReFashion, Tuần lễ thời trang quốc tế Việt Nam 2022 có 4 đêm trình diễn thời trang, giới thiệu 18 bộ sưu tập mới đến từ các nhà thiết kế, thương hiệu thời trang trong nước và quốc tế như: Võ Công Khanh, Hoàng Hải, Adrian Anh Tuấn, Linh San, Tuyết Lê, Hoàng Minh Hà, Nguyễn Tiến Truyển, Lý Giám Tiền, Ivan Trần, Thảo Nguyễn, Phương Hồ, Nguyễn Minh Công, Hoàng Quyên...Trong đó, khán giả thích thú với các bộ sưu tập sử dụng vải tái chế từ các nguyên vật liệu thiên nhiên như bã cà phê, sợi sen, vỏ hàu, nhựa tái chế... của nhà thiết kế Võ Công Khanh, Adrian Anh Tuấn, Hoàng Minh Hà, Nguyễn Tiến Truyển, Lý Giám Tiền và Hoàng Quyên.Tuần lễ thời trang quốc tế Việt Nam 2022 quy tụ hàng trăm người đẹp, siêu mẫu, diễn viên đến các người mẫu như hoa hậu Thùy Tiên, H’Hen Niê, Khánh Vân, Tiểu Vy, Đỗ Thị Hà, Bella Vũ Huyền Diệu, á hậu Hoàng Thùy, Võ Hoàng Yến, siêu mẫu Thanh Hằng, Anh Thư, Vũ Thu Phương, Lan Khuê…Đúng với tinh thần chủ đề Tuần lễ thời trang quốc tế Việt Nam năm nay là ReFashion, các nhà thiết kế đã mang đến những bộ sưu tập hướng tới phát triển thời trang theo hướng bền vững, thân thiện môi trường. Đêm bế mạc, giới mộ điệu thời trang được chiêm ngưỡng các bộ sưu tập đến từ nhà thiết kế Hoàng Hải, Thảo Nguyễn, Linh San, Hoàng Minh Hà…Trong đó, bộ sưu tập Bướm hoang của nhà thiết kế Hoàng Hải gây ""choáng ngợp"" khi có sự tham gia trình diễn của Miss Grand International 2021 Thùy Tiên (đảm nhận vị trí vedette), á hậu Hoàng Thùy (vị trí first face) cùng siêu mẫu Thúy Hạnh, ca sĩ Thanh Hà, diễn viên Đinh Ngọc Diệp...Lấy cảm hứng từ loài bướm có hình hài xinh đẹp được lột xác từ những cái kén xấu xí, Hoàng Hải thực hiện bộ sưu tập Bướm hoang, hàm ý về sự thăng hoa trong thời trang, biến cái xấu thành đẹp.Các mẫu thiết kế được Hoàng Hải sử dụng kỹ thuật thêu tay, tạo nên chiếc váy dạ hội, váy cưới sáng tạo và độc đáo.Á hậu Hoàng Thùy mở màn bộ sưu tập với chiếc váy màu xanh điểm xuyết cánh bướm được thêu dệt và đính kết 3D thủ công ấn tượng. Còn Miss Grand International 2021 Thùy Tiên diễn với chiếc đầm dạ hội cắt xẻ táo bạo, được đính kết đá lấp lánh cùng đôi cánh được lấy cảm hứng từ loài bướm.Lần đầu tiên đến với Tuần lễ thời trang quốc tế Việt Nam trong vai trò vedette của nhà thiết kế Hoàng Hải, do tuột dây giày lúc trình diễn, Thùy Tiên ""vồ ếch"" khiến khán giả lo lắng. Nhưng ngay sau đó, cô tự đứng dậy và hoàn thành phần trình diễn của mình."
