id,link,title,thumbnail,time,summary,category,sub_category,full_article
20221104090557875,https://tuoitre.vn/vu-thue-nha-so-huu-nha-nuoc-roi-dem-ban-buoc-giao-nha-cho-nguoi-thue-co-dung-20221104090557875.htm,Vụ 'thuê nhà sở hữu nhà nước rồi đem bán': Buộc giao nhà cho người thuê có đúng?,https://cdn1.tuoitre.vn/zoom/600_315/2022/11/4/pl-pham-chi-son-2read-only-16675272494631415269553-crop-16675274199511928410007.jpg,04/11/2022 10:46 GMT+7,"TTO - Ông Kiểm thuê nhà thuộc sở hữu nhà nước rồi bán cho ông Sơn, sau đó tòa phán quyết ông Sơn trả lại nhà cho ông Kiểm. Để bảo vệ nhà của nhà nước, UBND TP đang kiến nghị kháng nghị phán quyết của tòa. Việc buộc trả nhà cho người thuê có đúng?",Pháp luật,,"Thuê nhà sở hữu nhà nước rồi tự ý bán cho người khác. Tòa phán người mua nhà phải trả lại nhà cho người thuê. Trong khi UBND TP.HCM đang kiến nghị kháng nghị bản án, còn cơ quan thi hành án đòi cưỡng chế giao nhà, có thể sẽ phát sinh không ít vướng mắc.Vụ án này báo Tuổi Trẻ thông tin trong bài ""Thuê nhà sở hữu nhà nước rồi đem bán"" (ngày 3-9-2020). Sau khi bài báo đăng tải, UBND TP.HCM đã có văn bản kiến nghị kháng nghị giám đốc thẩm đối với bản án phúc thẩm của TAND cấp cao tại TP.HCM để bảo vệ nhà đất thuộc sở hữu nhà nước. Còn chấp hành viên Cục Thi hành án dân sự TP.HCM yêu cầu thi hành bản án đã có hiệu lực pháp luật.Lợi ích nhà nước chưa được bảo vệTheo quan điểm kiến nghị kháng nghị của UBND TP.HCM, căn nhà số 14 đường Tự Quyết (phường Tân Sơn Nhì, quận Tân Phú) do ông Đào Văn Kiểm thuê của nhà nước (ký hợp đồng thuê nhà vào tháng 3-2010 với Đội quản lý nhà quận Tân Phú), thời hạn thuê là 60 tháng. Đến năm 2015 thời hạn thuê nhà đã hết. Sau đó, Đội quản lý nhà không liên hệ được với ông Kiểm để gia hạn hợp đồng cũng không thu được tiền nợ thuê nhà từ tháng 4-2012 đến nay. Đồng thời, theo báo cáo từ UBND quận Tân Phú, thực tế ông Kiểm không sử dụng nhà.Theo UBND TP, bản án phúc thẩm tuyên ông Phạm Chí Sơn phải trả cho thừa kế của ông Kiểm phần nhà, đất nêu trên là chưa phù hợp. Vì đây là nhà ở thuộc sở hữu nhà nước, ông Kiểm cũng không có quyền để lại cho các thừa kế cũng như không còn thuộc đối tượng được thuê nhà. Ngoài ra, việc tòa án cấp cao xác định người có quyền và nghĩa vụ liên quan trong vụ kiện là Đội quản lý nhà thuộc sở hữu nhà nước trực thuộc quận Tân Phú (Đội quản lý nhà) là chưa phù hợp vì UBND TP mới là đại diện chủ sở hữu theo quy định.Theo hồ sơ vụ án, năm 1998 ông Kiểm là người thuê nhà đã phân căn nhà số 14 Tự Quyết thành ba căn (địa chỉ hiện nay là 19A-21-23 Tự Quyết) để bán giấy tay cho ba chủ sử dụng là ông Phạm Chí Sơn, ông Hồ Tiền và vợ chồng ông Trần Văn Ngọc. Đến năm 2001, ông Kiểm tranh chấp với ba hộ trên để đòi lại nhà đã bán. Trải qua thời gian tranh chấp, sau đó chỉ còn lại vụ kiện ông Kiểm kiện đòi lại nhà với ông Phạm Chí Sơn được giải quyết. Năm 2015, TAND TP.HCM xử sơ thẩm đã tuyên hủy hợp đồng mua bán nhà và yêu cầu ông Sơn phải trả nhà (21 Tự Quyết) cho ông Kiểm. Đến năm 2016, ông Kiểm qua đời. Năm 2017, TAND cấp cao tại TP.HCM xử phúc thẩm yêu cầu phía ông Sơn phải trả lại nhà đất cho người thừa kế của ông Kiểm.Giao trả nhà của Nhà nước có đúng?Sau khi có bản án phúc thẩm, chấp hành viên tiến hành thi hành bản án theo quy định. Và suốt thời gian qua, ông Sơn liên tục gửi đơn khiếu nại và cầu cứu đến nhiều cơ quan chức năng để phản đối việc cơ quan thi hành án đòi cưỡng chế giao căn nhà cho người thừa kế của ông Kiểm.Vào giữa năm 2019, Cục Thi hành án dân sự TP.HCM cũng từng hoãn thi hành án, cưỡng chế giao nhà vì ""tránh tình trạng khiếu kiện phức tạp"".Gần đây, phía Viện kiểm sát đã có văn bản thông báo không kháng nghị giám đốc thẩm đối với kiến nghị của UBND TP. Kiểm sát viên nhận định căn nhà ông Kiểm bán cho ông Sơn là nhà ông Kiểm thuê của Nhà nước. Mặc dù hợp đồng thuê hết hạn nhưng bên cho thuê chưa có quyết định chấm dứt hoặc thanh lý hợp đồng thuê. Mặt khác, quá trình giải quyết vụ án, Đội quản lý nhà tham gia với tư cách là người có quyền lợi và nghĩa vụ liên quan không yêu cầu trả lại nhà cho chủ sở hữu nhà nước. Như vậy, lợi ích nhà nước trong vụ án không bị xâm phạm. Việc tòa tuyên hủy hợp đồng mua bán nhà giữa ông Sơn và ông Kiểm vì vô hiệu và buộc phía ông Sơn trả lại nhà đất cho các thừa kế của ông Kiểm là đúng.Căn cứ thông báo không kháng nghị giám đốc thẩm của Viện kiểm sát, Thi hành án tiếp tục yêu cầu ông Sơn phải giao trả nhà cho người thừa kế ông Kiểm. Tuy nhiên, ông Sơn không đồng ý mà chỉ muốn giao trả lại nhà cho Nhà nước vì ""nhà thuộc sở hữu nhà nước, không thể trả cho phía ông Kiểm là người không sở hữu nhà"".Trao đổi với Tuổi Trẻ, luật sư Hứa Thị Thảo (Đoàn luật sư TP.HCM), nêu quan điểm đồng tình với kiến nghị kháng nghị của UBND TP.HCM. Theo luật sư Thảo, tư cách tham gia tố tụng là người có quyền lợi nghĩa vụ liên quan trong vụ án phải là UBND TP.HCM chứ không phải là Đội quản lý nhà quận Tân Phú.Vì UBND TP mới là đại diện chủ sở hữu nhà đất. Chỉ khi UBND TP ủy quyền cho Đội quản lý nhà quận Tân Phú tham gia tố tụng thì tư cách tố tụng của Đội quản lý nhà mới hợp pháp.Bên cạnh đó, hợp đồng thuê nhà giữa ông Kiểm và Nhà nước đã hết hạn thì dù chưa có quyết định chấm dứt hay thanh lý (chỉ là thủ tục) thì quyền gắn liền với đối tượng thuê nhà của ông Kiểm cũng không còn cơ sở pháp lý. Nhà đất thuộc sở hữu nhà nước, ông Kiểm cũng không có quyền để lại cho các thừa kế."
20221103155851831,https://tuoitre.vn/khoi-to-them-nhieu-can-bo-o-dong-nai-lien-quan-vu-an-ba-nguyen-thi-thanh-nhan-20221103155851831.htm,Khởi tố thêm nhiều cán bộ ở Đồng Nai liên quan vụ án bà Nguyễn Thị Thanh Nhàn,https://cdn1.tuoitre.vn/zoom/600_315/2022/10/22/bv-da-khoa-dong-nai-16664063463521808235156-crop-16674681595651730363611.jpg,03/11/2022 17:03 GMT+7,"TTO - Mở rộng vụ án tại Bệnh viện Đa khoa tỉnh Đồng Nai, cơ quan điều tra khởi tố thêm nhiều cán bộ của tỉnh này để điều tra tội vi phạm quy định về đấu thầu.",Pháp luật,,"Ngày 3-11, xác nhận với Tuổi Trẻ Online, một lãnh đạo cơ quan tố tụng cho biết Cơ quan cảnh sát điều tra Bộ Công an (C03) đã khởi tố thêm nhiều bị can trong quá trình mở rộng điều tra vụ án hình sự ""vi phạm quy định về đấu thầu gây hậu quả nghiêm trọng"" xảy ra tại Bệnh viện Đa khoa tỉnh Đồng Nai, Công ty cổ phần Tiến Bộ Quốc Tế (AIC) và các đơn vị liên quan.Theo nguồn tin của Tuổi Trẻ Online, C03 đã tống đạt quyết định khởi tố đối với các bị can: Trịnh Huy Cường - nguyên phó giám đốc Trung tâm Kiểm định và Tư vấn xây dựng Đồng Nai (khi bị khởi tố là trưởng phòng quản lý xây dựng Sở Xây dựng); Phan Thành An - nguyên trưởng phòng thẩm định và Nguyễn Thành Thái, Lê Lâm Đồng - cùng là nguyên cán bộ của trung tâm này.Một tổ công tác của C03 cũng tống đạt quyết định khởi tố các ông bà: Chu Văn Hiếu, nguyên phó giám đốc Trung tâm Tư vấn công nghiệp (khi bị khởi tố là phó giám đốc Trung tâm Khuyến công tỉnh Đồng Nai); Nguyễn Thị Nhung, nguyên phó giám đốc phụ trách Trung tâm Tư vấn xây dựng Đồng Nai.Bước đầu, theo nguồn tin, hai bị can Cường và Đồng được áp dụng biện pháp tại ngoại cấm đi khỏi nơi cư trú. Bà Nhung bị C03 bắt tạm giam để điều tra.Viện Kiểm sát nhân dân tối cao đã phê chuẩn các quyết định tố tụng trên.Nhóm cán bộ này của tỉnh Đồng Nai bị điều tra về tội vi phạm quy định về đấu thầu gây hậu quả nghiêm trọng và tội thiếu trách nhiệm gây hậu quả nghiêm trọng. Nhóm bị can này từng tham gia thẩm định các gói thầu ở Bệnh viện Đa khoa tỉnh Đồng Nai.Hiện cơ quan điều tra đang làm rõ thêm hành vi sai phạm của một số cán bộ khác của tỉnh Đồng Nai.Mới đây, C03 cũng khởi tố bị can, thực hiện lệnh bắt tạm giam ông Đinh Quốc Thái - cựu chủ tịch UBND tỉnh Đồng Nai và ông Trần Đình Thành - cựu bí thư Tỉnh ủy Đồng Nai. Cả hai cựu lãnh đạo này đều bị điều tra về tội nhận hối lộ.Bà Bồ Ngọc Thu - cựu giám đốc Sở Kế hoạch và Đầu tư tỉnh - bị bắt tạm giam về tội lợi dụng chức vụ, quyền hạn trong khi thi hành công vụ.  Ông Thái là trưởng Ban chỉ đạo dự án xây dựng Bệnh viện Đa khoa tỉnh Đồng Nai, còn bà Bồ Ngọc Thu là phó ban chỉ đạo thường trực dự án này.  Trước đó, cơ quan điều tra khởi tố bị can, ra lệnh bắt tạm giam bà Nguyễn Thị Thanh Nhàn, chủ tịch hội đồng quản trị kiêm tổng giám đốc Công ty AIC. Thời điểm C03 thực hiện lệnh bắt tạm giam, bà Nhàn đã bỏ trốn nên cơ quan điều tra ra quyết định truy nã.  Cơ quan điều tra cũng ra quyết định khởi tố bị can, thực hiện lệnh bắt tạm giam ông Phan Huy Anh Vũ, giám đốc Sở Y tế, nguyên giám đốc Bệnh viện Đa khoa tỉnh Đồng Nai.  Kết quả điều tra ban đầu xác định bị can Vũ và Nhàn móc ngoặc với đơn vị thẩm định giá, thực hiện nhiều hành vi sai phạm trong quá trình xây dựng Bệnh viện Đa khoa tỉnh Đồng Nai, gây thiệt hại cả trăm tỉ đồng.  Bị can Vũ đã ký thủ tục, hồ sơ đấu thầu 12 gói thầu mà Công ty AIC do Nguyễn Thị Thanh Nhàn làm chủ tịch hội đồng quản trị trúng thầu tại dự án xây dựng Bệnh viện Đa khoa tỉnh Đồng Nai, để mua sắm thiết bị y tế với tổng giá trị hơn 476 tỉ đồng.  Ông Phan Huy Anh Vũ, khi đó là giám đốc Bệnh viện Đa khoa tỉnh Đồng Nai, có hành vi thông đồng, móc ngoặc với đơn vị thẩm định giá để lập, phê duyệt báo cáo thẩm định 11/12 gói thầu do Công ty AIC trúng thầu với giá cao hơn so với giá pháp luật quy định.Cơ quan điều tra xác định các hành vi trên đã vi phạm nghiêm trọng các quy định của Luật đấu thầu, gây thiệt hại tài sản nhà nước hơn 152 tỉ đồng.  Cơ quan cảnh sát điều tra Bộ Công an cho biết đang tiếp tục điều tra triệt để, mở rộng vụ án và áp dụng các biện pháp theo luật định để thu hồi triệt để tài sản cho Nhà nước."
20221103165009991,https://tuoitre.vn/vien-kiem-sat-de-nghi-toa-xac-dinh-lai-that-thoat-trong-vu-ban-re-du-an-phuoc-kien-ven-song-20221103165009991.htm,"Viện Kiểm sát đề nghị tòa xác định lại thất thoát trong vụ bán rẻ dự án Phước Kiển, Ven Sông",https://cdn1.tuoitre.vn/zoom/600_315/2022/11/3/vs-16674737656641049897136-crop-1667473785541111605995.jpg,03/11/2022 17:01 GMT+7,"TTO - Viện trưởng Viện Kiểm sát nhân dân TP.HCM đã ký quyết định kháng nghị phúc thẩm đối với bản án sơ thẩm của TAND TP.HCM liên quan vụ bán rẻ hai dự án Phước Kiển, Ven Sông.",Pháp luật,,"Theo kháng nghị, quá trình điều tra, xét xử vụ án và bản án hình sự sơ thẩm cũng đã xác định rõ việc Công ty Tân Thuận chuyển nhượng khu dân cư Ven Sông, khu dân cư Phước Kiển cho Công ty Quốc Cường Gia Lai là trái quy định của Nhà nước về quản lý, sử dụng tài sản Nhà nước gây thất thoát, lãng phí. Hành vi phạm tội của các bị cáo bị Viện Kiểm sát nhân dân (VKSND) TP.HCM truy tố và hội đồng xét xử tuyên án về tội Vi phạm quy định về quản lý, sử dụng tài sản Nhà nước gây thất thoát, lãng phí.  Điều đó khẳng định các hành vi phạm tội phải được xác định kéo dài từ khi hành vi đó xảy ra cho đến khi Nhà nước lấy lại được quyền quản lý tài sản hoặc khi tội phạm bị ngăn chặn (khi khởi tố vụ án).  Vì vậy, thiệt hại phải tính đến thời điểm hai bên hủy hợp đồng ở dự án Phước Kiển và thời điểm cơ quan điều tra ra quyết định khởi tố vụ án ở dự án Ven Sông. Mặt khác, chính hội đồng xét xử cũng xác định hành vi phạm tội của các bị cáo đã gây thiệt hại thực tế cho Nhà nước (ở đây là Công ty Tân Thuận) tính tới ngày khởi tố vụ án chưa được khắc phục 283 tỉ đồng. Từ đó cho thấy việc hội đồng xét xử nhận định và quyết định thời điểm xác định tài sản Nhà nước bị thất thoát, lãng phí khi hành vi phạm tội xảy ra là không có căn cứ. Từ đó, viện trưởng VKSND TP.HCM đã kháng nghị một phần bản án sơ thẩm của TAND TP.HCM về phần xác định thời điểm thất thoát tài sản Nhà nước trong vụ án. Đồng thời, VKSND TP.HCM đề nghị TAND cấp cao tại TP.HCM xét xử phúc thẩm vụ án theo hướng xác định thời điểm thất thoát tài sản Nhà nước trong vụ án thực tế là số tiền Nhà nước bị thất thoát cho đến khi được ngăn chặn (tức thời điểm Cơ quan An ninh điều tra Công an TP.HCM ra quyết định khởi tố vụ án)."
20221103154713253,https://tuoitre.vn/bat-them-6-nguoi-lien-quan-den-vu-no-sung-o-phu-quoc-20221103154713253.htm,Bắt thêm 6 người liên quan đến vụ nổ súng ở Phú Quốc,https://cdn1.tuoitre.vn/zoom/600_315/2022/11/3/anh-2-16674652110252138974955-crop-1667465228484515025105.jpg,03/11/2022 16:30 GMT+7,"TTO - Công an tỉnh Kiên Giang cho biết đã bắt thêm 6 người liên quan đến vụ nổ súng ở Phú Quốc, đến nay đã có tổng cộng 44 người bị bắt.",Pháp luật,,"Chiều 3-11, đại tá Diệp Văn Thế - phó giám đốc Công an tỉnh Kiên Giang - cho biết tính từ ngày 27-10 đến nay, Công an tỉnh Kiên Giang đã bắt tổng cộng 44 người liên quan đến vụ nổ súng ở Phú Quốc (có 5 người tự ra đầu thú).Theo đại tá Thế, 44 người này có dấu hiệu phạm tội với nhiều tội danh khác nhau như: giết người, gây rối trật tự công cộng, hủy hoại tài sản, cố ý gây thương tích, sử dụng, tàng trữ trái phép vũ khí quân dụng, tội bao che… Lực lượng chức năng địa phương vẫn đang tiếp tục mở rộng điều tra. ""Liên quan đến khẩu súng bắn đạn hoa cải, Đoàn Thiên Long cũng khai nhận súng này có xuất xứ từ miền Bắc. Công an hiện cũng đang điều tra thông tin liên quan và quyết tâm phá án sớm"", đại tá Thế cho biết thêm.Như Tuổi Trẻ Online đưa tin, khoảng 11h30 ngày 27-10, ở khu vực Bến Tràm, xã Cửa Dương, TP Phú Quốc đã xảy ra vụ nổ súng khiến 2 người chết và 4 người bị thương.Nguyên nhân là do mâu thuẫn tranh chấp đất đai giữa nhóm Võ Văn Lượng và Bùi Minh Trung (ở Cà Mau - hiện ở phường Dương Đông, TP Phú Quốc) với nhóm Khúc Văn Đoài (ở xã Cửa Dương).Công an tỉnh Kiên Giang cho biết vụ nổ súng trên do 4 người chủ mưu, cầm đầu gồm: Võ Văn Lương (tức Hai Lượng, Cà Mau), Bùi Minh Trung (Cà Mau), Bùi Đức Ngọc (Hải Phòng), Nguyễn Văn Thái (phường An Thới, Phú Quốc).Còn Đoàn Thiên Long (TP.HCM) là người trực tiếp dùng súng bắn vào các nạn nhân.Đến nay, công an đã thu giữ được 2 khẩu súng, 19 viên đạn, 1 dấu giả của ấp và tạm giữ 1 ô tô..."
20221103151356603,https://tuoitre.vn/cong-an-tphcm-de-nghi-truy-to-ba-phuong-hang-toi-loi-dung-quyen-tu-do-dan-chu-20221103151356603.htm,"Công an TP.HCM đề nghị truy tố bà Phương Hằng tội lợi dụng quyền tự do, dân chủ",https://cdn1.tuoitre.vn/zoom/600_315/2022/3/25/khoi-to-ba-phuong-hang-1read-only-16481684221211023650155-crop-16674630250721288878411.jpg,03/11/2022 15:24 GMT+7,"TTO - Công an TP.HCM đã ban hành kết luận điều tra, chuyển hồ sơ sang Viện KSND TP.HCM đề nghị truy tố bà Nguyễn Phương Hằng, tổng giám đốc Công ty cổ phần Đại Nam, về tội lợi dụng các quyền tự do dân chủ...",Pháp luật,,"Bà Nguyễn Phương Hằng bị đề nghị truy tố vì tội ""lợi dụng các quyền tự do dân chủ xâm phạm lợi ích của Nhà nước, quyền, lợi ích hợp pháp của tổ chức, cá nhân"".Theo nội dung vụ án, khoảng tháng 3-2021, thông qua các tài khoản mạng xã hội YouTube và TikTok, bà Nguyễn Phương Hằng đã tổ chức nhiều buổi livestream để nói về nhiều chủ đề, nhiều nội dung khác nhau được nhiều người theo dõi, chia sẻ, bình luận.Tại các buổi livestream, bà Hằng đã phát ngôn những nội dung về chuyện bí mật đời tư cá nhân và những nội dung gây ảnh hưởng uy tín, danh dự của nhiều nghệ sĩ.Bà Nguyễn Phương Hằng đã lợi dụng sức ảnh hưởng của bản thân, sử dụng chức năng của mạng xã hội trên Internet, tổ chức nhiều buổi phát trực tiếp nội dung thông tin không kiểm chứng, liên quan đến đời tư của người khác, trong đó sử dụng những ngôn từ mang tính chất nhục mạ, xúc phạm danh dự, nhân phẩm.Tháng 3-2022, Cơ quan cảnh sát điều tra Công an TP.HCM đã khởi tố vụ án, khởi tố bị can và thực hiện lệnh bắt bị can để tạm giam đối với bà Nguyễn Phương Hằng.Quá trình điều tra, Cơ quan cảnh sát điều tra Công an TP.HCM đã mở rộng vụ án và mời nhiều cá nhân liên quan lên làm việc như ông Đặng Anh Quân, ông Nguyễn Đình Kim, ông Huỳnh Công Tân, bà Lê Thị Thu Hà, bà Nguyễn Thị Mai Nhi…Sau đó, Viện KSND TP.HCM đã trả hồ sơ, đề nghị Cơ quan cảnh sát điều tra Công an TP.HCM điều tra làm rõ hành vi đồng phạm của những cá nhân có liên quan, tham gia giúp sức cho hoạt động của bị can Nguyễn Phương Hằng; đồng thời, xem xét việc nhập vụ án liên quan đến bị can Hằng do Công an tỉnh Bình Dương khởi tố để giải quyết triệt để vụ án.Mới đây, Cơ quan cảnh sát điều tra Công an tỉnh Bình Dương đã chuyển hồ sơ, đề nghị Công an TP.HCM nhập vụ án để điều tra đối với bà Nguyễn Phương Hằng.Vào tháng 9-2022, Cơ quan cảnh sát điều tra Công an tỉnh Bình Dương đã kết thúc điều tra đối với bà Hằng về tội ""lợi dụng các quyền tự do, dân chủ xâm phạm lợi ích của Nhà nước, quyền, lợi ích hợp pháp của tổ chức, cá nhân"".Cơ quan chức năng Bình Dương đã kết luận giám định hàng chục buổi livestream (phát sóng trực tiếp) của bà Hằng trong hai năm 2021, 2022, trong đó xác định các buổi livestream này ""có chứa nội dung xúc phạm, xúc phạm nghiêm trọng uy tín, danh dự cá nhân"".Sáu cá nhân được Cơ quan cảnh sát điều tra Công an tỉnh Bình Dương xác định là bị hại gồm: ca sĩ Đàm Vĩnh Hưng, ca sĩ Thủy Tiên, Công Vinh, nhà báo Hàn Ni, nhà báo Nguyễn Đức Hiển và bà Đinh Thị Lan."
20221103145626461,https://tuoitre.vn/nguoi-lai-sieu-xe-ferrari-dung-chet-nguoi-ra-dau-thu-20221103145626461.htm,Người lái siêu xe Ferrari đụng chết người ra đầu thú,https://cdn1.tuoitre.vn/zoom/600_315/2022/11/3/tai-nan-1667462024228693036341-crop-16674620557721785381706.png,03/11/2022 15:15 GMT+7,"TTO - Sau khi tài xế điều khiển siêu xe ra đầu thú, cơ quan công an đã trưng cầu Trung tâm Pháp y Hà Nội lấy máu, mẫu nước tiểu của người này để giám định cồn, chất gây nghiện phục vụ quá trình xác minh nguyên nhân, diễn biến vụ tai nạn.",Pháp luật,,"Ngày 3-11, theo thông tin từ Công an TP Hà Nội, Hoàng Bằng Việt - 25 tuổi, trú tại phường Mỹ Đình 2, quận Nam Từ Liêm - đã đến Cơ quan cảnh sát điều tra Công an TP đầu thú và khai nhận là người điều khiển siêu xe Ferrari đụng chết người.Lời khai ban đầu tại cơ quan công an, Việt nhận mình là người lái chiếc siêu xe màu đỏ, gây ra vụ tai nạn giao thông nghiêm trọng tại đường Lê Quang Đạo (quận Nam Từ Liêm) vào lúc 5h ngày 31-10.  Tại khu vực trước cổng Liên đoàn Bóng đá Việt Nam, siêu xe này va chạm với xe máy đi phía trước, khiến ông L.Đ.T. (58 tuổi, là người điều khiển xe máy) chết tại chỗ.  Cú đâm mạnh khiến xe máy biến dạng, xe Ferrari hư hỏng phần đầu.  Khi xảy ra tai nạn, trên siêu xe có Việt và chị N.T.N.A. - 34 tuổi, trú tại quận 8, TP.HCM. Sau khi gây tai nạn, do hoảng sợ, cả hai người này đã rời khỏi hiện trường.  Cơ quan công an cho biết đến 22h ngày 1-11, Hoàng Bằng Việt đã đến Cơ quan cảnh sát điều tra Công an TP Hà Nội đầu thú.  Cơ quan cảnh sát điều tra đã ra quyết định trưng cầu Trung tâm Pháp y Hà Nội lấy máu, mẫu nước tiểu giám định cồn, chất gây nghiện đối với Hoàng Bằng Việt.  Công an Hà Nội đang tiếp tục tiến hành các biện pháp điều tra, thu thập tài liệu để làm rõ nguyên nhân, diễn biến vụ tai nạn giao thông trên và xử lý theo quy định của pháp luật.  Trước đó, Công an Hà Nội cũng thông tin, sau khi xảy ra tai nạn, lực lượng chức năng đã có mặt bảo vệ hiện trường, tiến hành các biện pháp điều tra theo quy định.  Kết quả tra cứu cơ sở dữ liệu đăng ký, quản lý phương tiện cho thấy ô tô Ferrari gây tai nạn nói trên đứng tên chủ sở hữu là người nước ngoài."
