id,link,title,thumbnail,time,summary,category,sub_category,full_article
20221108121741068,https://tuoitre.vn/doi-dien-cua-tu-ganh-chi-phi-dieu-tri-khung-vi-mac-sot-xuat-huyet-nang-20221108121741068.htm,"Đối diện 'cửa tử', gánh chi phí điều trị 'khủng' vì mắc sốt xuất huyết nặng",https://cdn1.tuoitre.vn/zoom/600_315/2022/11/8/sot-xuat-huyet-2-1656073143361645238209-16678833840221416058746-crop-16678833928032032194824.jpg,08/11/2022 13:06 GMT+7,"TTO - Trước nay khỏe mạnh, nhưng khi mắc sốt xuất huyết, bệnh nhân Nguyễn Thị Mỹ Phương chuyển nặng với “8 phần chết, 2 phần sống”. Gần một tháng cứu chữa, bệnh nhân vượt ""cửa tử"" nhưng gia đình phải gánh tổng chi phí điều trị hơn 260 triệu đồng.",Sức khỏe,,"Chia sẻ với Tuổi Trẻ Online sáng 8-11, bà Nguyễn Thị Mỹ Dung - mẹ của bệnh nhân Nguyễn Thị Mỹ Phương (33 tuổi, ngụ tỉnh Đồng Nai) - cho biết con bà đã xuất viện về nhà vào ngày 7-11, sau gần một tháng điều trị sốt xuất huyết tích cực. Hiện sức khỏe chị Phương đã ổn định, nhưng chỉ được ăn thức ăn lỏng và chân còn yếu nên chưa thể tự đi đứng được. Bà Dung nhớ lại thời điểm con bà bắt đầu có triệu chứng sốt cao, nhức đầu nhiều vào đầu tháng 10. Sau đó con bà Dung còn bị nôn ói và nặng hơn nên gia đình đưa đến Bệnh viện Lê Văn Thịnh (TP Thủ Đức, TP.HCM). Sau hơn ba ngày điều trị, bệnh nhân vẫn còn nguy kịch nên chuyển đến Bệnh viện Bệnh nhiệt đới. Tại đây, bác sĩ thông báo chị Phương mắc sốt xuất huyết thể nặng, sốc, tổn thương gan nặng, suy thận, viêm phổi... nên cơ hội sống rất thấp. “Vừa đưa con vào bệnh viện, bác sĩ nói con chỉ còn 2 phần sống, 8 phần còn lại đã chết, gia đình chuẩn bị tinh thần. Tôi bàng hoàng, khóc rất nhiều như chết ngất. Các thành viên của gia đình có mặt ở đây nói bác sĩ ráng cứu giúp Phương”, bà Dung nói. Sau 18 ngày điều trị tích cực (thở máy, lọc máu, thay huyết tương, dùng kháng sinh…) tại khoa cấp cứu - hồi sức tích cực chống độc người lớn, bệnh nhân Phương đã tỉnh dậy, không còn thở máy. Sau đó, bệnh nhân tiếp tục chuyển đến tại khoa nội B điều trị, theo dõi. Bác sĩ Nguyễn Thị Hồng Lan - trưởng khoa nội B - cho biết bệnh nhân đã được dùng nhiều kỹ thuật cao, phương pháp điều trị đặc hiệu và thời gian điều trị kéo dài nên tổng chi phí lên đến hơn 260 triệu đồng, thế nhưng bệnh nhân lại không có bảo hiểm y tế (BHYT) nên phải tự chi trả toàn bộ số tiền này. Bà Dung cho biết thêm, do hoàn cảnh gia đình khó khăn nên tất cả các thành viên trong gia đình đều không mua BHYT, trừ hai đứa con của chị Phương có thẻ BHYT mua tại trường học. Với tổng chi phí “khủng”, gia đình bà Dung rất lo lắng, chạy khắp nơi xin, mượn, vay tiền. Cùng với sự hỗ trợ của nhà hảo tâm, tính đến nay gia đình còn gần 100 triệu đồng phải thanh toán cho bệnh viện. “Tôi cảm ơn y bác sĩ bệnh viện rất nhiều, không những đã cứu chữa con tôi được sống mà còn lo lắng, vận động nhà hảo tâm hỗ trợ chi phí điều trị vì con tôi không có BHYT”, bà Dung nói. Không chỉ sốt xuất huyết gây bệnh nặng ở người lớn mà còn cả ở trẻ em. Bác sĩ Đỗ Châu Việt - trưởng khoa hồi sức bệnh nhiễm và COVID-19 Bệnh viện Nhi đồng 2 (TP.HCM) - cho biết bệnh viện từng tiếp nhận và điều trị bệnh nhi trên 6 tuổi mắc sốt xuất huyết nặng, phải lọc máu và thay huyết tương 5 chu kỳ với tổng chi phí lên đến hơn 120 triệu đồng. Dù đã nỗ lực cứu chữa nhưng bệnh nhi không qua khỏi. Bệnh nhi này đã nghỉ học, nhà nghèo, ở tỉnh nên không có BHYT. Bệnh viện phải kêu gọi nhà hảo tâm và duyệt miễn phí hỗ trợ. “Các bé bị sốt xuất huyết nặng thường trên 6 tuổi nên nhóm này phải mua BHYT gấp. Nếu trẻ đi học sẽ có bảo hiểm học sinh nhưng bé này nghỉ học và đã tử vong sau thời gian cứu chữa”, bác sĩ Việt chia sẻ."
20221108103519867,https://tuoitre.vn/mot-vet-xuoc-nho-tren-chao-chong-dinh-giai-phong-hang-nghin-vi-nhua-20221108103519867.htm,Một vết xước nhỏ trên chảo chống dính giải phóng hàng nghìn vi nhựa,https://cdn1.tuoitre.vn/zoom/600_315/2022/11/8/photo-1-1667877983449140247602-crop-16678784756542069719952.jpg,08/11/2022 12:48 GMT+7,"TTO - Có tới 9.100 hạt vi nhựa sẽ ngấm vào thực phẩm chỉ qua một vết xước nhỏ trên nồi, chảo chống dính. Điều này sẽ gây tổn hại không nhỏ đến sức khỏe lâu dài của chúng ta.",Sức khỏe,,"Nồi, chảo chống dính là một dụng cụ yêu thích trong mỗi căn bếp. Nó giúp chế biến đồ ăn dễ dàng mà không lo bị dính thực phẩm vào đáy chảo. Nhưng lớp phủ chống dính không tồn tại mãi, chúng dễ bị trầy xước sau một thời gian nấu nướng và cọ rửa. Việc đánh giá lượng vi nhựa được thải ra trong quá trình nấu ăn và cọ rửa các đồ dùng nhà bếp này là rất khó.Đây là lý do các nhà nghiên cứu tại Đại học Newcastle và Đại học Finders  (Úc) muốn tìm hiểu thêm về những nguy cơ tiềm ẩn của việc sử dụng chảo chống dính khi lớp phủ bị xước. Các hạt vi nhựa khó phát hiện hơn các loại nhựa khác vì chúng quá nhỏ. Các nhà khoa học đã sử dụng máy quang phổ Raman và thông qua tán xạ của hạt photon để nghiên cứu vi nhựa và nano trên lớp phủ chống dính ở cấp độ phân tử. Sau đó tính toán lượng lớp phủ này có thể bị bung ra và ngấm vào thức ăn.Kết quả cho thấy có tới 9.100 hạt vi nhựa sẽ ngấm vào thực phẩm chỉ qua một vết xước nhỏ trên chảo, nồi phủ lớp chống dính. Đối với những chiếc chảo xước nhiều, mỗi 30 giây nấu trên bếp nóng, cũng có thể giải phóng khoảng 2,3 triệu hạt vi nhựa.Tác động về mức độ nguy hiểm của sự giải phóng vi nhựa trong quá trình nấu nướng vẫn đang được nghiên cứu.    Các nhà  khoa học khuyến cáo chị em nội trợ nên thay nồi, chảo mới sau một thời gian nhất định. Không chỉ là nồi, chảo, mà tất cả các dụng cụ nhà bếp phủ lớp chống dính Teflon đều nên được thay thường xuyên. Bởi vì ngay cả khi lớp phủ không bị trầy xước, thì việc làm nóng thường xuyên cũng khiến hàng triệu vi nhựa thoát ra.Điều đáng lưu tâm là lớp chống dính Teflon (hoặc Polytetrafluoroethylene) nằm trong nhóm ""hóa chất vĩnh viễn"" per và polyfluoroalkyl (PFAS) rất độc hại với môi trường và sức khỏe con người.   PFAS có khả năng tích tụ theo thời gian trong cơ thể người, đất, nước, không khí và không thể phân hủy.  Một số nghiên cứu trước đây chứng minh rằng nếu nhiễm quá nhiều hóa chất này, một người khỏe mạnh có thể giảm khả năng sinh sản, tăng lượng cholesterol, gia tăng nguy cơ béo phì hoặc tăng nguy cơ mắc ung thư tuyến tiền liệt, thận và tinh hoàn. Trẻ em có thể dậy thì sớm hoặc chậm phát triển."
2022110723292605,https://tuoitre.vn/tin-sang-8-11-giai-ngan-4-000-ti-dong-kham-chua-benh-bi-treo-go-kho-cho-kinh-doanh-xang-dau-2022110723292605.htm,Tin sáng 8-11: Giải ngân 4.000 tỉ đồng khám chữa bệnh bị 'treo'; Gỡ khó cho kinh doanh xăng dầu,https://cdn1.tuoitre.vn/zoom/600_315/2022/10/8/3070751187710752006615884215643170140491594n-1665189821126940148756-crop-1667838495335579149112.png,08/11/2022 06:41 GMT+7,"TTO - Hơn 4.000 tỉ khám chữa bệnh 2021 bị 'treo' sẽ được trả, còn 2019-2020 vẫn vướng dẫn tới nhiều khó khăn cho bệnh viện; Hai bộ Tài chính - Công Thương bàn tháo gỡ khó khăn kinh doanh xăng dầu sau khi hỏi 34 đầu mối nhập khẩu... là tin đáng chú ý.",Sức khỏe,,"Hơn 4.000 tỉ đồng khám chữa bệnh năm 2021 bị ""treo"" sẽ được trảÔng Lê Văn Phúc - trưởng ban thực hiện chính sách bảo hiểm y tế (Bảo hiểm xã hội Việt Nam) - cho biết về cơ bản, các chi phí khám, chữa bệnh năm 2021 sẽ được tổng hợp và quyết toán.Theo ông Phúc, năm 2021, do ảnh hưởng của đại dịch COVID-19, số lượt khám, chữa bệnh giảm 25% nhưng chi phí bình quân của một đợt điều trị nội/ngoại trú đều tăng do đa phần là những bệnh nhân mắc bệnh nặng, mãn tính, không trì hoãn được. Vì vậy, một số cơ sở khám, chữa bệnh đã chi vượt tổng mức thanh toán với số tiền khá lớn, theo thống kê là hơn 4.000 tỉ đồng, chiếm đến hơn 4% tổng chi phí khám, chữa bệnh sau khi giám định.Ông Phúc cho rằng việc này do đặc thù của dịch COVID-19, vì vậy Bảo hiểm xã hội Việt Nam đồng thuận với Bộ Y tế kiến nghị Chính phủ cho phép năm 2021 thực hiện thanh toán theo giá dịch vụ, không áp dụng điều 24 của nghị định 146/NĐ-CP.Do quỹ bảo hiểm chi trả chi phí khám chữa bệnh 2021 sau khi bổ sung khoảng hơn 4.000 tỉ đang bị treo kể trên sẽ nâng tổng chi phí lên 94.000 tỉ đồng, ông Phúc cho rằng có thể ""tạo thuận lợi khi xác định tổng mức thanh toán của năm 2022 trên nền thanh toán, quyết toán của năm 2021"", nâng tổng mức thanh toán của năm 2022 cao hơn.Tuy nhiên, ngoài năm 2021 vượt trần, giai đoạn 2019-2020 còn hơn 4.000 tỉ đồng cũng đang bị ""treo"". Theo ông Phúc, khoản tiền này ""cần có ý kiến của Chính phủ vì tổng chi phí khám, chữa bệnh đã được Bảo hiểm xã hội Việt Nam quyết toán theo đúng quy định của nghị định 146. Nghị quyết số 144 chỉ áp dụng cho các khoản thanh toán của năm 2021 do có yếu tố đặc thù"".Theo tìm hiểu của Tuổi Trẻ Online, hiện nhiều bệnh viện trong cả nước đang bị quỹ bảo hiểm ""treo"" chi phí khám chữa bệnh như kể trên, đặc biệt là tại TP.HCM, khiến bệnh viện hết sức khó khăn do đã chi trả (theo ca bệnh) cho bệnh nhân từ năm 2019-2021.Hai bộ Tài chính - Công Thương bàn tháo gỡ khó khăn kinh doanh xăng dầuThông tin từ Bộ Tài chính cho biết trên cơ sở tổng hợp đề xuất kiến nghị của 28/34 thương nhân đầu mối kinh doanh xăng dầu, Bộ Tài chính đã có công văn số 1388 gửi Bộ Công Thương xin ý kiến về việc điều chỉnh chi phí đưa xăng dầu từ nước ngoài về Việt Nam.Bộ Tài chính cũng đề nghị Bộ Công Thương khẩn trương có ý kiến và gửi về Bộ Tài chính sớm để kịp thời điều chỉnh trong kỳ điều hành gần nhất. Đồng thời đề nghị Bộ Công Thương phối hợp tháo gỡ khó khăn vướng mắc trong hoạt động kinh doanh xăng dầu, đảm bảo nguồn cung xăng dầu cho hoạt động sản xuất kinh doanh và đời sống.Đây là lần thứ ba trong vòng gần một tháng qua, Bộ Tài chính có công văn gửi Bộ Công Thương đề nghị về việc này. Cụ thể gồm các công văn ngày 21-10, 2-11 và công văn kể trên.Năm 2025, Việt Nam có tới 200 sân golf Tại buổi tiếp ông Paul Stringer - chủ tịch Công ty thiết kế sân golf Nicklaus Design - về hoạt động du lịch golf của Việt Nam, Tổng cục trưởng Tổng cục Du lịch Nguyễn Trùng Khánh cho biết Việt Nam hiện có khoảng 100 sân golf, và mục tiêu đến năm 2025 sẽ có khoảng 200 sân golf phục vụ các golf thủ và du khách.""Du lịch golf  là loại hình du lịch được Việt Nam chú trọng phát triển trong những năm gần đây và đang thu hút du khách đến trải nghiệm. Trong thời gian tới, Tổng cục Du lịch mong muốn tổ chức những chương trình xúc tiến, quảng bá chuyên về du lịch golf. Điều này sẽ tạo thuận lợi rất lớn để du lịch golf của Việt Nam đến gần hơn với bạn bè thế giới"", ông Khánh cho biết.Năm 2021, Việt Nam đã nhận giải thưởng ""Điểm đến golf tốt nhất thế giới và châu Á"" lần thứ 2 (sau lần đầu nhận giải vào năm 2019), đồng thời cũng là năm thứ 5 liên tiếp được công nhận là Điểm đến golf tốt nhất châu Á (2017-2021) của Giải thưởng golf thế giới (World Golf Award - WGA). Với địa hình của Việt Nam có nhiều đồi núi, đường bờ biển dài, phong cảnh đẹp, là những lợi thế để phát triển các sân golf hiện đại, mang đẳng cấp thế giới.Ông Paul Stringer cho rằng muốn phát triển du lịch golf cần phải có những sân golf đẳng cấp. Việt Nam hiện tại đang có những lợi thế lớn về sân golf cùng cơ sở vật chất du lịch ngày càng được đầu tư hiện đại, dẫn đến các sân golf cũng trở nên hiện đại hơn.Số ca mắc COVID-19 liên tục ở mức thấpTheo báo cáo của Bộ Y tế, ngày 7-11 ghi nhận 365 ca mắc COVID-19 mới. Trong 10 ngày gần đây có tới sáu ngày số ca mắc mới ở mức dưới 400, 2/6 ngày này dưới 300 ca mắc mới/ngày.Cho đến nay Việt Nam đã tiêm chủng trên 262,3 triệu mũi vắc xin COVID-19."
20221107231015567,https://tuoitre.vn/vi-sao-nhieu-nguoi-tre-mac-benh-lao-20221107231015567.htm,Vì sao nhiều người trẻ mắc bệnh lao?,https://cdn1.tuoitre.vn/zoom/600_315/2022/11/7/benh-lao-1read-only-1667837139777792152344-crop-166783725044165252825.jpg,08/11/2022 06:00 GMT+7,"TTO - Nếu như trước đây bệnh lao chủ yếu xảy ra ở những bệnh nhân lớn tuổi, hiện nhiều người trẻ tuổi đã mắc phải bệnh lao. Theo ước tính mỗi năm nước ta có tới 13.000 trẻ em mắc bệnh lao cần phải điều trị.",Sức khỏe,,"Theo một báo cáo được công bố hồi cuối tháng 10, Tổ chức Y tế thế giới (WHO) ghi nhận mức tăng trong các ca mắc lao phổi là 4,5% so với cùng kỳ năm 2021. WHO cảnh báo số người mắc bệnh lao phổi trên toàn cầu đã tăng lần đầu tiên sau gần hai thập niên.Báo cáo của WHO nêu rõ trong tổng cộng 10,6 triệu người được chẩn đoán mắc bệnh lao phổi vào năm ngoái, 1,6 triệu người đã chết. Hằng năm Việt Nam có hơn 172.000 người đã mắc bệnh và 10.400 người chết do bệnh lao.Báo động nhiều người trẻ mắc bệnh laoThấy con trai mình 17 tuổi, đang theo học tại trường cấp III, sốt và ho liên tục, chị H.T.T. (44 tuổi, TP Thủ Đức) liền đưa con đến Bệnh viện Lê Văn Việt (TP.HCM) để thăm khám. Các bác sĩ tại đây chẩn đoán con chị bị lao phổi. Chị T. không tin vào kết quả chẩn đoán, tiếp tục đưa con đến Bệnh viện Phạm Ngọc Thạch để kiểm tra, chị khá suy sụp khi kết quả chẩn đoán con chị vẫn bị lao phổi, hiện đã được chuyển về địa phương để điều trị.""Tôi cứ nghĩ là cháu ho do COVID-19, chứ không nghĩ bệnh lao lại vận lên con mình khi còn quá trẻ như vậy, thường cũng chỉ thấy những người lớn tuổi, lao động nặng mới mắc lao. Giờ cháu phải bảo lưu kết quả học tập để điều trị bệnh"", chị T. rưng rưng nước mắt cho biết.Chị Hoa (19 tuổi, Hà Nội) đang làm công nhân may mặc tại Hà Nội. Cách đây khoảng hai tháng, Hoa có biểu hiện mệt mỏi, hay sốt về chiều, khạc đờm nhiều. Chị uống nhiều thuốc điều trị nhưng các triệu chứng không giảm. Sau đó, chị Hoa đi khám và được xác định là mắc bệnh lao phổi.Theo WHO ước tính số ca lao trẻ em mới mắc hằng năm tại Việt Nam chiếm khoảng 10 - 11% tổng số lao mắc mới. Như vậy, mỗi năm nước ta có tới 13.000 trẻ em mắc bệnh lao mới cần phải điều trị. Trong khi đó, mỗi năm Chương trình chống lao quốc gia mới chỉ phát hiện và quản lý điều trị được 10 - 13% số ca trẻ em mắc lao mới.Vì sao bệnh lao trẻ hóa?TS Nguyễn Như Vinh - trưởng khoa thăm dò chức năng hô hấp, Bệnh viện Đại học Y dược - cho biết trẻ em (nhất là trẻ em dưới 5 tuổi), người già, phụ nữ có thai thường có sức đề kháng kém, đây là những nhóm đối tượng rất dễ bị lao khi tiếp xúc với nhóm yếu tố nguy cơ.Ở bất cứ lứa tuổi nào khi làm việc quá mức, không nghỉ ngơi, ăn uống không điều độ, thức khuya làm cho sức đề kháng kém đi, khi gặp môi trường không thuận lợi, người bị nhiễm lao ho ra và sẽ bị lây.Theo ông Nguyễn Viết Nhung - giám đốc Bệnh viện Phổi trung ương, chủ nhiệm Chương trình chống lao quốc gia - lao ở trẻ em không phải là một bệnh hiếm gặp.Bệnh lao ở trẻ em khó phát hiện và chẩn đoán do các triệu chứng lâm sàng thường mờ nhạt, dễ nhầm lẫn với các bệnh lý khác.Thêm vào đó, số vi khuẩn ở trẻ em mắc lao, đặc biệt là thể lao sơ nhiễm - mới nhiễm rất ít nên khó phát hiện, đôi khi thầy thuốc vẫn lãng quên và không nghĩ đến có lao ở trẻ em.Theo bác sĩ Vinh, phác đồ điệu trị bệnh lao phổi hiện nay là 6 tháng, tương tự như COVID-19 khi điều trị lao thành công, nếu sức đề kháng yếu gặp người đang nhiễm nếu không cẩn thận sẽ có thể bị nhiễm lại. Tỉ lệ bệnh lao hiện nay của chúng ta có xu hướng ngày càng giảm, dịch COVID-19 người dân ít tiếp xúc, tăng cường đeo khẩu trang, rửa tay thường xuyên cũng khiến lao giảm đi.Phòng bệnh lao thế nào?Bác sĩ Vinh khuyến cáo bệnh lao là bệnh lây qua đường hô hấp, do vậy người bị nhiễm lao phải biết giữ gìn cho cộng đồng, không khạc, nhổ tại nơi công cộng, đặc biệt rất dễ lây cho người già, trẻ em. Người lớn khi có các triệu chứng như: ho kéo dài, sốt, sụt cân phải đi khám bệnh ngay. Trẻ nhỏ nếu không chịu lớn, gầy gò, bú kém cần phải đi khám để xem có lao hay không. Bản thân người dân nếu muốn phòng chống bệnh lao phải đeo khẩu trang, rửa tay thường xuyên, ăn uống điều độ, không học hành quá mức, ăn uống thất thường để phòng chống lao và có sức khỏe tốt.Ông Nguyễn Viết Nhung cũng khuyến cáo, để phòng ngừa bệnh lao, trẻ em cần được tiêm vắc xin BCG cho trẻ sơ sinh và trẻ nhỏ. Tuy nhiên vắc xin chỉ bảo vệ trẻ khỏi bệnh lao cho tới khi 15 tuổi và không tạo sự bảo vệ an toàn khi sử dụng cho trẻ sống chung với HIV.Vì vậy, trẻ em, đặc biệt là trẻ dưới 5 tuổi hay cơ địa suy giảm miễn dịch (suy dinh dưỡng, nhiễm HIV...) cần được tầm soát và điều trị dự phòng lao khi có tiếp xúc với người bệnh lao. Việc dự phòng lao có thể giảm 70 - 80% khả năng bị bệnh lao cho trẻ."
20221107225555911,https://tuoitre.vn/gan-200-tre-em-indonesia-chet-do-ton-thuong-than-lien-quan-siro-ho-20221107225555911.htm,Gần 200 trẻ em Indonesia chết do tổn thương thận liên quan siro ho,https://cdn1.tuoitre.vn/zoom/600_315/2022/11/7/siro-ho-indonesia-16678364930151083284047-crop-1667836546994980659204.png,07/11/2022 23:06 GMT+7,"TTO - Ngày 7-11, Bộ Y tế Indonesia thông báo số trẻ em chết do tổn thương thận cấp tính (AKI) liên quan đến một số loại thuốc siro ho đã tăng lên 195 ca, tăng hơn 60 ca so với con số được xác nhận đến ngày 21-10 vừa qua.",Sức khỏe,,"Trong một cuộc họp báo ngày 7-11, người phát ngôn Bộ Y tế Mohammad Syahril cho biết hơn 320 trường hợp mắc AKI đã được ghi nhận ở các tỉnh trên cả nước và 27 bệnh nhân vẫn đang nằm viện. Hầu hết trẻ em bị ảnh hưởng đều dưới 5 tuổi, theo Hãng thông tấn AFP.Theo ông Syahril, các kết quả xét nghiệm cho thấy đa số ca tử vong có liên quan đến sử dụng loại siro chứa lượng lớn ethylene glycol và diethylene glycol. Đây là hai hợp chất được dùng như loại chất chống đông trong các sản phẩm công nghiệp.Nhà chức trách đã nhập 246 lọ thuốc điều trị AKI, trong đó đa số do Singapore và Úc tặng. Những lọ thuốc này đang cho thấy kết quả điều trị tích cực.Indonesia thường ghi nhận 2-5 ca AKI/tháng. Tuy nhiên, sau khi ghi nhận các trường hợp AKI tăng đột biến kể từ tháng 8, nhà chức trách đã mở cuộc điều tra nguyên nhân dẫn đến tình trạng này. Hồi tháng trước, Cơ quan giám sát thuốc và thực phẩm Indonesia (BPOM) đã xác định được năm loại siro chứa lượng chất độc hại ở mức nguy hiểm và ra lệnh thu hồi, tiêu hủy toàn bộ. Cảnh sát sau đó mở cuộc điều tra một số công ty dược phẩm trong nước, trong đó có hai công ty đã bị tước giấy phép sản xuất.Các vụ trẻ em bị AKI bất thường ghi nhận đầu tiên tại Gambia. Quốc gia thuộc khu vực Tây Phi này báo cáo 70 trẻ tử vong nghi do liên quan đến thuốc siro nhập khẩu hồi tháng trước.Tổ chức Y tế thế giới (WHO) sau đó đã cảnh báo những ca tử vong gần đây tại Gambia có thể liên quan đến bốn sản phẩm siro trị ho và cảm lạnh là Promethazine Oral Solution, Kofexmalin Baby Cough Syrup, Makoff Baby Cough Syrup và Magrip N Cold Syrup. Các sản phẩm của công ty dược phẩm Maiden của Ấn Độ này có chứa một lượng lớn diethylene glycol và ethylene glyco. Nhà chức trách Ấn Độ sau đó đã vào cuộc điều tra và yêu cầu công ty nói trên ngừng sản xuất các loại siro trong danh sách cảnh báo của WHO."
