id,link,title,thumbnail,time,summary,category,sub_category,full_article
20221101093319898,https://tuoitre.vn/khai-tru-dang-cuu-vien-truong-vien-kiem-sat-huyen-luc-ngan-20221101093319898.htm,Khai trừ Đảng cựu viện trưởng Viện Kiểm sát nhân dân huyện Lục Ngạn,https://cdn1.tuoitre.vn/zoom/600_315/2022/11/1/vi-duc-ninh-luc-ngan-1667269383804698059789-crop-1667272466251841898517.jpeg,01/11/2022 10:30 GMT+7,"TTO - Ông Vi Đức Ninh - cựu viện trưởng Viện Kiểm sát nhân dân huyện Lục Ngạn (Bắc Giang) - bị khai trừ khỏi Đảng do vi phạm quy định của Đảng, pháp luật của Nhà nước về phòng, chống tham nhũng, tiêu cực.",Pháp luật,,"Theo nguồn tin của Tuổi Trẻ Online, sáng 1-11, Ban Thường vụ Tỉnh ủy Bắc Giang vừa ban hành quyết định thi hành kỷ luật khai trừ ra khỏi Đảng đối với ông Vi Đức Ninh - cựu viện trưởng Viện Kiểm sát nhân dân huyện Lục Ngạn.  Ông Vi Đức Ninh bị khai trừ ra khỏi Đảng do suy thoái về tư tưởng chính trị, đạo đức, lối sống; thiếu tu dưỡng, rèn luyện; vi phạm quy định những điều đảng viên không được làm và trách nhiệm nêu gương; vi phạm quy định Đảng, pháp luật của Nhà nước về phòng, chống tham nhũng, tiêu cực; bị cơ quan điều tra Viện Kiểm sát nhân dân tối cao khởi tố bị can và bắt tạm giam về tội ""nhận hối lộ"".Ban Thường vụ Tỉnh ủy Bắc Giang nhận định vi phạm của ông Ninh rất nghiêm trọng, gây dư luận xấu trong xã hội, làm mất uy tín của bản thân, giảm uy tín của tổ chức đảng, cơ quan nơi ông Ninh công tác.Như Tuổi Trẻ Online đưa tin, ngày 20-10, cơ quan điều tra Viện Kiểm sát nhân dân tối cao đã ra quyết định khởi tố vụ án hình sự về các tội nhận hối lộ, đưa hối lộ và môi giới hối lộ xảy ra tại huyện Lục Ngạn, Bắc Giang. Cơ quan điều tra khởi tố bị can, thực hiện lệnh bắt tạm giam ông Vi Đức Ninh về tội nhận hối lộ. Ông Hồ Anh Khoa, cựu cán bộ Cục Cảnh sát hình sự Bộ Công an, bị khởi tố về tội làm môi giới hối lộ.Ba người khác gồm: Phan Văn Hiếu, Dương Ngọc Quý, Nguyễn Thị Nhung, thường trú tại huyện Lục Ngạn, Bắc Giang, cùng bị khởi tố về tội làm môi giới hối lộ. Cả năm người trên cùng bị tạm giam 4 tháng.Trước đó ngày 14-8, tổ công tác Phòng Cảnh sát quản lý hành chính về trật tự xã hội, Công an tỉnh Bắc Giang phối hợp với Công an huyện Lục Ngạn kiểm tra hành chính tại quán karaoke Diamond thuộc tổ dân phố Lê Duẩn, thị trấn Chũ, huyện Lục Ngạn.  Tổ công tác phát hiện chín người sử dụng trái phép chất ma túy, trong đó có Đào Ngọc Sơn, Nguyễn Phạm Việt Nga, cùng trú tại TP Bắc Giang. Tại cơ quan điều tra, Nga thừa nhận về hành vi tổ chức sử dụng trái phép chất ma túy. Cơ quan cảnh sát điều tra Công an huyện Lục Ngạn đã ra quyết định tạm giữ đối với Nga và Sơn.Sau đó Quý, Hiếu, Nhung đã gặp gỡ, nhờ Hồ Anh Khoa, cán bộ Cục Cảnh sát hình sự Bộ Công an, đứng ra lo ""chạy án"". Khoa đã gặp và nhờ viện trưởng Viện Kiểm sát nhân dân huyện Lục Ngạn giúp đỡ nhằm giảm nhẹ tội cho hai người bị tạm giữ trong vụ tổ chức sử dụng trái phép chất ma túy.Đến ngày 25-8, Công an huyện Lục Ngạn đã khởi tố vụ án, khởi tố bị can và lệnh tạm giam đối với Nga về tội tổ chức, sử dụng trái phép chất ma túy. Do chưa đủ căn cứ khởi tố bị can đối với Đào Ngọc Sơn nên Viện Kiểm sát nhân dân huyện Lục Ngạn ra quyết định trả tự do cho Sơn."
2022110109343129,https://tuoitre.vn/bat-giam-doc-su-dung-bang-bac-si-gia-de-lam-rang-cong-nghe-cao-2022110109343129.htm,Bắt giám đốc sử dụng bằng bác sĩ giả để làm... răng công nghệ cao,https://cdn1.tuoitre.vn/zoom/600_315/2022/11/1/img3937-copy-16672696768202026361262-crop-1667272731092468092002.jpg,01/11/2022 10:26 GMT+7,"TTO - Vũ Xuân Tú đã mua 2 bằng giả chuyên ngành răng hàm mặt ở Bình Dương rồi về quê tại Thanh Hóa xin cấp chứng chỉ hành nghề. Sau đó, Tú vào An Giang lập công ty chuyên làm răng thì bị ngành chức năng phát hiện và bắt giữ.",Pháp luật,,"Ngày 1-11, Cơ quan cảnh sát điều tra Công an TP Long Xuyên, An Giang cho biết đã ký quyết định khởi tố vụ án, khởi tố bị can và lệnh bắt tạm giam bị can Vũ Xuân Tú (44 tuổi, ngụ phường Mỹ Bình, TP Long Xuyên, An Giang) về tội ""làm giả tài liệu của cơ quan tổ chức; sử dụng tài liệu giả của cơ quan, tổ chức"".    Theo kết quả điều tra, năm 2008, Tú đến thị xã Dĩ An, Bình Dương mua 2 bằng tốt nghiệp đại học hệ chính quy, ngành ""răng hàm mặt"" mang tên Vũ Xuân Tú.  Năm 2014, Tú đem văn bằng, chứng chỉ trên đến Sở Y tế tỉnh Thanh Hóa nộp hồ sơ để được cấp chứng chỉ hành nghề khám bệnh, chữa bệnh chuyên khoa răng hàm mặt và làm răng giả.  Ngày 15-10-2021, Tú sử dụng chứng chỉ hành nghề do Sở Y tế Thanh Hóa cấp đến Sở Kế hoạch và Đầu tư tỉnh An Giang để nộp hồ sơ thành lập Công ty TNHH Nha khoa công nghệ cao An Giang, do Tú làm giám đốc và điều hành.  Ngày 4-5, Đoàn thanh tra Sở Y tế tỉnh An Giang thanh tra việc chấp hành pháp luật về hành nghề y tại các cơ sở khám bệnh, chữa bệnh tư nhân trên địa bàn tỉnh An Giang, phát hiện phòng khám của Tú sử dụng văn bằng, chứng chỉ giả để hoạt động.  Vụ việc được chuyển cho Cơ quan cảnh sát điều tra Công an TP Long Xuyên để giải quyết theo thẩm quyền. Quá trình điều tra, Tú đã thừa nhận toàn bộ hành vi vi phạm của mình.  Hiện vụ việc đang được lực lượng Công an TP Long Xuyên tiếp tục điều tra, xử lý."
20221031184538129,https://tuoitre.vn/ba-nguoi-con-gai-mang-xang-dot-nha-me-de-xin-chia-dat-mat-tinh-than-20221031184538129.htm,"Ba người con gái mang xăng đốt nhà mẹ đẻ: Xin chia đất, mất tình thân",https://cdn1.tuoitre.vn/zoom/600_315/2022/10/31/hung-yen2-1667216314478160564397-crop-16672167255681846311542.jpg,31/10/2022 21:05 GMT+7,"TTO - Dùng búa phá dỡ tường nhà để đòi chia đất thừa kế nhưng bị mẹ can ngăn, ba cô con gái đang tâm phóng hỏa khiến mẹ và cả ba đều bỏng nặng.",Pháp luật,,"Một ngày sau vụ việc ba cô con gái mang xăng đến đốt nhà mẹ đẻ, ngôi nhà hai tầng khang trang ở thôn Thiên Lộc, xã Trung Hòa, huyện Yên Mỹ, Hưng Yên vẫn cửa đóng then cài.Xung quanh, người dân vẫn chưa hết bàng hoàng sau khi chứng kiến vụ việc đau lòng vì tranh chấp đất đai thừa kế mà cạn tình máu mủ.""Ngọn lửa đố kỵ""Dẫn phóng viên về lại hiện trường vụ việc, ông Đỗ Quang Lĩnh (người họ hàng của gia đình bà Đ.) đau xót cho biết gia đình bà V.T.Đ. (62 tuổi) và ông Đ.Đ.Đ. (sinh năm 1963, đã mất) sinh được bốn người con. Các con đều được đặt tên cùng vần Đ. giống bố mẹ, lần lượt là chị Đ.T.Đ. (sinh năm 1982), anh Đ.Đ.Đ. (sinh năm 1986), chị Đ.T.Đ. (sinh năm 1987) và con gái út Đ.T.Đ. (sinh năm 1988).Tình anh em ruột thịt thể hiện ngay ở tên gọi, chẳng ai nghĩ chỉ vì mâu thuẫn về đất đai thừa kế mà họ đành dứt tình máu mủ ruột rà.Một nhân chứng kể: sáng 30-10, chứng kiến ba người con gái của bà Đ. xách theo búa to cùng chiếc can bên trong có dung dịch màu xanh, láng giềng vẫn không nghĩ là xăng. Họ dùng búa đập tường, đòi lại phần đất chưa xây dựng đang xảy ra tranh chấp.""Khi nghe tiếng tranh cãi, mọi người ra xem. Sau đó, người con trai cầm búa vứt vào góc tường. Lúc sau, tôi thấy cả nhà vào trong đóng cửa nói chuyện. Một lúc nữa thì thấy mọi người hô hào cháy, người đem chăn, người dùng nước dập lửa, nạn nhân chạy ra có người cháy hết cả quần áo, tóc tai, da thịt"" - nhân chứng kể.Từ hôm qua đến nay, người con trai tất tả chạy ngược chạy xuôi lo cho mẹ tại Viện Bỏng quốc gia (Hà Nội). Ánh mắt thất thần, anh cho biết diễn biến vụ việc quá nhanh, chẳng ai ngăn kịp ngọn lửa bùng lên. Cánh cổng khóa trái, không ai vào được. Anh phải vùng ra khỏi nhà để mở cổng, kêu cứu hàng xóm láng giềng.""Quá đau lòng, toàn máu mủ ruột rà của mình nhưng chẳng biết làm thế nào..."" - anh Đ. nói.Anh cho rằng nguồn cơn vụ việc có lẽ từ lúc gia đình xây nhà mới, từ đó chị em trong gia đình sinh mâu thuẫn, lòng tham, đố kỵ nảy ra. Từ cuối năm 2020, người con gái thứ ba đã có đơn đề nghị hòa giải gửi đến UBND xã Trung Hòa về việc giải quyết phân chia tài sản thừa kế từ người cha để lại.Ba lần hòa giải không thànhTrong đơn gửi đến UBND xã Trung Hòa, người con gái thứ ba trình bày ông Đ.Đ.Đ. (người bố) đã qua đời mà không để lại di chúc. Tài sản để lại gồm hai mảnh đất: mảnh thứ nhất ở trong ngõ, cách đường trục chính của làng khoảng 200m, có nhà cấp bốn. Mảnh thứ hai sát mặt đường chính của làng, cả gia đình cùng góp công sức đổ nền để làm nhà ở và hiện đang có nhà mới xây.Cả ba chị em gái lấy chồng, sinh con và theo chồng. Gia đình không bàn bạc gì nên tài sản thừa kế vẫn chưa được phân chia. Người con thứ ba cho rằng sau đó mẹ và anh trai đã sử dụng di sản thừa kế để làm tài sản riêng.Đã lập gia đình nhưng vợ chồng xảy ra khúc mắc, bị người chồng cờ bạc đánh đập, chị Đ. đã hàn gắn nhiều lần nhưng không được. Không có chỗ nương tựa, chị về xin mẹ miếng đất xây nhà hoặc dựng lán ở tạm. Cả ba người con gái cũng nhiều lần góp ý với mẹ về việc phân xử, chia cho chị Đ. một mảnh đất để ở và chăm sóc hai con, nhưng người mẹ không đồng ý.Từ hồ sơ lưu trữ tại UBND xã Trung Hòa cho thấy, kể từ thời điểm con gái bà Đ. gửi đơn đề nghị hòa giải, chính quyền xã đã ba lần đứng ra hòa giải vụ việc.Đến tháng 4-2022 trong lần hòa giải thứ ba, người mẹ nêu quan điểm: gia đình có hai thửa đất thì thửa đất hiện tại (ở sát mặt đường) bà và con trai đang ở, nếu sau này bà mất đi sẽ để lại cho con trai thờ cúng. Còn thửa đất phía trong bà sẵn sàng cho ba cô con gái.Tuy nhiên, người con gái thứ ba nhất quyết không đồng ý nhận thửa đất phía trong và bày tỏ mong muốn mẹ chia thửa đất phía ngoài cho ba chị em để còn kinh doanh, sinh sống.Không tìm được tiếng nói chung, gia đình đã nhất trí xin về nhà để tự hòa giải.Trao đổi với Tuổi Trẻ Online, ông Đỗ Trọng Hoạch - chủ tịch UBND xã Trung Hòa - cho biết trong những lần hòa giải, chính quyền địa phương đã phân tích kỹ lưỡng nếu tài sản đó chia theo quyền lợi thì phát sinh nhiều vấn đề, dẫn đến tình cảm mẹ con, tình cảm anh em rạn nứt, không hàn gắn được. Nếu tự nguyện giải quyết bằng tình cảm với nhau mới giải quyết căn cơ, nguồn gốc của vấn đề mâu thuẫn.Ông Hoạch cho biết, sau lần hòa giải thứ ba không thấy gia đình thông tin phản hồi lại, cũng không xảy ra mâu thuẫn gì. Tuy nhiên, đến ngày 30-10 vừa qua lại xảy ra vụ việc đau lòng nói trên."
20221031194741869,https://tuoitre.vn/cach-chuc-nu-thieu-ta-cong-an-lai-say-xin-lai-xe-gay-tai-nan-o-gia-lai-20221031194741869.htm,"Cách chức nữ thiếu tá công an say xỉn, lái xe gây tai nạn ở Gia Lai",https://cdn1.tuoitre.vn/zoom/600_315/2022/10/31/nu-cong-an-1667204972981414178390-crop-16672203235931635776274.png,31/10/2022 20:04 GMT+7,"TTO - Tối 31-10, thiếu tướng Rah Lan Lâm, giám đốc Công an tỉnh Gia Lai, cho biết đã có quyết định kỷ luật cách chức đối với nữ thiếu tá đang công tác tại Công an huyện Đak Đoa lái ô tô gây tai nạn, có biểu hiện say xỉn.",Pháp luật,,"Thiếu tá bị kỷ luật nêu trên là Trần Thị Luận, đội trưởng Đội cảnh sát thi hành án hình sự và hỗ trợ tư pháp, Công an huyện Đak Đoa.Theo thiếu tướng Rah Lan Lâm - giám đốc Công an tỉnh Gia Lai, Công an tỉnh đã xử lý nghiêm hành vi vi phạm của cán bộ bằng hình thức kỷ luật ""cách chức"".Như trước đó Tuổi Trẻ Online đã thông tin, tối 28-10, tại ngã ba giao nhau giữa đường Hùng Vương với đường Nguyễn Viết Xuân (TP Pleiku, tỉnh Gia Lai) xảy ra vụ tai nạn giao thông. Theo người dân có mặt tại hiện trường, ô tô năm chỗ màu trắng do một phụ nữ điều khiển va chạm với một xe máy. Sau đó, người phụ nữ này lùi xe thì tiếp tục va chạm với ô tô khác.Đáng chú ý, trong clip được quay vào thời điểm xảy ra tai nạn, người phụ nữ mặc sắc phục công an, đeo quân hàm thiếu tá đã có biểu hiện say xỉn, ói lên người. Khi một người dân hỏi ""chị say rồi đúng không?"" thì người phụ nữ này trả lời ""dạ""."
20221031175932361,https://tuoitre.vn/vu-no-sung-phu-quoc-bat-them-3-nguoi-tiep-tuc-truy-lung-nhung-nguoi-co-lien-quan-20221031175932361.htm,"Vụ nổ súng Phú Quốc: Bắt thêm 3 người, tiếp tục truy lùng những người có liên quan",https://cdn1.tuoitre.vn/zoom/600_315/2022/10/31/doan-thien-long-1667213599812725566344-crop-16672140002141955460093.jpg,31/10/2022 18:31 GMT+7,"TTO - Chiều 31-10, đại tá Diệp Văn Thế - phó giám đốc Công an tỉnh Kiên Giang - cho biết công an bắt thêm 3 người có liên quan đến vụ nổ súng ở Bến Tràm và tịch thu khẩu súng bắn đạn hoa cải khiến nhiều người thương vong.",Pháp luật,,"Theo đại tá Thế, sau hơn bốn ngày (từ ngày 27 đến 31-10), Công an tỉnh Kiên Giang đã bắt 38 người có liên quan đến vụ nổ súng trên. Đồng thời, Công an tỉnh Kiên Giang cũng đã khởi tố Võ Văn Lương (tức Hai Lượng, ngụ ở Cà Mau) và những người còn lại có liên quan đến vụ án trên về tội giết người và gây rối trật tự công cộng.Đêm 30-10, lực lượng chức năng địa phương cũng đã tịch thu cây súng bắn đạn hoa cải mà Đoàn Thiên Long (ở TP.HCM) dùng bắn trực tiếp vào các nạn nhân.Công an tỉnh Kiên Giang cho biết vụ nổ súng trên có bốn người chủ mưu, cầm đầu gồm Võ Văn Lương, Bùi Minh Trung (ngụ ở Cà Mau), Bùi Đức Ngọc (ngụ ở Hải Phòng), Nguyễn Văn Thái (ngụ ở phường An Thới, Phú Quốc).""Hiện Công an tỉnh Kiên Giang đang tập trung tuần tra, kiểm soát và mở rộng điều tra, sớm bắt thêm những người có liên quan đến vụ nổ súng. Công an tỉnh Kiên Giang quyết tâm không để lọt tội phạm"", đại tá Thế nói.Như Tuổi Trẻ Online đưa tin, khoảng 11h30 trưa 27-10, ở khu vực Bến Tràm, xã Cửa Dương đã xảy ra vụ nổ súng làm 2 người chết và 4 người bị thương được đưa vào Trung tâm Y tế Phú Quốc điều trị.Lực lượng chức năng địa phương xác định nguyên nhân là do mâu thuẫn tranh chấp đất đai giữa nhóm Võ Văn Lương và Bùi Minh Trung (ngụ ở Cà Mau - hiện ở phường Dương Đông, TP Phú Quốc) với nhóm Khúc Văn Đoài (ở xã Cửa Dương).Lực lượng chức năng khám xét nhà ở những người liên quan thu giữ được 2 khẩu súng (có 1 khẩu súng nghi có tính năng quân dụng, đang giám định), 19 viên đạn, 1 dấu giả của ấp… và tạm giữ 1 xe ô tô 16 chỗ ở hiện trường."
20221031170417287,https://tuoitre.vn/bat-khan-cap-can-bo-phong-tai-nguyen-moi-truong-lien-quan-nhan-hoi-lo-20221031170417287.htm,Bắt khẩn cấp cán bộ phòng tài nguyên và môi trường liên quan nhận hối lộ,https://cdn1.tuoitre.vn/zoom/600_315/2022/10/31/nhap-truong-1617242869233641209304-1667210399143609695282-crop-1667210602533964921801.jpg,31/10/2022 17:37 GMT+7,"TTO - Ngày 31-10, lãnh đạo Viện KSND TP Gia Nghĩa (tỉnh Đắk Nông) xác nhận đã phê chuẩn quyết định khởi tố bị can và lệnh bắt tạm giam một cán bộ Phòng Tài nguyên và Môi trường TP Gia Nghĩa để điều tra về tội nhận hối lộ.",Pháp luật,,"Theo đó, Công an TP Gia Nghĩa tạm giữ người trong trường hợp khẩn cấp đối với ông Nguyễn Văn Hòa - cán bộ Phòng Tài nguyên và Môi trường TP Gia Nghĩa. Tuy nhiên, số tiền nhận hối lộ chưa được cơ quan điều tra tiết lộ.Trong khi đó, lãnh đạo UBND TP Gia Nghĩa cho biết cơ quan chức năng thực hiện lệnh bắt tại nhà của ông Hòa. Đến nay văn phòng vẫn chưa nhận thông báo của cơ quan điều tra.Trước đó, như Tuổi Trẻ Online đã thông tin, lực lượng chức năng TP Gia Nghĩa đã thực hiện lệnh bắt người trong trường hợp khẩn cấp và tiến hành khám xét nơi ở, nơi làm việc đối với ông Bùi Văn Đăng - phó giám đốc Văn phòng Đăng ký đất đai TP Gia Nghĩa.Liên quan đến việc này, nguồn tin của Tuổi Trẻ Online cho biết từ tháng 6-2021 đến nay, ông Bùi Văn Đăng đã nhận tiền của người dân để làm thủ tục nhanh (trước thời hạn theo quy định) đối với các hồ sơ chuyển đổi mục đích sử dụng đất, chia tách thửa đất trên địa bàn TP Gia Nghĩa. Trong đó, mỗi hồ sơ để được làm thủ tục nhanh người dân phải chi tiền ít nhất là 5 triệu đồng/hồ sơ, cao nhất là 35 triệu đồng/hồ sơ."
202210311703561,https://tuoitre.vn/dai-an-xang-dau-bi-cao-khang-dinh-ra-dau-thu-chu-khong-bi-bat-202210311703561.htm,Đại án xăng dầu: Bị cáo khẳng định 'ra đầu thú' chứ không bị bắt,https://cdn1.tuoitre.vn/zoom/600_315/2022/10/31/dao-ngoc-vien-1-1667210269498588664015-crop-1667210285784161891294.jpg,31/10/2022 17:27 GMT+7,"TTO - Trong phần xét hỏi, bị cáo Đào Ngọc Viễn (giám đốc Công ty TNHH Đại Dương Hải Phòng) liên tục cho rằng mình ra đầu thú để hưởng khoan hồng nhưng điều này không ghi nhận trong hồ sơ.",Pháp luật,,"Chiều 31-10, hội đồng xét xử tiếp tục làm rõ vai trò của các bị cáo cầm đầu vụ nhập xăng từ Singapore, cung cấp cho bị cáo Nguyễn Hữu Tứ tiêu thụ xăng lậu vào Việt Nam gồm Đào Ngọc Viễn - chủ tàu Pacific Ocean và tàu Western Sea và các thuyền trưởng.  Khi luật sư hỏi về việc trong hồ sơ vụ án có biên bản bắt bị can ở phường Thanh Xuân Nam, quận Thanh Xuân (Hà Nội) để tạm giam, bị cáo Viễn nói: ""Bị cáo ra đầu thú, sao lại nói bắt tạm giam? Từ lúc đầu thú ngày 8-7 cho đến lúc ra máy bay đưa về Đồng Nai không bao giờ bị cáo ra đến phường, mà chỉ ngồi trong phòng ở Cục Cảnh sát hình sự thôi"".  Tại tòa, nhiều lần bị cáo Đào Ngọc Viễn khẳng định hoàn toàn không có chuyện bị bắt tại công ty hay có mặt tại công an phường, mà bị cáo tự nguyện đến trình diện.  Theo bị cáo Viễn, tối 8-7-2021, ông Nguyễn Đình Lập - một người quen Viễn - dẫn Viễn đến gặp Thiếu tướng Vũ Hồng Văn (khi đó là giám đốc Công an tỉnh Đồng Nai) ở một quán cà phê trên đường Lý Thường Kiệt, TP Hà Nội để đầu thú.  ""Tại đây, Thiếu tướng Văn nói rất hoan nghênh, khuyến khích bị cáo ra đầu thú để hưởng lượng khoan hồng của pháp luật. Sau đó, Thiếu tướng Văn điện thoại cho một người tên Hưng là cán bộ Cục Cảnh sát hình sự yêu cầu đưa bị cáo về Cục Cảnh sát hình sự kèm lời dặn làm biên bản đầu thú"" - bị cáo Viễn khai trước tòa.  Theo bị cáo Viễn, khi về đến Cục Cảnh sát hình sự, ông Hưng dẫn Viễn vào gặp điều tra viên của Công an tỉnh Đồng Nai và Hưng có bảo làm cho Viễn biên bản đầu thú, rồi ông Hưng đi ra ngoài. Ngày 10-7-2021, Viễn được di lý về Đồng Nai.  Luật sư bào chữa cho bị cáo Viễn cho rằng có tình tiết mới trong việc ""đầu thú"" và ""bị bắt tạm giam"" nên tòa cần mời Thiếu tướng Vũ Hồng Văn và ông Nguyễn Đình Lập (kêu gọi Viễn ra trình diện) để làm rõ việc Viễn có ra đầu thú.  Còn Viễn nói: ""Nói bắt ở phường là hoàn toàn sai. Bị cáo ra trình diện, đầu thú để giảm nhẹ hình phạt nhưng khi cáo trạng truy tố thì ghi bắt tạm giam nên mong được xem xét cho bị cáo"". Trước ý kiến của bị cáo Viễn, đại diện hội đồng xét xử cho rằng các tình tiết bị cáo Viễn nêu ra ""sẽ được xem xét"".  Tiếp đó, hội đồng xét xử tiếp tục hỏi các bị cáo là thuyền trưởng tàu Pacific Ocean để làm rõ việc chở xăng nhập lậu từ Singapore do ai can thiệp, chỉ đạo.  Bị cáo Trần Văn Việt - thuyền trưởng tàu Pacific Ocean - khai: ""Khi bị bắt và nghe điều tra viên nói nhập xăng lậu thì bị cáo mới biết hành vi buôn lậu"".  Nhận thấy một số bị cáo thay đổi lời khai, vị đại diện Viện KSND tỉnh Đồng Nai giữ quyền công tố tại tòa đã công bố một số bút lục thể hiện lời khai của bị cáo Việt ""thấy không niêm phong, không bấm chì số xăng trên tàu thì đã biết là xăng lậu ngay chuyến đầu tiên…"". Viện KSND tỉnh Đồng Nai cho rằng, lời khai của các bị cáo tại tòa sẽ là tình tiết xem xét khi lượng hình…"
20221031155618326,https://tuoitre.vn/da-bao-cao-len-bo-vu-nu-thieu-ta-cong-an-lai-xe-gay-tai-nan-co-bieu-hien-say-xin-20221031155618326.htm,"Đã báo cáo lên bộ vụ nữ thiếu tá công an lái xe gây tai nạn, có biểu hiện say xỉn",https://cdn1.tuoitre.vn/zoom/600_315/2022/10/31/nu-cong-an-1667204972981414178390-crop-16672050213131482566471.png,31/10/2022 16:51 GMT+7,"TTO - Chiều 31-10, Thiếu tướng Rah Lan Lâm - giám đốc Công an tỉnh Gia Lai - cho biết đã báo cáo lên Bộ Công an vụ việc nữ thiếu tá Công an huyện Đak Đoa lái ô tô gây tai nạn, có biểu hiện say xỉn.",Pháp luật,,"Chiều 31-10, trao đổi với Tuổi Trẻ Online, Thiếu tướng Rah Lan Lâm cho biết nữ thiếu tá T.T.L. công tác tại Công an huyện Đak Đoa (tỉnh Gia Lai) lái ô tô gây tai nạn, có biểu hiện say xỉn vào tối 28-10. ""Đã báo cáo bộ biết rồi, còn xử lý phải có đủ các tài liệu căn cứ vi phạm và các vấn đề khác nữa, theo đúng quy định của ngành xử lý nghiêm"" - Thiếu tướng Rah Lan Lâm khẳng định.Như trước đó Tuổi Trẻ Online thông tin, tối 28-10, tại ngã ba giao nhau giữa đường Hùng Vương với đường Nguyễn Viết Xuân (TP Pleiku, tỉnh Gia Lai) xảy ra vụ tai nạn giao thông. Theo người dân có mặt tại hiện trường, ô tô năm chỗ màu trắng do một phụ nữ điều khiển va chạm với một xe máy. Sau đó, người phụ nữ này lùi xe thì tiếp tục va chạm với ô tô khác.Đáng chú ý, trong clip được quay vào thời điểm xảy ra tai nạn, người phụ nữ mặc sắc phục công an, đeo quân hàm thiếu tá đã có biểu hiện say xỉn, ói lên người. Khi một người dân hỏi ""chị say rồi đúng không?"" thì người phụ nữ này trả lời ""dạ""."
