id,link,title,thumbnail,time,summary,category,sub_category,full_article
20221027165708367,https://tuoitre.vn/mot-phong-vien-bi-de-doa-giet-ca-nha-sau-loat-bai-dieu-tra-20221027165708367.htm,Một phóng viên bị đe dọa 'giết cả nhà' sau loạt bài điều tra,https://cdn1.tuoitre.vn/zoom/600_315/2022/7/22/2948105315725102478494495287019053158343150n-1658486864159975714313-crop-1666865996817156831217.png,27/10/2022 17:28 GMT+7,"TTO - Sau khi loạt bài điều tra về tình trạng khai thác đất trái phép tại tỉnh Vĩnh Phúc được đăng tải, một phóng viên báo Giao Thông nhận được cuộc gọi đe dọa sẽ giết cả nhà.",Pháp luật,,"Ngày 27-10, phóng viên N.V.T. của báo Giao Thông (thường trú TP Bắc Giang, Bắc Giang) phản ánh vào lúc 16h52 ngày 22-10, phóng viên này nhận được cuộc gọi từ một số máy lạ với nội dung đe dọa sẽ bị giết cả nhà.Đoạn hội thoại được phóng viên N.V.T. ghi âm lại là giọng nói của một người đàn ông: ""… mày lo hậu sự cho cả nhà mày đi, vợ con mày sắp chết rồi, cả nhà mày sắp chết rồi. Mày ra đường phải cẩn thận, xe đâm chết cả nhà mày đấy. Mày làm gì thì tự hiểu…"".Phóng viên N.V.T. cho biết anh đã báo cáo vụ việc lên ban biên tập báo Giao Thông và Cơ quan cảnh sát điều tra Công an tỉnh Bắc Giang, nơi anh đang cư trú.Chiều 27-10, trao đổi với Tuổi Trẻ Online, ông Nguyễn Đức Thắng - phó tổng biên tập báo Giao Thông - cho biết sau khi tiếp nhận thông tin từ phóng viên bị đe dọa, báo Giao Thông đã gửi công văn đề nghị Công an tỉnh Bắc Giang và Cơ quan cảnh sát điều tra tỉnh Bắc Giang chỉ đạo điều tra, làm rõ để xử lý nghiêm theo quy định của pháp luật. Đồng thời, chỉ đạo các đơn vị liên quan có biện pháp ngăn chặn, bảo đảm an toàn tính mạng, tài sản của phóng viên và gia đình.Theo ông Thắng, trước đó phóng viên N.V.T. cùng nhóm phóng viên của báo Giao Thông làm loạt bài điều tra về tình trạng khai thác đất trái phép.Trên báo Giao Thông đăng tải hai bài báo ""Vĩnh Phúc: Xe chở đất trái phép, bất chấp biển cấm náo loạn đường quê"" và ""Vĩnh Phúc: Chính quyền thừa nhận bất lực trước nạn khai thác đất trái phép"".Đại diện báo Giao Thông đề nghị các cơ quan chức năng sớm vào cuộc điều tra làm rõ và có phương án bảo vệ sự an toàn về sức khỏe, tính mạng đối với phóng viên N.V.T. và gia đình."
20221027163907548,https://tuoitre.vn/ong-trum-buon-lau-trong-dai-an-xang-dau-keo-con-trai-vao-vong-lao-ly-ra-sao-20221027163907548.htm,Ông ‘trùm’ buôn lậu trong đại án xăng dầu kéo con trai vào vòng lao lý ra sao?,https://cdn1.tuoitre.vn/zoom/600_315/2022/10/27/xd3-1666862330405681802686-crop-16668623696721910464070.jpg,27/10/2022 17:24 GMT+7,"TTO - Đáng chú ý trong đại án buôn lậu xăng, bị cáo đầu vụ Phan Thanh Hữu, được xem là ông ‘trùm’ buôn lậu, đã kéo con trai cùng vào cuộc để tạo ‘vỏ bọc’ qua các cuộc chuyển tiền.",Pháp luật,,"Chiều 27-10, đại diện Viện KSND tỉnh Đồng Nai tiếp tục công bố phần cáo trạng còn lại trong 'vụ án Đào Ngọc Viễn, Phan Thanh Hữu và đồng phạm về các tội buôn lậu, nhận hối lộ'.Đáng chú ý, trong vụ án có hai cha con cùng ra hầu tòa và cùng bị truy tố về hành vi buôn lậu là bị cáo Phan Thanh Hữu và Phan Lê Hoàng Anh (33 tuổi, con trai út của Hữu).Lấy tên con lập công ty để hợp thức xăng lậu  Theo cáo trạng, sau khi góp vốn buôn lậu xăng với nhóm của bị cáo Đào Ngọc Viễn (54 tuổi, giám đốc Công ty TNHH Đại Dương Hải Phòng), bị cáo Phan Thanh Hữu đã hoán đổi tiền góp vốn tại Công ty TNHH Hà Lộc Phát (Bà Rịa-Vũng Tàu) để nhận lại bốn con tàu Nhật Minh. Sau đó, Hữu lập Công ty TNHH Hải Minh Nhật để đăng ký sở hữu bốn chiếc tàu này.Đồng thời, Hữu thuê người làm giám đốc công ty và đăng ký kinh doanh ngành nghề vận tải hàng hóa đường thủy nội địa, ven biển... với mục đích vận chuyển xăng nhập lậu.Tháng 7-2019, bị cáo Hữu tiếp tục lấy tên con trai út để lập tiếp Công ty TNHH thương mại Phan Lê Hoàng Anh để kinh doanh xăng dầu, do Hữu làm giám đốc để hợp thức hóa hồ sơ, chứng từ trong quá trình vận chuyển, tiêu thụ nguồn xăng nhập lậu.Khi có pháp nhân hai công ty trên, Hữu tạo ra các hợp đồng vận chuyển xăng RON95 giữa Công ty Phan Lê Hoàng Anh và Công ty Hải Minh Nhật để đối phó khi bị kiểm tra. Thực chất, xăng RON95 do bị cáo Trần Văn Việt (thuyền trưởng tàu Pacific Ocean), bị cáo Lê Đình Hùng (thuyền trưởng tàu Western Sea) buôn lậu từ Singapore về, bơm vào các tàu Nhật Minh của Hữu rồi chở vào đất liền bán cho các tàu của Nguyễn Hữu Tứ... để bán ra thị trường Việt Nam.Thay cha, nhận tiền bán xăng lậu hơn 1.000 tỉ đồng  Để thu tiền mua, bán xăng nhập lậu, Hữu dẫn con trai Hoàng Anh gặp gỡ khách mua xăng lậu để thu tiền. Đồng thời để Hoàng Anh lập nhiều tài khoản ở các ngân hàng nhằm nhận tiền chuyển khoản từ các ""chân rết"" tiêu thụ xăng lậu do Hữu điều hành.Theo cáo buộc của vị đại diện Viện KSND, từ tháng 3-2020 đến đầu tháng 2-2021, bị cáo Phan Lê Hoàng Anh đã giúp cha là Phan Thanh Hữu nhận thanh toán (tiền mặt và chuyển khoản) tiền mua bán, xăng nhập lậu của rất nhiều bị cáo mua xăng lậu.Cụ thể, bị cáo Hoàng Anh nhận chuyển khoản, tiền mặt từ các bị cáo Nguyễn Hữu Tứ, Trần Ngọc Thanh, Lê Thanh Trung, Phạm Thị Hương... với tổng số tiền hơn 1.000 tỉ đồng.Cũng theo Viện KSND, khi có chỉ đạo của cha, Hoàng Anh còn chuyển tiền lợi nhuận từ việc bán xăng nhập lậu và tiền phí thuê tàu cho Phạm Hùng Cường (đang bị truy nã) với số tiền gần 282 tỉ đồng để Cường chuyển cho bị cáo Đào Ngọc Viễn, Phùng Danh Thoại (nguyên đại tá, trưởng phòng xăng dầu Cục Hậu cần Bộ tư lệnh Cảnh sát biển)...Đại diện Viện KSND cáo buộc bị cáo Phan Lê Hoàng Anh không hưởng lợi từ hoạt động buôn lậu xăng dầu của cha mình nhưng phải chịu trách nhiệm với vai trò đồng phạm giúp sức đối với gần 198 triệu lít xăng RON95 nhập lậu, tổng giá trị phạm pháp hơn 2.596 tỉ đồng."
20221027161850528,https://tuoitre.vn/facebooker-dang-nhu-quynh-khai-dang-thong-tin-sai-su-that-vi-ham-like-20221027161850528.htm,Facebooker Đặng Như Quỳnh khai đăng thông tin sai sự thật vì 'hám like',https://cdn1.tuoitre.vn/zoom/600_315/2022/10/27/dang-nhu-quynh-16498262882891125524392-16668629222201051074356-crop-1666862976132247871801.jpeg,27/10/2022 17:23 GMT+7,"TTO - Khai trước tòa, bị cáo Đặng Như Quỳnh cho hay việc đăng tải các thông tin sai sự thật trên Facebook cá nhân ""không nhằm mục đích gì, chỉ vì hám like nên đăng các bài viết câu like"".",Pháp luật,,"Chiều 27-10, TAND quận Nam Từ Liêm (Hà Nội) tuyên phạt bị cáo Đặng Như Quỳnh (42 tuổi, trú tại quận Nam Từ Liêm) 2 năm tù về tội lợi dụng các quyền tự do dân chủ xâm phạm quyền, lợi ích hợp pháp của tổ chức, cá nhân.Tòa nhận định bị cáo Quỳnh đã lợi dụng quyền tự do dân chủ của mình đăng tải các thông tin sai sự thật lên Facebook, ảnh hưởng đến quyền, lợi ích hợp pháp của tổ chức, cá nhân.Trước đó, trả lời thẩm vấn, bị cáo Quỳnh nói cáo trạng truy tố ""hơi nặng"". Bị cáo cho hay không mâu thuẫn gì với ông Nguyễn Văn Tuấn - chủ tịch hội đồng quản trị kiêm tổng giám đốc Công ty cổ phần Tập đoàn Gelex, chủ tịch hội đồng quản trị Tổng công ty Viglacera và các doanh nghiệp có liên quan đến những bài viết bị cáo đăng.Các thông tin bị cáo đăng tải đều copy trên mạng xã hội và Facebook của một người bạn, sau đó thêm thông tin, hình ảnh vào, rồi đăng lên trang cá nhân.""Bị cáo thực hiện hành vi hoàn toàn theo ý thức chủ quan của cá nhân, không có ai đứng sau. Việc đăng tải các thông tin không nhằm mục đích gì, chỉ vì hám like nên bị cáo đăng các bài viết câu like"", bị cáo trình bày.Cũng theo lời bị cáo, thời điểm đăng tải thông tin, bị cáo không nhận thức được hành vi của mình là sai, không lường trước được hậu quả ảnh hưởng đến người khác, sau đó bị cáo mới nhận ra.Cuối phần trình bày, bị cáo nói đã nhận thức được hành vi sai phạm của mình, rất ăn năn hối lỗi và gửi lời xin lỗi đến ông Nguyễn Văn Tuấn, những người liên quan không có mặt tại tòa.Trước lời khai của bị cáo, chủ tọa phân tích bị cáo biết Facebook của mình có nhiều người theo dõi, tuy nhiên bị cáo phải hiểu rằng mọi cá nhân có quyền chia sẻ, nêu quan điểm trên mạng xã hội nhưng phải trên cơ sở luật pháp cho phép, không xâm phạm đến quyền của người khác.""Bị cáo chỉ là người kinh doanh tự do, không phải cơ quan điều tra, không có quyền điều tra tội phạm, cũng không làm việc trong cơ quan báo chí đăng tải thông tin tuyên truyền…. Các thông tin bị cáo đăng trên Facebook đều lấy từ các nguồn không chính thống, không được kiểm định, gây ảnh hưởng đến các cơ quan, cá nhân, thị trường chứng khoán, an ninh kinh tế quốc gia"", chủ tọa nói.Trình bày ý kiến, đại diện của bị hại không yêu cầu bồi thường dân sự, tuy nhiên yêu cầu bị cáo Quỳnh công khai xin lỗi trên các phương tiện truyền thông. Trước yêu cầu trên, chủ tọa cho hay bị cáo hiện bị tạm giam, do đó yêu cầu này không khả thi."
20221027161212476,https://tuoitre.vn/no-sung-o-phu-quoc-hai-nguoi-chet-nhieu-nguoi-bi-thuong-20221027161212476.htm,"Nổ súng ở Phú Quốc, hai người chết, nhiều người bị thương",https://cdn1.tuoitre.vn/zoom/600_315/2022/10/27/z3833578359052d0539aace0fac882082b6b5f2e6ca16c-16668616865511363752264-crop-1666861853881669032726.jpg,27/10/2022 16:42 GMT+7,"TTO - Chiều 27-10, ông Trần Văn Việt - chủ tịch UBND xã Cửa Dương, TP Phú Quốc, Kiên Giang - xác nhận hôm nay ở địa phương đã xảy ra một vụ nổ súng khiến hai người chết và làm nhiều người bị thương.",Pháp luật,,"Thông tin ban đầu, vụ việc xảy ra khoảng 11h trưa cùng ngày ở khu vực Bến Tràm, xã Cửa Dương. Theo người dân địa phương, vụ nổ súng này nghi vấn có liên quan đến tranh chấp đất đai. Vụ nổ súng trên đã làm hai người thiệt mạng, một số người bị thương được đưa vào Trung tâm Y tế TP Phú Quốc để điều trị.Hiện lực lượng chức năng địa phương đã phong tỏa hiện trường để điều tra nguyên nhân xảy ra vụ việc trên."
20221027151948335,https://tuoitre.vn/facebooker-dang-nhu-quynh-hau-toa-20221027151948335.htm,Facebooker Đặng Như Quỳnh hầu tòa,https://cdn1.tuoitre.vn/zoom/600_315/2022/10/27/tai-xuong-16668581478261838557315-crop-16668581611741618425509.jpeg,27/10/2022 15:46 GMT+7,"TTO - Ông Đặng Như Quỳnh hầu tòa với cáo buộc đã tự suy diễn, đăng tải các thông tin sai sự thật trên trang Facebook cá nhân, làm ảnh hưởng đến danh dự người khác và làm nhiều nhà đầu tư chứng khoán thiệt hại.",Pháp luật,,"Chiều 27-10, TAND quận Nam Từ Liêm (Hà Nội) mở phiên tòa xét xử bị cáo Đặng Như Quỳnh (42 tuổi, trú tại quận Nam Từ Liêm) về tội lợi dụng các quyền tự do dân chủ xâm phạm quyền, lợi ích hợp pháp của tổ chức, cá nhân. Theo cáo trạng, cuối năm 2019 đến tháng 4-2022, Đặng Như Quỳnh sử dụng tài khoản Facebook “Đặng Như Quỳnh” có hơn 300.000 lượt theo dõi để đăng tải các bài viết do mình soạn thảo hoặc chia sẻ lại bài viết của người khác. Ngày 2-4, mặc dù không có thông tin ông Đỗ Anh Dũng - chủ tịch hội đồng quản trị kiêm tổng giám đốc Công ty cổ phần Tập đoàn Tân Hoàng Minh - bị xử lý hình sự, nhưng ông Quỳnh đã tự suy diễn, đăng tải công khai trên Facebook cá nhân bài viết có nội dung ám chỉ về việc các cơ quan tố tụng sẽ tiến hành xử lý hình sự đối với ông này.Đến ngày 5-4, khi các cơ quan tố tụng công bố thông tin về việc xử lý hình sự đối với ông Dũng, Đặng Như Quỳnh đã chỉnh sửa bài viết, bổ sung thêm nội dung được các cơ quan tố tụng công khai để định hướng người đọc tin rằng mình biết trước thông tin về việc xử lý hình sự ông Dũng.Biết các thông tin đăng tải trên Facebook được nhiều người tiếp cận, Đặng Như Quỳnh tiếp tục tự suy diễn về việc cơ quan chức năng sẽ tiến hành điều tra đối với ông Nguyễn Văn Tuấn - chủ tịch hội đồng quản trị kiêm tổng giám đốc Công ty cổ phần Tập đoàn Gelex (công ty có mã chứng khoán GEX), chủ tịch hội đồng quản trị của Tổng công ty Viglacera - CTCP (công ty có mã chứng khoán VGC). Ngày 6-4, Đặng Như Quỳnh sử dụng tài khoản Facebook của mình đăng hai bài viết có nội dung sai sự thật về việc các cơ quan tố tụng sẽ tiến hành khởi tố, điều tra, bắt tạm giam đối với ông Nguyễn Văn Tuấn kèm theo hình ảnh cá nhân của  ông này.Đồng thời, Đặng Như Quỳnh đăng tải thông tin ông Tuấn sở hữu phức tạp nhiều công ty đại chúng có hoạt động niêm yết trên sàn chứng khoán. Sau khi Quỳnh đăng tải, các bài viết trên được hàng nghìn cá nhân tương tác, bình luận, chia sẻ.Ngày 12-4, một số nhà đầu tư chứng khoán đã có đơn tố giác hành vi của Đặng Như Quỳnh.Ngày 29-8, Bộ Thông tin và Truyền thông xác định hành vi của Đặng Như Quỳnh đã xúc phạm danh dự, nhân phẩm của cá nhân ông Nguyễn Văn Tuấn. Đồng thời, Ủy ban Chứng khoán Nhà nước xác định các bài viết của Đặng Như Quỳnh là một trong những nguyên nhân gây ra hiệu ứng tiêu cực đối với các mã chứng khoán có liên quan đến ông Nguyễn Văn Tuấn nói riêng, thị trường chứng khoán nói chung trong giai đoạn từ ngày 6 đến ngày 12-4.Đến ngày 13-4, Đặng Như Quỳnh đã bị Cơ quan an ninh điều tra Bộ Công an bắt khẩn cấp.Tại Cơ quan an ninh điều tra, Quỳnh khai nhận hành vi phạm tội, khai do biết trang Facebook của mình có lượng lớn người theo dõi nên đăng tải các bài viết trên nhằm định hướng người đọc, gây sự chú ý, tăng lượt tương tác..."
20221027152150424,https://tuoitre.vn/canh-cao-pho-truong-phong-canh-sat-hinh-su-cong-an-tp-hcm-tran-van-phu-20221027152150424.htm,Cảnh cáo phó trưởng Phòng Cảnh sát hình sự Công an TP.HCM Trần Văn Phú,https://cdn1.tuoitre.vn/zoom/600_315/2022/10/27/5f13d8b94cf98aa7d3e8zzpq-16668586824901041893624-crop-16668586989511561618613.jpeg,27/10/2022 15:37 GMT+7,"TTO - Ngày 27-10, Ban Thường vụ Đảng ủy Công an TP.HCM đã thi hành kỷ luật với thượng tá Trần Văn Phú, phó trưởng Phòng Cảnh sát hình sự, nguyên phó thủ trưởng Cơ quan cảnh sát điều tra Công an TP.HCM.",Pháp luật,,"Thượng tá Trần Văn Phú với vai trò phó trưởng Phòng Cảnh sát hình sự, phó thủ trưởng Cơ quan cảnh sát điều tra Công an TP.HCM trong các năm 2019, 2020 đã thiếu kiểm tra, đôn đốc thực hiện chủ trương, quy định của Đảng, pháp luật Nhà nước, để cấp dưới thực hiện sai và thiếu kiểm tra, ngăn chặn kịp thời hành vi vi phạm quy định của Đảng, pháp luật Nhà nước trong lãnh đạo, quản lý.Ông Phú cũng thiếu trách nhiệm trong thực hiện quy định của Đảng, Nhà nước, Bộ Công an trong phòng, chống tội phạm và giải quyết tố giác, tin báo về tội phạm; thực hiện không đầy đủ, không đúng quy định về điều tra đối với tội phạm để cấp ủy, tổ chức Đảng cấp dưới và cán bộ, đảng viên vi phạm, gây hậu quả nghiêm trọng, ảnh hưởng xấu trong xã hội.Các vi phạm của thượng tá Trần Văn Phú là nghiêm trọng, ảnh hưởng đến uy tín của Đảng, của ngành công an. Ban Thường vụ Đảng ủy Công an TP.HCM đã quyết định thi hành kỷ luật thượng tá Trần Văn Phú bằng hình thức cảnh cáo."
20221027145906252,https://tuoitre.vn/ky-luat-dai-ta-nguyen-dang-nam-nguyen-truong-phong-canh-sat-hinh-su-cong-an-tp-hcm-20221027145906252.htm,Kỷ luật đại tá Nguyễn Đăng Nam - nguyên trưởng Phòng Cảnh sát hình sự Công an TP.HCM,https://cdn1.tuoitre.vn/zoom/600_315/2022/10/27/nam2-1666858937991646491231-crop-16668589718572017069999.jpg,27/10/2022 15:13 GMT+7,"TTO - Ngày 27-10, Ban Thường vụ Đảng ủy Công an TP.HCM đã thi hành kỷ luật đại tá Nguyễn Đăng Nam vì buông lỏng lãnh đạo, quản lý, vi phạm quy định của Đảng, pháp luật, của ngành công an trong công tác phòng chống tội phạm.",Pháp luật,,"Ngày 27-10, Ban Thường vụ Đảng ủy Công an TP.HCM đã thi hành kỷ luật đối với đại tá Nguyễn Đăng Nam - trưởng Phòng Xây dựng phong trào bảo vệ an ninh Tổ quốc (PV05), Công an TP.HCM.Đại tá Nam bị kỷ luật do có sai phạm trong thời gian làm trưởng Phòng Cảnh sát hình sự (PC02) Công an TP.HCM.Theo đó, đại tá Nam vi phạm nguyên tắc tổ chức và hoạt động của Đảng, vi phạm thẩm quyền, nguyên tắc, quy trình công tác tổ chức cán bộ; thiếu trách nhiệm, buông lỏng lãnh đạo, quản lý, vi phạm quy định của Đảng, pháp luật, của ngành công an trong công tác đấu tranh phòng chống tội phạm; thiếu kiểm tra, giám sát để xảy ra nhiều vi phạm.Những vi phạm của đại tá Nam rất nghiêm trọng. Hậu quả để một số cán bộ, đảng viên bị kỷ luật, đình chỉ công tác, gây dư luận bức xúc trong xã hội, làm ảnh hưởng xấu đến uy tín của Đảng, của ngành công an.Với những vi phạm trên, Ban Thường vụ Đảng ủy Công an TP.HCM quyết định thi hành kỷ luật ông Nam bằng hình thức cách tất cả các chức vụ trong Đảng nhiệm kỳ 2015-2020 và nhiệm kỳ 2020-2025.Đại tá Nguyễn Đăng Nam hiện là đảng viên chi bộ 1 thuộc Đảng bộ Phòng Xây dựng phong trào bảo vệ an ninh Tổ quốc (PV05). Ông cũng là bí thư Đảng ủy, trưởng Phòng Cảnh sát hình sự (PC02) Công an TP.HCM nhiệm kỳ 2015-2020 và nhiệm kỳ 2020-2025.Ngày 8-1-2021, Công an TP.HCM đã điều động ông Nam đến nhận công tác và giữ chức vụ trưởng Phòng PV05."
20221026155658167,https://tuoitre.vn/lao-dong-cu-tru-bat-hop-phap-o-han-quoc-co-the-bi-phat-tu-phat-tien-toi-500-trieu-20221026155658167.htm,"Lao động cư trú bất hợp pháp ở Hàn Quốc có thể bị phạt tù, phạt tiền tới 500 triệu",https://cdn1.tuoitre.vn/zoom/600_315/2022/10/26/tim-viec-lam-nuoc-ngoai-59-16667746538921156946138-crop-16667747128691158170104.jpg,26/10/2022 17:19 GMT+7,"TTO - Lao động cư trú bất hợp pháp có thể bị phạt tù tới 3 năm, phạt tiền lên tới 30 triệu won (hơn 500 triệu đồng) và bị hạn chế nhập cảnh vào Hàn Quốc.",Pháp luật,,"Đó là thông tin được bà Yun Jae Yeon - trưởng văn phòng đại diện Cơ quan Phát triển nguồn nhân lực Hàn Quốc (HRD Korea) tại Việt Nam - cho biết khi nhiều doanh nghiệp vừa và nhỏ ở nước này đang tăng tuyển dụng nhân lực nước ngoài cuối năm 2022, dẫn tới lo ngại lao động Việt Nam có thể bỏ trốn, làm việc bất hợp pháp. Theo bà Yun Jae Yeon, hạn ngạch tuyển dụng dành cho mỗi quốc gia đến Hàn Quốc dựa theo ""tỉ lệ cư trú bất hợp pháp"" hoặc mức độ ưa thích của người sử dụng lao động. Có nghĩa là nước nào muốn tăng hạn ngạch lao động cần giảm tỉ lệ lao động cư trú bất hợp pháp.Hiện Hàn Quốc tạm dừng tuyển lao động theo Chương trình cấp phép việc làm cho lao động nước ngoài (EPS) hết năm 2022 với các huyện Nghi Xuân, Cẩm Xuyên (tỉnh Hà Tĩnh), TP Chí Linh (tỉnh Hải Dương), huyện Nghi Lộc, thị xã Cửa Lò, huyện Hưng Nguyên (tỉnh Nghệ An) và huyện Đông Sơn, Hoằng Hóa (tỉnh Thanh Hóa). Đây là những nơi có số lao động cư trú bất hợp pháp tại Hàn Quốc từ 70 người trở lên và tỉ lệ lao động hết hạn hợp đồng không về nước đúng hạn từ 27% trở lên.  ""Chúng tôi đề nghị Chính phủ Việt Nam cùng các cơ quan liên quan quan tâm hơn nữa đến vấn đề này. Lao động cư trú bất hợp pháp có thể bị phạt tù tới 3 năm và phạt tiền lên tới 30 triệu won (hơn 500 triệu đồng) và hạn chế nhập cảnh vào Hàn Quốc. Do đó, lao động tự nguyện về nước khi đã hết hạn hợp đồng (4 năm 10 tháng) sẽ có cơ hội sang Hàn Quốc làm việc thêm một lần nữa"", bà Yun cho hay.Để giảm và phòng tránh lao động bất hợp pháp, Bộ Tư pháp và Bộ Việc làm lao động Hàn Quốc đang tiến hành rà soát, kiểm tra các công ty có nhân lực nước ngoài. Đồng thời, nước này cung cấp các chương trình đào tạo nghề, đào tạo tiếng Hàn, khóa khởi nghiệp, giới thiệu việc làm để lao động người Việt tái ổn định cuộc sống khi về nước, kể cả công ty Hàn Quốc ở Việt Nam.""Chính phủ Hàn Quốc tuyệt đối sẽ không khoan thứ hay bỏ qua đối với những hành vi cư trú bất hợp pháp hay các hành vi trái pháp luật khác"", bà Yun Jae Yeon nêu rõ.Còn ông Nguyễn Gia Liêm, phó cục trưởng Cục Quản lý lao động ngoài nước (Bộ Lao động - Thương binh và Xã hội), đưa ra một số giải pháp ngăn chặn lao động bỏ trốn như tuyển chọn, đào tạo lao động thật kỹ trước khi sang Hàn Quốc; người làm việc ở Hàn Quốc cần được hỗ trợ khó khăn về sinh hoạt, sức khỏe kịp thời. Lao động đi Hàn phải ký quỹ 100 triệu đồng để đảm bảo việc thực hiện đúng hợp đồng, về nước đúng thời hạn. Người thuộc hộ nghèo, cận nghèo khi tham gia Chương trình EPS được vay vốn 100% tại Ngân hàng Chính sách xã hội. Về nước, người lao động mới phải thanh quyết toán tiền ký quỹ. Theo ông Liêm, cuối năm 2022 là thời điểm để thanh niên vùng trung du, miền núi hoặc huyện nghèo ""rộng cửa"" đi làm việc ở Hàn Quốc, Nhật Bản… Người có kinh tế khó khăn có thể tham gia các chương trình phi lợi nhuận như Chương trình EPS (lương 1.400 - 1.800 USD/tháng), Chương trình đưa thực tập sinh sang thực tập tại Nhật Bản IM Japan (1.200 - 1.400 USD/tháng)… Người lao động tìm hiểu thông tin, liên hệ Cục Quản lý lao động ngoài nước qua điện thoại 024.3824.9517 hoặc website: dolab.gov.vn."
