id,link,title,thumbnail,time,summary,category,sub_category,full_article
20211012234852279,https://tuoitre.vn/tang-le-ca-si-phi-nhung-tai-my-ben-kia-the-gioi-mong-em-dung-dau-buon-them-nua-20211012234852279.htm,"Tang lễ ca sĩ Phi Nhung tại Mỹ: 'Bên kia thế giới, mong em đừng đau buồn thêm nữa'",https://cdn1.tuoitre.vn/zoom/600_315/2021/10/13/2fd0d2e73c38f566ac29-1634076743933935640125-crop-16340767910161044679071.jpg,13/10/2021 07:10 GMT+7,"TTO - Sáng sớm 13-10 (tức trưa 12-10 giờ Mỹ), đông đảo nghệ sĩ, bạn bè, khán giả Việt Nam tại Mỹ đã đến chùa Huệ Quang (Santa Ana, California, Mỹ) đưa tiễn ca sĩ Phi Nhung. Nhiều người không khỏi nghẹn ngào trước sự ra đi của cô.",Văn hóa,Đời sống,"Hôm nay, tro cốt cố ca sĩ Phi Nhung được gia đình đưa từ tịnh xá Giác An về chùa Huệ Quang (Santa Ana, California, Mỹ) để tiến hành tang lễ.Trước khi đến chùa Huệ Quang làm lễ, gia đình đã đưa tro cốt Phi Nhung dạo quanh những địa điểm quen thuộc mà cố ca sĩ thường hay đến.Đúng 1h sáng 13-10, lễ cầu siêu và phát tang cố ca sĩ đã diễn ra tại chùa Huệ Quang. Ca sĩ Mạnh Quỳnh, Trizzie Phương Trinh cùng nhiều nghệ sĩ, bạn bè, người thân tham dự.Mạnh Quỳnh chia sẻ xúc động: ""Đến bây giờ tôi cũng không ngờ mình đứng đây để tưởng niệm một người có ý nghĩa rất lớn lao trong cuộc đời tôi. Cô ấy là người ca sĩ có thể dành cả đời cho công chúng, cô ấy sống vì mọi người, có thể hy sinh hạnh phúc vì mọi người. Phi Nhung năm nay mới có 51 tuổi, bao nhiêu hoài bão cô ấy nói với tôi mà giờ không thực hiện được nữa"".Mạnh Quỳnh từng tâm sự về việc lùm xùm ở Việt Nam và có ý muốn lên tiếng nhưng Phi Nhung bảo thôi.""Thôi ông ơi, bao nhiêu năm nay ông là người tốt rồi, bây giờ ông có nói tốt cách mấy đi thì người ta cũng bẻ thành xấu được. Bản thân tôi đã nằm trên chảo dầu, người ta muốn chiên, muốn xào, nấu gì cũng được. Còn ông thì ông ráng giữ gia đình hạnh phúc của ông đi"" - Mạnh Quỳnh nhắc lại lời người bạn quá cố.Mạnh Quỳnh gửi lời xin lỗi Wendy vì cho rằng bản thân vô dụng, không che chở và bảo bọc cho giọng ca Phải lòng con gái Bến Tre.""Lúc đầu chú đã nói mẹ con về đi, làm từ thiện bao năm nay rồi thì về đi, nhưng vì lý do gì mà không chịu về. Chú còn giữ bao nhiêu tin nhắn mẹ Nhung hẹn về hát ngày 22-8, rồi lên kịch bản hát bài gì bài gì"" - Mạnh Quỳnh xúc động nói.Ca sĩ Trizzie Phương Trinh - người chị thân thiết 31 năm của Phi Nhung - cũng có những lời cuối cùng dành cho cố ca sĩ: ""Trizzie đã hứa với Phi Nhung sẽ yêu thương và bảo bọc Wendy, tâm nguyện Phi Nhung còn dang dở thì tôi sẽ thay em thực hiện. Bên kia thế giới, mong em đừng đau buồn thêm nữa. Chị hứa, những gì em còn oan ức, chị sẽ xoa dịu cho em"".Nhiều văn nghệ sĩ như Giao Linh, Bằng Kiều, Cam Thơ, Lê Quang, Hồng Đào, Đan Nguyên, Hồng Ngọc, Nguyễn Hồng Nhung, Thúy Nga... cũng đã đến thắp hương đưa tiễn đồng nghiệp lần cuối.Trước đó, trên trang cá nhân, Wendy Phạm đã viết, thay vì đi vòng hoa viếng thì mọi người góp số tiền đó vào quỹ từ thiện Phi Nhung - Wendy Phạm để cô tiếp tục làm những công việc thiện nguyện mà mẹ mình đang làm dang dở.""Tâm nguyện của mẹ là giúp tịnh xá Giác An xây trường học Việt ngữ kế bên chùa và giúp các nạn nhân bị ảnh hưởng vì COVID-19 tại Việt Nam. Tất cả số tiền thu được con sẽ chia đều cho 2 nơi"" - Wendy Phạm cho biết.Lễ viếng diễn ra từ 3h đến 9h30 sáng (tức từ 13h đến 19h30 tại Mỹ). Một số hình ảnh tại tang lễ ca sĩ Phi Nhung:"
20211012131247501,https://tuoitre.vn/thi-sinh-tu-tien-giang-chiem-nhieu-giai-cuoc-thi-tim-hieu-bien-cuong-20211012131247501.htm,Thí sinh từ Tiền Giang chiếm nhiều giải cuộc thi tìm hiểu biên cương,https://cdn1.tuoitre.vn/zoom/600_315/2021/9/30/banner1-1632977571728890152725-crop-1634018980674719872486.jpg,12/10/2021 14:42 GMT+7,"TTO - Ban tổ chức cuộc thi trực tuyến tìm hiểu 'Biên cương Tổ quốc tôi' vừa cho biết kết quả vòng thi tuần đầu tiên, giải nhất thuộc về Tạ Công Minh Nhựt - dự thi từ huyện Chợ Gạo, tỉnh Tiền Giang.",Văn hóa,Đời sống,"Điều thú vị của kết quả đầu tiên thuộc vòng thi tuần là có đến 4 thí sinh từ Tiền Giang đoạt giải. Ngoài giải nhất, hai giải nhì, ba cũng thuộc về thí sinh người Tiền Giang là Đoàn Văn Nam (ở huyện Cái Bè - giải nhì), và Trần Thị Cẩm Thu (ở cùng huyện Cái Bè, giải ba). Người thứ tư ở Cái Bè đoạt giải trong tuần này là Đặng Phi Yến (huyện Cai Lậy, giải khuyến khích).  Còn lại 6 giải khuyến khích tuần này thuộc về thí sinh từ các tỉnh thành: Nguyễn Hoài Nam (thị xã Phước Long, tỉnh Bình Phước), Nguyễn Thị Diệu Hương (huyện Quảng Trạch, tỉnh Quảng Bình), Trần Công Đặng (thành phố Thủ Đức, TP.HCM), Trịnh Thị Anh Trâm (huyện Quảng Trạch, tỉnh Quảng Bình), Trần Lương Xuân Thùy (huyện Mỏ Cày Bắc, tỉnh Bến Tre), Nguyễn Anh Hùng (huyện Quảng Trạch, tỉnh Quảng Bình).  Cuộc thi tuần đầu tiên diễn ra từ ngày 1 đến 8-10, có 147.853 người tham gia thi với 193.701 lượt thi. Trong đó, Hà Nội dẫn đầu cả nước về số người tham gia thi với 73.580 người; TP.HCM giữ vị trí thứ 2 với 17.315 người; đứng thứ 3 là tỉnh Quảng Bình với 9.149 người. Vị trí tiếp theo lần lượt thuộc về các tỉnh, thành phố: Quảng Ninh, Hà Nam, Tuyên Quang…  Ban tổ chức sẽ liên hệ các thí sinh đoạt giải để trao giấy chứng nhận và giải thưởng của cuộc thi.  Tuần thi thứ 2 đang tiếp tục diễn ra từ ngày 9 đến 16-10. Những ai muốn đến với cuộc thi, có thể tham gia với các cách thức như sau:  - Truy cập vào website biencuongtoquoc.vn để đăng ký tham gia và dự thi.- Tải app Thanh Niên Việt Nam trên điện thoại di động, truy cập vào mục Học tập để đăng ký và dự thi.- Truy cập vào banner cuộc thi trên các báo điện tử: báo điện tử Đảng Cộng Sản Việt Nam, Nhân Dân, Quân Đội Nhân Dân, Tạp chí Tuyên Giáo, Tiền Phong, Thanh Niên, Tuổi Trẻ... để tham gia cuộc thi."
20211009152717391,https://tuoitre.vn/giang-quoc-co-giang-quoc-nghiep-que-tran-my-uyen-duoc-de-xuat-danh-hieu-nsnd-20211009152717391.htm,"Giang Quốc Cơ, Giang Quốc Nghiệp, Quế Trân, Mỹ Uyên… được đề xuất danh hiệu NSND",https://cdn1.tuoitre.vn/zoom/600_315/2021/10/9/32983e80e7be2ee077af-1633769887169161047841-crop-16337699137031403569016.jpg,09/10/2021 17:20 GMT+7,"TTO - Trong 35 nghệ sĩ vừa được Hội đồng xét tặng danh hiệu Nghệ sĩ Nhân dân, Nghệ sĩ Ưu tú đề xuất danh hiệu NSND có rất nhiều tên tuổi được chú ý trong làng nghệ thuật.",Văn hóa,Đời sống,"Sau cuộc họp ngày 6-10 để thông qua hồ sơ đề nghị xét tặng danh hiệu Nghệ sĩ nhân dân, Nghệ sĩ ưu tú (NSND, NSƯT), Hội đồng xét tặng danh hiệu NSND, NSƯT cấp thành phố đã công bố danh sách đề xuất danh hiệu NSND cho 35 nghệ sĩ và danh hiệu NSƯT cho 65 nghệ sĩ.Hội đồng xét tặng danh hiệu NSND, NSƯT lần 10-2021 tại TP.HCM đã tổ chức cuộc họp phiên toàn thể lúc 14h ngày 6-10 để thông qua các hồ sơ đề nghị xét tặng danh hiệu NSND, NSƯT cho 102 cá nhân thuộc 9 hội đồng cơ sở đề xuất lên.Theo đó, kết quả có 35 nghệ sĩ được đề xuất danh hiệu NSND và 65 nghệ sĩ được đề xuất danh hiệu NSƯT. Có 2 trường hợp chưa đủ điều kiện đề xuất lên hội đồng cấp nhà nước.Trong 35 nghệ sĩ được đề xuất danh hiệu NSND có rất nhiều tên tuổi được chú ý trong làng nghệ thuật như anh em nghệ sĩ xiếc Quốc Cơ - Quốc Nghiệp, ca sĩ Thanh Thúy, nhạc sĩ Thế Hiển, nghệ sĩ Đàm Loan, Lê Thiện, Thanh Điền, Thanh Kim Huệ, Thanh Nguyệt, Thoại Mỹ, Trọng Phúc, Phượng Loan, Quế Trân, Hữu Quốc, Mỹ Uyên, Trịnh Kim Chi…65 nghệ sĩ được đề xuất danh hiệu NSƯT có Bạch Long, Đại Nghĩa, Hữu Nghĩa, Đình Toàn, Ốc Thanh Vân, Hòa Hiệp, Huỳnh Đông, Võ Minh Lâm, Hà Như…Từ kết quả cuộc họp này, Hội đồng xét tặng danh hiệu NSND, NSƯT lần 10-2021 tại TP.HCM thông báo đến các hội đồng cấp cơ sở và cá nhân. Các cấp cơ sở và cá nhân có ý kiến phản hồi gởi về Sở Văn hóa - thể thao TP.HCM, thường trực hội đồng xét tặng theo thời gian quy định. Sau thời gian trên, các hội đồng cấp cơ sở và cá nhân không có ý kiến phản hồi xem như thống nhất với kết quả trên."
20211006113243454,https://tuoitre.vn/ho-ngoc-ha-kha-nhu-cung-hon-1-000-nguoi-noi-tieng-lan-toa-nang-luong-tich-cuc-cho-thanh-pho-20211006113243454.htm,"Hồ Ngọc Hà, Khả Như cùng hơn 1.000 người nổi tiếng lan tỏa năng lượng tích cực cho thành phố",https://cdn1.tuoitre.vn/zoom/600_315/2021/10/6/1fa7135e3645ff1ba654-16335007210601768560100-crop-16335007463302062889682.jpg,06/10/2021 13:52 GMT+7,"TTO - Sau hơn 3 tháng phát động, dự án cộng đồng 'Năng lượng tích cực cho thành phố yêu thương' khép lại với sự đồng hành của hơn 1.000 người nổi tiếng trên nhiều lĩnh vực thông qua những việc làm cụ thể.",Văn hóa,Đời sống,"Từ một chiến dịch phát động trên mạng xã hội đầu tháng 7-2021, dự án cộng đồng Năng lượng tích cực cho thành phố yêu thương nhanh chóng nhận được sự hưởng ứng của đông đảo nghệ sĩ.Sau đó, dự án mở rộng bằng các hoạt động thiết thực như: tặng quà tại các bệnh viện, mái ấm tình thương, hỗ trợ người khó khăn, thất nghiệp...Điểm nhấn là chuỗi chương trình livestream Thành phố 18h mang đến nhiều thông tin hữu ích và phút giây thư giãn với âm nhạc. Cũng thông qua chương trình này, các nhà hảo tâm đóng góp kinh phí hơn 8,5 tỉ đồng vào các hoạt động xã hội.Đạo diễn Trần Thành Trung - người khởi xướng dự án - cho biết sau khi ra mắt vài ngày, dự án nhận được sự hưởng ứng nồng nhiệt của nhiều tầng lớp trong xã hội, nhất là người nổi tiếng. Chương trình thật sự đã trở thành cầu nối góp phần thiết thực vào công cuộc đẩy lùi dịch bệnh.""Đây là chiến dịch mang lại nguồn năng lượng tích cực và truyền cảm hứng đến tất cả mọi người. Hà có tham gia, đóng góp sức mình thông qua gửi các suất ăn đến các y bác sĩ, bệnh nhân ở các bệnh viện dã chiến. Hành động này nhỏ thôi nhưng Hà rất tự hào"" - ca sĩ Hồ Ngọc Hà chia sẻ.Còn MC Đại Nghĩa - một trong những nghệ sĩ có đóng góp tích cực cho cộng đồng thời gian qua - cho rằng không phải việc xông pha đến những nơi cần được trợ giúp mới góp phần hỗ trợ cho công tác chống dịch, mà ngay cả việc chúng ta ở nhà cũng là cách chúng ta giúp đỡ cho những y bác sĩ tuyến đầu.Diễn viên Khả Như nói: ""Bản thân mỗi người có sự lo toan cho cuộc sống nhưng khi mình lan tỏa một chút xíu tích cực của mình sẽ làm cho mọi người xung quanh mình vui hơn, bản thân mình cũng thấy vui hơn, sống có ích hơn""."
20210909110320201,https://tuoitre.vn/giao-hoang-francis-mua-15-000-que-kem-giup-tu-nhan-y-vuot-qua-mua-he-do-lua-20210909110320201.htm,Giáo hoàng Francis mua 15.000 que kem giúp tù nhân Ý vượt qua mùa hè đổ lửa,https://cdn1.tuoitre.vn/zoom/600_315/2021/9/9/giao-hoang-kem-16311603642391272605796-crop-1631160434398409191632.jpg,09/09/2021 12:08 GMT+7,TTO - Những cây kem được Hồng y Konrad Krajewski thay mặt Giáo hoàng Francis chuyển đến nhà tù Regina Coeli ở trung tâm thành phố Rome và nhà tù Rebibbia trong suốt mùa hè năm nay.,Văn hóa,Đời sống,"Báo The Guardian của Anh dẫn thông báo từ văn phòng từ thiện của Tòa thánh Vatican hóm hỉnh cho biết văn phòng này ""không nghỉ hè 2021"".Thay vào đó, các tình nguyện viên của Vatican đã dành thời gian thăm các tù nhân và an ủi những người kém may mắn. Theo Vatican, Giáo hoàng Francis đã quyết định mua 15.000 cây kem và chuyển cho các tù nhân tại hai nhà tù ở Rome trong suốt mùa hè này.Số kem này đã được Hồng y Konrad Krajewski thay mặt Giáo hoàng chuyển đi với hy vọng giúp các phạm nhân bớt ngột ngạt trong cái nóng như đổ lửa của mùa hè năm nay.Theo Vatican, số kem này chỉ là một trong số nhiều việc làm được tiến hành ""để giúp đỡ và mang lại hy vọng cho hàng nghìn người trong các nhà tù của Rome"".Vào tháng 6, khoảng 20 tù nhân từ nhà tù Rebibbia đã diện kiến Giáo hoàng Francis trước khi cùng ngài đến thăm Viện bảo tàng Vatican.Văn phòng từ thiện của Vatican cũng đưa những nhóm nhỏ người vô gia cư ""đến biển hoặc hồ lớn để có một buổi chiều thư giãn và ăn tối trong một tiệm bánh pizza"". Cơ quan này cũng tài trợ xét nghiệm COVID-19 miễn phí và tiêm chủng cho những người vô gia cư, người nghèo ở Rome.Mùa hè năm nay là một trong những mùa hè nóng nhất được ghi nhận ở Ý, theo The Guardian. Syracuse, một thành phố ở Sicily, ghi nhận nhiệt độ tới 48,8 độ C vào tháng 8. Nhiệt độ cao cũng dẫn tới các vụ cháy rừng diện rộng khiến lực lượng cứu hỏa phải căng mình ngăn chặn.Giáo hoàng Francis là vị giáo hoàng đầu tiên đến từ Nam Mỹ và bán cầu Nam. Ông được bầu vào vị trí người đứng đầu Vatican trong Mật nghị Hồng y năm 2013, sau khi Giáo hoàng Benedict XVI thoái vị vì lý do sức khỏe.Hồng y Krajewski, 57 tuổi, thường lặng lẽ làm các việc giúp đỡ người nghèo trong suốt nhiều năm, theo The Guardian. Ông gây chú ý vào năm 2019 khi xé niêm phong của cảnh sát và khôi phục điện cho một tòa nhà là nơi tá túc của khoảng 450 người vô gia cư. Địa điểm này trước đó bị cắt điện vì thiếu hơn 300.000 euro tiền điện. Hồng y Krajewski khi đó tuyên bố nhận mọi trách nhiệm, kể cả tiền phạt."
20210902141041393,https://tuoitre.vn/noi-niem-ca-ho-kho-dua-em-kho-ngon-qua-rat-vua-mieng-anh-20210902141041393.htm,"Nỗi niềm cá hố kho dưa, em kho ngon quá rất vừa miệng anh",https://cdn1.tuoitre.vn/zoom/600_315/2021/9/2/ca-ho-kho-dua-thoi-gian-cach-4-1630566494317314112352-crop-1630566661985538882852.jpg,09/09/2021 07:09 GMT+7,"TTO - Cách đây mấy hôm, rể của tôi ở nội thành Đà Nẵng gửi cho con cá hố khá to cùng mấy ký rau cải để muối dưa. Cá hố tươi kho dưa cải muối chua mới là món khoái khẩu trong bữa cơm người vùng biển và khu vực nông thôn, miền núi.",Văn hóa,Đời sống,"Trước tiên, tôi làm dưa muối đơn giản như sau: cắt bỏ gốc cải, lặt bỏ lá úa vàng, rửa sạch và để ráo. Mấy ngày qua, khu vực miền Trung có nắng to cùng với gió Nam Lào nóng rát rạt cũng tạo điều kiện cho tôi phơi số cải  vừa xắt cho mau héo. Cuối cùng tôi cho ""cải héo"" vào thẩu thủy tinh, châm nước sôi (có muối) để nguội vào đầy thẩu và không quên cài ít cọng tre để thân cải chìm trong nước muối, đậy nắp lại chờ ba, bốn hôm sẽ thành dưa cải chua.Cá hố tươi rói được bán nhiều và khá rẻ tại các chợ miền duyên hải, đồng bằng, và còn được phơi khô sau này mang lên các chợ quê nông thôn, miền núi để bán với giá khá cao. Ngoài ra, cá hố lớn con được đông lạnh xuất khẩu.  Các lão ngư ở làng chài Thọ Quang (Q.Sơn Trà)  cho hay, mùa hè cá hố được mùa và chất lượng cá hố ngon nhất bởi nắng ấm, cá hố từ tầng đáy  lượn lờ gần mặt nước để săn đủ mồi nên thịt đậm đà, bùi béo. Tại các chợ, từng rổ cá hố tươi ""lấp lánh"" với mình dài thượt với lớp phấn sáng rỡ mỡ màng và loại cá hố vàng phổ biến của biển miền Trung còn hấp dẫn thêm với lớp da hơi ửng vàng, nhìn ""đã"" mắt vô cùng…Cá hố chọn kho là những con cá to bằng bàn tay, thật tươi thì mới ngon. Cá hố tươi có màu trắng óng ánh, sờ vào có cảm giác láng mượt.  Người xứ biển Quảng Nam - Đà  Nẵng thường chế biến cá hố tươi thành nhiều món ăn hấp dẫn, khác nhau như: nướng, nấu canh chua, chiên, kho rim, kho xốt cà chua…Nhưng món cá hố tươi kho dưa cải muối chua mới là món khoái khẩu trong bữa cơm người vùng biển và khu vực nông thôn, miền núi. Cho nên vẫn còn lưu truyền câu ca: ""Thơm ngon cá hố kho dưa / Cá chuồn kho mít, cá dưa kho cà…"".  Cá hố kho dưa cải tuy dễ chế biến nhưng muốn ngon phải tỉ mỉ hơn. Trước hết, rửa dưa cải muối chua bằng nước lã cho bớt vị mặn, vắt khô nước rồi cắt dưa thành những đoạn ngắn và xếp xuống dưới đáy xoong. Tôi xếp cá hố (đã rã đông và cắt miếng) lên trên dưa cải. Gia vị dùng để ướp cá gồm một ít bột ngọt, nước mắm, đường, một vài trái ớt xanh hay ớt chín đỏ; hành tím giã giập sơ qua, tiêu bột. Tất cả trải đều lên bề mặt cá, cuối cùng cho thêm vài muỗng dầu phộng để cá dậy mùi thơm. Ướp chừng 10 phút, tôi bắc nồi cá lên bếp, vặn lửa liu riu để cá thấm gia vị. Khi mùi thơm của cá tỏa ra, tôi cho một ít nước đun sôi vào đậy nắp lại rồi kho nhỏ lửa liu riu cho tới khi gần cạn nước thì nhắc xuống.  Món cá hố kho dưa hấp dẫn trong bữa ăn gia đình tôi thời giãn cách bởi vị ngọt, béo, thơm của cá, nhất là ăn miếng lườn cá hố, ôi, ""béo ơi lá béo, ngon ơi là ngon"" hòa quyện với vị cay nhẹ của ớt, tiêu và vị chua chua của dưa cải đã làm các con tôi ""đánh bay"" nồi cơm  mà chẳng cần ""coi hướng""."
20210907220120792,https://tuoitre.vn/nha-thiet-ke-cong-chua-nguyen-minh-cong-tro-tai-lam-banh-nam-bo-20210907220120792.htm,'Nhà thiết kế công chúa' Nguyễn Minh Công trổ tài làm bánh Nam Bộ,https://cdn1.tuoitre.vn/zoom/600_315/2021/9/7/8437f15b5074a62aff65-1631026742219357978022-crop-16310267771111813089739.jpg,08/09/2021 16:38 GMT+7,"TTO - Trân quý khoảnh khắc bên gia đình trong thời gian giãn cách xã hội, nhà thiết kế Nguyễn Minh Công làm bánh đãi cả nhà. Anh thích làm các loại bánh dân gian Nam Bộ: bánh da lợn, bánh bèo, bánh ướt, bánh chuối, bánh ít, bánh tằm khoai mì...",Văn hóa,Đời sống,"Nhắc đến nhà thiết kế Nguyễn Minh Công, mọi người sẽ nghĩ ngay đến ""nhà thiết kế công chúa"" bởi sự nghiệp thời trang của anh gắn liền với những mẫu váy áo ""đậm chất công chúa"".Anh đánh dấu sự nghiệp bằng những sô diễn thời trang ấn tượng, đặc biệt là dự án sách ảnh lưu lại những tác phẩm đẹp nhất trong 5 năm theo đuổi thời trang.Trong những ngày giãn cách xã hội, Nguyễn Minh Công may mắn có nhiều thời gian ở bên gia đình. Anh cùng mọi người nấu ăn rồi thưởng thức cùng nhau.Anh đã thực hiện nhiều loại bánh dân gian được nhiều người yêu thích như: bánh bèo, bánh ướt, bánh chuối, bánh ít, bánh tằm khoai mì..., đặc biệt là món bánh da lợn nằm trong top 100 loại bánh ngọt ngon nhất thế giới được trang ẩm thực nổi tiếng TasteAtlas công bố gần đây.Nhà thiết kế Nguyễn Minh Công cho biết: ""Trước đây hoàn cảnh khó khăn nên mẹ thường làm đủ các loại bánh cho cả nhà cùng ăn. Dịp này về quê (Vĩnh Long) có nhiều thời gian nên mình làm các loại bánh mẹ hay làm để nhớ lại tuổi thơ. Có lẽ được thừa hưởng gen khéo tay của mẹ nên mình làm món bánh nào cũng thành công ngay từ lần đầu tiên"".""Mình hay ví von nấu ăn cũng giống như thời trang. Mình phải dành tâm huyết cho món ăn, đặt toàn tâm toàn ý thì mới thành công được. Mình thấy nấu ăn giúp rèn luyện được tính kiên nhẫn, tỉ mỉ và tinh tế"", Nguyễn Minh Công cho biết thêm.Vậy nên ngoài có nguyên liệu tốt, công thức hay thì người làm bánh cần phải cố gắng làm đến cùng mới có món ăn ngon. Nếu vội vàng bỏ đi bước nào đó dù là nhỏ nhất sẽ không thu về được kết quả tốt.Công thức món bánh da lợn, bánh bèo, bánh ướt ngọt và chè bưởi của nhà thiết kế Nguyễn Minh Công:Một số loại bánh khác của nhà thiết kế Nguyễn Minh Công"
