id,link,title,thumbnail,time,summary,category,sub_category,full_article
20221028091113061,https://tuoitre.vn/ha-noi-156-o-dich-sot-xuat-huyet-9-nguoi-tu-vong-20221028091113061.htm,"Hà Nội: 156 ổ dịch sốt xuất huyết, 9 người tử vong",https://cdn1.tuoitre.vn/zoom/600_315/2022/10/28/z367203610989249e49a40150475dbf925ddd7f5146180-1666922784417146108696-crop-16669229340841384082214.jpg,28/10/2022 11:13 GMT+7,"TTO - Sở Y tế thành phố Hà Nội thông tin tình hình dịch sốt xuất huyết có xu hướng tăng nhanh. Từ đầu năm đến nay đã có 9 ca tử vong, hiện tại còn 156 ổ dịch đang hoạt động. Sở Y tế thành phố nhận định đỉnh dịch sốt xuất huyết rơi vào giữa tháng 11.",Sức khỏe,,"Trao đổi với Tuổi Trẻ Online, ông Khổng Minh Tuấn - phó giám đốc phụ trách điều hành Trung tâm Kiểm soát bệnh tật thành phố Hà Nội - cho biết tính đến ngày 28-10, thành phố ghi nhận chín ca tử vong do sốt xuất huyết tại sáu quận, huyện: Thanh Oai (3); Thanh Trì (2); Hà Đông (1); Phú Xuyên (1); Đan Phượng (1); Long Biên (1).Theo báo cáo mới nhất của Sở Y tế Hà Nội, toàn thành phố đã ghi nhận 8.481 ca mắc, số ca mắc tăng nhiều so với cùng kỳ năm 2021 (2.627 ca mắc, 0 ca tử vong). Bệnh nhân phân bổ tại 30/30 quận, huyện, thị xã; 530/579 xã, phường, thị trấn.Trong năm 2022, tình hình dịch bệnh sốt xuất huyết có xu hướng gia tăng nhanh và tăng vượt mức trung bình giai đoạn 2019 - 2021. Đến nay toàn thành phố ghi nhận 720 ổ dịch sốt xuất huyết, hiện tại còn 156 ổ dịch đang hoạt động.Ngoài sốt xuất huyết, một số dịch bệnh ở Hà Nội có xu hướng tăng so với cùng kỳ 2021 như bệnh tay chân miệng (1.543 ca); liên cầu lợn (3 ca); viêm não Nhật Bản (4 ca); uốn ván (11 ca).Ngày 27-10, ông Vũ Cao Cương, phó giám đốc Sở Y tế Hà Nội, cùng đoàn kiểm tra công tác phòng chống sốt xuất huyết trên địa bàn quận Hoàng Mai. Sở Y tế cho hay, nhiều địa phương tại thành phố đang trong quá trình đô thị hóa, nhiều công trình xây dựng, nhiều phế liệu phế thải là nơi chứa nước tạo điều kiện để lăng quăng, bọ gậy phát triển.Khu vực nhà trọ, dân cư di biến động phức tạp, đa số người trọ là học sinh, sinh viên nên ý thức vệ sinh môi trường chưa được tốt, tạo điều kiện để muỗi phát triển. Ở một số phường, người dân có bể chứa nước nổi không có nắp đậy kín, hoặc có nắp nhưng không kín. Các hộ còn trồng rau sạch trên sân thượng, trồng cây cảnh chính là môi trường thuận lợi cho bọ gậy phát triển.Ông Tuấn nhận định đỉnh dịch sốt xuất huyết có thể rơi vào trung tuần tháng 11. Sở Y tế cũng đề nghị các đơn vị tăng cường công tác giám sát, phát hiện sớm dịch bệnh sốt xuất huyết tại các cơ sở điều trị và tại cộng đồng để khoanh vùng, xử lý ổ dịch kịp thời.Theo ông Đỗ Duy Cường - giám đốc Trung tâm Bệnh nhiệt đới, Bệnh viện Bạch Mai, số lượng bệnh nhân sốt xuất huyết ở Hà Nội và các tỉnh lân cận đang gia tăng. Số bệnh nhân sốt xuất huyết có dấu hiệu cảnh báo phải nhập viện tháng 9 là 160 bệnh nhân, từ đầu tháng 10 đến nay là 250 bệnh nhân.Các bác sĩ cảnh báo dịch chồng dịch khi thời tiết miền Bắc chuyển mùa, các bệnh dịch khác (COVID-19, adenovirus, cúm, thủy đậu,...) cũng có nguy cơ bùng phát.Ông Cường khuyến cáo người dân khi có biểu hiện sốt nên đến bệnh viện để làm xét nghiệm công thức máu và xét nghiệm chẩn đoán sốt xuất huyết sớm từ những ngày đầu tiên.Nếu đúng bệnh nhân sốt xuất huyết sẽ được các bác sĩ theo dõi, tư vấn và điều trị kịp thời. Một số trường hợp có thể điều trị tại nhà, không nhất thiết phải nhập viện nếu không có chỉ định, tránh dẫn đến quá tải bệnh viện."
20221027161322419,https://tuoitre.vn/vi-sao-chung-ta-lun-di-khi-ve-gia-20221027161322419.htm,Vì sao chúng ta 'lùn đi' khi về già?,https://cdn1.tuoitre.vn/zoom/600_315/2022/10/27/photo-1-16668618490881566530354-crop-16668619328661538716160.jpg,28/10/2022 09:55 GMT+7,"TTO - Giảm chiều cao là một đặc trưng điển hình của việc chúng ta già đi. Bắt đầu từ năm 40 tuổi trở đi, chúng ta thường giảm khoảng 1,2cm chiều cao sau mỗi 10 năm tuổi và tốc độ giảm chiều cao sẽ nhanh khi ta bước vào độ tuổi 70.",Sức khỏe,,"Cơ thể một người sẽ phát triển từ thấp đến cao và đạt đỉnh vào giai đoạn 30 tuổi. Bắt đầu từ năm 40 tuổi trở đi, chúng ta thường giảm khoảng 1,2cm chiều cao sau mỗi 10 năm và tốc độ giảm chiều cao sẽ nhanh khi ta bước vào độ tuổi 70.Theo khoa học, nguyên nhân dẫn đến điều này là do những thay đổi trong xương, cơ, khớp và cả tư thế.  Một nghiên cứu khoa học năm 2006  trên tạp chí JAMA Internal Medicine cho biết giảm chiều cao có liên quan đến những thay đổi lão hóa ở xương, cơ và khớp. Cụ thể là tại các đĩa đệm cột sống - những đệm giống như gel nằm giữa các đốt sống của cột sống - hoạt động như bộ giảm xóc để giữ cho lưng của chúng ta linh hoạt.Nhưng khi năm tháng trôi qua, các đĩa đệm mất dần chất lỏng (khi chúng ta sinh ra, chúng chứa khoảng 80% nước) và không chống chọi được với sự hao mòn tự nhiên. Chúng dần bị nén lại và phẳng ra. Không gian giữa các khớp bị thu hẹp dẫn đến thân và cột sống ngắn lại.Hầu hết con người ở độ tuổi 60 đều gặp các vấn đề về đĩa đệm ở một mức độ nào đó.Ở phụ nữ, mãn kinh còn có thể gây mất tác dụng bảo vệ của estrogen đối với xương, làm tăng tốc độ loãng xương, mật độ khoáng của xương và khối lượng xương giảm, chất lượng hoặc cấu trúc của xương cũng thay đổi.  Cùng với những thay đổi trong xương, chúng ta cũng sẽ mất khối lượng cơ theo tuổi tác. Bắt đầu từ tuổi 30, mất cơ liên quan đến tuổi được gọi là chứng giảm cơ (mất khối lượng và sức mạnh của cơ xương) có thể khiến bạn mất tới 3% đến 5% khối lượng cơ mỗi thập kỷ. Đặc biệt, cơ thân có nhiệm vụ giữ cho chúng ta đứng thẳng bị suy yếu có thể gây ra tư thế khom lưng, khiến bạn trông thấp hơn. Bàn chân về già trở nên bằng hơn cũng khiến ta trông thấp hơn.Làm thế nào để ngăn ngừa giảm chiều cao khi về già?Giảm chiều cao là điều bình thường nên chúng ta không cần phải quá lo lắng về vấn đề này. Tuy nhiên, nếu tốc độ giảm chiều cao diễn ra quá nhanh và thường xuyên bị đau lưng thì nên đến các cơ sở y tế kiểm tra, vì có thể đã mắc các vấn đề về xương, chẳng hạn như bị loãng xương.  Chúng ta cũng có thể giảm nguy cơ mất chiều cao khi về già, đồng thời bảo vệ sức khỏe của xương ngay từ bây giờ bằng cách: tập thể dục thường xuyên, nâng tạ nhẹ nhàng (tạo áp lực cho xương và giúp xương chắc khỏe hơn), thực hiện một chế độ ăn uống giàu canxi và vitamin D để hỗ trợ sức khỏe của xương, tránh hút thuốc, tránh sử dụng quá nhiều rượu và caffeine."
20221027231057982,https://tuoitre.vn/benh-nhan-mac-giang-mai-co-xu-huong-tang-20221027231057982.htm,Bệnh nhân mắc giang mai có xu hướng tăng,https://cdn1.tuoitre.vn/zoom/600_315/2022/10/27/anh-tin-sk-28-101-2read-only-16668869400431402257370-crop-16668869749721996661948.jpg,28/10/2022 08:23 GMT+7,"TTO - Những năm gần đây, số lượt bệnh nhân bị giang mai đến các cơ sở y tế thăm khám có xu hướng gia tăng, tập trung chủ yếu ở nhóm MSM (nam quan hệ tình dục đồng giới).",Sức khỏe,,"Theo số liệu thống kê tại Bệnh viện Da liễu TP.HCM, số lượt bệnh nhân khám bệnh giang mai có xu hướng tăng mạnh, cụ thể năm 2014 có 2.091 ca, đến 2020 tăng hơn gấp ba, lên 6.734 ca. Riêng năm 2021, mặc dù ảnh hưởng dịch COVID-19 nhưng số ca giang mai vẫn ở mức 5.883 ca. Trong 9 tháng đầu năm 2022, đã có hơn 6.279 ca giang mai đến khám và điều trị, con số này vẫn tiếp tục gia tăng và dự báo có thể vượt mức năm 2020.Bác sĩ Đoàn Văn Lợi Em - phó trưởng khoa lâm sàng 3, Bệnh viện Da liễu TP.HCM - cho biết nguyên nhân của việc tăng bệnh nhân giang mai có thể là do các hành vi quan hệ tình dục. Ở nhóm MSM, nguyên nhân có thể do quan hệ với nhiều bạn tình ""lạ"".Ngoài ra, nhóm này thường quan hệ qua đường miệng và hậu môn, khó và hiếm khi sử dụng biện pháp bảo vệ như bao cao su. Thậm chí, một số có quan niệm sai lầm cho rằng quan hệ qua đường miệng và hậu môn là hành vi tình dục khác với quan hệ tình dục thông thường nên sẽ ít nguy cơ bị lây nhiễm bệnh hơn.Một nguyên nhân khác là có thể phần lớn bệnh giang mai không có triệu chứng hoặc triệu chứng không quá rầm rộ, người bệnh không nhận biết kịp thời để đi khám bệnh. Nhiều trường hợp bệnh chỉ biểu hiện với một vết loét duy nhất, nhưng do vết loét của giang mai có đặc điểm là thường không đau, không gây khó chịu nên nếu vết loét nằm ở vị trí khó quan sát như vùng hậu môn thường bị bệnh nhân bỏ sót. Sau một thời gian, vết loét cũng sẽ tự lành mặc dù không điều trị."
20221027231458238,https://tuoitre.vn/tang-ca-tu-vong-sot-xuat-huyet-vi-con-bac-si-quen-bai-dieu-tri-20221027231458238.htm,Tăng ca tử vong sốt xuất huyết vì còn bác sĩ 'quên bài' điều trị,https://cdn1.tuoitre.vn/zoom/600_315/2022/10/27/anh-sxh-16663227799271330458735-16668871901941248313612-crop-1666887206930557547313.jpg,28/10/2022 08:15 GMT+7,"TTO - Lý do này do bác sĩ Đỗ Châu Việt, trưởng khoa hồi sức nhiễm Bệnh viện Nhi đồng 2, trao đổi tại Hội nghị khoa học kỹ thuật lần thứ 29 ở Bệnh viện Nhi đồng 2 (TP.HCM) chiều 27-10",Sức khỏe,,"Bác sĩ Đỗ Châu Việt đã báo cáo một số khó khăn và giải pháp trong chẩn đoán, xử trí sốt xuất huyết Dengue hiện nay, trong đó nổi bật là nhân viên y tế thiếu kiến thức hay còn ""quên bài"" về chẩn đoán, điều trị sốt xuất huyết.Lý giải điều này, bác sĩ Việt cho rằng các nhân viên y tế đã tập trung chống dịch COVID-19 trong suốt hai năm qua, chưa được tập huấn và ""tái"" tập huấn phác đồ. Bên cạnh đó, sự luân chuyển, nghỉ việc, nghỉ hưu, xáo trộn nhân sự cũng là nguyên nhân làm các nhân viên y tế ""quên bài"".Để giải quyết tình trạng này, theo bác sĩ Việt, cần tập huấn phác đồ điều trị sốt xuất huyết năm 2019 (phác đồ cập nhật) cho tất cả nhân viên y tế, cần phải nghĩ đến sốt xuất huyết ngay khi bệnh nhân có triệu chứng sốt. Về phía bệnh nhân và người nhà, nhân viên y tế phải dặn dò theo dõi dấu hiệu cảnh báo, tái khám ngay khi có dấu hiệu chuyển độ nặng hoặc không an tâm.Cũng theo bác sĩ Việt, tính đến chiều 27-10, số người tử vong vì sốt xuất huyết ở khu vực phía Nam là 135 người, trong đó có 79 người lớn, còn lại là trẻ em. Hiện số tử vong do sốt xuất huyết tại TP.HCM chiếm 22% trong tổng số ca tử vong ở khu vực phía Nam. Theo báo cáo của Sở Y tế TP.HCM, tính từ đầu năm đến ngày 24-10, TP.HCM có 68.972 ca mắc sốt xuất huyết, trong đó có 29 ca tử vong (tăng 24 ca tử vong so với cùng kỳ năm 2021)."
20221027230740196,https://tuoitre.vn/khi-my-pham-cung-co-the-gay-ung-thu-20221027230740196.htm,Khi mỹ phẩm cũng có thể gây ung thư,https://cdn1.tuoitre.vn/zoom/600_315/2022/10/27/anh-bai-sk-28-10-2read-only-16668866443001892382083-crop-166688669317353895615.jpg,28/10/2022 05:40 GMT+7,"TTO - Hàng loạt dầu gội khô của một thương hiệu nổi tiếng thế giới bị thu hồi tại Mỹ vì nghi chứa chất gây ung thư. Trước đó, nhiều loại mỹ phẩm như kem chống nắng, kem dưỡng ẩm cũng bị thu hồi vì lý do này.",Sức khỏe,,"Theo bác sĩ Phạm Cao Kiêm - nguyên trưởng khoa thẩm mỹ, Bệnh viện Da liễu trung ương, mỹ phẩm bao gồm chất tẩy rửa cơ thể, chất dưỡng ẩm, chất khử mùi, bộ sản phẩm trang điểm, kem đánh răng được sử dụng hằng ngày, thường xuyên. Khi sử dụng mỹ phẩm, một số hóa chất có trong mỹ phẩm có thể thấm qua da với số lượng đáng kể, đặc biệt là khi mỹ phẩm để lại trên da trong một thời gian dài.Mỹ phẩm gây ung thư như thế nào?""Hiện tại Việt Nam chưa có nhiều nghiên cứu về ảnh hưởng của các loại mỹ phẩm có thể gây ra ung thư như thế nào. Tuy nhiên, một số nghiên cứu trên thế giới cho thấy việc sử dụng một số loại hóa chất có thể làm tăng nguy cơ gây ung thư, phổ biến nhất là ung thư da. Bên cạnh đó, những sản phẩm dưỡng da kém chất lượng cũng có thể gây ra nhiều biến chứng khác như nhiễm trùng da, ảnh hưởng sắc tố da, gây mụn, các loại dầu gội đầu kém chất lượng có thể gây viêm da đầu, rụng tóc...Hiện đã có quy định về danh mục chất không được sử dụng, nếu được sử dụng thì quy định hàm lượng cho phép. Tuy nhiên việc kiểm soát lại không hề dễ dàng"", bác sĩ Kiêm nhận định.Theo bác sĩ Kiêm, mặc dù có quy định về các chất cấm trong mỹ phẩm nhưng không phải sản phẩm nào cũng ghi đầy đủ thành phần. Vì vậy, rất khó để người tiêu dùng có thể lựa chọn sản phẩm. ""Các chất hóa học không dễ đọc, dễ nhớ, vì vậy nhiều người tiêu dùng không thể biết được sản phẩm mỹ phẩm mình sử dụng có chứa chất cấm hay không.Bởi vậy, để tránh ảnh hưởng đến sức khỏe, người tiêu dùng nên lựa chọn những sản phẩm có uy tín trên thị trường. Tránh mua, sử dụng các sản phẩm không rõ nguồn gốc xuất xứ. Ngoài ra, có thể sử dụng các sản phẩm làm đẹp tự nhiên, ít hóa chất để sử dụng an toàn"", bác sĩ Kiêm khuyến cáo.Nhiều người bị ảnh hưởng bởi mỹ phẩmBác sĩ Lê Thái Vân Thanh, khoa da liễu - thẩm mỹ da, Bệnh viện Đại học Y dược TP.HCM, cho biết nhiều người cho rằng dầu gội, sữa tắm, các sản phẩm chăm sóc da, trang điểm... sử dụng ngoài da, không ảnh hưởng đến sức khỏe. Nhưng thực tế nếu chất lượng những sản phẩm này không đảm bảo, nguy cơ thẩm thấu qua hệ tuần hoàn, ảnh hưởng đến sức khỏe người sử dụng. Ngoài ra ảnh hưởng trước mắt như gây kích ứng da đã ghi nhận nhiều.Trong quá trình khám chữa bệnh tại khoa da liễu - thẩm mỹ da, bác sĩ Vân Thanh gặp nhiều nhất các trường hợp sử dụng các sản phẩm chăm sóc da và bị kích ứng ngay, hoặc bị dị ứng sau 2-3 tuần đến 3 tháng sử dụng.Người bệnh đến bệnh viện trong tình trạng khô da, tróc vảy, nổi mề đay, da sần sùi và ngứa. Nhiều bệnh nhân không biết những mỹ phẩm sử dụng trước đó lại gây ra tình trạng này. Khi được giải thích, nhiều bệnh nhân thắc mắc: ""Tôi chỉ sử dụng mỹ phẩm ở mặt mà dị ứng cả người?"". Điều đáng nói là nhiều bệnh nhân chỉ nghe người nổi tiếng quảng cáo ""đã sử dụng"" nên mua, sử dụng theo.Cũng có không ít người không biết mỹ phẩm từng dùng có thể gây những triệu chứng trên da, nên khi dị ứng lại tưởng bị mắc giun, sán và đi khám.Trước thực tế này, bác sĩ Thanh khuyên khi thấy có bất kỳ triệu chứng gì trên da cần ngưng các loại mỹ phẩm đang sử dụng, sau 1-2 ngày không thấy đỡ thì cần đến chuyên khoa da liễu khám ngay. Trong trường hợp triệu chứng trên da rầm rộ thì cần đến bác sĩ khám để được tìm nguyên nhân và điều trị kịp thời."
20221027092139527,https://tuoitre.vn/tam-trong-nuoc-am-10-phut-de-han-che-viem-da-co-dia-bung-phat-20221027092139527.htm,Tắm trong nước ấm 10 phút để hạn chế viêm da cơ địa bùng phát,https://cdn1.tuoitre.vn/zoom/600_315/2022/10/27/tin-suc-khoe-16668371048701750169661-crop-1666837238314452546828.jpg,27/10/2022 10:02 GMT+7,"TTO - Ngày 26-10, bác sĩ Nguyễn Vũ Hoàng, trưởng khoa lâm sàng 2 Bệnh viện Da liễu TP.HCM, cho biết hiện thời tiết đang chuyển hanh khô, điều kiện thuận lợi để viêm da cơ địa tái phát.",Sức khỏe,,"Những ngày gần đây, bệnh viện đã tiếp nhận nhiều trường hợp bị viêm da cơ địa đến khám, số ca bệnh có xu hướng gia tăng trong thời gian tới.Theo thống kê của Bệnh viện Da liễu TP.HCM, mỗi năm có khoảng 63.000 lượt người bị viêm da cơ địa đến khám. Đây là bệnh lý mãn tính, thường ít nguy hiểm đến tính mạng, nhưng nếu người bệnh không được điều trị hoặc điều trị không đúng cách sẽ dễ dẫn đến nhiễm trùng da và đặc biệt là nhiễm trùng huyết, nguy cơ tử vong cao.Bác sĩ khuyến cáo khi cơ thể xuất hiện các dấu hiệu của bệnh như da nổi đỏ, tróc vảy, mụn nước, phù nề, rỉ dịch kèm với ngứa nhiều, người bệnh nên sớm đến khám tại các bệnh viện chuyên khoa da liễu để được chẩn đoán, điều trị kịp thời, đúng cách và tránh được các biến chứng của bệnh. Tuyệt đối không được chích vỡ các mụn nước và hạn chế cào gãi để tránh nhiễm trùng da.Để hạn chế viêm da cơ địa bùng phát, bác sĩ Hoàng khuyên nên thoa kem dưỡng ẩm ngay sau khi tắm và khi da bị khô. Chọn các sản phẩm chăm sóc da không có mùi thơm. Kiểm tra tất cả các sản phẩm chăm sóc da trước khi sử dụng chúng.Tắm hằng ngày từ 5 đến 10 phút trong nước ấm. Mặc quần áo rộng rãi, thoáng mát bằng vải 100% cotton. Giặt quần áo bằng bột giặt không có mùi thơm và không có thuốc nhuộm. Bảo vệ làn da khỏi nhiệt độ tăng/giảm quá mức trong ngày. Tìm hiểu nguyên nhân gây ra viêm da cơ địa bùng phát và tìm cách tránh những tác nhân này."
