id,link,title,thumbnail,time,summary,category,sub_category,full_article
1377307,https://tuoitre.vn/a-hau-thuy-dung-dai-dien-viet-nam-du-miss-international-2017-o-nhat-1377307.htm,Á hậu Thuỳ Dung đại diện Việt Nam dự Miss International 2017 ở Nhật,https://cdn1.tuoitre.vn/zoom/600_315/tto/i/s626/2017/08/30/screen-shot-2017-08-30-at-08-36-31-1504057007.png,30/08/2017 08:37 GMT+7,"TTO - Á hậu Thuỳ Dung chính thức được Cục nghệ thuật biểu diễn cấp phép, đại diện cho Việt Nam tranh tài ở Miss International 2017, diễn ra tại Nhật Bản từ ngày 25-10 đến 14-11",Giải trí,Thời trang,"Á hậu Thuỳ Dung (trái) được Á khôi Áo dài 2016 Phương Linh, đại diện Việt Nam tại Hoa hậu Quốc tế 2016 trao băng đeo Miss International Vietnam 2017 - Ảnh: KIỆT VÕ - HUY NGUYỄN

Đúng một năm sau ngày đăng quang ngôi vị Á hậu 2 cuộc thi Hoa hậu Việt Nam 2016, cô gái Trần Thị Thuỳ Dung nhút nhát, sợ đám đông ngày nào đã “lột xác”, trưởng thành rõ rệt.
“Ngày xưa có nằm mơ tôi cũng không bao giờ nghĩ mình có đủ can đảm để đứng trên một sân khấu lớn nói chuyện với mọi người như thế này” cô sinh viên năm 4 ngành Tài chính Quốc tế ĐH Ngoại thương TP.HCM chia sẻ.
Một năm đã qua, trên cương vị của một Á hậu Việt Nam, Thuỳ Dung đã nỗ lực hết mình xây dựng hình ảnh của một người đẹp có tri thức, không hề vướng bận đến những scandal trong giới “chân ngắn, chân dài”, không tin đồn tình ái, không quá tật bật chạy sô sự kiện.
Nơi người ta thấy Thuỳ Dung xuất hiện nhiều nhất là những buổi hiến máu nhân đạo tại Cà Mau, đại sứ của chiến dịch Xuân tình nguyện 2017 tại TP.HCM, giới thiệu du lịch, văn hoá Việt Nam trong những chuyến lưu diễn tại nước ngoài và học ngoại ngữ (Dung có thể giao tiếp bằng tiếng Anh và tiếng Nhật)

Chính sự nỗ lực và rèn giũa nghiêm túc ấy, việc Thuỳ Dung được công ty Elite Việt Nam, đơn vị giữ bản quyền cuộc thi Miss International tại Việt Nam chọn lựa và chính thức được Cục nghệ thuật biểu diễn cấp phép tham dự cuộc thi vào đầu tháng 8 vừa qua là hoàn toàn xứng đáng.
Trong buổi công bố sự kiện chiều ngày 29-8, Á khôi Áo dài 2016 Phương Linh, đại diện Việt Nam tại Hoa hậu Quốc tế 2016 đã trao băng đeo (sash) Miss International Vietnam 2017 cho Thuỳ Dung.
Việc này được thực hiện theo đúng tinh thần của các cuộc thi quốc tế, như một sự trao quyền đại diện cho các người đẹp dự thi từ người tiền nhiệm.
Trả lời cho vấn đề liên quan đến hành trang chuẩn bị cho cuộc thi Hoa hậu Quốc tế 2017, người đẹp cho biết cô và ê-kíp đang tăng tốc để có thể chuẩn bị mọi thứ một cách tốt nhất.
Trong đó, phần trang phục dạ hội của cô sẽ do nhà thiết kế Lê Thanh Hoà đảm nhận.
Về mặt kĩ năng, Thuỳ Dung với khả năng vẽ tranh, chơi nhạc cụ và phong thái khá tự tin của một người đang thử sức trong lĩnh vực MC hoàn toàn khiến người hâm mộ có thể chờ đợi sự toả sáng của Thuỳ Dung tại đấu trường này.
 Ngắm một số hình ảnh đẹp của á hậu Thuỳ Dung - Ảnh: Kiệt Võ - Huy Nguyễn
  

Á hậu Thuỳ Dung bên gia đình 

CEO Elite miền Nam - Trần Ngọc Lan Khuê, Thuỳ Dung và Hoa hậu biển Nguyễn Thi Loan, giám đốc quốc gia của Hoa hậu quốc tế 2017"
1376335,https://tuoitre.vn/tuong-linh-thi-hoa-hau-lien-luc-dia-2017-1376335.htm,Hoa hậu sắc đẹp châu Á Tường Linh thi Hoa hậu liên lục địa 2017,https://cdn1.tuoitre.vn/zoom/600_315/tto/i/s626/2017/08/28/collage-fotor-1503891609.jpg,28/08/2017 10:38 GMT+7,TTO - 'Hoa hậu The Face' Tường Linh sẽ đại diện Việt Nam đến với cuộc thi Hoa hậu Liên lục địa - Miss Intercontinental 2017 diễn ra tại Ấn Độ vào tháng 11 tới.,Giải trí,Thời trang,"Vẻ đẹp hiền hòa, xinh tươi của Tường Linh

Tường Linh đã có cơ hội trải nghiệm và cọ xát với các cuộc thi nhan sắc trong nước lẫn quốc tế, vì vậy khi được Helios Organization ngỏ lời mời, Tường Linh rất tự tin để gật đầu.
Tất nhiên, đấu trường nhan sắc Miss Intercontinental sẽ khốc liệt hơn rất nhiều so với các cuộc thi trước đó Linh từng tham gia.
Với hơn 70 người đẹp khắp thế giới. Tường Linh sẽ phải có sự chuẩn bị thật chu đáo và nỗ lực hết sức để đạt kết quả tốt nhất có thể, mang lại niềm tự hào cho Việt Nam.

Tổ chức Helios Organization - đơn vị nắm bản quyền cử thí sinh tham gia Hoa hậu Liên lục địa - vừa chính thức công bố: Hoa hậu sắc đẹp châu Á 2017 Tường Linh sẽ là gương mặt đại diện Việt Nam tham dự cuộc thi Hoa hậu Liên lục địa - Miss Intercontinental 2017
Tường Linh năm nay 23 tuổi, là con út trong một gia đình viên chức tại Phú Yên, có mẹ là Nhà giáo ưu tú dạy môn văn trường chuyên Lương Văn Chánh, ba làm việc trong quân đội.
Cô từng giải Nhất cuộc thi Người đẹp Phú Yên 2011, Hoa khôi nữ sinh thanh lịch tỉnh Phú Yên, Top 5 Hoa khôi Học viện Hàng không Việt Nam. Người đẹp vừa tốt nghiệp cử nhân đại học khoa Quản trị kinh doanh - Học viện Hàng không Việt Nam.
Tường Linh sở hữu chiều cao 1m70, số đo 3 vòng 83-58-89, có khả năng giao tiếp tốt bằng tiếng Anh, từng đoạt nhiều thành tích trong học tập và được xem là có nhiều tố chất để tỏa sáng trong tương lai.
Đáng chú ý, trong năm 2017 Tường Linh bất ngờ đăng quang cuộc thi Hoa hậu Sắc đẹp châu Á 2017 - Miss Asia Beauty 2017 được tổ chức tại Thái Lan. Sau đó, Tường Linh xuất hiện trong The Face Vietnam - Gương mặt thương hiệu 2017 (đội Hoàng Thùy) giành vị trí á quân.
Người đẹp 9x sở hữu “gương mặt hoa hậu” đầy đặn, ưa nhìn cùng phong cách thời trang sành điệu này được các bạn trong chương trình The Face ưu ái tặng cho danh hiệu ""Hoa hậu The Face"". 
Được tổ chức lần đầu vào năm 1971, Miss Intercontinental đến nay đã trải qua 46 lần tổ chức, trở thành cuộc thi nhan sắc quốc có “thâm niên” lâu thứ 4 chỉ sau Hoa hậu Thế giới, Hoa hậu Hoàn vũ và Hoa hậu Quốc tế.
Là cuộc thi nhan sắc chú trọng vào khuôn mặt và kỹ năng trình diễn, Hoa hậu Liên lục địa tìm kiếm những người đẹp sở hữu gương mặt ưa nhìn, hoàn hảo, phong cách trình diễn trên sân khấu tự tin, chuyên nghiệp. 
Việt Nam chính thức có đại diện tham gia Hoa hậu Liên lục địa là vào năm 2005. Khi đó, đại diện Việt Nam là siêu mẫu Thanh Hằng (cô đoạt được thành tích nhỏ là có tên trong danh sách các thí sinh được yêu thích bình chọn qua mạng).
Đến năm 2015, sau 10 năm, Việt Nam mới lại có gương mặt tiếp theo tham gia cuộc thi này là á hậu 1 Hoa hậu Đại dương 2014 Hà Thu. Người đẹp đã lọt vào top 14 chung cuộc cùng giải thưởng Thí sinh được yêu thích nhất do khán giả quốc tế bình chọn.
Năm 2016, Việt Nam tiếp tục cử người đẹp Bảo Như đến với cuộc thi nhưng cô không tiến sâu trong đêm chung kết.
Venezuela và Mỹ hiện là 2 quốc gia có thành tích tốt nhất hiện nay tại Hoa hậu Liên lục địa với 5 lần đăng quang cuộc thi.
Một số quốc gia khác có thành tích cao tại Miss Intercontinental là: Puerto Rico, Nga, Đức, Brazil, Colombia, Ấn Độ…Đương kim hoa hậu Liên Lục Địa 2016 là người đẹp Puerto Rico - Heilymar Rosario.
Hoa hậu Liên lục địa 2017 sẽ được tổ chức tại Mumbai (Ấn Độ) vào tháng 11-2017 với sự tham gia tranh tài của hơn 70 đại diện nhan sắc khắp thế giới.

Tường Linh trong phần trình diễn tại đêm chung kết The Face 2017 hôm 27-8 - Ảnh: Duyên Phan
Ngắm hoa hậu Tường Linh trong bộ ảnh áo dài, áo dạ hội và bikini:

Tường Linh trong trang phục áo dài Thuận Việt

Tường Linh với áo dạ hội Đỗ Long

Tường Linh và bikini Lovisa"
1339116,https://tuoitre.vn/hailey-baldwin-nguoi-dep-nong-bong-nhat-hanh-tinh-1339116.htm,​Hailey Baldwin: người đẹp nóng bỏng nhất hành tinh,https://cdn1.tuoitre.vn/zoom/600_315/tto/i/s626/2017/06/27/untitled-1498541935.png,27/06/2017 19:30 GMT+7,"TTO - Sở hữu hơn 10 triệu người theo dõi trên Instagram, là gương mặt quen thuộc của nhiều nhãn hàng, mới đây, Hailey Baldwin còn đứng đầu danh sách 100 người đẹp nóng bỏng nhất thế giới, Maxim Hot 100.",Giải trí,Thời trang,"Hailey Baldwin trong một chiến dịch quảng cáo cho Guess



Sinh ngày 22-11-1996, nữ người mẫu Hailey Baldwin có gia thế khá nổi tiếng. Cha cô là nam diễn viên kỳ cựu Stephen Baldwin, còn bác ruột là diễn viên, nhà văn, nhà sản xuất và cây hài nổi tiếng từng đoạt 2 giải Quả cầu Vàng Alec Baldwin.
Từng không muốn làm người mẫu
Hailey không chọn theo nghiệp diễn xuất của cha và bác, mà bắt đầu bước chân vào con đường người mẫu, nghề mà chị họ cô Ireland Baldwin  - con gái Alec Baldwin - cũng theo đuổi.
Hợp đồng quảng cáo đầu tiên của Hailey là với nhãn hiệu quần áo French Connection vào năm 2014. Tháng 10 năm đó, cô cũng chính thức bước chân lên sàn catwalk lần đầu tiên khi trình diễn cho bộ sưu tập của nhãn hàng Topshop.
Chỉ trong 3 năm làm người mẫu, Hailey Baldwin đã trở thành gương mặt được nhiều nhãn hàng danh tiếng lựa chọn, trong đó có Ralph LaurenTommy Hilfiger, Philipp Plein, Moschino, Guess, UGG, Karl Lagerfeld, Dolce & Gabbana, Elie Saab…
Người đẹp tóc vàng cũng từng sải bước trên nhiều sàn catwalk của các tuần lễ thời trang nổi tiếng như New York, Milan, Paris…
Cô cũng xuất hiện trên nhiều tạp chí thời trang nổi tiếng như Vogue, Teen Vogue, LOVE Magazine, L'Officiel Magazine, W, Marie Claire Magazine, Glamour Magazine, Harper's Bazaar, Elle…






Hailey Naldwin trên bìa tạp chí Maxim với cương vị là người dẫn đầu Maxim Hot 100



Tuy nhiên, năm 2014, trong một lần Elle hỏi rằng liệu có phải Hailey muốn trở thành người mẫu vì cô có nhiều bạn bè và cả chị họ đều là người mẫu hay không, Hailey cho biết mình từng không có ý định là người mẫu.
“Thậm chí là hơi ngược lại nữa kìa” Hailey tiết lộ. “Trong một thời gian dài, tôi luôn nói là mình không muốn làm người mẫu. Lúc đó tôi là một vũ công.
Tôi múa ballet 12 năm trời, từ hồi học mẫu giáo. Nhưng tôi biết là mình sẽ không theo đuổi sự nghiệp ballet dù tôi vẫn luôn muốn việc nhảy và di chuyển cơ thể là một phần của cuộc đời mình.”



Và tôi nhận ra rằng công việc người mẫu cũng là di chuyển cơ thể, và còn có thể có cơ hội được thể hiện nhiều nhân vật khác nhau, cũng tương tự như ballet, nhiều người mẫu cũng xuất thân từ ballet”, Hailey giải thích lý do vì sao mình bén duyên với nghề người mẫu.




Người mẫu sexy mê nhạc kịch
Dù không chính thức theo nghiệp diễn viên, nhưng “máu” diễn xuất từ cha và bác có lẽ cũng ngấm vào cô bé Hailey, người từng phải nghỉ học ở trường và tự học ở nhà từ sau năm lớp 8 vì những rắc rối từ cái bóng nổi tiếng của gia đình.
“Lúc rảnh rỗi tôi vẫn thích diễn xuất. Có một điều mà nhiều người không biết về tôi là tôi bị nghiện nhạc kịch Broadway và tôi từng học 7 năm trong một nhà hát nhạc kịch”, Hailey từng chia sẻ.
Đối với Hailey, theo nghiệp gia đình là một chuyện rất tự nhiên. ""Tôi thật sự cảm thấy đó là một điều hiển nhiên với mình"", cô nói. Hiện tại, Hailey đang chuẩn bị cho series hài thực tế trên truyền hình có tên Drop the Mic của cây hài James Corden.
Ngoài ra, Hailey còn có tài lẻ là tự thiết kế quần áo cho mình. Nữ người mẫu từng là gương mặt đại diện cho các sản phẩm denim của Topshop tiết lộ rằng mình thích biến tấu quần jean dài thành quần short.
“Tôi thích biến tấu các sản phẩm denim theo ý mình, về cơ bản, tôi thích biến chiếc quần jean của mình thành kiểu quần rách.
Nhưng cũng phải thú nhận là vài lần tôi cũng làm ra những sản phẩm rất kinh khủng, có mấy lần tôi cứ cắt mà không tính toán gì cả, kết quả là hư luôn cả bộ đồ”, người đẹp vui vẻ chia sẻ.
Một số hình ảnh xinh đẹp của Hailey Baldwin:






Hailey Baldwin gởi cảm trên tạp chí Maxim









Hailey Baldwin quyến rũ trên tạp chí Maxim









Hailey Baldwin tại sự kiện Maxim Hot 100 Party ngày 24-6 - Ảnh: Splash News









Khoe sắc tại amfAR Gala Cannes 2017 - Ảnh: WireImage









Hailey Baldwin tại amfAR New York Gala 2015 - Ảnh: WENN









Ảnh: Getty Images









Chụp ảnh quảng cáo cho Guess









Chụp ảnh quảng cáo cho French Connection









Chụp ảnh quảng cáo cho Guess









Chụp ảnh quảng cáo cho Guess









Hailey Baldwin tại Tuần lễ thời trang New York tháng 9 - 2015 - Ảnh: Startraks"
1338582,https://tuoitre.vn/dan-my-nhan-nong-bong-tren-tham-do-maxim-hot-100-party-1338582.htm,​Dàn mỹ nhân nóng bỏng trên thảm đỏ Maxim Hot 100 Party,https://cdn1.tuoitre.vn/zoom/600_315/tto/i/s626/2017/06/26/hailey-baldwin-justine-antje-main-1498463048.jpg,26/06/2017 16:07 GMT+7,TTO - Hàng trăm tên tuổi nổi tiếng của Hollywood đã cùng nhau quy tụ về khoe sắc trên thảm đỏ sự kiện Maxim Hot 100 Party cuối tuần qua.,Giải trí,Thời trang,"Từ trái sang: người mẫu Hailey Baldwin, ca sĩ Justine Skye, và diễn viên - người mẫu Antje Utgaard tại Maxim Hot 100 Party 2017 - Ảnh: Getty Images



Hàng loạt sao như Jamie Foxx, Wiz Khalifa, Nick Cannon, Christina Milian, và nhiều mỹ nhân trong danh sách 100 phụ nữ nóng bỏng nhất Maxim Hot 100 năm nay do tạp chí Maxim bình chọn.
Khác với những  năm trước, các người đẹp lọt vào Maxim Hot 100 không được xếp hạng theo số thứ tự nữa, mà được phân chia thành nhóm dựa theo nhiều tiêu chí khác nhau như nhóm chị em The Sister Acts, nhóm hoang dã The Wild Ones, nhóm ngọt ngào The Sweethearts…
Người dẫn đầu danh sách 100 phụ nữ nóng bỏng nhất năm nay thuộc về nữ người mẫu người Mỹ Hailey Baldwin.
Dàn mỹ nhân khoa sắc áo lộng lẫy trên thảm đỏ Maxim Hot 100 Party:






Hailey Baldwin - Ảnh: Splash News









Hai chị em họ nhà Baldwin: Ireland Baldwin và Hailey Baldwin - Ảnh: Getty Images









Ca sĩ Christina Milian - Ảnh: Getty Images









Rapper Chanel West Coast - Ảnh: Getty Images









Delilah Belle Hamlin và Amelia Gray, hai cô con gái của nữ diễn viên Lisa Rinna - Ảnh: startraksphoto.com









Nữ diễn viên Caitlin O'Connor - Ảnh: Getty Images









Thiên thần Victoria's Secret Jasmine Tookes - Ảnh: Getty Images









Người mẫu Shanina Shaik - Ảnh: Splash News"
1336836,https://tuoitre.vn/an-nguy-chi-pu-va-kelbin-lei-top-3-anh-huong-thoi-trang-2017-1336836.htm,"An Nguy, Chi Pu và Kelbin Lei top 3 ảnh hưởng thời trang 2017",https://cdn1.tuoitre.vn/zoom/600_315/tto/i/s626/2017/06/23/spiderman-11-1498200193.jpg,23/06/2017 13:52 GMT+7,TTO - An Nguy - nữ diễn viên chính trong Chờ em đến ngày mai - vừa lọt vào top 3 người trẻ có phong cách thời trang ảnh hưởng nhất năm 2017 trên mạng xã hội tại Việt Nam. Kết quả do tạp chí thời trang Elle Việt Nam công bố.,Giải trí,Thời trang,"An Nguy chụp ảnh vui cùng người nhện trong sự kiện ra mắt bộ phim Spider-Man Homecoming diễn tại Singapore - Ảnh: NVCC




Mới đây, tạp chí thời trang Elle (phiên bản tại Việt Nam) đã công bố Top 3 các hạng mục được vinh danh tại lễ trao giải Elle Style Award 2017 (giải thưởng thường niên danh giá và uy tín toàn cầu của Elle - thương hiệu tạp chí thời trang lớn nhất thế giới).
Theo đó, An Nguy, Chi Pu và Kelbin Lei là ba cái tên lọt vào vòng tranh giải Người có phong cách thời trang ảnh hưởng trên mạng xã hội nhất của năm 2017. Lễ trao giải Elle Style Award 2017 sẽ diễn ra vào đêm ngày 28-6 tại TP.HCM.






An Nguy phỏng vấn đạo diễn Jacob Batalon của Spider-Man Homecoming sẽ ra mắt tại Việt Nam ngày 7-7 



Chỉ chưa đầy một năm về nước sau khi hoàn tất quá trình học tập tại Mỹ, nữ vlogger với 3,4 triệu người theo dõi trên Facebook đã có được những thành công đáng ghi nhận.
Sau khi tham gia chương trình Gương mặt thương hiệu (The Face) mùa đầu tiên, cô nhận lời vào vai nữ chính trong  Chờ em đến ngày mai của đạo diễn Đinh Tuấn Vũ. Vai diễn Ly ‘Cún’ cũng giúp cô nhận được đề cử Nữ diễn viên chính xuất sắc nhất tại giải thưởng Cánh Diều 2016.
Lần thử sức với điện ảnh này cũng giúp con đường nghệ thuật của An Nguy thêm rộng mở.
Tháng 4 vừa qua, An Nguy tiếp tục nhận 3 đề cử quan trọng tại Influence Asia 2017 -  lễ trao giải những cá nhân có sức ảnh hưởng trên mạng xã hội khắp châu Á được tổ chức tại Malaysia, cùng các tên tuổi trẻ khác có sức ảnh hưởng trên mạng xã hội Việt Nam như Châu Bùi, Rocker Nguyễn, Phở Đặc Biệt….
Có bước đệm thuận lời, An Nguy đang tập trung nhiều hơn vào lĩnh vực điện ảnh thứ bảy . Mới đây cô cũng là đại diện đến từ Việt Nam được mời tham dự sự kiện giải trí, ra mắt bộ phim Spider-Man Homecoming diễn tại Singapore, phỏng vấn trực tiếp đạo diễn Jacob Batalon và diễn viên thủ vai người nhện Tom Holland trong phim.
Ngắm một số phong cách thời trang giúp An Nguy lọt top 3 cá nhân có sức ảnh hưởng về thời trang trêhn mạng xã hội:"
1336485,https://tuoitre.vn/thoi-trang-khong-lang-phi-dep-khong-de-bep-moi-truong-1336485.htm,Thời trang không lãng phí: Đẹp không... đè bẹp môi trường,https://cdn1.tuoitre.vn/zoom/600_315/tto/i/s626/2017/06/23/a315880f.jpg,23/06/2017 09:26 GMT+7,"TTO - Thời trang và làm đẹp, nhưng một nguyên tắc của các nhà thiết kế theo trường phái zero-waste fashion (tạm dịch: thời trang không lãng phí) là làm đẹp nhưng không được gây tổn hại đến cuộc sống, đặc biệt là hệ sinh thái môi trường.",Giải trí,Thời trang,"Các bạn trẻ yêu thích thời trang tìm hiểu về xu thế ""thời trang không lãng phí"" qua bộ sưu tập của nhà thiết kế Elena - Ảnh: MINH TRANG



1 Dù thời trang có lộng lẫy, xa hoa đến đâu thì “hậu kỳ” của toàn bộ ngành công nghiệp này đều phải được hoàn thành tại phòng cắt.
Zero-waste fashion và eco-sustainable fashion (thời trang thân thiện với môi trường) là hai chủ đề chính được bà Elena Ryeeva - chuyên gia về thời trang thế giới, hiện là nhà sáng lập EWST fashionlab - chia sẻ tại cuộc trò chuyện sáng  22-6 tại TP.HCM.
Nhiều năm nay, nhà thiết kế thời trang có kinh nghiệm làm việc hơn 25 năm trong ngành thời trang quốc tế này đã chọn theo đuổi một con đường thật khó: ứng dụng kỹ thuật cắt may không thừa vải vào các thiết kế của bà.
Hãy thử tưởng tượng một chiếc váy, một chiếc áo được cắt may hoàn hảo với lượng vải vừa đủ dùng, không dư dù chỉ một ngón tay lượng vải thừa.
“Điều này sẽ giúp tiết kiệm tối đa chi phí phụ liệu, việc sản xuất vải, việc dệt bông và là nguyên nhân gây ô nhiễm môi trường, lãng phí tài nguyên”  - bà Elena nói.
Các kinh đô thời trang lớn hoặc những thị trường thời trang “khủng” như Hong Kong, Milan hằng năm tiêu tốn khoảng 200 triệu tấn vải thừa từ việc cắt may trang phục (theo số liệu của bà Elena cung cấp).
Một sự lãng phí có thể đong đếm bằng mắt và hoàn toàn không thể phân hủy tự nhiên trong một sớm một chiều. Bà Elena nói để theo đuổi xu hướng thời trang này, bà đã dành thời gian tìm hiểu về cách may mặc của người cổ  đại từ thời Ai Cập trở đi.




Cộng đồng các nhà thiết kế theo đuổi zero-waste fashion cũng tương đối nhỏ.
Họ chủ yếu tập trung ở Úc, Canada, Mỹ và một số khác ở châu Âu, mỗi người trong số họ đề ra một quy luật riêng trong thiết kế của mình để mang đến sự phong phú cho zero-waste fashion.
Tuy vậy, cùng với những thương hiệu zero-waste fashion, họ đã tạo ra sự thay đổi nhanh chóng về mặt tư duy và truyền đi cảm hứng sáng tạo bền vững cho những thế hệ trẻ sau này” 



Bà Elena chia sẻ



2 Có một dạo những trang tin trên mạng xôn xao quanh câu chuyện “bốp chát” của những người mẫu, người đẹp tiếng tăm về chiếc túi da cá sấu bạch tạng thuộc hàng tuyệt phẩm mà họ sở hữu.
Họ tự hào với việc phải thức đêm thức ngày, “có tiền cũng chưa chắc mua được” món xa xỉ phẩm được ra đời bằng việc lột da một con vật sống, hoặc nuôi cho lớn chỉ để lấy da. 
Họ tìm mọi lời lẽ chứng minh mình mới là người sở hữu chiếc túi thật. Họ mỉa mai, miệt thị những người - theo họ là - thích khoe mẽ nhưng không đủ đẳng cấp để sở hữu chiếc túi da “có mùi  hôi đặc trưng của hàng xịn”.
Tự dưng lại có một ước muốn bất chợt: ước gì những người đẹp còn đang mải tranh giành “đẳng cấp” kia có mặt trong buổi trò chuyện này để lắng nghe câu chuyện thực sự về thời trang, biết đâu  họ sẽ tự biết lặng im vì mắc cỡ!





Để bạn trẻ yêu thời trang hiểu đúng
F.A.C.E Fashion Workshop - đơn vị đồng hành tổ chức chương trình lần này - cho biết họ sớm nhận ra thời trang cũng giống như bất kỳ lĩnh vực văn hóa, nghệ thuật nào, đang có những bước phát triển và thay đổi.
Những nhà thiết kế không chỉ là người làm ra áo quần, mà còn tạo nên lối sống cho một lớp người trẻ.
Trong khuôn khổ những buổi workshop tiếp theo về thời trang, F.A.C.E sẽ lần lượt mang đến những chuyến đi thực tế, câu chuyện văn hóa, hành trình khám phá cách dệt vải lụa tơ tằm truyền thống tại làng lụa tơ tằm ở Bảo Lộc, Lâm Đồng, hay tìm hiểu về vải lãnh Mỹ A - Tám Lăng danh tiếng… để những bạn trẻ yêu thời trang hiểu biết đúng đắn và có thêm kiến thức thực tế về lĩnh vực này."
