id,link,title,thumbnail,time,summary,category,sub_category,full_article
2022102414583714,https://tuoitre.vn/mon-the-thao-nao-giup-tieu-hao-nang-luong-va-giam-beo-hieu-qua-nhat-2022102414583714.htm,Môn thể thao nào giúp tiêu hao năng lượng và giảm béo hiệu quả nhất?,https://cdn1.tuoitre.vn/zoom/600_315/2022/7/8/gettyimages-1352669725-1068x712-1657245610531516740689-crop-16665982327161840629044.jpg,24/10/2022 16:25 GMT+7,"TTO - Trong 30 phút tập thể dục, người nặng 50kg có thể tiêu thụ 260kcalo bằng cách chạy bộ, trong khi đó tập tạ (ở mức độ trung bình) chỉ tiêu hao 79kcalo.",Sức khỏe,,"Đây là thông tin trong Hướng dẫn chẩn đoán và điều trị bệnh béo phì vừa được Bộ Y tế ban hành. Theo Bộ Y tế, một thống kê tại Việt Nam 2021 cho kết quả tỉ lệ thừa cân, béo phì ở Hà Nội và TP.HCM chiếm 18% tổng số lượng người thừa cân, béo phì trên toàn quốc.Trong đó, tỉ lệ thừa cân, béo phì ở trẻ em tuổi học đường 5-19 tuổi tăng từ 8,5% năm 2010 lên thành 19% năm 2020, trong đó tỉ lệ thừa cân béo phì khu vực thành thị là 26,8%, nông thôn là 18,3% và miền núi là 6,9%.Chẩn đoán béo phìBộ Y tế đánh giá béo phì gây ra các vấn đề trầm trọng đến sức khỏe, là thủ phạm gây hơn 200 bệnh khác nhau như bệnh tim mạch, đột quỵ, đái tháo đường, thoái hóa khớp, gan nhiễm mỡ và nhiều bệnh ung thư, đặc biệt là ung thư đường tiêu hóa... Tình trạng tự chữa béo phì không có hiệu quả, nhiều biến cố nặng và tốn kém.Theo các chuyên gia, nguyên nhân dẫn đến béo phì do tăng quá mức lượng năng lượng ăn vào; ăn một lượng thức ăn nhiều hơn nhu cầu của cơ thể; chế độ ăn giàu chất béo. Trẻ em tiêu thụ quá nhiều chất ngọt làm tăng nguy cơ béo phì hoặc nuôi con bằng sữa mẹ ít hơn 3 tháng thường đi kèm với tăng nguy cơ béo phì ở trẻ em khi đến trường.Ngoài ra, nguyên nhân còn do di truyền và do các nguyên nhân nội tiết khác như bệnh lý ác tính, viêm nhiễm, hội chứng béo phì, suy giáp,...Bộ Y tế cũng đưa ra 3 cách chẩn đoán béo phì, đó là chỉ số khối cơ thể (BMI - Body mass index); vòng bụng (béo phì dạng nam (béo phì phần trên cơ thể, béo phì kiểu bụng, béo phì hình quả táo, béo phì trung tâm) khi vòng bụng ≥ 90 cm ở nam và ≥80 cm ở nữ); phương pháp DEXA hấp thụ năng lượng kép.Bộ Y tế cũng khuyến cáo, để giảm cân mang lại lợi ích cho sức khỏe, có thể giảm cân 5-15% trong khoảng thời gian 6 tháng. Đối với những người có mức độ béo phì cao hơn (BMI ≥ 35 kg/m2) có thể cân nhắc giảm cân nhiều hơn (20% trở lên). Bên cạnh đó, cần duy trì giảm cân, phòng ngừa và điều trị các bệnh đồng mắc là hai tiêu chí chính để thành công.Béo phì là một bệnh mạn tính. Người bệnh cần được theo dõi và tái khám thường xuyên để ngăn ngừa tăng cân trở lại, và để theo dõi nguy cơ bệnh tật cũng như điều trị các bệnh đồng mắc nếu xuất hiện (ví dụ: đái tháo đường type 2, bệnh tim mạch).Tập thể dục, chế độ ăn giảm năng lượngTại hướng dẫn này, các chuyên gia cũng khuyến cáo các phương pháp điều trị béo phì như: chế độ ăn giảm năng lượng; điều chỉnh hành vi ăn uống cá nhân và phải thay đổi dần dần, cộng với sự hỗ trợ của gia đình, xã hội, môi trường sống; chế độ ăn cân đối giữa các chất sinh nhiệt, không quá nhiều glucid, tỉ lệ thay đổi tùy cá thể theo bệnh lý mắc kèm, thói quen ăn uống. Hạn chế số bữa ăn trong ngày (3 bữa là đủ), hạn chế ăn loại glucid hấp thu nhanh và các chất béo bão hòa, muối dưới 5g/ngàyBên cạnh đó, có thể tập vào bất kỳ thời điểm nào trong ngày, miễn là phù hợp với nếp sinh hoạt của mình. Mỗi ngày trung bình 30 - 40 phút. Hoặc vận động nhiều lần trong ngày, mỗi lần tối thiểu 10 phút. Nên vận động tối thiểu 5 ngày/tuần, tốt hơn nên tập đều đặn mỗi ngày.Trong bảng tham khảo năng lượng kcalo tiêu thụ được sau 30 phút tập thể dục, các chuyên gia cũng chỉ rõ với người nặng 50kg có thể tiêu thụ 260kcalo bằng cách chạy bộ, trong khi đó tập tạ (ở mức độ trung bình) chỉ tiêu hao 79kcalo; cầu lông là 119kcalo, bi-a 66kcalo.Ngoài ra, người béo phì cần được hỗ trợ điều trị tâm lý, sử dụng thuốc, phẫu thuật trong một số trường hợp nhất định."
20221024153444224,https://tuoitre.vn/quang-nam-sot-xuat-huyet-tang-dot-bien-1-benh-nhan-tu-vong-20221024153444224.htm,"Quảng Nam: Sốt xuất huyết tăng đột biến, 1 bệnh nhân tử vong",https://cdn1.tuoitre.vn/zoom/600_315/2022/10/24/sot-xuat-huyet-4-16666003018001394708394-crop-1666600396805766644991.jpg,24/10/2022 16:24 GMT+7,"TTO - Chiều 24-10, Sở Y tế Quảng Nam cho biết ở địa phương vừa có một ca mắc sốt xuất huyết tử vong, đây là ca tử vong đầu tiên trong năm 2022 của tỉnh này.",Sức khỏe,,"Đây là bệnh nhân nam, trú phường Hòa Thuận, TP Tam Kỳ, Quảng Nam. Hiện ngành chức năng địa phương đang nỗ lực điều tra dịch tễ trường hợp này.   Theo chính quyền phường Hòa Thuận, người tử vong là ông N.T.A.T. (40 tuổi, trú phường Hòa Thuận) tử vong sáng cùng ngày.Theo số liệu, TP Tam Kỳ đang ghi nhận tình hình bùng phát dịch sốt xuất huyết với số mắc trong tháng 10-2022 lên đến 284 ca, nhiều nhất là phường Hòa Thuận ghi nhận 65 ca mắc trong tháng này.Từ đầu năm đến ngày 17-10, toàn tỉnh Quảng Nam đã ghi nhận hơn 11.200 ca mắc sốt xuất huyết tại 18/18 huyện, thị xã, thành phố. Ngành y tế nhận định, đây là con số đáng báo động, vì số ca mắc gần bằng so với cả năm 2019 (là năm bùng phát dịch sốt xuất huyết với 11.651 ca) và cao gấp bốn lần so với trung bình cùng kỳ 5 năm (2016 - 2020).  Dịch sốt xuất huyết bắt đầu tăng đột biến bắt đầu từ đầu tháng 8 đến nay (hơn 300 ca/tuần), các địa phương có số ca mắc cao trong tỉnh chủ yếu ở khu vực đồng bằng như TP Tam Kỳ, Thăng Bình, Đại Lộc, thị xã Điện Bàn."
20221023215359076,https://tuoitre.vn/lam-sao-tranh-dau-mua-khi-khi-di-du-lich-nuoc-ngoai-20221023215359076.htm,Làm sao tránh đậu mùa khỉ khi đi du lịch nước ngoài?,https://cdn.tuoitre.vn/zoom/600_315/2022/10/23/14-nay-24-10-2read-only-16665366866921417430281-crop-1666536744640364685646.jpg,24/10/2022 08:16 GMT+7,"TTO - Vừa qua Việt Nam đã ghi nhận hai trường hợp mắc bệnh đậu mùa khỉ khi đi du lịch nước ngoài. Để giảm thiểu rủi ro mắc bệnh khi đi du lịch nước ngoài, cần lưu ý một số vấn đề.",Sức khỏe,,"Trước hết, cần hiểu rõ cách lây lan của bệnh đậu mùa khỉ khi đi du lịch.Trước đây, bệnh đậu mùa ở khỉ thường lây lan khi tiếp xúc với động vật bị nhiễm bệnh, nhưng đợt bùng phát hiện nay thì khác. Nó chủ yếu lây lan qua tiếp xúc trực tiếp giữa người với người với các vết phát ban, vảy hoặc chất dịch cơ thể của người bệnh phát tán ra. Nó cũng có thể lây truyền từ dịch tiết đường hô hấp khi bà con tiếp xúc trực tiếp lâu dài khi người bệnh ho, hắt hơi gần mặt của mình.Mặc dù bệnh đậu mùa khỉ không được coi là một bệnh lây truyền qua đường tình dục, nhưng nó lây lan khi quan hệ tình dục do tiếp xúc gần với các vết phát ban hoặc tổn thương. Các chuyên gia y tế cho biết các trường hợp mắc bệnh áp đảo ở nam quan hệ tình dục đồng giới.Tuy nhiên, vi rút không chỉ giới hạn ở những tiếp xúc gần gũi với con người. Lin Chen, phó giáo sư tại Trường Y Harvard và giám đốc y học du lịch tại Bệnh viện Mount Auburn, Mỹ, cho biết nó cũng có thể lây lan qua quần áo bẩn, giường, đồ vật hoặc các bề mặt khác. Cụ thể, bệnh có thể lây lan theo cách này khi những người bị nhiễm bệnh tiếp xúc với các bề mặt khi dịch tiết và vảy từ phát ban có chứa chất bị nhiễm bệnh.Khi ở khách sạn, không nên dùng chung giường, khăn tắm hoặc quần áo với những người bị nhiễm bệnh đậu mùa khỉ, nếu khách sạn chưa làm vệ sinh tiêu chuẩn trước khi chúng ta nhận phòng.Khi ở trên máy bay, khách du lịch sẽ có nguy cơ trung bình bị nhiễm nếu họ ngồi ngay cạnh người bị bệnh đậu mùa trên máy bay hoặc cách người bị nhiễm bệnh trong vòng 1 mét, khoảng ba hàng ghế trước, sau và hai bên, mà không có thiết bị bảo vệ thích hợp như khẩu trang, mắt kiếng, găng tay.Kể từ ngày 7-6, Trung tâm Kiểm soát dịch bệnh (CDC) Hoa Kỳ đã đưa ra cảnh báo tư vấn cấp độ 2 cho khách du lịch. Họ được khuyến cáo ""thực hành các biện pháp phòng ngừa nâng cao"" để bảo vệ mình khỏi vi rút đậu mùa khỉ.Các khuyến nghị cấp độ 2 của CDC Hoa Kỳ bao gồm: tránh tiếp xúc gần với người bệnh hoặc những người có tổn thương ở da và bộ phận sinh dục. Tránh tiếp xúc với động vật hoang dã hoặc ăn thịt động vật hoang dã, không sử dụng các sản phẩm, chẳng hạn như kem, sữa dưỡng và bột, có chứa các dẫn xuất từ động vật hoang dã châu Phi. Tránh tiếp xúc với các vật liệu do người bệnh sử dụng. Rửa tay thường xuyên hoặc vệ sinh tay bằng chất khử khuẩn có cồn.Bệnh đậu mùa khỉ là bệnh khó lây, nên chỉ cần chú ý cách phòng ngừa đúng thì không ảnh hưởng đến sức khỏe."
20221022175344121,https://tuoitre.vn/con-nguoi-tien-hoa-hon-sau-cai-chet-den-20221022175344121.htm,Con người tiến hóa hơn sau 'cái chết đen',https://cdn1.tuoitre.vn/zoom/600_315/2022/10/22/photo-1-16664354655171887227756-crop-1666435977169324493688.jpg,24/10/2022 06:48 GMT+7,TTO - Các bệnh truyền nhiễm là một trong những yếu tố chọn lọc mạnh nhất trong quá trình tiến hóa của loài người. Bằng chứng di truyền cho thấy quá trình tiến hóa của loài người được định hình bởi đại dịch hạch cũng mới được tìm thấy.,Sức khỏe,,"""Cái chết đen"" là một trong những đại dịch chết chóc nhất trong lịch sử nhân loại. Nó bắt đầu lây lan qua châu Âu, Trung Đông và Bắc Phi vào năm 1346 và giết chết khoảng 30 - 50% dân số vào thời điểm đó. Bệnh do vi khuẩn Yersinia pestis gây ra và lây qua vết cắn của bọ chét bị nhiễm bệnh.Loại vi khuẩn này có khả năng phát triển với tốc độ và số lượng rất nhanh trong các cơ quan bên trong cơ thể vật chủ, gây tình trạng rối loạn chức năng đa cơ quan và  dẫn đến tử vong trong hầu hết các trường hợp. Các đợt dịch hạch tiếp theo tiếp tục trong 400 năm sau đó, một số đợt lây lan có tỉ lệ tử vong giảm.  Giới khoa học từng đặt giả thuyết cho sự giảm thiểu tỉ lệ tử vong này là con người đã có thể tiến hóa thích nghi di truyền để chống lại vi khuẩn. Sau nhiều thập niên nghiên cứu, cuối cùng các nhà khoa học đã tìm ra bằng chứng chứng minh giả thuyết đó.  Phát hiện được công bố trên tạp chí Nature hôm 19-10. Theo đó, nhóm các nhà khoa học quốc tế đã phân tích 206 mẫu DNA của những người sống trước, trong và sau  đại dịch ""Cái chết đen""  ở Anh và Đan Mạch. Họ tìm thấy bằng chứng về sự xuất hiện biến thể của một số gene nhất định. Có sự khác biệt rõ ràng về tần suất của các biến thể này trong các quần thể người trước và sau đại dịch thế kỷ 14.  Ít nhất bốn biến thể di truyền đã được xác định xuất hiện nhiều trong các nhóm người sau bệnh dịch. Nhóm người trước thời kỳ đại dịch cũng có bốn biến thể này nhưng ở tần số ít. Đặc biệt, một trong những biến thể sau đại dịch đã có thể kiểm soát Yersinia pestis trong các thí nghiệm với các tế bào bạch cầu.  Theo nhà khoa học Javier Pizarro-Cerdá (Viện Pasteur, Paris, Pháp - thành viên nhóm nghiên cứu), trong nhiều trường hợp tiến hóa, chọn lọc tự nhiên sẽ tác động lên một biến thể di truyền mới được hình thành. Biến thể này có thể mất nhiều thế hệ để lan truyền trong quần thể. Nhưng trong trường hợp ""dưới sự tác động của đại dịch hạch"", việc lựa chọn tự nhiên đã không tác động đến biến thể mới xuất hiện mà tác động trên chính biến thể đã có trước đó, nhưng điều đó trở nên có lợi khi Yersinia pestis xuất hiện.  Các biến thể gene này tạo ra một số lượng đề kháng nhất định đối với vi khuẩn Yersinia pestis và đáp ứng miễn dịch mạnh mẽ hơn chống lại mầm bệnh.  Đặc biệt, các nhà khoa học còn phát hiện thêm các biến thể này cũng làm tăng khả năng phát triển các bệnh tự miễn khác. Chẳng hạn như viêm khớp dạng thấp và bệnh rối loạn tiêu hóa. Nói cách khác, nó có thể dẫn đến một hệ thống miễn dịch hoạt động tốt hơn.  Phát hiện mới này đặt ra câu hỏi về tác động của đại dịch COVID-19 và tương lai đối với sự tiến hóa của loài người. Đại dịch có để lại ảnh hưởng lâu dài đến hệ gene của con người hay không sẽ phụ thuộc vào độ tuổi chịu tác động mạnh nhất sau khi nhiễm bệnh."
20221023231626696,https://tuoitre.vn/tin-sang-24-10-ca-mac-covid-19-xuong-thap-nhat-gan-500-ngay-qua-nhieu-du-an-quan-trong-cham-tre-20221023231626696.htm,Tin sáng 24-10: Ca mắc COVID-19 xuống thấp nhất gần 500 ngày qua; Nhiều dự án quan trọng chậm trễ,https://cdn1.tuoitre.vn/zoom/600_315/2022/10/8/3070751187710752006615884215643170140491594n-1665189821126940148756-crop-1666539215031210694013.png,24/10/2022 06:42 GMT+7,"TTO - Ca mắc COVID-19 ngày 23-10 xuống thấp nhất gần 500 ngày qua; Cứ 100 người béo ở Việt Nam có 18 ở Hà Nội, TP.HCM; Ủy ban Tài chính Ngân sách nêu loạt dự án quan trọng chậm tiến độ; Giá hồ tiêu nguy cơ xuống đáy... là các tin đáng chú ý sáng nay.",Sức khỏe,,"Ca mắc COVID-19 giảm thấp nhất trong gần 500 ngày quaBáo cáo của Bộ Y tế ngày 23-10 cho biết số ca mắc đã giảm xuống rất thấp, còn 158 ca mới được báo cáo. Đáng chú ý, đây là ngày có số ca mới thấp nhất tính từ ngày 15-6-2021 cho đến nay.Tính đến nay, Việt Nam đã ghi nhận gần 11,5 triệu ca mắc COVID-19, đứng thứ 13/230 quốc gia/vùng lãnh thổ, 43.159 ca tử vong, đứng thứ 26 về số ca tử vong do COVID-19 trên thế giới.Thời điểm hiện nay, số ca mắc mới và ca chuyển nặng giảm thấp cũng cùng lúc các chuyên gia đã lên tiếng về việc cần công bố kết thúc giai đoạn đại dịch của dịch COVID-19, bởi hiện còn nhiều dịch bệnh cần ưu tiên phòng chống hơn như sốt xuất huyết, adenovirus, tay chân miệng... và mùa đông xuân sắp tới nguy cơ có thêm dịch cúm, sởi...Ủy ban Tài chính - Ngân sách nêu loạt dự án quan trọng quốc gia chậm tiến độTrong báo cáo thẩm tra về tình hình thực hiện kế hoạch đầu tư công năm 2022, dự kiến kế hoạch 2023 vừa gửi tới các đại biểu Quốc hội, Ủy ban Tài chính - Ngân sách Quốc hội đã nêu tên hàng loạt dự án quan trọng quốc gia chậm tiến độ.Trong đó có các dự án cao tốc Bắc - Nam phía Đông giai đoạn 2017-2020 đến nay mới giải ngân được 79,5% tổng kế hoạch vốn được giao (39.712,4 tỉ đồng); dự án thu hồi đất, bồi thường, hỗ trợ, tái định cư cảng hàng không quốc tế Long Thành giải ngân được 72,83% kế hoạch đã giao.Ủy ban Tài chính - Ngân sách cho rằng đây là những dự án chuyển tiếp, được ưu tiên bố trí vốn để sớm hoàn thành, phát huy hiệu quả kinh tế, xã hội. Tuy nhiên việc thực hiện kéo dài, đến nay vẫn chưa giải ngân hết số vốn được giao. Vì vậy cơ quan này đề nghị Chính phủ tập trung đẩy nhanh tiến độ, sớm hoàn thành các dự án chuyển tiếp từ giai đoạn trước, bảo đảm thực hiện theo tiến độ, kế hoạch đề ra, đạt mục tiêu của dự án.Đối với dự án cao tốc Bắc - Nam phía Đông giai đoạn 2021-2025, tổng vốn kế hoạch đầu tư công trung hạn giai đoạn 2021-2025 đã giao khoảng 47.168,5 tỉ đồng, đến nay mới phân bổ vốn được khoảng 8.591 tỉ đồng, giải ngân được khoảng 203 tỉ đồng, đạt 2,4% kế hoạch.Tương tự, dự án cảng hàng không quốc tế Long Thành, sơ bộ tổng vốn đầu tư 109.111 tỉ đồng, công tác xây lắp khu vực cảng hàng không được chia làm bốn dự án thành phần, Bộ Giao thông vận tải đang triển khai các thủ tục để lựa chọn nhà đầu tư, phần lớn vốn chưa giải ngân.Một số dự án đầu tư xây dựng cao tốc khác như Khánh Hòa - Buôn Ma Thuột, Biên Hòa - Vũng Tàu, Châu Đốc - Cần Thơ - Sóc Trăng, đường vành đai 4 vùng thủ đô Hà Nội, đường vành đai 3 TP.HCM mới được phê duyệt chủ trương đầu tư trong năm 2022, đang trong giai đoạn đầu triển khai thực hiện, mới dừng ở việc giao vốn.Theo ủy ban, có năm nguyên nhân giải ngân vốn đầu tư công chậm. Ủy ban Tài chính - Ngân sách cũng đề nghị Chính phủ làm rõ nguyên nhân việc các bộ, cơ quan trung ương, địa phương xin ""trả lại"" vốn đầu tư công năm 2022 do không có khả năng giải ngân, tổng hợp, báo cáo Quốc hội.Giá tiêu nguy cơ xuống đáy, giá cà phê giảm thêmTheo nhiều nhà vườn phía Nam, giá hồ tiêu (loại đen khô) đang bán ra ở mức 55.500 - 58.000 đồng/kg, giảm 2.000 - 3.000 đồng so với tuần trước, giảm 25.000 - 30.000 đồng so với mức cao của các tháng trước đó. Với giá này, nhiều nhà vườn đang bị thua lỗ.Theo đại diện Hiệp hội Hồ tiêu Việt Nam, giá hồ tiêu giảm liên tục thời gian qua chủ yếu do thị trường tiêu thụ chậm vì ảnh hưởng lạm phát tăng cao, và nhiều nhà kinh doanh thế giới dưới áp lực lãi suất ngân hàng tăng cao nên buộc đẩy mạnh lượng tiêu bán ra để xử lý nợ. Nguồn cung tăng nhưng nhu cầu giảm khiến giá giảm.""Khả năng giá tiêu còn giảm thêm, thậm chí có thể xuống mức 50.000 đồng/kg do quốc gia cung cấp hơn 50% lượng tiêu thế giới là Việt Nam sắp tới vào vụ thu hoạch, trong bối cảnh lạm phát và lãi suất ngân hàng tăng cao vẫn tiếp diễn"", vị này nhận định.Trong khi đó, sau thời gian tăng nóng với mức đỉnh 53.000 đồng/kg nhân, giá cà phê được nông dân trong nước bán ra đã quay đầu giảm lại trong nhiều tuần qua với hiện còn trên dưới 43.000 đồng/kg. Theo nhiều nhà thu mua, giá cà phê giảm chủ yếu do sức mua thế giới có xu hướng chững lại, và nông dân trong nước vào vụ thu hoạch rộ. Tuy nhiên, diễn biến giá sắp tới khó nhận định vì nguồn cung từ quốc gia lớn nhất là Brazil đang giảm mạnh.18% người béo phì sống ở Hà Nội, TP.HCMTheo hướng dẫn chẩn đoán và điều trị béo phì vừa được Bộ Y tế công bố, tần suất thừa cân, béo phì trên người lớn ở Việt Nam là 2,3% vào năm 1993, tăng lên đáng kể 15% vào năm 2015, tỉ lệ ở thành thị gấp gần hai lần so với nông thôn (22,1% so với 11,2%).Ngoài ra, báo cáo cho rằng lối sống của người Việt Nam thay đổi rất nhiều trong những năm gần đây như ít vận động hơn, chế độ ăn có nhiều muối, ăn nhiều mì ăn liền, uống nhiều nước ngọt, ăn ít rau và nhiều hải sản.Một thống kê năm 2021 cho kết quả tỉ lệ thừa cân, béo phì ở Hà Nội và TP.HCM chiếm 18% tổng số người thừa cân, béo phì trên toàn quốc.Rất đáng lưu ý là tỉ lệ thừa cân, béo phì ở trẻ em tuổi học đường 5-19 tuổi tăng từ 8,5% năm 2010 lên thành 19% năm 2020, trong đó khu vực thành thị là 26,8%, nông thôn là 18,3% và miền núi là 6,9%.TP.HCM phối hợp Nhật Bản hạn chế mức thải khí carbon vào môi trườngSở Tài nguyên và Môi trường TP.HCM đã phối hợp Cục Môi trường thành phố Osaka, Nhật Bản tổ chức hội thảo quốc tế về ""Chương trình phát triển thành phố phát thải carbon thấp"". Đây là hoạt động nằm trong khuôn khổ hợp tác với Nhật Bản để tạo ra những chuyển biến trong môi trường tại TP.HCM.Lượng khí thải carbon cao ở TP.HCM chủ yếu đến từ ba nguồn chính: hoạt động giao thông, hoạt động công nghiệp và xây dựng. Một số điểm như ngã tư An Sương, Huỳnh Tấn Phát - Nguyễn Văn Linh, Hàng Xanh, Gò Vấp… nồng độ bụi lúc nào cũng vượt mức cho phép. Tương tự, tại các khu vực tập trung hoạt động sản xuất công nghiệp như khu vực quanh nhà máy thép Thủ Đức, xi măng Hà Tiên… chất lượng không khí cũng không tốt."
