id,link,title,thumbnail,time,summary,category,sub_category,full_article
20210425090311126,https://tuoitre.vn/con-ca-chot-giay-ca-mau-va-co-nam-kho-quet-20210425090311126.htm,Con cá chốt giấy Cà Mau và 'cô Năm kho quẹt',https://cdn1.tuoitre.vn/zoom/600_315/2021/4/25/ca-kho-16193161033682026521811-crop-1619316145101649870170.jpg,25/04/2021 09:53 GMT+7,"TTO - Có dịp ghé lại nhà cô Năm - nhà thơ, nhà sưu tầm dân ca Lê Giang, thể nào cũng được cô chèo mời ở lại ăn cơm, quyến rũ không chỉ là rau xanh hái ngay bên hông nhà, mà là món kho quẹt của cô hương vị thật đặc biệt...",Văn hóa,Đời sống,"Đến chừng đọc sách của cô, rồi lai rai nghe bà già ngoài 80 tỉ mẩn lần hồi ức, mới hay cớ sự của món kho quẹt đã theo người con gái quê Cà Mau vào kháng chiến, trở thành ""thương hiệu"" của Lê Giang ra sao.Bản giao hưởng kho quẹtXuất phát từ một kiểu chế biến món kho mặn kiêm nước chấm, kho quẹt của người Nam Bộ đa dạng phong phú và là thương hiệu vùng miền. Kho quẹt dễ làm nhưng khó ngon, có thể áp dụng cho cả động thực vật, cốt sao khi hoàn thành phải thơm ngon đánh thức khứu giác, vị giác dẫn thực khách vào bữa ăn và ""dính chặt"" với mùi vị trong cái ơ đất rất bình dị ấy. Với nhà thơ Lê Giang, chính hoàn cảnh chiến tranh đẩy cô trở thành đầu bếp thiện xảo cùng món kho quẹt. ""Ngày ở rừng, tôi đã nổi tiếng món kho quẹt, lừng lẫy đến nỗi trong một cuộc họp mặt rất đông, nhạc sĩ Hoàng Hiệp giới thiệu: nhà thơ Lê Giang, nổi tiếng nhờ món kho quẹt không thể nào quên"". Lê Giang bảo rằng trong hoàn cảnh kham khổ, mọi thứ xung quanh người lính đều có thể trở thành thực phẩm. Với cô, tiện nhất là kho quẹt, ""tôi kho quẹt cả dế cơm, thằn lằn, rắn mối, ễnh ương, đậu xanh, đậu phộng, nấm mối, nấm sao..."".Khi dứt chiến tranh, nước nhà thống nhất, cánh văn nghệ sĩ các miền mỗi khi họp mặt lại có dịp để món kho quẹt của cô Năm ""tái xuất công phu"". Tuy vậy, theo cách nhìn của cô Lê Giang thì ""cái ơ kho quẹt của tôi biến chất rồi. Ngày đó măng le, nấm rừng, dế nhủi, cào cào gì cũng đem ""quẹt"", còn bây giờ là món ăn nhà giàu, không nói giỡn chút nào"". Thực ra cái sự ""biến chất"" đó cũng chỉ là cách ví von của Lê Giang, tức là kho quẹt với cá rô mề và cá lòng tong mua ở chợ, cộng với rau ngồ, rau đắng đất lúc nào cũng có ở nhà... đủ để bạn văn khi nào ghé lại cũng được thỏa mãn cơn thèm một món ăn rặt ròng Nam Bộ.Rồi thể nào cũng có đứa em út kỳ kèo hỏi bí quyết kho quẹt của cô Năm. Cô cười hóm hỉnh, ""có bí quyết gì đâu, chút đường chút tiêu, có điều như là bản giao hưởng ấy mà, tới đâu để tiêu, tới đâu để tóp mỡ mới vừa thắng, rồi thì quơ đũa khi nhắc xuống đúng lúc"". Cô Năm căn dặn: Kho quẹt đừng ham cá bự, không ngon đâu, hễ kho cá kèo thì rửa sạch thôi, để sống vậy đem kho thì dù có hâm hoài cá vẫn mềm không tanh, đừng kho bằng nước màu thắng sẵn mà kho tới đâu thắng nước màu tới đó, nhớ trước khi bắc xuống mới để tóp mỡ, rắc tiêu..."".Con chốt giấy Cà MauLê Giang kể lại chuyện ngày thống nhất đất nước, đứa con gái bỏ nhà theo Việt cộng mấy chục năm nay là cô giờ mới trở về, được bà má quê nhà Cà Mau gói ghém công phu tặng cho món quà - xem như của hồi môn, vì đến lúc đó mới hay bề gia thất của con - mở ra thấy cái ơ kho quẹt xửa xưa của má. Chắc hẳn má của Lê Giang không biết con mình trong mấy chục năm theo cách mạng đã trở nên nổi tiếng với món kho quẹt. Với Lê Giang, cái ơ má vẫn dùng kho quẹt ấy là cả một trời kỷ niệm.Từ cái ơ ấy, có một món bước vào tuổi thơ của Lê Giang rồi ở lại trong ký ức của cô mãi mãi, có lẽ chính nó mới là bí quyết thật sự cho tay nghề kho quẹt. Ấy là con cá chốt giấy, một cư dân độc đáo của sông Gành Hào. Lê Giang bảo rằng sau khi tuổi đời chồng chất, nhiều thứ đã quên quên nhớ nhớ, vậy mà thi thoảng cô vẫn như nghe rõ mồn một tiếng gọi của ba cô: Năm à! Ra sông câu cho ba vài con cá chốt giấy đi con! ""Tôi dạ một tiếng thật lớn, quơ mấy con tép bạc trong thúng của hàng đáy đem lại bán cho má tôi mỗi ngày, xách giỏ vác cần câu ù ra bờ sông"", cô Năm hồi tưởng.Câu cá chốt giấy với một đứa bé gái tuổi lên mười là cả một không gian đầy kỷ niệm. Lê Giang nghe được luồng gió báo hiệu nước lớn giác sáng, cô nhìn trên sông các ghe thuyền với đủ loại buồm chiếu, buồm mền, buồm mùng, có cả buồm lá dừa nước lướt như chim bay... Lớn lên, Lê Giang mới tự nghĩ không hiểu sao ba mình lại sai mình đi câu cá chốt giấy ở sông, làm như cá rọng sẵn trong lu, trong khạp? Phải câu đúng cá chốt giấy, gặp cá chốt đen gỡ bỏ không bắt vì nó ăn dơ. Không nghe Lê Giang kể chuyện, khó mà hiểu được cái tinh tế của người dân hiển hiện trong từng nết ăn. Con cá chốt giấy ăn mồi trên nước chảy ở sông Gành Hào, Lê Giang câu về, xúc tro cạo nhớt, chặt bỏ đầu đuôi, rửa tới rửa lui, ngắm mình mẩy nó trắng tinh trong ngần, có sọc ửng hồng hồng... Rồi má cô mới kho bằng ơ đất.Lê Giang bảo cái ơ cá chốt kho quẹt ấy là độc quyền của ba cô, cả nhà không ai được thò đũa vô để ông chấm dưa bồn bồn và nhậu. Chính cái ơ cá chốt giấy ấy, chính những lần ba sai đi câu đã khiến cho cô bé Cà Mau có cơ hội nhìn ngó đất trời, ôm ấp trong mình bao mơ ước viển vông, và rồi đến lúc vượt thoát khỏi gia đình ra đi biền biệt... Để rồi đến tuổi xế chiều nhìn lại, cô nghĩ có lẽ chính ba mình cũng không ngờ ông đã ""chia gia tài cho tôi bằng ngọn gió mùa cá chốt giấy"". Của báu ấy dễ gì ai có được!"
20210424143647306,https://tuoitre.vn/viet-nam-hom-nay-va-ngay-mai-cac-tri-thuc-chung-giac-mo-viet-nam-thinh-vuong-20210424143647306.htm,Việt Nam hôm nay và ngày mai: Các trí thức chung giấc mơ Việt Nam thịnh vượng,https://cdn1.tuoitre.vn/zoom/600_315/2021/4/24/20210424104228-16192489737761357608301-crop-1619249039702579026473.jpg,24/04/2021 15:09 GMT+7,"TTO - Buổi ra mắt đầu tiên của tập sách 'Việt Nam hôm nay và ngày mai' sáng 24-4 như dịp để một số tác giả gặp nhau, chia sẻ tiếng nói về thời cuộc với điểm chung là cùng mơ về một Việt Nam thịnh vượng...",Văn hóa,Đời sống,"Ý tưởng thực hiện tập sách với bài viết của 22 trí thức hiện nay để cùng góp tiếng nói mong muốn Việt Nam phát triển ổn định trên nhiều lĩnh vực, đã nhận được đồng thuận từ cả trong và ngoài nước.Nhấn mạnh vai trò trí thức  Trong khi giáo sư Trần Văn Thọ từ Nhật Bản không về nước được, tiến sĩ Nguyễn Xuân Xanh trong vị trí đồng chủ biên nhắc lại rằng: ""Chủ tịch Hồ Chí Minh cũng từng nói nhiều về vai trò của người trí thức trong việc xây dựng xã hội mới"". Quan trọng hơn, ông dẫn một phát biểu từ những năm 1960 của tổng thống Hàn Quốc Park Chung Hee - người đã thay đổi vận mệnh đất nước ông một cách thần kỳ: ""Trong tầng lớp lãnh đạo xã hội của Hàn Quốc, trí thức làm thành khối quan trọng nhất của dân tộc"".  Xác định vai trò của trí thức đến đâu, cũng chưa quan trọng bằng thực sự cầu thị để lắng nghe, tiếp thu và thực hiện những ý kiến, công trình, hoài bão của các trí thức.  Nói như giáo sư Cao Huy Thuần trong clip thu từ Pháp và gửi về buổi ra mắt sách: Ra được quyển sách là quan trọng, nhưng nếu không được giới thiệu đến với người đọc cần thiết, thì sách cũng như bị chôn sống giữa hỗn mang tri thức của thời nay.  ""Người đọc"" ở đây theo giáo sư Thuần, có thể hiểu trước nhất chính là các nhà quản trị quốc gia, những người quy hoạch ngành và tổ chức bộ máy, vận hành nền kinh tế nước nhà.  Và thật thú vị khi tác giả Phúc Tiến cho biết khi tổ chức bản thảo sách này, giáo sư Trần Văn Thọ gợi ý cần có bài viết về lịch sử phát triển của Sài Gòn. Đô thị phương Nam từng là hòn ngọc trong mắt bè bạn năm châu, hẳn có gì để soi chiếu cho hành trình đi lên tiếp tục của đất nước hôm nay và ngày mai chứ?  Theo ông Phúc Tiến, Sài Gòn có tính chất ""hợp chủng xứ"", một nơi hỗn dung và tích hợp được nhiều nguồn lực, và trong quá khứ xa xưa, tính từ vương quốc Phù Nam ở vị trí này, Sài Gòn cũng có bề dày di sản văn hóa đáng kể cả về vật thể và phi vật thể.  Điều gì làm nên sức mạnh quốc gia?  Câu hỏi căn cốt của tiến sĩ Nguyễn Xuân Xanh dường như khiến đông đảo cử tọa và các diễn giả phải nghĩ về hiện tình đất nước một cách có trách nhiệm.  Nhà kinh tế học Phạm Chi Lan nhắc lại cái lần bà ""thọ nạn"" khi phát biểu đại ý ""Việt Nam không chịu phát triển"". Nay, vẫn với một lòng đau đáu về tình hình doanh nghiệp Việt Nam, bà Phạm Chi Lan nhắc lại đầy tiếc nuối khi Việt Nam đã đổ ra rất nhiều nguồn lực, tốn kém hơn các nước cùng khu vực rất nhiều chỉ để vượt qua được ngưỡng nghèo.  Bà Chi Lan nhắc lại giấc mơ Việt Nam thịnh vượng như một điểm gặp nhau giữa các tác giả sách Việt Nam hôm nay và ngày mai. Bà dẫn ý kiến các chuyên gia quốc tế tính toán rằng nếu Việt Nam tăng tốc ngay từ năm 2015 thì đến năm 2035 may ra mới đạt chuẩn quốc gia có thu thập đạt trung bình cao, như vậy chuẩn quốc gia giàu hãy còn xa lắm.  Giáo sư Cao Huy Thuần nhấn mạnh rằng một khi góp ý về phát triển tức là nói đến chính sách, là nói đến thể chế, và đó là chính trị, là nhạy cảm... Chia sẻ với tâm lý đó, tác giả Trương Trọng Nghĩa cho rằng Nhà nước đã có những chuyển động đáng kể về mặt thể chế. Cũng theo ông Nghĩa, có những chuyển động ở tầng sâu, chẳng hạn như khi xây dựng luật, đấu tranh để đưa bằng được một khái niệm pháp lý trở thành điều luật (như quyền giữ im lặng, tuy trong luật không dùng cụm từ ""quyền im lặng""), mới thấy sự đổi mới thể chế ở ta cực kỳ khó khăn.  Dù vậy, ông Nghĩa vẫn có niềm tin rằng chúng ta đã có mục tiêu xây dựng đất nước tốt đẹp và hoàn hảo: dân giàu, nước mạnh, xã hội công bằng, dân chủ, văn minh; ""không ai còn thêm được gì vào nữa, vấn đề là ta cứ làm cho được cho đúng những gì ta đã viết ra, thì không thể gọi hay bị xem là Việt Nam không chịu phát triển nữa"" - ông Nghĩa nhận định."
20210424133928492,https://tuoitre.vn/sap-co-dai-le-hoi-3f-dua-xe-va-giai-tri-tai-viet-nam-20210424133928492.htm,Sắp có Đại lễ hội 3F - đua xe và giải trí tại Việt Nam,https://cdn1.tuoitre.vn/zoom/600_315/2021/4/24/anh-dai-dien-1619246201473211881043-crop-1619246266771145637517.png,24/04/2021 15:00 GMT+7,"Đại lễ hội Fun Fast Fest được tổ chức với nhiều hoạt động giải trí hấp dẫn, quy tụ hàng trăm tay đua chuyên nghiệp và dàn nghệ sĩ nổi tiếng tham dự.",Văn hóa,Đời sống,"Chương trình được tổ chức với mục đích đưa môn bộ môn đua xe tốc độ đến gần hơn với công chúng, truyền tải tinh thần sống mạnh mẽ, dám bứt phá giới hạn bản thân để chinh phục đam mê.Theo Ban tổ chức - Học viện Đua xe Việt Nam (Vietnam Racing Academy - VRA), chương trình sẽ diễn ra từ ngày 01-5 đến 02-5-2021 tại Khu du lịch Đại Nam, tỉnh Bình Dương. Đại lễ hội Fun Fast Fest có sự tham gia của hơn 100 tay đua, các vận động viên trình diễn thể thao mạo hiểm, các ca sĩ, nghệ sĩ nổi tiếng... và dự kiến hơn 30.000 khán giả.Trong hai ngày diễn ra lễ hội, sẽ có hàng loạt chương trình giải trí sôi động như: giải đua xe tốc độ, trưng bày siêu xe thể thao, trình diễn flyboard và stunt show, đại nhạc hội EDM, lễ hội ẩm thực và nhiều trò chơi hấp dẫn khác. Tại đây, khán giả sẽ được chứng kiến những màn phô diễn tài năng đỉnh cao của các vận động viên, trải nghiệm không gian âm thanh, ánh sáng mãn nhãn và nhiều cung bậc cảm xúc bất ngờ.Cụ thể, Đại lễ hội 3F - Fun Fast Fest sẽ bắt đầu với giải đua xe gồm các hạng mục thi đấu đa dạng như Auto gymkhana (điều khiển xe qua các chướng ngại vật và sa hình đã được định sẵn), Drifting (điều khiển bánh xe trượt trên đường đua), Karting (đua xe đường trường sử dụng xe bốn bánh hở), UB150 (đua xe môtô hạng 150 phân khối) và Roller Sport (trượt patin). Đặc biệt, trong số hơn 100 vận động viên tham gia, chương trình còn có sự góp mặt của những tay đua nữ.Khán giả sẽ được chiêm ngưỡng những màn đua ấn tượng từ các tay đua chuyên nghiệpNgoài giải đua xe, khán giả còn được tham quan khu vực trưng bày quy tụ những dòng siêu xe, xe thể thao nổi tiếng của các thương hiệu Maserati, Porsche, Audi… khiến những tín đồ yêu xế hộp hâm mộ không chỉ bởi tính năng cao cấp, vận hành phức tạp hay khả năng tăng tốc lớn mà còn bởi lối thiết kế ấn tượng, tinh xảo, là thành quả của những nỗ lực sáng tạo tuyệt vời.Sự kiện lần này được xem là một chương trình đầy màu sắc và hứa hẹn sẽ mở màn cho những sự kiện thường niên về đua xe thể thao chuyên nghiệp, là bệ phóng đưa các tay đua xuất sắc tại Việt Nam ra đấu trường quốc tế. Xen kẽ những khung giờ thi đấu, khán giả còn được thưởng thức các màn trình diễn flyboard (thể thao mạo hiểm dưới nước) và stunt show (mô tô mạo hiểm), thưởng thức hàng trăm món ăn ẩm thực đường phố, tham gia đêm nhạc EDM sôi động với các hiệu ứng âm thanh, ánh sáng hấp dẫn.Đặc biệt, chương trình quy tụ dàn nghệ sĩ nổi tiếng như: Noo Phước Thịnh, ISAAC, Rapper Karik, Lowkey, Mess , KenJi, KOO, DJ Vinjaz , DJ Lại Thanh Hương, DJ Tio, DJ MIKI, MC Lil Vin'x, DJ Mie...Thông qua đêm nhạc, Ban tổ chức Đại lễ hội 3F mong muốn đem tới sân chơi giải trí lành mạnh, sôi nổi đam mê, cổ vũ giới trẻ tiếp tục sống với tinh thần chinh phục mạnh mẽ, dám thách thức bản thân vượt qua những giới hạn cùng bộ môn đua xe thể thao thời thượng.Đại lễ hội 3F - Fun Fast Fest không chỉ dừng lại ở những hoạt động ăn uống - vui chơi - xem đua xe đơn thuần mà còn còn kết nối cộng đồng công chúng tại các tỉnh miền Nam cũng như cả nước yêu ẩm thực, thích ""xê dịch"" có được không gian du lịch - giải trí tại chỗ trong giai đoạn Covid - 19 hiện nay. Ban tổ chức kỳ vọng đưa đua xe thể thao trở thành bộ môn thịnh hành với công chúng và đóng góp vào việc hình thành văn hóa lái xe có ý thức tại Việt Nam.Chương trình dự kiến thu hút khoảng 30.000 người tham gia từ khắp cả nước. Motul, Mortlach, ROC, Maxxis, AzHome là các nhà tài trợ đồng hành cùng sự kiện.Vé của sự kiện đã chính thức mở bán tại: https://ticketbox.vn/event/vr-fest-le-hoi-dua-xe-viet-nam-80567"
20210423193745819,https://tuoitre.vn/chiem-nghiem-triet-ly-sau-sac-cua-nha-phat-qua-nhung-buc-anh-dep-20210423193745819.htm,Chiêm nghiệm triết lý sâu sắc của nhà Phật qua những bức ảnh đẹp,https://cdn1.tuoitre.vn/zoom/600_315/2021/4/23/img-3017-16191809187241696946866-crop-16191813768121988078459.jpg,23/04/2021 22:45 GMT+7,"TTO - Những bức ảnh cho thấy nét đẹp của Phật giáo trong đời sống cùng những thắng cảnh Phật giáo đẹp đang được trưng bày tại nhà triển lãm 93 Đinh Tiên Hoàng, Hà Nội.",Văn hóa,Đời sống,"Triển lãm bao gồm 16 tác phẩm được trao giải cuộc thi sáng tác ảnh Phật giáo trong đời sống và những bức ảnh đẹp được chọn ra từ hơn 3.500 bức ảnh của 670 tác giả từ 58 tỉnh, thành phố gửi tới cuộc thi này.Sự kiện do một số đơn vị thuộc Giáo hội Phật giáo Việt Nam tổ chức, hướng tới kỷ niệm 40 năm thành lập Giáo hội Phật giáo Việt Nam (1981 - 2021). Các tác phẩm dự thi theo 4 chủ đề: kiến trúc Phật giáo, nghi lễ thờ tự, Thiền phái Trúc Lâm và các hoạt động Phật giáo trong đời sống.Trung ương Giáo hội Phật giáo Việt Nam mong muốn thông qua triển lãm, các bức ảnh nghệ thuật được trưng bày có thể giới thiệu và quảng bá các danh lam thắng cảnh, di tích lịch sử, văn hóa, các công trình và nét đẹp kiến trúc của Phật giáo Việt Nam tới bạn bè gần xa, du khách trong nước và quốc tế; phát triển, bảo tồn và tôn vinh các nét tinh hoa trong mọi hoạt động của Giáo hội.Nhà báo Việt Văn - thành viên ban giám khảo cuộc thi - cho biết ông cơ bản hài lòng với cuộc thi ảnh về chủ đề Phật giáo lần đầu tiên được tổ chức trên toàn quốc, thu hút đông đảo các nhà nhiếp ảnh tham gia, thậm chí cả các nhà tu hành. Trong đó, một nữ nhà sư giành giải nhì với tác phẩm Gội sạch duyên trần.""Những hình ảnh đẹp về Phật giáo Việt Nam, đặc biệt là những giá trị nhân văn của đạo Phật được thể hiện rõ, nhiều bức ảnh có kỹ thuật tốt, dụng công"", nhà báo Việt Văn nhận xét.Tuy nhiên, ông cũng kỳ vọng cuộc thi có nhiều tác phẩm thể hiện sâu sắc hơn nữa tư tưởng Phật giáo bởi có những bức ảnh chỉ dừng ở mức ảnh du lịch, đẹp thuần túy nhưng không đọng lại lâu bền bởi chưa có sự am hiểu về Phật pháp.Triển lãm kéo dài đến 2-5.Một số tác phẩm tại triển lãm:"
20210411161115239,https://tuoitre.vn/dinh-thien-phu-chang-designer-dung-sau-hon-1-000-poster-cua-showbiz-viet-20210411161115239.htm,Đinh Thiên Phú - chàng designer đứng sau hơn 1.000 poster của showbiz Việt,https://cdn1.tuoitre.vn/zoom/600_315/2021/4/11/6645887024156440586553594189517864538996736o-16181316813542102253764-crop-16182048995271427058293.jpg,13/04/2021 13:26 GMT+7,"TTO - Đinh Thiên Phú là cái tên không còn xa lạ với showbiz Việt bởi anh đã thiết kế hơn 1.000 poster cho cả trăm nghệ sĩ tên tuổi như: Trấn Thành, Lệ Quyên, Chi Pu, Hồ Ngọc Hà, Noo Phước Thịnh… Mới đây, anh thiết kế poster MV Laylalay cho Jack.",Văn hóa,Đời sống,"Từ khi còn là sinh viên chuyên ngành thiết kế nội thất của Trường ĐH Công nghệ TP.HCM, Đinh Thiên Phú đã yêu thích và đam mê với thiết kế poster quảng cáo. Ngoài giờ học, Phú dành nhiều thời gian tìm hiểu, nghiên cứu, tập tành thiết kế các mẫu poster quảng cáo từ đơn giản đến cầu kỳ.Niềm say mê thiết kế cộng với sự nhạy bén, nắm bắt được xu thế, Phú cho ra nhiều sản phẩm mang phong cách riêng. Cũng vì vậy, êkip của Hồ Ngọc Hà liên hệ ""đặt hàng"" làm poster MV Gửi người yêu cũ và dự án phim ngắn cùng tên của chị.Sau đó, êkip Hồ Ngọc Hà ngỏ ý mời anh về hợp tác với công ty. Phú nhận lời làm việc ở đây được gần 2 năm và hiện tại anh hoạt động tự do. Đây là cái duyên đưa Thiên Phú đến gần với công chúng - đặc biệt là giới nghệ sĩ.Đinh Thiên Phú chia sẻ với Tuổi Trẻ Online ""lần đầu thiết kế cho nghệ sĩ nổi tiếng Phú khá áp lực"". Nhưng nhờ cách làm việc chuyên nghiệp, đúng tiến độ, làm hài lòng nghệ sĩ nên Đinh Thiên Phú nhanh chóng được mọi người tìm đến, đặt hàng anh thiết kế.Theo Thiên Phú, điều kiện cần và đủ để poster ấn tượng gồm các yếu tố cơ bản như màu sắc, bố cục, hình ảnh… Quan trọng nhất là ý tưởng và sự sáng tạo phù hợp với yêu cầu khách hàng và phải dung hòa được giữa Phú và nghệ sĩ đó.""Điều Phú cảm thấy khó nhất là phải làm sao dung hòa được ý tưởng của cả hai bên. Vì mỗi nghệ sĩ có góc nhìn và ý tưởng khác nhau, kể cả ""gu thẩm mỹ"" cũng không đồng nhất"", Thiên Phú cho biết thêm.Một trong những mẫu thiết kế ấn tượng của Phú trong thời gian qua chính là poster web drama Bố già của Trấn Thành, đã tạo được hiệu ứng tốt trong khán giả. Trước đó, Thiên Phú cũng từng thiết kế poster dự án phim The Call - Cuộc gọi nửa đêm, được Trấn Thành ưng ý.Phú còn là chủ nhân sáng tạo nên poster MV Em gì ơi và Sóng gió với hai màu sắc đối lập nhau của cặp đôi tạo hit một thời là Jack và K-ICM.Ngoài ra, Đinh Thiên Phú từng thiết kế poster cho Trấn Thành, Chi Pu, Ngô Kiến Huy, Jack, Lệ Quyên, Nguyễn Trần Trung Quân, Dennis Đặng, Trúc Nhân, Đạt G, Du Uyên, Noo Phước Thịnh, Bảo Anh, Erik, Lam Trường…; poster phim điện ảnh Thạch Thảo, web drama Ai chết giơ tay…Thiên Phú cũng cho hay công việc của anh phải làm sao cho những chiếc poster không được trùng ý tưởng, màu sắc và không đạo nhái sản phẩm của người khác dù là vô tình hay cố ý.Một số tác phẩm của Đinh Thiên Phú:"
