id,link,title,thumbnail,time,summary,category,sub_category,full_article
1095676,https://tuoitre.vn/madonna-an-mac-qua-bao-tai-met-gala-2016-1095676.htm,"Madonna ăn mặc ""quá bạo"" tại Met Gala 2016",https://cdn1.tuoitre.vn/zoom/600_315/tto/i/s626/2016/05/05/madonna-met-gala-2016-1462433045.jpg,05/05/2016 14:16 GMT+7,"TTO - Những mỹ nữ tại Met Gala 2016 như Beyoncé, Kristen Stewart, Gigi Hadi... khuấy động sự kiện thời trang đình đám nhất Hollywood hàng năm. Nhưng gây dư luận nhất là bộ cánh của nữ ca sĩ Madonna.",Giải trí,Thời trang,"Madonna trên thảm đỏ Met Gala 2016. -Ảnh: celebuzz




Nếu điện ảnh Mỹ có sự kiện nổi bật là Oscar thì thời trang có Met Gala. Khởi xướng từ năm 1948, sự kiện này có tên gọi chính thức là Metropolitan Museum of Art Costume Institute Benefit (dạ tiệc gây quỹ cho Việt bảo tàng nghệ thuật Metropolitan - Mỹ), được tổ chức để mở màn cho các triển lãm thường niên của Viện.
Mỗi năm sự kiện có từng chủ đề khác nhau. Khách tham dự được khuyến khích ăn mặc theo chủ đề đó. Năm nay Met Gala có chủ đề là: Manus x Machina: Fashion in an Age of Technology (tạm dịch: Thời trang trong kỷ nguyên công nghệ).
Khách xuất hiện tại sự kiện phải là những nghệ sĩ có tên tuổi và đặc biệt, sự kiện không bán vé. Do đó, ai nhận được vé mời được xem là một vinh hạnh lớn lao.






Nữ diễn viên Claire Danes gây chú ý với bộ váy ""lọ lem"" tinh tế của nhà thiết kế Zac Posen. -Ảnh: Reuters.



Met Gala 2016 gây nhiều sự chú ý với sự xuất hiện của những mỹ nữ trong trang phục theo chủ đề công nghệ như nữ ca sĩ Beyoncé, Selena Gomez, taylor Swift, diễn viên Nicole Kidman, vợ chồng Kanye West...
Chiếc váy lọ lem của nữ diễn viên Claire Danes chinh phục giới thời trang Hollywood và được công nhân là bộ cánh đẹp bậc nhất trong đêm hội.
Trong khi đó, bộ cánh ren đen tuyền của ca sĩ Madonna được xem là ""quá bạo"" về độ hở đối với một phụ nữ đã 57 tuổi như cô.
Luồng dư luận lập tức nổi lên và có ý kiến chỉ trích Madonna ăn mặc ""lố bịch"", ""không phù hợp"" với lứa tuổi của cô.
Tuy nhiên, Madonna ""phản pháo"" và viết trên mạng xã hội rằng cô cố tình mặc phóng khoáng như thế để đấu tranh cho quyền bình đẳng giới: ""Bộ váy của tôi tại Met Ball chính là một tuyên ngôn chính chị, một tuyên ngôn về thời trang"".
""Chúng ta đã đấu tranh và đang tiếp tục đấu tranh cho quyền dân chủ, quyền của người đồng tính trên khắp thế giới. Nhưng với quyền của phụ nữ thì vẫn còn nằm trong kỷ nguyên tối tăm.
Sự thật là chúng ta vẫn mặc định rằng phụ nữ không được quyền thể hiện sự gợi cảm của bản thân. Chúng ta đang sống trong một xã hội phân biệt giới tính và tuổi tác"", Madonna viết. 
Nữ hoàng nhạc pop kết luận mạnh mẽ: ""Đó là cách chúng ta thay đổi lịch sử. Nếu các bạn xem cách ăn mặc của tôi là vấn đề để bôi nhọ thì đó đơn giản chỉ là là sự phản chiếu chính định kiến của bạn"".






Madonna tại Met Gala năm nay.



 






Beyoncé vô cùng gợi cảm trong chiếc đầm pha chất liệu latex của hãng Givenchy













Nữ diễn viên Kate Hudson nhẹ nhàng trong chiếc đầm với các mẫu cắt ghép nối bằng chất liệu nhựa của Versace. Trong khi đó, ca sĩ lập dị Lady Gaga cũng trong trang phục cùng thương hiệu, nhưng lại nghiêng về kim loại nặng và tóc đánh rối.







Vợ chồng nam ca sĩ Kanye West cũng tạo ấn tượng với thương hiệu Balmain, tuy nhiên, Kanye lại ghi điểm xấu bởi chiếc quần jeans rách không đồng điệu.









Chiếc váy lông của nữ diễn viên Zoe Saldana trông có vẻ ""lạc đề"" với chủ đề công nghệ năm nay.









Chiếc váy lông của ca sĩ Rita Ora lại được khen ngợi hết lời. Màu lông nhuộm bạc theo thiết kế của Vera Wang gợi cảm giác mạnh mẽ và gợi cảm









Taylor Swift trông rất nổi loạn với style rock đình đám của nhà thiết kế Louis Vuiton. Người đồng dẫn chương trình của Met Gala 2016 này cũng biết phối với son môi kiểu ma cà rồng và giày cột dây.









Katy Perry cũng theo phong cách trang điểm ma cà rồng. Rất tiếc bộ váy của nhà Prada không tạo ấn tượng cho mỹ nữ này.









Nữ diễn viên Nicole Kidman vô cùng gợi cảm với chiếc váy của nhà thiết kế Alexander McQueen









Cặp đôi Gigi Hadid và Zayn Malik khá lệch nhau. Zayn Malik nhìn cồng kềnh với trang phục vest với cánh tay rô bốt của Versace. Gigi Hadid lại nhìn rất thanh thoát trong chiếc đầm đính kim sa của Tommy Hilfiger.









Selena Gomez trong trang phục trẻ trung của Louis Vuitton









Nhà thiết kết Alexa Chung trong thiết kế kiểu pijama đính kim sa được đánh giá cao bởi đường nét cắt tinh tế.









Kristen Stewart với thiết kế quần lạ mắt của Calvin Klein









Cựu siêu mẫu Cindy Crawford cùng vẻ đẹp không tuổi trong trang phục của Bailman."
1095325,https://tuoitre.vn/chanel-trinh-dien-thoi-trang-ngay-tren-duong-pho-cuba-1095325.htm,Chanel trình diễn thời trang ngay trên đường phố Cuba,https://cdn1.tuoitre.vn/zoom/600_315/tto/i/s626/2016/05/04/160504155711-chanel-cuba-new-5-super-169-1462369626.jpg,04/05/2016 20:54 GMT+7,"TTO - Hãng thời trang danh tiếng Chanel vừa giới thiệu bộ sưu tập mới nhất mang tên Cruise, do nhà thiết kế linh hồn của hãng, Karl Lagefeld thực hiện.",Giải trí,Thời trang,"Con phố chính tại Havana, Cuba được biến thành sàn catwalk trong show của Chanel - Ảnh: CNN



Con phố chính Paseo del Prado rợp bóng cây được biến thành sàn catwalk sang trọng. Các khách đến tham dự show diễn bằng những chiếc xe hơi đời cũ, sơn đủ màu sắc. 
Tham dự show diễn có rất nhiều tên tuổi lớn trong làng giải trí thế giới, như nam diễn viên Vin Diesel, nữ diễn viên Tilda Swinton, siêu mẫu Gisela Bundchen... cùng dàn người mẫu đỉnh của Chanel.
Chanel cho biết bộ sưu tập này lấy ý tưởng từ dòng sản phẩm từng được thiết kế cho giới thượng lưu Mỹ đi nghỉ mát bằng du thuyền đến vùng Caribe để tránh mùa đông ảm đạm.
Trả lời báo chí, Karl Lagefeld nói rằng cảm hứng để làm ra bộ sưu tập này chính là ""nền văn hóa đậm đà của Cuba"".
Đây là show thời trang quốc tế đầu tiên tại thủ đô Havana, Cuba kể từ năm 1959. Chanel cũng trở thành thương hiệu lớn đầu tiên trên thế giới, đưa dàn người mẫu của mình sang Cuba trình diễn. 
Bruno Pavlovsky, người đứng đầu Chanel, cho biết ban đầu Chanel không chắc chắn có thể trình diễn tại Cuba nhưng sau đó mọi thứ trở nên dễ dàng vì ""chính phủ Cuba rất nồng nhiệt và sẵn sàng giúp đỡ"".
Tuy nhiên, người địa phương không được tham gia show và hàng Channel vẫn chưa được bán tại Cuba. Hãng tin BBC cho biết hiện nay, với mức thu nhập trung bình 25 USD/tháng, người dân Cuba không thể mơ tới việc sở hữu một món hàng của Channel.
Trước show diễn của Chanel, người dân Cuba có phản ứng trái chiều. Hãng tin Reuters dẫn lời sinh viên Heidi Lopez, 23 tuổi: ""Đây là sự kiện dành cho thiểu số. Số đông chúng tôi không hề được thưởng thức, đừng nói tới cảm hứng mua món hàng của hiệu này"".
Trong khi đó, Marilia Veliz, một kế toán 44 và là người yêu thời trang, lại nhận xét: ""Một ngày nào đó tôi có thể mua được món hàng của Chanel. Quan trọng là phải mơ ước"".






Dù không được chính thức tham dự nhưng người dân Cuba vẫn có thể coi show Chanel từ ban công nhà - Ảnh: CNN









Khách đến dự show bằng những chiếc xe hơi đời 1950, sơn đủ màu sắc - Ảnh: CNN









Một người mẫu trong show - Ảnh: CNN









Các người mẫu trong show - Ảnh: CNN









Nhà thiết kế Karl Lagefeld xuất hiện cuối show diễn - Ảnh: CNN"
1078789,https://tuoitre.vn/100-nam-trang-phuc-phu-nu-thay-doi-ra-sao-1078789.htm,100 năm trang phục phụ nữ thay đổi ra sao?,https://cdn1.tuoitre.vn/zoom/600_315/tto/i/s626/2016/04/04/thoi-trang-1459752172.jpg,04/04/2016 13:01 GMT+7,"TTO - Xem những clip phản ánh xu hướng thời trang của phụ nữ đã thay đổi chóng mặt trong 100 năm qua, từ váy cưới, váy dạ hội cho đến đồ ngủ.",Giải trí,Thời trang,"Thời trang thập niên 1950 theo phong cách của ngôi sao Marilyn Monroe



 
* Váy cưới







* Đồ ngủ







 * Trang phục dạ hội của phụ nữ phản ánh trong thời trang phim ảnh







* Trang phục thể thao"
1077919,https://tuoitre.vn/ngam-saree-an-do-khoe-sac-tai-sai-gon-1077919.htm,Ngắm saree Ấn Độ khoe sắc tại Sài Gòn,https://cdn1.tuoitre.vn/zoom/600_315/tto/i/s626/2016/04/02/saree-an-do-19-jpg-1459567876.jpg,02/04/2016 10:28 GMT+7,"TTO - Bộ sưu tập áo Saree truyền thống của Ấn Độ được đông đảo khán giả trầm trồ trong buổi trình diễn thời trang Áo dài - Áo Saree tối 1-4 tại Bảo tàng Áo dài, Q.9, TP.HCM.",Giải trí,Thời trang,"Buổi trình diễn thời trang Áo dài – Áo Saree tối 1-4 tại Bảo tàng Áo dài, Q.9, TP.HCM.



Chương trình do Tổng Lãnh sự quán Ấn Độ tại TP.HCM và Bảo tàng Áo Dài tổ chức. Mục đích là nhằm tăng cường sự hiểu biết của mọi người về vẻ đẹp của Saree Ấn Độ và áo dài Việt Nam cũng như mở ra những cơ hội hợp tác giữa các nhà thiết kế hai nước.
Triễn lãm về vải Ấn Độ, áo dài được thiết kế từ vải Ấn, trang phục nam và nữ Ấn mở cửa từ ngày 1-4 đến 30-6.
Saree là trang phục truyền thống của phụ nữ Ấn Độ, bao gồm một mảnh vải dài khoảng 5-9m, rộng khoảng 1m quấn quanh thắt lưng và vắt qua một bên vai. Saree thường được mặc bên ngoài một chiếc váy lót gọi là shaya với tay ngắn và được cắt ngang bụng.
Saree Ấn Độ có thể giữ cho người mặc cảm giác mát mẻ, tôn thêm vẻ hấp dẫn người mặc đồng thời có thể che đi những hạn chế của thân hình nếu có.
*Xem hình ảnh từ buổi trình diễn tối 1-4:"
1076872,https://tuoitre.vn/sieu-mau-va-the-face-viet-nam-cung-khoi-dong-1076872.htm,​Siêu mẫu và The Face Việt Nam cùng khởi động,https://cdn1.tuoitre.vn/zoom/600_315/tto/i/s626/2016/03/31/ngoc-tinh-1459415998.jpg,31/03/2016 16:21 GMT+7,"TTO - Cuộc thi siêu mẫu Việt Nam 2016 và cuộc thi The Face Việt Nam mùa đầu tiên cùng khởi động từ 1-4, với vòng tuyển sinh trực tiếp bắt đầu tại khu vực Hà Nội.",Giải trí,Thời trang,"Hai người mẫu Ngọc Tình và Minh Tú. Ảnh tư liệu.



Vòng tuyển sinh diễn ra trong cả ngày 1-4 tại Trung tâm thương mại Times City do các giám khảo từng gắn bó và thành danh từ cuộc thi Siêu mẫu là người mẫu Ngọc Tình, Minh Tú và “ông bầu” Phúc Nguyễn đảm nhiệm.  
“Hiện tại có nhiều gương mặt rất mới và rất tiềm năng đăng ký tham gia và chúng tôi sẽ tuyển lựa qua 4 tỉnh, thành trên cả nước”, giám khảo Phúc Nguyễn cho biét.
Điều đặc biệt là năm nay các giám khảo không chỉ tuyển chọn (casting) người mẫu cho cuộc thi Siêu mẫu diễn ra thường niên mà còn tuyển chọn thí sinh cho chương trình truyền hình thực tế mới The Face Việt Nam, với đối tượng là thí sinh từ 16 tuổi trở lên.
The Face Việt Nam với tiêu chí “vẻ đẹp chạm đến thương hiệu” là cuộc thi đầu tiên tìm kiếm những gương mặt quảng cáo tại Việt.
Hiện tại, tên tuổi của 3 vị huấn luyện viên sẽ hướng dẫn 12 thí sinh cuối cùng lọt vào 3 đội tranh tài chưa được BTC tiết lộ. Tuy nhiên, trên website của chương trình có nhắc đến ba cái tên người mẫu được cho là “đủ chuẩn” ngồi ghế nóng The Face Việt Nam là Bảo Hòa, Jessica Minh Anh và Hà Anh.
Sau vòng casting trực tiếp tại Hà Nội, các buổi casting trực tiếp của hai cuộc thi sẽ tiếp tục vào 4-4 tại Eden Plaza - Đà Nẵng, ngày 6-4 tại Cung văn hóa thể thao thanh niên - Hải Phòng, ngày 7-4 tại Riverside Palace - TP. Hồ Chí Minh."
1076770,https://tuoitre.vn/hoa-hau-ban-sac-viet-toan-cau-nghi-ngai-danh-xung-1076770.htm,Hoa hậu Bản sắc Việt toàn cầu: nghi ngại danh xưng,https://cdn1.tuoitre.vn/zoom/600_315/tto/i/s626/2016/03/31/hoa-hau-ban-sac-1459412245.jpg,31/03/2016 15:36 GMT+7,TTO - Sự ra đời của Hoa hậu Bản sắc Việt toàn cầu 2016 có thể sẽ tạo “tiền đề” cho nhiều cuộc thi người đẹp đang nhăm nhe muốn “nâng cấp” thương hiệu của mình lên thành “Hoa Hậu” dựa trên kẽ hở của nghị định 79.,Giải trí,Thời trang,"Từ trái qua: Á hậu 3 Hoa hậu Quốc tế 2015 Thúy Vân, Hoa khôi thể thao 1995 Thu Hương, Á hậu Phụ nữ Việt Nam qua ảnh 2012 Hoàng Oanh và Hoa hậu Việt Nam 2010 Ngọc Hân trong buổi giới thiệu Hoa hậu bản sắc Việt toàn cầu 2016 sáng 31-3 - Ảnh: Minh Trang



Sáng 31-3 tại TP.HCM, Ban tổ chức cuộc thi Hoa hậu Bản sắc Việt toàn cầu 2016 công bố về thời gian tổ chức cuộc thi, sau lần họp báo giới thiệu vào hồi đầu tháng 3 tại Hà Nội. 
Theo đó, đêm chung kết của cuộc thi diễn vào đêm 24-7 tại Sầm Sơn, Thanh Hoá và được truyền hình trực tiếp trên kênh VTV6. 
Lo ngại danh xưng
Kể từ khi giới thiệu về kế hoạch tổ chức cuộc thi Hoa hậu bản sắc Việt toàn cầu vào tháng 3-2016, cuộc thi đã làm dấy lên nhiều ý kiến lo ngại về việc “lách luật” dựa theo nghị định 79 của chính phủ quy định rõ: mỗi năm chỉ được cấp phép không quá hai cuộc thi hoa hậu.
Trong năm 2016, có hai cuộc thi sắc đẹp mang tính chất toàn quốc được Bộ VH-TT&DL cấp phép là cuộc thi Hoa hậu Biển VN và Hoa Hậu Việt Nam. Vậy Hoa hậu Bản sắc Việt toàn cầu thực chất về quy mô là cuộc thi ra sao? Và tại sao lại được cấp phép là một cuộc thi Hoa hậu?
Vấn đề này được ông Vương Duy Biên - Thứ trưởng Bộ VH-TT&DL trả lời trước đó là bởi Hoa hậu bản sắc Việt toàn cầu có yếu tố quốc tế, và điều này hoàn toàn nằm trong quy định của nghị định 79. Theo đó đối với cuộc thi người đẹp quốc tế tổ chức tại Việt Nam, Bộ VH-TT-DL sẽ căn cứ vào tình hình cụ thể của từng năm để xem xét, quyết định.
Tuy nhiên, trong buổi công bố sáng 31-3, trả lời cho câu hỏi tính quốc tế của cuộc thi này được thể hiện đến mức độ nào? Ví dụ, trong đầu vào tuyển sinh của cuộc thi phải đảm bảo 50% số thí sinh tham gia phải đến từ nước ngoài (theo quy định của Bộ VH-TT-DL tham khảo từ các cuộc thi quốc tế), nhưng tỉ lệ này có được đảm bảo sẽ duy trì cho đến đêm chung kết của cuộc thi?
Ông Lê Minh Tuấn - trưởng phòng quản lý biểu diễn của Cục nghệ thuật biểu diễn trả lời điều đó phụ thuộc vào chất lượng của thí sinh dự thi mà thôi.
Liệu có gì khác biệt?
Bà Mi Lan - đại diện cho đơn vị tổ chức cuộc thi là công ty FLC cũng nhấn mạnh: Hoa hậu bản sắc Việt toàn cầu chỉ cần thí sinh có gốc Việt Nam (ông bà, bố mẹ… người Việt) và không phân biệt họ đang mang quốc tịch nào, do vậy hi vọng sẽ thu hút được một lượng thí sinh đông đảo và đa dạng hơn cho lần tổ chức đầu tiên này.
Câu trả lời của đại diện Cục nghệ thuật vẫn chưa làm thoả lòng người quan tâm bởi nếu không giữ được tỉ lệ 50/50 các thí sinh quốc tế đến đêm chung kết, thì cuộc thi này liệu có khác biệt gì so với các cuộc thi người đẹp đã tổ chức trong phạm vi lãnh thổ Việt Nam?
Thực tế, rất nhiều cuộc thi tuyển chọn sắc đẹp trong cả nước phải đổi tên thành cuộc thi Hoa khôi, thi Người đẹp để tránh những vi phạm dựa trên nghị định 79.
Sự ra đời của Hoa hậu Bản sắc Việt toàn cầu 2016 có thể sẽ tạo “tiền đề” cho nhiều cuộc thi người đẹp đang nhăm nhe muốn “nâng cấp” thương hiệu của mình lên thành “Hoa Hậu” dựa trên kẽ hở của nghị định 79.




Cuộc thi dự kiến được tổ chức định kì 2 năm/lần. Ngoài ra, Hoa hậu bản sắc Việt toàn cầu 2016 sẽ được đào tạo để tham dự cuộc thi Miss Globe International được tổ chức tại Trung Quốc vào tháng 11 năm nay.
Tổng giải thưởng của cuộc thi Hoa hậu bản sắc Việt toàn cầu 2016 trị giá hơn 2 tỉ đồng."
1075228,https://tuoitre.vn/thoi-trang-cua-nguyen-cong-tri-tai-tokyo-qua-ong-kinh-reuters-1075228.htm,Thời trang của Nguyễn Công Trí tại Tokyo qua ống kính Reuters,https://cdn1.tuoitre.vn/zoom/600_315/tto/i/s626/2016/03/28/nguyen-cong-tri-tokyo-fashion-week-40-1459172580.jpg,28/03/2016 20:53 GMT+7,TTO - Hãng tin Reuters chọn ra những hình ảnh đặc sắc từ Tuần lễ thời trang Tokyo (Tokyo Fashion Week) 2016 với nhiều mẫu thời trang từ bộ sưu tập Lúa của nhà thiết kế Việt Nam Nguyễn Công Trí.,Giải trí,Thời trang,"Bộ sưu tập của Nguyễn Công Trí. - Ảnh Reuters.



Như tin Tuổi Trẻ Online đã đưa, nhà thiết kế (NTK) Nguyễn Công Trí vinh dự mở màn tuần lễ thời trang tokyo vào trung tuần tháng 3 vừa rồi với bộ sưu tập Lúa.
Công Trí cho biết anh phát huy tối đa thế mạnh về kĩ thuật đan lát thủ công các sợi chất liệu to bản để phác hoạ không khí của vùng thôn quê Việt Nam; kết hợp sắc màu rêu phong, cỏ úa, vàng vọt của những cánh đồng lúa bạt ngàn để cộng hưởng với phẩm nhuộm mặc nưa đen huyền.
BST còn kết hợp khéo léo sao cho chất liệu Lãnh Mỹ A vừa nổi bật vừa hòa quyện khi đứng cạnh các chất liệu khác như chiffon, satin, lụa tơ tằm, đũi, nhung, organza… 
Tin từ Multimedia JSC ngày 28-3 cho biết ""đơn vị tổ chức Vietnam International Fashion Week xác nhận nhà thiết kế Nguyễn Công Trí với bộ sưu tập “Lúa” cùng chất liệu Lãnh Mỹ A huyền thoại sẽ trình diễn mở màn Tuần lễ thời trang quốc tế Việt Nam – Vietnam International Fashion Week 2016 diễn ra từ ngày 23-4 đến 26-4 tại GEM Center, TP HCM. 





* Một số hình ảnh khác từ Tuần lễ thời trang Tokyo 2016 qua ống kính Reuters:"
1066255,https://tuoitre.vn/ao-dai-hot-nhat-bay-gio-1066255.htm,​Áo dài “hot” nhất bây giờ!,https://cdn1.tuoitre.vn/zoom/600_315/tto/i/s626/2016/03/13/ao-dai-1457864785.jpg,13/03/2016 09:42 GMT+7,"TT - Công sở ngập tràn áo dài, những món quà cho Ngày phụ nữ 8-3 năm nay ngoài hoa tươi, có thêm lựa chọn là những chiếc áo dài duyên dáng.",Giải trí,Thời trang,"Áo dài in hình Sài Gòn - TP.HCM. Ảnh tư liệu.



Một cô hot blogger về thời trang của tạp chí nổi tiếng nọ, vốn thường ngày chỉ mặc hàng hiệu, nay sung sướng khoe tấm ảnh xúng xính trong tà áo dài đỏ thắm cách điệu, chạy chiếc mobylette thong dong qua nhà thờ Đức Bà. 
Tấm ảnh được gần 1.000 “like” và hàng trăm lời khen tặng vì quá xinh đẹp! Trên các mạng xã hội, người ta cứ ngỡ... tết lại ùa về khi đâu đâu cũng bắt gặp hình ảnh các cô gái, chàng trai rạng ngời trong tà áo dài mới. Áo dài đã có sự trở lại “ngoạn mục” hiếm có trong đời sống thị dân!
Nhìn những bức ảnh rạng rỡ cùng áo dài ấy, dễ dàng nhận ra: áo dài hôm nay đã sẵn sàng “cạnh tranh” với bất kỳ trang phục thời thượng nào khi đi làm, đi chơi, du lịch bởi sự tiện dụng và xinh đẹp khó chối cãi.
Xưa, hàng khuy bấm có thể “bật tung” bất cứ lúc nào thì nay đã được thay thế gọn gàng hơn bằng khóa kéo sau lưng, khóa kéo bên hông. Xưa, quần đi với áo nhất thiết phải là quần lụa ống rộng thì nay được biến tấu năng động, trẻ trung hơn với quần tây, quần jean, váy ngắn, váy dài... 






Bộ sưu tập Lạc Việt của nhà thiết kế Tuấn Hải trình diễn tại lễ hội Áo dài TP.HCM. Ảnh tư liệu



Cái hồn của áo dài vẫn được giữ trọn vẹn qua hai tà áo. Chiếc áo vẫn uyển chuyển, tôn vinh nét đẹp tự nhiên, hài hòa của người mặc dù có những đổi thay về chất liệu, kiểu dáng. Giá thành của một chiếc “áo dài mới” cũng không quá “chát” mà hoàn toàn nằm trong tầm tay của nhiều người.
Đi tìm lời giải thích cho chuyện áo dài “bỗng dưng” được yêu bất thường, nhà thiết kế Diệu Anh - một trong những nhà thiết kế nhắm đến xu hướng hiện đại, phá cách gây ngạc nhiên khi lần đầu tiên cho ra mắt bộ sưu tập về áo dài vào đầu năm nay - thành thật chia sẻ:
“Áo dài chỉ đẹp khi người mặc chúng một cách tự nguyện với một phong thái tự tin. Bản thân tôi nghĩ sẽ rất thú vị nếu các bạn trẻ tiếp nhận áo dài trong những hoạt động thường ngày với điều kiện: tinh thần của áo dài phải chuyển biến theo tinh thần của thời đại, thời mà mọi người muốn thể hiện cái tôi của mình rõ nét hơn.
Thời trang giờ đây không chỉ là chuyện mặc một bộ đồ đẹp, mà nó cần phải nói lên văn hóa, bản sắc riêng biệt của chính bạn. Khi áo dài thỏa mãn được tất cả những tiêu chí đó, không có lý do gì người ta lại không mạnh dạn chọn cho mình một bộ áo dài phù hợp”.
Với chị, mặc áo dài trước hết là một niềm vui!






Ảnh tư liệu.



Đã từng có thời điểm, người ta rầm rộ với những cuộc bình chọn, thi thố để chọn ra quốc phục được người dân yêu thích nhất nhưng rốt cuộc... chẳng đi đến đâu.
Vậy rồi tự nhiên như hơi thở, mát lành như một làn gió, áo dài với những biến chuyển phù hợp đã khơi dậy một nét đẹp văn hóa truyền thống lâu đời và được “nhân rộng” bằng tình yêu của chính những người mặc.
Biết đâu, Sài Gòn sẽ lại lộng lẫy áo dài trên khắp các nẻo đường như năm 1989, khi cuộc thi Hoa hậu áo dài lần đầu tiên được tổ chức và hình ảnh người đẹp Kiều Khanh với những bộ áo dài đẹp thuần khiết trên các bưu thiếp trở thành thần tượng của nhiều cô gái trẻ.
Hay biết đâu áo dài cách điệu Việt sẽ tạo ra một xu hướng “làm mưa làm gió” trên thị trường thời trang như cách người ta đã “cải biên” kimono và yukata của Nhật trở thành những chiếc áo khoác, áo choàng giản tiện khuynh đảo làng thời trang thế giới trong năm 2015 (trong đó có Việt Nam). Biết đâu được đấy!"
